Question Speaker,Question Text,Answer Speaker,Answer Text
Jayatīrtha,"...to the Goddess Kālī an offering, and then they were distributing it as prasādam .",Prabhupāda, In the name of Vedānta .
Jayatīrtha,"Vedānta means the goal of knowledge, but they are making an end of knowledge. Keśava went to Santa Barbara last night to finish up some last minute business he had there, but now he's back and he is resting.",Prabhupāda, So he is prepared to go to London?
Jayatīrtha,"He seems anxious to go, yes.",Prabhupāda, That's good. Why Śyāmasundara does not return?
Jayatīrtha,"He's here. He's also asleep. He came in the middle of the night, two or three o'clock in the morning.",Prabhupāda, (indistinct)
Jayatīrtha,"(indistinct) is in charge of our traveling saṅkīrtana party, so he's back here for a few days. They're going around to all the fairs, state fairs, county fairs, and distributing literature. He's had very great success",Prabhupāda," Indians are coming in Europe and America to learn technology, but next generation will come here to learn spiritual science, to seek brāhmaṇas. What do you think?"
SvarūpaDāmodara,"Svarūpa Dāmodara : Yes, there's no doubt about it. They will learn technology the coming years, and when they become frustrated again, then they will again learn the spiritual science.",Prabhupāda, Yes.
Jayatīrtha,"A lot of times when the Indian people come to our temple, they remark like that, that they've never seen such a temple and devotees.",Prabhupāda," There is no temple in India. As we are maintaining our temple, there is no such temple in India. There are temple, they are neglected. Just like here, the churches are neglected. [break] ...demons, and here we are manufacturing demigods."
SvarūpaDāmodara,"Svarūpa Dāmodara : I read in the news that in the next five-year plan, they are planning to spend about thirty-two billion rupees for education, the greatest for ten years. They said that there were so many mistakes for the last ten years in introducing the basic education that everybody said there is no success. So they are planning another thirty-two billion rupees from 1974 onwards.",Prabhupāda, What education? To eat meat and beef.
SvarūpaDāmodara,Svarūpa Dāmodara : Yes.,Prabhupāda, That education. And no restriction of sex even amongst the leaders.
Jayatīrtha,And all advanced contraceptive methods.,Prabhupāda," This Jawaharlal(?) was implicated with his sister, and some say with his daughter also, and he was the prime minister. This is their position. In our Indian system, education is mātṛvat para - dāreṣu : every woman except your own wife, all mothers. That is education. Mātrā svasrā duhitrā vā [SB 9.19.17 ] . Either your mother or sister or daughter, you don't live together alone. These are education. And they're freely advocating sex life. What is the (indistinct) difference? In India they're doing, so many leaders. (indistinct), it can be done. The leaders are speaking while doing that. No discrimination, just like hog. No discrimination. [break]"
Jayatīrtha,...in Īśopaniṣad that modern-day educational system means culturing avidyā .,Prabhupāda," Yes, avidyā ."
Jayatīrtha,"So they're spending so much, so many billions of rupees, simply to culture ignorance.",Prabhupāda," Making rogues and guṇḍās and hippies, that's all. The science is manufacturing atom bomb, and philanthropy is becoming hippies. This is the result of education. They are manufacturing compounds, strong contraceptive method, infallible contraceptive method. Suffering only. What is the time now?"
Jayatīrtha; SvarūpaDāmodara,(?) minutes to seven.; Svarūpa Dāmodara : So this propensity will increase in this Kali - yuga .,Prabhupāda, Yes. [break]
Jayatīrtha,"...so many riots by the students at the university there that the shopkeepers in the local area are suing the State because the windows have been broken so many times and so much merchandise has been stolen by the students, they think the State should pay them back.",Prabhupāda," Yes, they must. The State must be responsible. What the State reply?"
Jayatīrtha,"Well, they're having to litigate in court over it. The State doesn't want to do it. So this university there is one of the most famous universities in the whole country. They spend so many millions of dollars to maintain it nicely. [break] (dog barking) ...changing their bodies in particular ways to make them look (indistinct).",Prabhupāda," When you do not take care of God, you must take care of dog. (laughter) (end)"
Ambassador Keating,Both the human and the animals?,Prabhupāda," Just so. Spirit soul individual. He is passing through the evolutionary process. Evolutionary process means as he is desiring, nature is supplying a particular type of body."
Mrs. Keating,That's very interesting. I believe in the transmigration of the soul.,Prabhupāda, Yes. It is a fact.
Mrs. Keating,It's very interesting.,Prabhupāda," It is a fact. Just like this child is transmigrating from one body, one kind of body to another body. So in the same way, when I give up this body I transmigrate to another body. This is the science. Unfortunately, there is no university, no education, no culture of this great science. Therefore according to Bhāgavatam , the knowledge is imperfect. The knowledge which are imparting from universities, they are not perfect knowledge. And this human form of body is the opportunity to understand the position of the soul and how he is transmigrating from one body to another, what is happening next. In this way, in this human form of body, we can understand this science, science of soul. Unfortunately, no education is there to understand this science. So in other words, it may be taken that the modern civilization is killing the prerogative of the human being. He has got a chance to understand himself and to stop. He can stop this repetition of birth and death. He can remain in a spiritual form in the spiritual kingdom or with God, but these things are unknown to him, because there is no discussion in any university or any institution of knowledge. Although the Vedic literature gives us ample information of this—in the the Bhagavad- gītā , that is the preliminary study of all Vedic literature—but there is no chance for the people to understand. This is the defect of the modern civilization. Therefore it is necessary. And actually, because there is no sufficient knowledge of the position, I see the American boys and girls, although they are coming out very rich and respectable family, they are turning to hippies. In spite of your arrangement for very big, big university, they are becoming frustrated. They are no longer satisfied to live materially opulent like their fathers and grandfathers. In other countries also, the same symptoms are there. Just like in India, the Naxalites. So that is another form of confusion. In your country the confusion state is a different kind. Another type is another confusion. In China also there is another type of confusion. In Russia also there is another type of confusion. So the present position of the human society is very dangerous because everyone is feeling dissatisfaction for confusion."
Ambassador,"Any way how to make any progress, or have you any representation, for instance, in Russia?",Prabhupāda, Russia... Last time when I went to Europe I visited Russia. I was invited by one Professor Kotovsky. Perhaps you know him.
Ambassador,"No, I don't.",Prabhupāda, Ah. A very nice gentleman. Indology. He is charge of the Indological department. Russia has got very good respect for Indian culture.
Ambassador,Yes. That's right.,Prabhupāda, They have very good respect. So that.... [break]
Ambassador,"...have much, they don't believe in God.",Prabhupāda, They do not know the (indistinct).
Mrs. Keating,Do you have many Indian followers? Many Indian followers as well as foreign?,Prabhupāda," Yes. This Kṛṣṇa consciousness, so far Indians are concerned, everyone accepts Kṛṣṇa as the Supreme Personality of Godhead."
Mrs. Keating,May I ask the significance of the markings?,Prabhupāda," Yes. This is a sign that we are Vaiṣṇava , devotee of Kṛṣṇa ."
Ambassador; Mrs. Keating,"You all have that.; And the bag, is that, is that...",Prabhupāda, That is our chanting.
Mrs. Keating,Oh.,Prabhupāda," We are chanting always the holy name of Kṛṣṇa . These have got special significance because Kṛṣṇa is absolute. There is no difference between Him and His name. Here, just like this milk substance and the milk name is different. If I want to take milk, simply if I go on chanting ""milk"" and ""milk,"" that will not satisfy. I must have the substance milk. But in the spiritual world the Absolute has no differentiation between His name, ...between His name, between His quality, form, entourage. They are the same. So this chanting of holy name means that directly associating with Kṛṣṇa . Directly associating with Kṛṣṇa ."
Ambassador,It's a constant reminder to yourselves of the...,Prabhupāda, ...of my relationship with Kṛṣṇa .
Ambassador,Yes.,Prabhupāda, That is it.
Ambassador,"Oh, that's very... I'm very much impressed with the sincerity of these American...",Prabhupāda," As soon as one understands this science, he would accept immediately."
Śyāmasundara; Gurudāsa; Ambassador; Devotee; Ambassador; Devotee; Ambassador; Devotee; Ambassador; Devotee,"The one thing that impresses us and causes us to be sincere is that we recognize Kṛṣṇa consciousness not on a sentimental level but philosophically, and because it's very practical. It's not only the philosophy is there but also the practice of the philosophy. So we realize the results of the philosophy, actually, in our lives. So this convinces us absolutely, because the philosophy works. There's no flaw.; Guru dāsa : Śyāmasundara was..., had a scholarship to big college for philosophy, and he was studying philosophical sciences, but he could not apply them. This was the reason for his frustration, searching. Now we found something we can apply in our practical everyday life. And not only ourselves, but people who, having families in the United States, etc., they wanted to apply philosophy. And that's the strength of this movement. We can apply it.; I sort of forgot..., I don't know what I asked you, where you joined the movement.; In California.; In California. In uh...?; Los Angeles, California.; Los Angeles.; I met the devotees there about three years ago.; Ahah .; ...and stayed in the...",Prabhupāda, He was in the Navy of your country.
Ambassador,"Oh, he was in the Navy.",Prabhupāda, Yes.
Ambassador; Śyāmasundara; Ambassador; Śyāmasundara; Ambassador; Śyāmasundara; Ambassador; Gurudāsa; Ambassador; Gurudāsa; Ambassador; Gurudāsa,"Isn't that interesting.; We've got a lot of Vietnam veterans too, join up.; Really.; One boy in London, he was on his way back from Vietnam, and he was completely shattered, and he found refuge in Kṛṣṇa consciousness. He was a machine-gunner.; Where are you living?; Well, we've been living in London last two years.; But here you're all living in the Delhi area, but you're going down to... What's the name of that place south of here?; Guru dāsa : Vṛndāvana ?; Yeah.; Guru dāsa : We went.; Oh, you went?; Guru dāsa : Very nice.",Prabhupāda, Where?
Gurudāsa,Guru dāsa : They inquired about our Vṛndāvana trip.,Prabhupāda," Oh, yes."
Śyāmasundara; Ambassador; Mrs. Keating; Ambassador,That's where Kṛṣṇa was born.; Oh.; Where is that?; Ninety miles south of here.,Prabhupāda," Yes, ninety miles."
Gurudāsa,"Guru dāsa : Śrīla Prabhupāda spoke to the Russians that the principle, our philosophy is the same, and that's service. You are serving Lenin and we are serving Kṛṣṇa . So by expounding upon the philosophy, then when you see that it's more intelligent to put his service toward God than one man. Like that.",Prabhupāda," Our, this is a fact, that everyone is serving somebody superior."
Ambassador,Yes.,Prabhupāda, Nobody can say that I am not serving anybody. Is it possible?
Ambassador,You're serving God.,Prabhupāda," I am serving, you are serving your state."
Ambassador,Yes.,Prabhupāda, So everyone is serving. Nobody can say that I am not serving anybody. It is not possible.
Mrs. Keating,But we serve God first.,Prabhupāda, Huh ?
Mrs. Keating,We serve God first.,Prabhupāda," God or anything, we have to serve."
Mrs. Keating,Yes.,Prabhupāda," That is our constitutional position. Just like eating and drinking. You may eat something, I may eat something, but eating is essential. You cannot say that I don't eat. That is not possible. Eating, sleeping, mating, defending—these are the bodily necessities. Similarly, the soul's necessity is to serve someone. Either you serve your country or your society or your family or your community, or at least if you nothing to serve, then you keep a dog and serve it. (laughter)"
Mrs. Keating; Śyāmasundara; Mrs. Keating,"Or what?; A dog.; Oh, a dog, yeah.",Prabhupāda," Therefore, the conclusion is that I have to serve. This is our position. Do you admit?"
Mrs. Keating,Yes.,Prabhupāda," Suppose I say that I don't serve. That is not possible. That being our constitutional position then, just like my finger, it is serving, always, sometimes doing like that, sometimes doing like that, sometimes doing like that. The finger's business is to serve. As part and parcel of my body, the finger's business is to serve the whole body. Similarly, we are part and parcel of God. Our essential business is to serve God. How do you find this argument? Do you refute this argument?"
Mrs. Keating,You serve and you share.,Prabhupāda, Huh ?
Mrs. Keating,You serve...,Prabhupāda, Yes.
Mrs. Keating,...and you share.,Prabhupāda," Yes. By serving I share. Just like this milk. The hand helps me, brings it here. I drink, and as soon I drank, the benefit is shared by all the parts of body. Is it not?"
Ambassador,That's true.,Prabhupāda," You do not require to pass the milk through the finger, then with the toes. No. Simply put the tea, tea or milk, within, and every part of the body is satisfied. Just like you pour water in the root of the tree. The energy immediately, I mean to say, distributed to the leaves, to the tree, to the flowers, to the fruits, everything, immediately. Similarly, there must be something which is the root of everything. That is God. The Vedānta philosophy says God means the origin, the source of everything. That is God. Now you can imagine how that source should be. That is also explained. But God, or the Absolute Truth, is that, is the original source of everything."
Ambassador,Are you acquainted with Swami Ranganathanandaji? You have met him?,Prabhupāda," I am not very much well known to him, but sometimes I met him."
Ambassador,"He was in here, and I asked him the definition, his definition of God, and he described, he thought a minute and said, ""Well, I would say God in the thread which links one good person to another.'' I thought that was an interesting definition.",Prabhupāda, Huh ?
Ambassador,I thought that was a very interesting definition.,Prabhupāda, No. That is stated in the Bhagavad- gītā .
Ambassador,Hm.,Prabhupāda," Sūtre maṇi - gaṇā iva . Just like you have got pearl necklace, and if it is woven in a thread. So all the pearls, they are resting on that thread. There is no question of good or bad. Everything is resting in God. There is no question of good or bad. Not that all good men simply rest on that thread. Whatever we see within our experience, everything is resting on God. There is another verse in the Bhagavad- gītā , māyā tatam idaṁ sarvaṁ jagad avyakta - mūrtinā : [Bg. 9.4 ] ""In the impersonal form, I am spread all over the manifestation, cosmic manifestation, and everything is resting on Me, but it is not necessarily I am in everything.'' That is the statement there. The definition of God, first of all, if you take this definition, as the root of everything, as the source of everything, however you like. It is the definition given by the Vedānta - sūtra , janmādy asya yataḥ : [SB 1.1.1 ] the origin or birth or emanation of everything. Now you take anything and find out where is the original cause, then you come to God. Take anything on this table. Your self, your body. Everything you take, if you go on searching, searching, searching, what is, where is the origin, then you come to God. That is the perfect definition of God, janmādy asya yataḥ : [SB 1.1.1 ] the origin or source of everything. What do you think?"
Ambassador,"Oh, I'm very impressed.",Prabhupāda, Yes.
Ambassador,The last...,Prabhupāda," This is the right... Another definition is God, God is all-attractive. Now, if you try to understand what is this attractiveness, just like your American country is very opulent, very attractive. If a man is very rich in the society, he is attractive. Then if a man is very strong, then he is attractive. If a man is very famous, he is attractive. If a man-man or woman—if a man is very beautiful, he is attractive. If a man is in the renounced order, he is attractive. If a man is very wise, he is attractive. These six features are attractive features. Now, these attractive features, every one of us have to some extent. Just like you are ambassador, representative of USA , so you are attractive. So this attractiveness you have got. Sometimes I have also got. Somebody comes to me, ""Let me see this Swami speak,"" you see. So this attractiveness everyone possesses. But God means who has got all the attractiveness in full. That is God. You may be very rich, but you cannot say that ""I am the richest person in the world."" That is not possible. But God can say ""I am the richest person in the whole creation."" Bhoktāraṁ yajña - tapasāṁ sarva - loka - maheśvaram [Bg. 5.29 ] . He says, ""I am the proprietor of everything.'' Just like in America, before the Europeans migrated to America, the land was there. It belonged to somebody. Now you are claiming you are proprietor. Say after five hundred years or something somebody may come. The land is there, we come here for the time being and claim ""It is my property.'' But actually who is the proprietor? Actually God is the proprietor. Therefore anything produced out of the land, that is also property of God. Just like if you have got a gold mine in your country. So I am not.... India will not go to claim that ""It is my property."" It is your property, because it is produced with your land. So if the whole land, whole sky, whole air, whole light, everything belongs to God, then where is your proprietorship? It is stated, bhūmir āpo 'nalo vāyuḥ khaṁ buddhiḥ mano eva [Bg. 7.4 ] . Now, nobody can say ""The sky is my property,"" but there must be some proprietor of the sky. What do you think? If everything has got a proprietor, everything is made of these five elements—sky, water, air, earth...."
Śyāmasundara,Fire.,Prabhupāda, Huh ?
Śyāmasundara,Fire.,Prabhupāda," Fire, mind, intelligence, ego. These eight elements. Kṛṣṇa says that ""They are my energies."" The things which are made by Kṛṣṇa's energy, how you can claim your property? Suppose a carpenter comes, you give him money to prepare some chair. The money is your energy. Now when the chair is prepared, he cannot claim that ""I have prepared this chair. It is my property."" No. It has been made with my energy; therefore it is my property. So if you make analysis of this whole cosmic situation you will find that everything is made out of the energy of God. Then how you can claim that ""I am proprietor""? This is false. This is called māyā . Just like we have seen in Calcutta when there was a (indistinct) during the transition state. Britishers are going on. There was a great Hindu -Muslim riot. Now they fought, Hindus and Muslims, and they died. After death, they're lying piles of dead body. No more Hindu and Muslim. It is simply lump of matter. But because they got a type of body, a type of mental situation, consciousness, they fought with one another, and then after death, no more claiming ""Hindu"" and ""Muslim."" This is called illusion. ""I am American,'' ""I am Indian,'' ""I am Hindu ,'' ""I am Muslim,'' ""I am this,'' ""I am that''—these are all designation. Really what I am? I am pure soul, part and parcel of God. That is my identity. So people should be taught this science. As soon as one understands his constitutional position, his actual situation, then he says, ""Oh, I am not this. I was struggling so hard under some misidentification."""
Ambassador,Is there a movement to get this philosophy or science propagated in the colleges?,Prabhupāda," Yes. We are trying, but we..."
Ambassador,That's your program.,Prabhupāda," ...we have no patronization, so whatever I have done, single-handed, and these boys help me a little. I did not get any help, either from my government or your government. But it is such a great science, such a great philosophy."
Śyāmasundara,"They're starting to appreciate it. Many of the universities we have a course, in America.",Prabhupāda, That is (indistinct).
Ambassador; Śyāmasundara,"You do have a course.; Yes, Berkeley, Southern California.",Prabhupāda, We have got books. I have brought along books for you.
Ambassador,Oh! Oh!,Prabhupāda," Big, big books. Dozens of books like that. Here is another book."
Mrs. Keating,"Now I know why I feel at one with nature, because I love the land very much too, and the land belongs to God. Now I feel at one with the land.",Prabhupāda, Huh ?
Mrs. Keating,That's why I feel at one with the land. Because the land belongs to God.,Prabhupāda, No. All lands belong to God.
Mrs. Keating,Yes.,Prabhupāda, Why do you think particular land?
Ambassador; Mrs. Keating; Ambassador; Mrs. Keating; Gurudāsa; Ambassador; Mrs. Keating; Ambassador,"She worships the land.; I feel at one with... I feel, I felt an affinity to the land, to nature. I feel a close affinity to the land.; Isn't that a lovely book His Divine Grace brought me?; Oh my!; Guru dāsa : There's sixty-four paintings in...; Yeah, I sought to achieve those paintings. Lovely.; Oh, that's wonderful.; Now, Your Divine Grace, when did you... Did you from boyhood enter this movement, or...",Prabhupāda, Yes. My father was a great devotee.
Ambassador,I see.,Prabhupāda, So from the very childhood I was trained up.
Ambassador,I see.,Prabhupāda, Then it was very much adjusted after meeting my spiritual master. But the ideas were impregnated and I was trained up from my childhood. That was a great opportunity that I got a very good.... I have dedicated this book to my father.
Ambassador; Gurudāsa; Ambassador; Śyāmasundara; Ambassador; Śyāmasundara; Ambassador; Mrs. Keating; Ambassador; Mrs. Keating; Ambassador,"Oh! Oh, yes.; Guru dāsa : ""To my father, Gour Mohan De .""; Yeah, it's nice.; We met Prabhupāda's sister in Calcutta. She is also a great devotee.; Oh, really!; And she was lamenting that she has eight sons, eight sons, but none of them are devotees, and her brother has so many hundreds of sons, real sons.; Oh.; Who is this?; His sister.; Oh.; The sister of who, of uh, His Divine Grace?",Prabhupāda," My sister, my sister."
Mrs. Keating,"Oh, your sister.",Prabhupāda, Material sister.
Ambassador,"Oh, yes.",Prabhupāda, She is my Godsister also.
Ambassador; Śyāmasundara; Ambassador,"She uh, she's uh...; She's also a devotee.; Devotee, but none of her children?",Prabhupāda, Why? She has got eight children.
Ambassador,"No, but I mean they are not devotees.",Prabhupāda, Yes. Not so much.
Śyāmasundara; Gurudāsa; Ambassador; Gurudāsa; Ambassador,"And the father of one of our Godbrothers from America, Mr. Teton, he's from Chicago, he was there with Girirāja, and she was saying to him, his sister was saying to him, ""You're so fortunate that your son is a devotee.'' He's a very wealthy attorney in Chicago, and his only son is a devotee, but he is somewhat, from material point of view, he was somewhat confused. So she said, ""You should be very happy that your son is a devotee. I have eight sons, and they are not like your son.""; Guru dāsa : You met Girirāja. He came last time to the city.; Oh, yes. I remember. Yes, yes.; Guru dāsa : He's from Chicago.; That's right. Now he, uh, he has a wife here? No? He's not married?",Prabhupāda," No, he's not."
Ambassador; Śyāmasundara; Ambassador; Śyāmasundara; Ambassador and Guest; Śyāmasundara; Mrs. Keating; Ambassador; Śyāmasundara; Ambassador; Mrs. Keating,"But your wife is here?; Yes, she's here in India.; It's a lovely little girl, and so well behaved. She must have already had a part of the Kṛṣṇa consciousness. Our little girls at that age don't behave so well, usually. But she is so quiet and sweet.; Her only education has been from Prabhupāda.; Really!; Completely. She doesn't know anything but Kṛṣṇa and...; Really.; How old is she?; Three.; Three.; But she doesn't tell me her name. (child giggles)",Prabhupāda, This is bad reputation.
Śyāmasundara; Ambassador,Why don't you chant for her?; Could you chant?,Prabhupāda," Oh, yes. She can chant. Sarasvatī prabhu , chant little."
Śyāmasundara,Swamiji wants you to chant.,Prabhupāda," Come on, come here. Hare Kṛṣṇa . Come on."
Mrs. Keating,"She's shy, like all children.",Prabhupāda," She dances very nice, chants very nice. And very rhythmically."
Mrs. Keating,Really?,Prabhupāda," Oh, yes."
