Question Speaker,Question Text,Answer Speaker,Answer Text
Śyāmasundara,"One thing that has so much gone to, into our hearts is the fact that this philosophy and this way of life is eternal and nonsectarian. It applies to all people of all different races, different ages.",Prabhupāda," That is my experience, you see. I have preached this cult everywhere, and everywhere it has been received well."
Ambassador,"Well that's a philosophy that mother Anne here believes in. All, all, all religions are...",Prabhupāda," First of all, we have to understand what do you mean by religion?"
Mrs. Keating,What?,Prabhupāda, What do you mean by religion?
Mrs. Keating,"Oh, religion. Well, I'm more of an eclectic. I believe in, in the best of all religions.",Prabhupāda, Huh ?
Mrs. Keating,I believe in the best of all religions.,Prabhupāda, What is that?
Mrs. Keating; Ambassador; Mrs. Keating; Śyāmasundara,"The highest.; He asked what you mean by religion. You mean an organized...?; Oh, no. I don't mean anything organized.; No. What...",Prabhupāda," No, no, first of all, principle of religion. What is the principle of religion?"
Mrs. Keating,"Well I think it comes from within, inside. I think we are at one with God and I am a reflection of God. I am an idea of God. That's what I believe.",Prabhupāda," That is very nice. Idea of God means whatever you have got, God has got the same idea. Is it not?"
Mrs. Keating,Huh ?,Prabhupāda, You mean to say like that?
Mrs. Keating,Ah huh .,Prabhupāda, Or you are a sample of God.
Mrs. Keating,Yes.,Prabhupāda," A small sample of God. Just like you take a drop of ocean water and you taste it, then you can understand immediately the whole ocean is salty. Similarly, if you analyze your characteristic, then the same characteristic is there in God. Just like you want to love someone. Everyone wants to love someone. Therefore it can be concluded that God has got the propensity to love."
Mrs. Keating,Yes. God is love.,Prabhupāda, Yes. But if God is love...
Mrs. Keating,Spirit?,Prabhupāda," Yes. Kṛṣṇa means love, so when you want to love somebody and somebody wants to love you, the both of us must be a person."
Mrs. Keating,Both must be...?,Prabhupāda," Person. You don't love the air. You love your husband. He is a person. And he loves you, you are a person. Therefore God must be person. This conclusion. Because I am person, I am a sample of God, so God must be person. What do you think? Without God being person, how we can reciprocate love?"
Ambassador,"Uh, Your Divine Grace, I'm sorry, but I have an Ambassador waiting, and I have to move from the sublime to the mundane. I'd like to continue this, but he has this appointment and I have to... But I appreciate very much your coming in and...",Prabhupāda," Now, I am also coming to the mundane point of view. The next time I want, when I go and come back to USA , I wish to see the President, if you can help me?"
Ambassador,"Well I, I can write a letter, but uh, I've had, let me, don't let me discourage you, but let me tell you that I've had at least a dozen religious leaders from India request the same thing, and none of them have gotten to see the President.",Prabhupāda, But one thing is...
Ambassador,But I'll be glad to try to help.,Prabhupāda," So, the things are, such an important philosophy, important movement is going unnoticed. You are busy to help the whole world so that peace will come, people may be happy, but instead of being happy, your country are becoming hippie."
Mrs. Keating; Ambassador,(laughing) Happy to hippie.; That's right.,Prabhupāda," So there is some defect, and here is a chance to rectify that defect. Here is a chance. I can argue with any scientist, any philosopher, that this is the only remedy to save people from frustration. This is the only remedy. Why it should go unnoticed by your country, such a great, who are willing to help others, willing to help. You started the United Nations in your country for that. Let us do something tangible, scientific, that people will be happy."
Ambassador,"Oh, I think the, what this young man says is very encouraging, that some of this is now being slowly inculcated in our colleges and universities.",Prabhupāda, Yes.
Śyāmasundara; Ambassador; Śyāmasundara; Ambassador; Gurudāsa; Ambassador; Mrs. Keating; Ambassador; Gurudāsa; Mrs. Keating; Ambassador,"Of all the movements, religious movements from India that have gone there, this one has shown the most potency of all, by far...; Yes.; There's been nothing like this movement ever before in the United States or in the world. And its potency proves the philosophy. If something is potent it automatically grows.; Yes, that's true.; Guru dāsa : We want also to be encouraged by our brothers and friends.; Yes, well that's right, and I'm so grateful to you for that lovely book. That's a beautiful book. I'll keep it out here on my table. Maybe I will send... You know, I had a young man here that was having trouble to extend his visa , and the government said to him, ""What are you here for?'' He said, ""I am here to find myself.'' They said I should have sent... He's a hippie...; This would be perfect.; So I said, they said when they were in last time, you should have sent him to us, which I would do again, because it's...; Guru dāsa : Then that hippie will become happy.; Will become happy, yes.; Well, Your Divine Grace, thank you very much for stopping to see us.",Prabhupāda, Thank you.
Ambassador; Śyāmasundara; Ambassador; Devotee; Śyāmasundara; Mrs. Keating,"Very nice of you. And nice to see you.; Hare Kṛṣṇa .; Give my regards to your wife. Bye.; Hare Kṛṣṇa .; Say good-bye, Sarasvatī .; Where can you be reached? Anyplace?",Prabhupāda, My American headquarters.
Mrs. Keating,The American...,Prabhupāda," Yes, American headquarters."
Ambassador,Is it in there?,Prabhupāda, Yes.
Mrs. Keating; Śyāmasundara; Ambassador; Śyāmasundara; Ambassador; Mrs. Keating; Ambassador,"Oh, fine, fine. Yes.; Today we received a telegram. Macmillan Company has just agreed to print Prabhupāda's Bhagavad- gītā .; Oh, really!; Thirty-five thousand copies.; Oh!; Oh, that's marvellous. It's a very good...; I used to be the attorney for the Macmillan Company.",Prabhupāda," Yes, here is, here is my headquarters address."
Ambassador; Mrs. Keating,"I see. In Los Angeles.; Oh, good. Fine.",Prabhupāda, That is my Press address.
Śyāmasundara; Ambassador; Śyāmasundara; Mrs. Keating; Ambassador; Mrs. Keating; Ambassador; Mrs. Keating,"This was received today.; ""Macmillan enthusiastic. Commitment letter sent to you. 30,000 paper, 10,000 hard.""; Forty thousand.; Excellent.; Forty thousand.; Forty thousand. That's wonderful.; That's great.; Really, and it's a fine company.",Prabhupāda," Yes, fine."
Mrs. Keating; Śyāmasundara,It's very good.; Ambassador Keating was the attorney for Macmillan.,Prabhupāda, Oh!
Ambassador,Yes.,Prabhupāda, (laughs) Hare Kṛṣṇa .
Ambassador,So I... Very nice to see you.,Prabhupāda, Thank you.
Ambassador; Śyāmasundara; Śyāmasundara; Indian man; Śyāmasundara; Indian man; Śyāmasundara; Indian man; Śyāmasundara; Indian man; Śyāmasundara; Indian man,"And I appreciate your calling.; Thank you very much. (end); Did Vāsudeva carry Kṛṣṇa across the Yamunā ?; Yes.; But their home was somewhere, other place.; Huh ?; Their... The other Gokula was somewhere else.; The Kṛṣṇa was carried through old Gokula .; Ah.; Old Gokula .; Not at this place.; Not at this place. But for those whom..., for those people who are in, this is the real Gokula . (indistinct), but I think the old Gokula is that. [break]",Prabhupāda, ...it is available?
Devotee (1),Some boxes.,Prabhupāda, Ah.
Indian man (2); Devotee,"Boxes, oh, you leave it there.; Huh ? [break]",Prabhupāda," Gokula , Hari bol . That does not cooperate with the modern..."
Indian man; Śyāmasundara,No. It must have changed completely. [break] ( kīrtana ); ...tell us a little bit about the temple as we move?,Prabhupāda," Yes. This temple was constructed by Śrīla Jīva Gosvāmī, one of the first disciples of Lord Caitanya , and this is Narottama Samādhi . Here is Kṛṣṇadāsa Kavirāja Gosvāmī entombed, and here is Rūpa Gosvāmī entombed. Later on, several other devotees, they are not entombed like them. Flowers from their body, they were placed. It is called Puṣpa Samādhi . But here, the original bodies."
Devotee (1),Ah. This is Kṛṣṇadāsa Kavirāja's body?,Prabhupāda, Yes.
Devotee,Original bodies.,Prabhupāda," And that side, the original body of Śrī Rūpa Gosvāmī. [break]"
Śyāmasundara,...a well?,Prabhupāda, Yes. This is the original well.
Passer-by; Devotee (1),"(Hindi to Prabhupāda); Did the Gosvāmīs drink from this well, Śrīla Prabhupāda?",Prabhupāda," Yes. This is... This well water is used for cooking, for... [break]"
Devotee (1),"And Jīva Gosvāmī and Rūpa , they drank from this well?",Prabhupāda," (Hindi with passers-by) This is the place for dining. The Gosvāmīs, they used to dine here, this room."
Devotee (1),Is this building four or five hundred years old? This very room?,Prabhupāda," Huh ? Oh, yes!"
Devotee (1),This is the original building?,Prabhupāda, Yes. Not less than four hundred and fifty years.
Śyāmasundara,And they used to meet here daily?,Prabhupāda," Yes. They, all the Gosvāmīs, used to sit down there. And Rūpa Gosvāmī's bhajana , he was dancing here, and after his passing away, he was entombed there. But that tomb is Lokanātha Gosvāmī. He is also one of the important Gosvāmīs."
Śyāmasundara,Rūpa Gosvāmī.,Prabhupāda, (Hindi with passers-by)
Śyāmasundara,"Could you tell us any stories about Rūpa Gosvāmī while we are sitting here, or any...",Prabhupāda," (Hindi) Rūpa Gosvāmī was a minister. So after retirement he, under the instruction of Caitanya Mahāprabhu , he came to Vṛndāvana ."
Indian man,(Hindi),Prabhupāda," Rūpa Gosvāmī. So formerly they were living under trees. That I have already described in Caitanya - caritāmṛta . Later on, when Jīva Gosvāmī constructed this temple, he is nephew and disciple, at that time Rūpa Gosvāmī also, he lived with his disciple. Actually, this temple belongs to Jīva Gosvāmī, and Rūpa Gosvāmī's temple is at..."
Śyāmasundara,We saw it.,Prabhupāda, ...Govindajī.
Śyāmasundara,Yeah.,Prabhupāda," And Sanātana Gosvāmī's temple is at Madana - Mohana . But when Jīva Gosvāmī was here, naturally—they were elder uncle—so lived together, and because they, all of them lived here, so other Gosvāmīs, Gopāla Bhaṭṭa Gosvāmī, Raghunātha dāsa Gosvāmī, all of them used to meet here. And Gopāla Bhaṭṭa Gosvāmī used to live (indistinct), and all other Gosvāmīs used to be here. And this is explained, Rūpa Gosvāmī bhajana , that chant (indistinct)."
Indian man; Śyāmasundara,"(Hindi with Prabhupāda); Are those rooms you live in, were they formerly inhabited by the Gosvāmīs, Jīva or Rūpa Gosvāmī, those rooms you have now?",Prabhupāda, These rooms?
Śyāmasundara,Yes.,Prabhupāda, No.
Śyāmasundara,These came after that time.,Prabhupāda," This is..., rooms were existing, but they used to sit down here."
Devotee (1),Was Vṛndāvana mostly...?,Prabhupāda," (Hindi) In this place, all the six Gosvāmīs used to sit down and read Śrīmad- Bhāgavatam ."
Śyāmasundara; Indian man,"And, and did...; (Hindi)",Prabhupāda, Ah.
Śyāmasundara,At that time Vṛndāvana was existing as a village or mostly open area?,Prabhupāda," Formerly, before Lord Caitanya's coming here, this was open fields. Nothing..."
Śyāmasundara,So everything has been built up.,Prabhupāda," (Hindi) So after the Gosvāmīs came here, practically, all this Vṛndāvana city has developed. Before that, it was open fields. (Hindi) You developed this photo here in India also?"
Devotee (1); Indian man,"Ah, some of it.; At least mine and Swamiji.",Prabhupāda, You send some copies here.
Devotee,Yes.,Prabhupāda, (Hindi) You can take one photograph alone. Have you got (indistinct).
Śyāmasundara; Devotee; Śyāmasundara,This man here. This man.; Where?; Right here. Is he one of your old friends?,Prabhupāda, Yes.
Śyāmasundara,He lives in the...,Prabhupāda, In this temple.
Śyāmasundara,"He lives in this temple. This, where the...",Prabhupāda, He has left his (indistinct). [break]
Śyāmasundara; Indian man,"Bhakti - rasāmṛta - sindhu was written here, in this place?; (Hindi)",Prabhupāda, (indistinct) Imlitala.
Śyāmasundara; Indian man; Gargamuni; Śyāmasundara; Gargamuni; Śyāmasundara; Gargamuni; Śyāmasundara,"Imlitala? (indistinct) The car is not here?; No, he's just coming the...; It's just a very brief walk.; We can walk.; It's very brief walk.; Is that, is that Mahā - rāsa place on the way?; It's, yes, it's more or less, Sevakunj.; Is it, is it, er, should we.... [break] When we go to Bombay, I think.",Prabhupāda, (indistinct)
Devotee (2),The place where mahā - rāsa took place?,Prabhupāda, (indistinct)
Devotee (2),So it is of no significance to us then?,Prabhupāda, Eh?
Śyāmasundara; Indian man,This... Words and films.; (Hindi),Prabhupāda," (Hindi) New York, San Francisco, Los Angles, Chicago, Boston, Buffalo, Montreal. Sixty-six all over the world."
Indian man,(Hindi with Prabhupāda),Prabhupāda," Oh. Give immediately, on the (indistinct)."
Devotee,(indistinct),Prabhupāda, Give immediately. And you come to the Imlitala.
Devotee,Yes.,Prabhupāda, (Hindi)
Indian man; Śyāmasundara; Indian man,"(Hindi) (referring to Sarasvatī ) Don't eat that She is licking the...; What, coins?; No. Licking the (indistinct) also.",Prabhupāda," Oh, how you have come here?"
Indian man (3); Śyāmasundara,(indistinct); This is a new edition?,Prabhupāda, Yes.
Śyāmasundara,"Oh, all the dogs are coming. (dogs barking) Is the driver here? There's the driver. Should we walk, or...",Prabhupāda," (Hindi with guest) [break] ...and how it is concerned, we can get many. The thing is, will he get his (indistinct)."
Śyāmasundara,Hm. I've been thinking a lot about it.,Prabhupāda, Huh ?
Śyāmasundara,"I'm thinking that if we developed a very large center here, like a headquarters, it would have worldwide impact.",Prabhupāda, Uh.
Śyāmasundara,"Because, just like a throwing a rock in the pond, first of all the devotees of India would all be coming...",Prabhupāda, Uh.
Śyāmasundara,"...and it would revitalize the spiritual life of India from this point, and then the whole world would come to Vṛndāvana .",Prabhupāda," So, now next thing, what to do?"
Śyāmasundara,"I was thinking perhaps I would like to devote a lot of time to raising funds for such a project—in the United States, England.",Prabhupāda, (indistinct)
Śyāmasundara,Manage.,Prabhupāda, Manage? There's no scarcity of funds.
Śyāmasundara,"Yes. If we built the most magnificent temple and center here, which was full of spiritual life, day and night hundreds of devotees would be there having kīrtana , and all the devotees of Vṛndāvana would come. They're simply astounded by our kīrtana when they come to our house.",Prabhupāda, (Hindi)
Śyāmasundara; Devotee(2); Śyāmasundara,"What's this? This is another temple? Imlitala?; Imlitala.; Oh, this is not the entrance?",Prabhupāda, Yes.
Indian man; Indian man (2),(Hindi); (Hindi),Prabhupāda, Hare Kṛṣṇa .
Śyāmasundara; Indian; Śyāmasundara,"Jaya .; Hare Kṛṣṇa . Jayo Mahārāja .; That is your Guru Mahārāja , Prabhupāda?",Prabhupāda, Huh ?
Śyāmasundara,That is a mūrti of Guru Mahārāja ?,Prabhupāda, Ah!
Śyāmasundara,Aaah.,Prabhupāda, Not like (indistinct). (Hindi)
Śyāmasundara,"(to daughter) Sarasvatī , who is that?",Prabhupāda, (Hindi with Indian man)
Śyāmasundara,"What is the history of this temple, Śrīla Prabhupāda?",Prabhupāda, (to Indian man) You say.
Indian; Śyāmasundara; Indian; Śyāmasundara; Indian,"You would like to say in English?; Ah, yes.; Not in Hindi.; If you can speak English, please.; This is an old place, Vṛndāvana . Śrī Kṛṣṇa Caitanya Mahāprabhu came here and sat under this tree nearly five hundred years back. He sat under this tree and meditated: Hare Kṛṣṇa , Hare Kṛṣṇa , Kṛṣṇa Kṛṣṇa, Hare Hare/ Hare Rāma , Hare Rāma , Rāma Rāma, Hare Hare, until midday. Several days He chanted His name and came here and sat . This tree is the old tree of Dvāpara - yuga . Under this tree, Rādhikā and Kṛṣṇa both met once. This is written in Param - Gita (?) For this reason Kṛṣṇa Caitanya Mahāprabhu came here with this reason. He came here and sat under this tree and recited the name Rādhā - Kṛṣṇa . When He sat here once, one Vaiṣṇava , name Kṛṣṇadāsa , name Kṛṣṇadāsa , he saw, at night, he dreamt of Śrī Caitanya Mahāprabhu and became mad to see Him, and he crossed the Yamunā River, Keśīghāṭa, and gradually came here and saw the glorious silhouette of Śrī Caitanya Mahāprabhu , and he made his obeisance to His feet, and Śrī Caitanya Mahāprabhu touch him, and he became mad with Kṛṣṇa - prema , and then Mahāprabhu , from this place, Kṛṣṇa Caitanya Mahāprabhu came, went to Rādhā - kuṇḍa , but displayed the name of this before that time.",Prabhupāda, He went to Rādhā - kuṇḍa ?
Indian,"Rādhā - kuṇḍa . He went there and asked the old gentlemen of that place that ""Where is Rādhā - kuṇḍa and Śyāma- kuṇḍa ?'' But none of them (indistinct) Rādhā - kuṇḍa .",Prabhupāda," Oh, yes, discovery of Rādhā - kuṇḍa ."
Śyāmasundara; Guest,"From this place He went there.; Yes, He went there, Rādhā - kuṇḍa , Śyāma- kuṇḍa place. Ariṣṭa - grāma .(?) Ariṣṭāsura(?) was (indistinct), killed there by (indistinct) Kṛṣṇa . So He went there and asked the old people in there, but nobody can say that where is Rādhā - kuṇḍa and Śyāma- kuṇḍa . After that Kṛṣṇa Caitanya Mahāprabhu Himself said to the field, that ""This is Rādhā - kuṇḍa and this is Śyāma- kuṇḍa ,"" and that this place was low place. There's some water there. He lifted the waters (indistinct) and said that ""These two places are Rādhā - kuṇḍa and Śyāma- kuṇḍa ."" In this way, Rādhā - kuṇḍa and Śyāma- kuṇḍa were discovered there. After that He went to Sola , Solakṣetra(?), and because and Śrī Kṛṣṇa Caitanya Mahāprabhu came here, so after His visit here He went to (indistinct), and Rūpa and Sanātana first came here. And after, following them, all the Vaiṣṇavas came to Vṛndāvana , and gradually Vṛndāvana was discovered (indistinct), and places and important places which..., holy places of this Vṛndāvana and Vraja - maṇḍala was discovered by the followers of Kṛṣṇa Caitanya Mahāprabhu , (indistinct). They both discovered all the places (indistinct), holy places of Vṛndāvana . In this way, this place was discovered. Nobody knew this place. Kṛṣṇa Caitanya Mahāprabhu Himself came here, sat under this tree because under this tree, Kṛṣṇa and Rādhikā met. (Hindi) Once, at the time of rāsa , how They met here once at the time of rāsa , Śrīmate Rādhā , Rādhikā felt that ""I am not be able...""",Prabhupāda," ""Able to walk."" He carried..."""
Indian,"""I'm not really (indistinct)."" So He left rāsa and went out. Śrī Kṛṣṇa saw that there is no Rādhikā , every, all the gopīs were still, Rādhikā not there, so He left all them and went out and began to search Her. But through roaming about Vṛndāvana He did not caught Her, and after became very regretted. He sat under this tree, and Rādhikā afterwards came here and met Him. In this way, Rādhā Kṛṣṇa (indistinct).",Prabhupāda," (Hindi with Indian) Guru - Gaurāṅga , then Rādhā - Kṛṣṇa . Where is my stick?"
Devotee (2),Stick? Just here.,Prabhupāda," (Hindi) Accha . If you want to take photo , you can take."
Indian,"If you wish, you can take photo .",Prabhupāda, Is it ready? Film is ready? Where is he? He has gone?
Śyāmasundara; Devotee (1),You can take photos of the Deities if you like.; He has gone to the other side.,Prabhupāda, All right.
Śyāmasundara; Devotee; Śyāmasundara,"The, the movie camera.; It's really dark.; Oh, it's dark.",Prabhupāda, (Hindi)
Śyāmasundara,This is Yamunā River?,Prabhupāda, Yes. This is branch of.
Śyāmasundara,Branch of Yamunā .,Prabhupāda, Yes.
Indian; Devotee,You come this place. Come this way.; Where is the main Yamunā ?,Prabhupāda, Main Yamunā is (indistinct)
Śyāmasundara; Indian; Śyāmasundara; Indian; Śyāmasundara,It's very strong....; (indistinct); Thousands of years old.; This is (indistinct) place of Śrī Kṛṣṇa Caitanya Mahāprabhu .; Oh.,Prabhupāda, (Hindi)
Śyāmasundara,This is a ghāṭa ?,Prabhupāda, This was formerly a ghāṭa . (Hindi)
Śyāmasundara; Indian; Śyāmasundara; Indian; Śyāmasundara,"Oh. There's Yamunā out there, is it not?; (Hindi) Here is the footprint of Kṛṣṇa Caitanya Mahāprabhu .; Accha .; He stepped here. Big!; It's very large, large.",Prabhupāda, (to passer-by) Hare Kṛṣṇa . Jaya .
Devotee; Śyāmasundara,"Jaya .; Lord Caitanya was very tall, Śrīla Prabhupāda?",Prabhupāda," Oh, yes."
Child,Hari bol !,Prabhupāda, Hari bol ! (Hindi)
Śyāmasundara,Who is that?,Prabhupāda, Gosvāmī. He is one of my eldest Godbrothers.
Śyāmasundara,Oh.,Prabhupāda, He also went to London. Yes. I sometimes speak that he talked with Lord Zetland.
Śyāmasundara,Aha . But he left no followers there? (aside:) Hare Kṛṣṇa . Thank you very much. Prabhupāda?,Prabhupāda, Hm?
Śyāmasundara,"When Kṛṣṇa used to come here, was His home in Gokula at that time, or Mathurā ?",Prabhupāda, Yes.
Śyāmasundara,And He used to come here for herding the cows?,Prabhupāda, Yes.
Devotee (2); Śyāmasundara,But He did not live here.; Was there any palace here?,Prabhupāda, Huh ?
Śyāmasundara,Was there any palace here of His parents?,Prabhupāda, They say there is a (indistinct) (Hindi) Huh ? [break]
Śyāmasundara,Everyone wants some prasāda .,Prabhupāda, [break] ...some small feast.
Indian; Śyāmasundara,(Hindi); Sarasvatī .,Prabhupāda, (Hindi with Indians)
Śyāmasundara,I should stay here with Subala Mahārāja ?,Prabhupāda, Huh ?
Śyāmasundara,I should stay here with Subala Mahārāja ?,Prabhupāda, As you like it.
Śyāmasundara,What is that?,Prabhupāda, We shall talk.
