Question Speaker,Question Text,Answer Speaker,Answer Text
Pañcadraviḍa; Prajāpati; Acyutānanda; Prajāpati; Acyutānanda; Prajāpati; Acyutānanda; Prajāpati,"He said to that effect, yes. He said, ""Your argument about a fisherman community is not completely valid.""; There's always a differentiation we must make between a Christian, who we might meet and engage in argument, and the theologian himself. The theologian is a very oily character, very hard to pin down. The Christian, he may have specific beliefs, dogmatic, tenaciously holding to dogma, but the theologian, he-; Well what does that...? What do they say?; The theologians?; Yes.; They are simply word-jugglers. They are not held nearly so tight to...; Well, then, what's some of the things they invent?; Well, one we were bringing up is that theology is a means that faithful men are coming to understand themselves, not that are approaching God. One approaches God within a community and within...",Prabhupāda," That a faithful man understands God, that we say. Then what is the basic principle of theology? Why this separate science has been established as ""theology""? Logy means science."
Prajāpati,"Yes. From the Christian point of view, the science is there simply that man does not accept simply by sentiment or by faith, but he can have his mind convinced as well.",Prabhupāda, Yes.
Acyutānanda; Prajāpati; Acyutānanda; Prajāpati; Pañcadraviḍa; Prajāpati; Pañcadraviḍa; Prajāpati; Pañcadraviḍa; Ravīndra-svarūpa,"But that has to be there. So what is the self according to theology?; Again, Christian... InKṛṣṇaconsciousness, we can ask such a question. ""What does theBhagavad-gītāorKṛṣṇaconsciousness say about the self or aboutKṛṣṇa?"" But in theology it's not so cut and dried. There's so many different authorities, each one saying a different thing.; Well, that's why I said...; You must say, ""So and so says...""; Or they say, ""At the time of judgement, a man must stand before the ever-living God and he will be held, called, held accountable for his actions during this life.""; That's only a very small group. Those who are fundamentalists, who take strict interpretation of theBible,and they're a very small group. And even that group doesn't have very many thoughtful or theological men backing it.; Well, all Christians, they believe that there are, in one way or another, they're going to be held accountable to the word of God. Isn't that?; No.; Well, how they can have any...? How they can have any tenets or principles if they don't believe they're accountable to God?; Because they believe they can use Jesus like a doormat to clean their sinful activities of themselves.",Prabhupāda," Now, one thing is that why theology should be in reference withBible?If it is a science, then why should it refer only to theBible?"
Prajāpati; Acyutānanda; Prajāpati; Acyutānanda; Prajāpati; Acyutānanda; Prajāpati; Acyutānanda; Prajāpati; Acyutānanda,"Yes. The biggest school of theology, Harvard School of Theology... The study of theBibleis there, but only on the side. Instead, they study Freud, Karl Marx, everybody else...; Well, they should studyGītā.; Yes, that's our point. How to get them to realize that? That's a question.; So we'll ask them, ""We have a most scientific and detailed description of the self and God and the means to join to Him. That cannot be avoided in your study. And we claim the highest standard of renunciation, and worship and godly society.""; And their answer...; ""You can't avoid us.""; Their answer to such a challenge will be: ""You please go across the street to the study of Hinduism.""; ""No, you said theology. God is not a Christian God.""; But they're not interested. They only want to hear the Christian point of view. And for them, ""Christian"" doesn't meanBible;it means their own...; That's Prabhupāda's first thing—what is God? Is it the Christian God? What is God? What is your definition of God? Is He a Christian God or pure?",Prabhupāda," No, the... The... First of all, this should be established, whether God can be Christian God orHinduGod or Muslim God? Is God to be designated like that? God is one, so how there is one God? If Christian has got separate God, aHinduhas got separate god, Muslim has got separate God, then how God is one?"
Prajāpati,"Their answer would be: ""We cannot talk about God. We can simply talk about the Christian tradition of God, or the...""",Prabhupāda," Now, again you come to the Christian God."
Acyutānanda,Then your knowledge is limited.,Prabhupāda, Then... Either Christian tradition... Then it becomes bound up by the Christian ideas.
Prajāpati,And that is exactly the situation today.,Prabhupāda," But that is not God. Just like gold. Gold is everywhere gold. Because it is in Christian country, you cannot say, ""It is Christian gold."" And because it is in Muslim country, you cannot say, ""It is Muslim gold."" Gold is the world standard of money. The same gold, dispatched from America, can be accepted in India. Dispatched from India, it can be accepted in Palestine because it is gold. Everyone who knows what is gold, he'll accept it. So God should be like that. And therefore the nameKṛṣṇa, ""all-attractive""... When there is gold, either you be Christian, Muslim,Hindu—""Oh, here is a lump of gold. Can I possess it?"" That is attraction. So as gold is all-attractive, similarly, God must be all-attractive. And that word is used asKṛṣṇa.Kṛṣṇameans all-attractive. One who knows gold, he'll be attracted. Doesn't matter whether he'sHinduor Muslim, Christian, poor, rich man, black, white. It doesn't matter. Here is gold, and everyone... Just like in your country there was gold rush. Eh? In California? From all different parts of the world they came. So gold is gold for everyone. So now one should try to understand or check what is gold. That is required."
Prajāpati; Acyutānanda; Pañcadraviḍa,"These men, Śrīla Prabhupāda, are very, very puffed up. They think that even such discussions of who God is and what God is, that... They feel they're way past that, and that's for lower class men to discuss.; Why do we give anything to them? (?); But when you came to France, Śrīla Prabhupāda, you spoke at the Theology Club. About four years ago you came for a conference. They arranged a big meeting at the Theology Society in France, a world-wide society. And one thing I was... One thing I was considering. They must be interested because the Christians say that there is soul, and they say that there is God, so then wouldn't our question be: ""What is the relationship of the soul to God?"" They admit there is a soul. Every human being, they say, has a soul.",Prabhupāda," No. That, that is also beginning of understanding. But first, preliminary understanding should be that God is one. There cannot be Christian God. There cannot beHinduGod. There cannot be Muslim God. That is not complete idea of God. That is imperfect. Just like in Vedic literature,brahmeti paramātmetibhagavāniti: [SB1.2.11]three phases of understanding of the Absolute. First, beginning, isBrahman, then, further advanced,Paramātmā, then, final advancement,Bhagavān. Similarly, the final realization of God is the Supreme Person. And then we should seek (see?) who is that person. That is real theology."
Pañcadraviḍa,"What if they say, ""We agree there's one God, but we do not agree that His name is Kṛṣṇa"" or ""We do not agree...""",Prabhupāda, Then you suggest what is His name. My next challenge will be... You suggest.
Pañcadraviḍa; Ravīndra-svarūpa,"Well, they...; In theBiblethey give twelve names for God.",Prabhupāda," No, let me finish this. If you do not acceptKṛṣṇais the name of God,... I have explained what is the idea ofKṛṣṇa. TheKṛṣṇameans all-attractive. The example is given: Just like gold. Gold is attractive to everyone—to the educated, the uneducated, to the black, to the white, man, woman, everyone. One who knows God, er, one who knows gold-gold is attractive. Similarly, God is all-attractive. There cannot be that ""It is black gold,"" ""It is white gold,"" ""It is Christian gold,"" ""It isHindugold."" No. Gold is gold. So we presentKṛṣṇathat ""Here is God, all-attractive."" Now you say, ""No, He's not God."" Then you present your God."
Pañcadraviḍa,"Well, I know just the...",Prabhupāda," You cannot say, reject. They cannot rejectKṛṣṇaunless you present an alternative."
Pañcadraviḍa,"Well, here's the argument. Part of the thing I remember in the Judeo tradition, Judeo-Christian tradition, in the... Whenever we used to go to service and all that, they used to have in the prayer books... They would never write out the name of God because they say...",Prabhupāda," Oh, that means you do not know."
Pañcadraviḍa,"No, they say God's name should never be spoken out loud.",Prabhupāda, Why?
Pañcadraviḍa,I don't know.,Prabhupāda," This is nonsense. If you know somebody, why should you say, ""His name should not be explained""?"
Brahmānanda; Ravīndra-svarūpa; Acyutānanda,"They say that God's name is so pure and we are so impure that to utter His name is to make it impure.; Is blasphemy.; No, I heard the explanation that a nonbeliever should not know it.",Prabhupāda, That is all right.
Acyutānanda,So they don't say it out loud.,Prabhupāda," No, when we come to argument that... We are supposed to be all believers in God. We are not nonbelievers. We simply want to ascertain who is that God. We are not nonbelievers. Then some persons who believe in God come together so to ascertain who is God. So just like when we come to a meeting to elect a president, so they are not nonbelievers. They are not nonbelievers. As there are so many personalities, candidate for president, now who is the right person to become the president? That is wanted. To the nonbelievers, he has no access. About discussion in God he has no access. When we discuss about God, it is supposed they are all believers. So if you say... Just like we are holding meeting to ascertain... There are so many names of God. Now we ascertain who is real God. God means there should be no more above Him.Mattaḥparataraṁnānyat [Bg.7.7].That is God."
Viṣṇujana; Acyutānanda; Viṣṇujana; Acyutānanda; Viṣṇujana,"Christians have such a name. They call Him Yahweh.; Yahweh.; Yahweh means ""I am that I am. No one is beyond Me.""; Yahweh.; They will say Yahweh is God.",Prabhupāda," No, Yahweh, what is...? That is the name?"
Viṣṇujana; Prajāpati; Viṣṇujana; Prajāpati,"Name. ""I am that..."" It means in English, ""I am that I am.""; Some people translate that as Jehovah.; Jehovah.; But it's the same word. In fact, everyone agrees they do not know what the real name is. Some say Yahweh; some say Jehovah. The Jewish tradition replaces completely and says Adonai, instead.",Prabhupāda, That's all right. He may not say. But we have to take from the meaning. What is the meaning?
Viṣṇujana,"""No one is beyond Me.""",Prabhupāda," That's all right. ""No one is beyond Me."" Then he comes to our conclusion, all-attractive. This is... They come to our conclusion, all-attractive. Because if somebody is beyond Him, then he should be attractive. But if He's final attractive, then all-attractive,Kṛṣṇa.Kṛṣṇameans all-attractive. What do you think?"
Prajāpati; Acyutānanda; Prajāpati; Acyutānanda; Prajāpati; Acyutānanda; Prajāpati; Acyutānanda; Prajāpati; Acyutānanda; Prajāpati,"It would be very nice to engage them in this way, Śrīla Prabhupāda. But they're not interested. They're interested in...; Self. ""Then my aim is that..."" They're interested in people, then. How they understand self.; Right.; So we have the highest standard of renunciation, highest standard of piety, highest standard of all religious qualities. So they cannot deny it. They cannot be noninterested.; But in that sense, they would see us as a threat.; Yeah. So then you're only interested in keeping your Harvard chair.; That's right.; Then they're not sincere.; Harvard chair, bishop's salary... Bishops get 25,000 dollars a year.; Then if you can't discuss openly with people, then what's the point?; The point is they have big, big buildings, big, big salaries, big, big positions...",Prabhupāda," That is... That is all right. If you want to keep one man in a very high position, you should give all comforts. That is good. Just like if you want to keep a king, he must have a palace. He must have his officers, secretaries..."
Acyutānanda; Pañcadraviḍa; Acyutānanda; Prajāpati; Acyutānanda; Prajāpati,"So he means to say that if we present that we are better theologists, then their position will be in jeopardy.; Then the question is ""Then why...?"" Now we are... Hypothetically, in this situation, we are approaching these theologists. Then why we are approaching if they are not open to discussion? I mean, what is the purpose in going to them?; No.Prajāpatihere studied theology and brought it up to Prabhupāda.; The purpose is because they are purporting to be...; Authority.; ...what Śrīla Prabhupāda really is. Śrīla Prabhupāda is the real theologian, but they are using that name. And they... In that sense, they are the biggest cheaters. They're going by the name theologians, and they're not actually theologians. They're simply scholars, dry academicians.",Prabhupāda, What is that scholarship? Simply...
Prajāpati,"The scholarship... They have degrees by their names, and they've gone through listening to other mental speculators, and now their students listen to them.",Prabhupāda, You said there are twelve names?
Ravīndra-svarūpa,Yes. I have a list of them.,Prabhupāda, In theBible?
Ravīndra-svarūpa; Acyutānanda; Ravīndra-svarūpa; Acyutānanda,"Yes. One of them means ""the Lord who sees me."" One of them means ""the supreme friend,"" ""the supreme father."" One of them means ""the Lord of the mountain."" One of them means ""the King, the greatest King."" ""Brother"" is another meaning. So... And these are all in theOld Testament,all these different names. So one of their arguments is that we're presenting a different name. Therefore they think it is a different God. We can refer that there are twelve names. Does that mean that there are twelve Gods?; We have names which apply to those also.; Yes.; ""Supreme friend.""",Prabhupāda, Yes.Dīna-bandhu.
Acyutānanda,Jagad-bandhu.,Prabhupāda, Hekṛṣṇakaruṇā-sindhodīna-bandhojagat-pate.We have got these names.
Acyutānanda,What's another one?,Prabhupāda, Gopikā-suta.
Ravīndra-svarūpa; Acyutānanda; Ravīndra-svarūpa,Lord of the mountain.; Girirāja.; The Lord of the Mountain.,Prabhupāda, Hekṛṣṇakaruṇā-sindhodīna-bandhojagat-pate.Then?
Ravīndra-svarūpa,"""The brother.""",Prabhupāda," Gopīka...? What is that, next line?"
Ravīndra-svarūpa,"""The brother.""",Prabhupāda, Hekṛṣṇakaruṇā-sindhodīna-bandho...
Devotees,Gopīka-kāntarādhā-kānta...,Prabhupāda," The so many names in one verse, and we have got thousands of names."
Prajāpati,"LordCaitanyawould hear from ŚrīvāsaPaṇḍita""The Thousand Names ofViṣṇu.""",Prabhupāda," Yes. And thousand names, they are recorded, but He has got millions of names."
Pañcadraviḍa,"In one tape, you said actually God has no name. You said God has no name, but because He...",Prabhupāda," No, that is other party's argument, ""God has no name."""
Pañcadraviḍa,"No, no. In the tape, you said... In this tape,bhajana,explanation ofbhajana,you said, ""God... Actually God has no name, but because He does so many things, then He has names for...""",Prabhupāda," Yes, according to His activities, there are names."
Ravīndra-svarūpa,"But all these twelve names, they still make that personality whom they are describing all-attractive. So that means...",Prabhupāda," Yes. And not only that. When you have names, that means God is person. That must be admitted. God cannot be imperson. You may have twelve names or twelve thousand names, but when He has got name, He's a person. Now, our point is: ""Who is that person?"""
Trivikrama,"Their point is... Well, one of their points is that if Christ was actually the son of God, why didn't he talk aboutKṛṣṇa?",Prabhupāda, Hm?
Trivikrama,"If Christ was the son of God, the good son, how is that he didn't, he never mentionedKṛṣṇaby name? Sometimes they criticize us like that: ""Why is there no mention ofKṛṣṇain the ChristianBible?""",Prabhupāda," He might not have mentioned, but why there are twelve names in theBible?"
Pañcadraviḍa,That'sOld Testament.That's not Christ...,Prabhupāda, The name is there.
Acyutānanda,"And Christ, Prabhupāda has...",Prabhupāda, Eh?
TamālaKṛṣṇa,The point is that just like when you're...,Prabhupāda," No, first of all, one should be answered."
TamālaKṛṣṇa,I'm going to answer his point.,Prabhupāda, Yes.
TamālaKṛṣṇa; Pañcadraviḍa; Prajāpati,"The answer to his point is that just as there's a president of the United States, so when someone is talking about the president, according to how intimate that person is, you discuss different subject matters. For example, if the person is just a common person, a regular person, you may discuss about the president's powers in the government. But when you meet someone who actually is intimately connected with the president, then you describe the president's family, how the president's family is doing, what is the president doing in his time of relaxation, etc. So similarly, Jesus was speaking to persons who were not very intimate with God. They were not so much spiritually advanced. Therefore, for those persons, simply the power and glory of God is mentioned in theBible.ButKṛṣṇa, the description ofKṛṣṇain theBhāgavatam,is meant for the pure devotees. And for them the very detailed, intimate description ofKṛṣṇais given there.; Nirmatsarāṇām.; A very major thing happenned to the Christian tradition in about 400 A.D. Up until that time, as best our records are, Christianity was very much likeKṛṣṇaconsciousness, very much like our movement. But at that time it became the official religion of the Roman Empire under Constantine, and it took on many of the paraphernalia of the old Roman demigod worship, and at that time it became a whole...",Prabhupāda," Just to make it favorable for your government, for the government."
Acyutānanda,Yes.,Prabhupāda, Then deterioration began.
Trivikrama; Pañcadraviḍa; Prajāpati; Pañcadraviḍa; Prajāpati; Ravīndra-svarūpa; Prajāpati; Pañcadraviḍa; Acyutānanda; Pañcadraviḍa; Prajāpati; Acyutānanda; Prajāpati; Acyutānanda,"Deterioration.; Well, they don't... Again, mentioning this Saul. Saul was converted on the way to Damascus, and he became a believer in God. Then, by himself, he traveled all over the known world and convinced everyone in the Roman Empire to accept, to accept Christianity. So it may have taken on those formal signs, but actually there was no process... According to them, there was no process done to dilute the religion or to weaken it or to change it, but it was only accepted by the masses. That's all.; Actually a very interesting thing, in terms of this point, is that this Paul, Saul, was in confiict with the direct disciplic succession from Jesus in many points. Those who were his, Jesus's, direct disciples, Paul disagreed with them and cut out many of their teachings or the teachings that were coming down in direct disciplic succession to make it more palatable to the outlying areas.; The government.; Yes. So at that moment there, the disciplic succession was broken.; What is the time difference between Paul and Jesus' (?) disciples?; He was here at the same time. Peter, James... He was a contemporary, but he had never had any personal contact with Jesus while Jesus was in Gospel. (?); In fact, he lived... He... In the beginning, he was against Christianity. He was antithetical to it. And then he experienced...; He was a professional religionist who made it popular to the...; And then he experienced a so-called conversion, isn't it?; Yes.; He fell off his horse and saw...; He heard a voice, fell off his horse, and he was blinded, and his eyesight would only be restored when he would approach a certain man in Jerusalem who was part of the Christian fold, and when he approached that man then his sight would be returned.; This story...",Prabhupāda," Now, another question, that we say that God's name and God-all-powerful.CaitanyaMahāprabhusays,nāmnāmakāribahudhānija-sarva-śaktis tatrārpitā:""In the name of God, all God's potencies are there."" So have you got any name like that? That means if you chant that name, you get immediately contact with God."
Ravīndra-svarūpa; Trivikrama,"That idea is put forth in thePsalmsrepeatedly. It says, ""Sing the names of the Lord with high-sounding cymbals, with drums."" It says in one place that ""The name of the Lord is exalted even beyond heaven.""; ""Hallowed by Thy name."" There's a prayer.",Prabhupāda, That... What is that name?
Ravīndra-svarūpa,"They don't... The Christians... It says, ""Sing the name of God,"" but they don't do that.",Prabhupāda," That's all right. But if you have to chant name... Just like we prescribe, ""ChantHareKṛṣṇa,"" so what is the name they recommend to chant?"
Prajāpati,Adonai.,Prabhupāda, Eh?
Prajāpati; Acyutānanda; Prajāpati; Pañcadraviḍa; Ravīndra-svarūpa; Viṣṇujana,"Adonai.; ""Adonai"" is a... It's an apostrophe.; But that's the name that was chanted.Adonai(Hebrew).; No, by the Christians.; What about Christians?; Jesus, Jehovah. They say Jesus is the name.",Prabhupāda," Adonai, whose name it is?"
Pañcadraviḍa; Acyutānanda; Ravīndra-svarūpa; Acyutānanda; Prajāpati,"Jewish.; In India Christians say that Jesus Christ is God.; They're trying to substitute... In the beginning of theBibleit says that ""In the beginning was the word, and the word was God."" And modern-day translations, they have substituted the word ""Christ"" for ""the word."" So it says, ""In the beginning was Christ, and Christ was God."" So they're trying to make, they're trying in that way to make Jesus God. And that is the name, because they don't know what is that word.; Yes.; We can understand this...",Prabhupāda, That is again another adulteration.
Prajāpati,"It is adulteration, but the tendency is there becauseKṛṣṇais a person. Because God is a person, they, everyone, wants to worship God as a person. It's the only way God can be worshiped. So because they do not knowKṛṣṇa, they make Jesus God so they can worship him as a person.",Prabhupāda, That is also good. But do they do?
TamālaKṛṣṇa,No.,Prabhupāda, Eh?
TamālaKṛṣṇa,"To worship means to follow the instructions, and they...",Prabhupāda, Do they follow?
TamālaKṛṣṇa,...do not follow the instructions.,Prabhupāda, Yes. The... Do they follow the Ten Commandments?
TamālaKṛṣṇa,No.,Prabhupāda, Then?
Trivikrama; Acyutānanda,"They say, ""You cannot. It is not possible. Only you have to accept Christ. Then you will be saved.""; As Lord Zetland.",Prabhupāda, Eh?
Acyutānanda; Trivikrama; Acyutānanda,"Lord Zetland said, ""It is not possible...""; It is not possible.; ...to give up meat and illicit...""",Prabhupāda, Then? Where is Christian?
TamālaKṛṣṇa; Pañcadraviḍa; Acyutānanda,"We are. We are the Christians.; Well, they say then, ""You can't do any of these things, so you have to accept Christ in your heart.""; That was my challenge, that ""We are doing them better than all of you, so you... That's...""",Prabhupāda," No, if you keep God or Christ within your heart, then your heart will be purified. That means you are cheating."
Trivikrama; Pañcadraviḍa,"Yeah.; Yeah, that's what it boils down to.",Prabhupāda," You are all cheaters, not Christians, but cheaters. You do not keep in the heart Christ's name or God's name, but you keep your own ideas. Therefore you think it is impossible. Otherwise, your heart would have been cleansed.Ceto-darpaṇa-mārjanam[Cc.Antya20.12]."
Acyutānanda,You know the Cardinal that you spoke with in Paris?,Prabhupāda, Hm?
Acyutānanda,You know how he died?,Prabhupāda, Yes.
Acyutānanda; Brahmānanda,So.; It has happenned again.,Prabhupāda, Eh?
Brahmānanda; Pañcadraviḍa; Brahmānanda,"Just when I was in Germany, a big Bishop in France, he was also found in a similar... He had died in a similar circumstance.; Worse state.; Worse, yes.",Prabhupāda," Yes, these things are... And inVṛndāvana, one big Gosvāmī, he died at the house of her (his) one woman disciple, lying there, sleeping with her. There are so many."
Trivikrama,And he was saying that animals have no soul.,Prabhupāda, You were present that time?
Trivikrama,I heard the tape. So now he is an animal. He knows.,Prabhupāda," (Chuckles) So I am just interested, but people will, many people will come and many theories. So you discuss among yourself how to get the strength to defend yourself and to convince them."
Acyutānanda; Prajāpati,"But unless their theology is practical, if it is not practical, then it is useless to study theology, if it has no practical application.; They make that point. ""Therefore,"" they say, ""such talk about God is impractical. So therefore we don't bother talking about God.""",Prabhupāda," ""Then why you put theology?"" That is our point. ""Then why you have put this theology?"" ""There's no use talking of God""—that is another thing. But when you make ""logy,"" you must come to logic. ""Logy"" means discussion. Is it not? ""Logy"" means science?"
Devotee,Yes.,Prabhupāda," What is the meaning of ""logy""?"
