Question Speaker,Question Text,Answer Speaker,Answer Text
Bhagavān,Shopping? Throbbing?,Prabhupāda, Throbbing or throbbing?
Brāhmaṇada,Groping?,Prabhupāda, No. Throbbing?
Bhagavān,Groving? What does that mean?,Prabhupāda, (Bengali)Cat-patha(?). Just like when you take a fish from the water and put it in the land.
Bhagavān,"Oh, throbbing, throbbing.",Prabhupāda, Yes. That is right word?
Brahmānanda,Yes.,Prabhupāda," Yes. All politicians, political party, nobody is in peace, simply throbbing-making this party, making that party, combining this party, and theanti-government troops, and this, that, so many... There is no other business."
Brahmānanda,No solution.,Prabhupāda," No solution. Big, big leaders.Nābhijānātimāmebhyaḥparamavyayam.Mūḍhāḥ.""All these rascals, they do not know the background is 'I am.' Solution should come from Me,""Kṛṣṇasays.Tribhirguṇa-māyāir bhāvairmohita.But they'll not take this solution. They'll make simply, start a plan. [break] ...less you come to this point,māmebhyaḥ,there is no solution. Now, at least for me, thisKṛṣṇaconsciousness movement is no more theoretical. It is practical. I can solve all problems."
PuṣṭaKṛṣṇa,"The people don't want to accept any austerity, though.",Prabhupāda, Hm?
PuṣṭaKṛṣṇa,The people won't accept any austerity.,Prabhupāda," Then you must suffer from the disease. If you have got disease, you must undergo the... What is this austerity? Where is the austerity?"
PuṣṭaKṛṣṇa,"If they don't accept the medicine, then they can't be cured.",Prabhupāda," Then they must suffer. A man, diseased, and he doesn't want to take medicine, then where is the...? He must suffer. Where is the cure?"
Pañcadraviḍa,They say we're the ones who are diseased.,Prabhupāda, Eh?
Pañcadraviḍa,"They say we are the ones who are diseased. They say, every one of us, we are diseased, not them.",Prabhupāda," Yes. The deaf man thinks all others deaf. (Laughter) That means they are not even human beings. Animals. They do not come to reason, that ""Whether we are diseased, or you are diseased. Sit down. Talk."" That also, they are not ready. Then? What we can do with animals?"
Pañcadraviḍa,They say we are old-fashioned. They don't want to bother with us anymore.,Prabhupāda," Hm? Then why do you bother with the problems? Why do you bother with the problems of society? You bother, but you cannot make a solution. All over the world, the newspaper is full, simply throbbing."
Viṣṇujana,"Śrīla Prabhupāda, can you make them reasonable? If they're unreasonable, is there some way to make them reasonable?",Prabhupāda," They are reasonable. Man, every human being, is reasonable. It is said, ""Man is rational animal."" So when the rationality is not there, that means they are still animal."
Pañcadraviḍa,"Well, what can be done with animals?",Prabhupāda," It is... It is very simple truth. Just I am this body. I am seeking happiness. So why I am seeking happiness? The... If you simply discuss on this point, then you'll find that a man is reasonable. Why I am seeking after happiness? What is the answer? That's a fact. Everyone is seeking happiness. Why we are seeking happiness? What is the answer?"
Pañcadraviḍa,"Because everybody's miserable, and they don't like it.",Prabhupāda," That is a opposite way, explanation."
Kīrtanānanda,'Cause by nature I am happy.,Prabhupāda," Yes. By nature I am happy. And who is happy, this body or the soul?"
PuṣṭaKṛṣṇa,"No, the soul.",Prabhupāda," Who wants happiness? I want protect this body—why? Because I am within this body. And if I go away from this body, who seeks for the happiness of this body? This common reason, they have no sense. Why I am seeking happiness? I am covering this body because the body may not be affected by cold. Then why I am seeking happiness of the body from cold and heat? Because I am within the... If I go away from the within the body, then there is no more seeking after happiness. Either you throw it on the street or it is in extreme cold or extreme heat, it doesn't matter. Then who is seeking happiness? That they do not know. For whom you are so busy for happiness? That they do not know. Just like cats and dogs."
PuṣṭaKṛṣṇa,But they think they have no time to chant the holy name.,Prabhupāda, Hm?
PuṣṭaKṛṣṇa,"Their philosophy is that to be, in order to be happy, they have to work all day long.",Prabhupāda," Hm. That is your philosophy. You are rascals, but we are not working. Why don't you see our example? We are simply living happily."
Satsvarūpa,But they say we're living off their work.,Prabhupāda, Eh?
Satsvarūpa,"They work and we beg money from them, they say.",Prabhupāda," We don't beg money from them. We take their money in the way that they'll use it for bad purposes, so we take it forKṛṣṇa. They'll drink. They'll smoke. They'll have illicit sex and go to hell. Therefore, out of our humbleness, we have become beggar, just like a father asking the child... He has taken one hundred rupees note and spoiling. ""My dear child, you are so nice. Why you are taking this? Give this. Take a lozenges."" Like that. We are not for their money. That's a wrong theory."
Pañcadraviḍa,"But they say this drinking and smoking, it's all right, but you are parasites because you're taking our money.",Prabhupāda, Eh?
Pañcadraviḍa,They say that smo...,Prabhupāda," I'm not after... I kick on your face. I don't want your money. (laughter.) You are taking books from us, and you are paying. Therefore I have adopted this means. They may not say... I knew that they would say in the Western countries. Therefore I thought that without books it is not possible. What is this?"
PuṣṭaKṛṣṇa,"Come this way, Śrīla Prabhupāda. Jayapatāka is pointing to...",Prabhupāda, All of a...
Śrutakīrti; PuṣṭaKṛṣṇa,We can cross right... No? No.; JayapatākaMahārāja.,Prabhupāda, There is no house?
PuṣṭaKṛṣṇa,You want Prabhupāda to come...?,Prabhupāda, So why he's claiming his money? Eh?
Pañcadraviḍa,"He says, ""Because I work for it.""",Prabhupāda," That's all right. But money, what is the standard of money? First of all, just discuss this. What is the standard of money throughout the whole world?"
Devotee (1),"Work, labor, labor.",Prabhupāda, Eh?
Devotee (1); Pañcadraviḍa,Labor.; Purchases...,Prabhupāda," Gold. So have you created gold? How is your money? The gold is already there. You have stolen. You are thief. You are not laborer, but you are rascal, thief. You'll be punished for this policy. Is gold your property?"
Devotee (1),"But they say that if the whole world follows our example, then the society will be finished.",Prabhupāda," Nobody follows. We do not follow... There are so many... Why they are struggle? Why they struggle? Why do you fight? Because you are all thieves—you want to steal God's gold-therefore you fight. Why do you fight? Why you declare war from one nation to another? Because you are all thieves and you want to steal God's gold. Therefore there is fight. Why do you claim, ""This is America, my land""? Is it your land? Have your forefathers created this? Why you falsely claim like that? What is the answer? You have stolen from another party, Red Indians, and you are now claiming, ""We are the proprietor."" You are thieves. You are not even gentlemen. What do you think?"
Pañcadraviḍa,"But they say... They say, ""God is up in heaven. What does He need with gold?""",Prabhupāda, Eh?
Pañcadraviḍa,"They say, ""God is up in heaven. What does He need with gold?""",Prabhupāda," ""God is up in heaven""? What is that?"
Pañcadraviḍa,"Well, they say God...",Prabhupāda," Because the master is in heaven, or in some other place, therefore we shall steal?"
Tripurāri,"They say, ""God gave us the land to do what we want with.""",Prabhupāda, No. God did not give you the land. How do you think it is given to you?
Tripurāri,"They say, ""God put us here...""",Prabhupāda," God... God has given to every living entity. You can say like that. Just like father. Father gives to all sons, not that a particular son. Why do you claim? Why do you slaughter the cows? They have got right. So, so many faults there are. But they are not reasonable. That is the..."
GopālaKṛṣṇa,They quote a verse from the Bible where it says that God has given man control over everything on this earth.,Prabhupāda," That control does not mean ""The government is in control, therefore government should kill only."" These... All rascals, simply rascals. Control, that's all right. You are grown-up boys, human beings, so you should control. You should maintain them, and take service from them, not that you shall kill them. They interpret in that ""Because under my control, therefore I shall kill""?"
Devotees,Yes.,Prabhupāda, Just see how foolish they are.
Jayatīrtha,"The children are under the control of the parents, but the parents don't kill the children.",Prabhupāda, Yes.
Brahmānanda; Santoṣa,They protect.; Control means protect. [break],Prabhupāda," Suffering for all these sinful activities, always throbbing. See the newspaper. The newspaper is full of news—one side, everyone is restless condition, throbbing, and another news, sense gratification. That's all."
PuṣṭaKṛṣṇa,Is it necessary for people to leave the cities and live in ourvarṇāśramasituations in order to become happy?,Prabhupāda," You haven't got to leave anything, provided you understandKṛṣṇaconsciousness. We are not after leaving or accepting. We are not after this. We are after understandingKṛṣṇaconsciousness. What... What shall I leave? Suppose if I leave city—I come here—still it is God's property. So what, what I leave? What I have got that I have to leave? Everything God's property. If you have something, then you can leave. But if you have nothing, what you will leave? It is another bogus. This isMāyāvādītheory.Brahmasatyaṁjaganmithyā.Whyjaganmithyā?IfBrahmanissatya, jaganis alsosatya.[break] ...means they are trying to possess, and thejñānīsare trying to leave—both of them rascals. Where is the question of possessing? Stealing. You... I want to possess, but that thing does not belong to me. Therefore it is stealing. And thejñānīsare trying to give up living. That is also not truth. But you haven't got anything, so what you are going to leave? So both are in ignorance, thekarmīsandjñānīs,the yogis. SimplyKṛṣṇaconscious persons, they are in knowledge. Before your birth the land was there, the world was there. Everything is there. Now you came. Then how do you possess? Before your birth, things were there. How do you possess unless you steal and cheat? Hm? What is the answer?"
Pañcadraviḍa,I have inherited it.,Prabhupāda, Eh?
Pañcadraviḍa,"They say that man inherits the property of his father, which is God.",Prabhupāda," That means you must obey your father. Otherwise you'll be kicked. (Laughter) You are so rascal that you don't feel obliged to your father who has given you so much things, so many things. You are such a rascal. Therefore you must be punished."
Satsvarūpa,"So if all the land belongs to God, then who decides who will distribute it to the people?",Prabhupāda," You don't distribute. You live only, till the ground and take your food. Where is the question of distribution? Whatever you can till, you take so much land. God has enough land. Why do you possess more? One acre of land is sufficient for producing your food. Why do you take more?"
Satsvarūpa,Nobody should own excessive.,Prabhupāda," No. Therefore God's representative, king, is wanted. He'll divide. ""All right, you take this."" That is king. King means God's representative.Naradeva.Therefore, according to Vedic scripture, the king is so respected,guruis so respected, father is so respected—because they give guidance. ""You live,Kṛṣṇaconscious, like this."" That is their duty. The king is simply planning how to collect taxes, this tax, land tax,saletax, income tax, this tax, this... So his only business is to plunder: ""Let him work, and I shall take it away."" And everyone is doing. That is struggle for existence. I want to cheat you. You want to cheat me. That's all. And therefore they are throbbing. There is no solution."
Pañcadraviḍa,Who will decide who will be king?,Prabhupāda," Therefore the king isevaṁparamparāsystem. The king, the original king is the sun-god. Then his son,Manu, his son,Ikṣvāku. Everything is described. Why don't you see there?"
Pañcadraviḍa,"But who would be the king today? If we establish such a system, who would become the king?",Prabhupāda, Nobody would be king. Everyone is king and fight. That's all. Nobody is king. Everyone is a dog. And they are simply barking.
Devotee (1),"In Africa, recently, one of the leaders has taken all themūrtisand crucifixes from the churches and put his own statue.",Prabhupāda, Just see.
Devotee (1),He has banned all religions.,Prabhupāda, Just see.
Devotee (1),"He put his own statue there, that the people should worship him. He's a disciple of Mao.",Prabhupāda," And because there is no king, therefore he is flourishing."
Devotee (1),Yes.,Prabhupāda," Had there been any real king, he would have been killed immediately. Because there is no king, therefore in South India, they are insulting the statue of LordRāmacandra, because there is no king. Everyone is king. Diplomacy... Democracy. What is this nonsense, democracy? All over the world the royalty is hereditary, never elected. [break] ...and it was hereditary, even Russia. That is the system.Evaṁparamparā-prāptam[Bg.4.2].Andevaṁparamparā-prāptam—who?Rājarṣayoḥ.They are king, but just like saintly persons. That is king, not a loafer class is elevated to the royal post.Rājarṣayoḥ.Although they're holding the post of a king for administration, they're just likeṛṣi.That is king."
Pañcadraviḍa,"In France they went to the Queen a long time ago, and they said, ""The people don't have bread."" So she said, ""Let them eat cake."" And they did not like this. So...",Prabhupāda," These are all stories. Don't indulge in stories. Just try to find out the real fact fromśāstra.Thereforeśāstra...Yaḥśāstra-vidhimutsṛjyavartatekāma-kārataḥ[Bg.16.23].Leaving aside theśāstra,if one talks nonsense... (end)"
Prajāpati,"They describe the nature of God simply in terms of how religious men have understood themselves. They talk about, ""God is simply men understanding men.""",Prabhupāda, That means nobody has approached real God.
Prajāpati; Acyutānanda,No.; No one.,Prabhupāda," That is speculation. If you want to study me, so you can do so either by approaching me or through one of my confidential servant. How one can understand me from outside by speculating? Why do they come to see me? Let them remain far away and speculate. But that is not possible in ordinary common sense also. So how they speculate about God? If you cannot understand even a common man, maybe very big in the society, you cannot understand a common man by hearsay, by speculation..."
Prajāpati,"Practically all the theologians are aligned with one denomination or another, and they're like company men to the big churches, and they're afraid of admitting they do not know about God because they're afraid somebody will leave their camp and come to ours. We say we know about God.",Prabhupāda," Yes. We say frankly that we know God, His father's name, His address, everything. Let anyone come and challenge. He cannot say that ""No, this is not God,"" because he has not approached God. He does not know what is God. How he can challenge us that ""This is not God""? Suppose we are presentingKṛṣṇaas God, so how anyone can challenge? Because he has not approached God. He is simply speculating."
Prajāpati,And not even on his own. He's simply approaching other speculators.,Prabhupāda, Eh?
Prajāpati,One speculator simply approaches other speculators.,Prabhupāda," So how they can say, ""This is not God""? Is it possible to say? We say, ""Here isKṛṣṇa, God."" Why not discuss this point for our preaching work. Call all thesannyāsīs."
Śrutakīrti,Call thesannyāsīs?,Prabhupāda, Hm. [break] Theologician. You know?
Śrutakīrti,He's theologian?,Prabhupāda, You know?
Acyutānanda,"No, I didn't know.",Prabhupāda, He's theologician. Now you discuss with him whether by theological arguments one can approach or understand what is God.
Jayapatāka,Śrīla Prabhupāda.,Prabhupāda, Sit down straight. Otherwise feel sleepy.
Jayapatāka,Myself andGopālaKṛṣṇawere just going to Krishnanagara to see that attorney for that...,Prabhupāda," Oh, all right."
Śrutakīrti; Jayapatāka; Acyutānanda,Others will be coming.; TamālaKṛṣṇaand...; Theology or Theosophy?,Prabhupāda, Eh?
Acyutānanda,Theosophy?,Prabhupāda," No, theology."
Śrutakīrti,Theology. Theologian.,Prabhupāda, Theosophy and theology is practically the same.
Prajāpati,"No, theosophy is nonsense Buddhist...",Prabhupāda," But according to academic order, logic is the preliminary study of philosophy. Our, our professor, Dr. Watt (?), he defined like that. In 1917...-(Aside:) Come on.-There was the governor in Bengal, Lord Ronaldsey (?), Marquis of Zetland. He was a Scottish man. And our college was Scottish Churches College-(aside:) Get the light. So... don't lean. You'll feel sleep. Just like sit myGuruMahārāja. Show the picture. Be... Become myGuruMahārāja. Yes. That sitting is theyogāsana.I am gone to hell. (laughter) You are young men. You learn from myGuruMahārāja."
Pañcadraviḍa,No leaning.,Prabhupāda, Hm?
Pañcadraviḍa,No leaning.,Prabhupāda," No. You'll never see any picture, he was leaning. So that Lord Ronaldsey (?) was very good scholar. So we were... When he was invited, he was taken to all the classes. So I was, at that time, in the second year. So I took permission to sit down in the first benches. The... Our college was very big. So in each class there were 150 students. [break] Where is..."
Brahmānanda,TamālaKṛṣṇais taking a bath.,Prabhupāda," So they were giving role number according to admission. So I did not know that. So my role number was 105. So I thought it very incon... ""I have to sit down after one hundred students?"" So I took one certificate from Dr. Karttika Chandra Bose, who became, later on, my boss. Because he was our father's friend, so ""Give me one certificate in this way, that I am hard of hearing. I must be given first row seat."" So he gave immediately certificate. What is that?"
Śrutakīrti; Jagajīvana,"Some juice.; Some juice and some watermelon, Prabhupāda.",Prabhupāda," Oh, all right. Give it."
Acyutānanda,What does theology say?,Prabhupāda, Hm?
Acyutānanda,What does theology mean.,Prabhupāda, Just explain.
Prajāpati,This is the study of faithful men understanding themselves through the medium of the church.,Prabhupāda, Now you discuss whether this point is very nice.
Acyutānanda; Prajāpati; Acyutānanda,So what is the authority?; The authority is the Christian tradition.; TheBible.,Prabhupāda," Yes. When he says church, that means authority,Bible."
Acyutānanda; Prajāpati; Acyutānanda,"TheBible.; No, part. TheBibleis part.; Only part, one part.",Prabhupāda, Eh?
Acyutānanda; Prajāpati; Viṣṇujana,"He says theBibleis not... TheBibleis not the complete authority?; No, it's the tradition of the church through the great founding fathers, the great theologians up until the present day.; Sādhu,śāstra,guru.",Prabhupāda, No...Vāk...
Prajāpati,"Yes, unfortunately noguru.",Prabhupāda, Church... Church is followingBible.
Prajāpati,Yes.,Prabhupāda, So ultimatelyBiblebecomes authority.
Prajāpati; Acyutānanda; Pañcadraviḍa,"In certain segments of Christianity, not all.; So what is their conclusion?; Excuse me one minute before we go on. What is this in relation to, this discussion? I just walked in.",Prabhupāda, This... The subject matter is whether by theological arguments one can understand God.
Pañcadraviḍa,"Well, according to dictionary, theology,theo,the Latin wordtheo,it means, that means God.Theomeans God. And as far as I know, theology means the science or the study of God.",Prabhupāda, Yes.
Pañcadraviḍa; Prajāpati,"So by definition...; Not precisely. The word theology comes from the wordlogos. Theologos.Andlogos,in this sense, means the word of God. Yes.",Prabhupāda," Now, the words of God, that means one must know what is God. Otherwise how he can know this is the word of God? What is the answer by the theologian?"
Prajāpati,"The word of God is that a man is known by his works, his fruits. If he is a godly man...",Prabhupāda," No, no. Unless you know what is God, how you can accept this is the word of God? Just like you say, ""Prabhupāda says."" You take it, accept it: ""Oh, Prabhupāda said."" But you know what is Prabhupāda."
Prajāpati,So in...,Prabhupāda, It is not a fiction.
Prajāpati; Acyutānanda; Prajāpati; Acyutānanda; Prajāpati; Acyutānanda; Prajāpati; Acyutānanda; Prajāpati; Acyutānanda; Prajāpati; Pañcadraviḍa; Prajāpati; Pañcadraviḍa; Prajāpati; Acyutānanda,"In theological circles, yes, they are accepting great authorities like Augustine, Thomas Aquinas, Martin Luther, as well as theśāstra,theBibleitself.; But Martin Luther and St. Augustine are opposed.; Yes, there're many opposed in many different ways.; Then the authority is...; So that's why the goal is not so much a...; Who invented theology?; Saint Paul.; The first Saint Paul?; First Saint Paul.; And he was before Martin Luther.; Yes, he's before Martin Luther.; In the... Also this wordlogos,in theBibleit says, ""In the beginning there was the word."" That'slogos,right? In the beginning there was the word. So what word was that?; In the beginning...?; When it says, ""In the beginning, there was the word.""; According to that same verse, that word was God.; And what was that?",Prabhupāda," But they... They must explain. Just like in Vedic literature the same idea is there. (aside:) Don't lean. I am begging excuse. I am old man. But you should sit down like thatGuruMahārāja. So we know what was the word,oṁkāra.Praṇavaḥsarva-vedeṣu.[break] Sooṁkārais the word. So what is the Christian word?"
Prajāpati,"Again there's no absolute authority. In the vast Christian tradition we have Origen saying one thing and Saint Francis saying another. Widespread... That's why it is not a science that we can go to like we can to Śrīla Prabhupāda for an exact answer,Bhagavad-gītā,exact absolute authority. In the Christian tradition it is simply defined as faithful men understanding themselves in the light of the scripture, in the light of the tradition.",Prabhupāda," No, that is because you are our student. Suppose our preachers meet the theologicians. How to prove that theology is not the means? Theology... Generally, you say it is speculation. So our point is thatnāyamātmāpravacanena labhyonamedhayānabahunāśrutena.Theātmā,Kṛṣṇa, cannot be understood or approached,pravacanena,simply by logical arguments."
Prajāpati; Acyutānanda; Prajāpati; Acyutānanda; Pañcadraviḍa,"The theologian would agree, Śrīla Prabhupāda. It's a question of what's called apologetics. Theology has a specific function for the Christian church, to bring people within the fold. Simply to convince them through any means, logical or whatever, to them to come within the church community, and then once they are within that group, then they can participate in what's called the Christian life. You have taking sacraments, engage in Christian fellowship, taking communion, so many things.; But their authorities disagree.; Yes. That is... They will agree with that.; But our disciplic succession from thousands of years, there's no big disagreement.; I met one... I was traveling about three months ago in India. I met one Christian on the train. So we began to discuss theśāstra.So I mentioned some of the arguments in reference to theBible,that Christ was speaking...",Prabhupāda," (aside:) No, no. Where that covering? Where is it?"
Pañcadraviḍa,"I said that Christ was speaking basically to an uneducated public, the fishermen, etc... So then this man, he stopped me. He said, ""That's all right. But,"" he said, ""You're...""",Prabhupāda, Who? Who? Who said?
Pañcadraviḍa,"I was discussing with one Christian in India. So I attacked... Politely I attacked his scriptural reference, theBible.I was saying that it was not meant that an educated community. So then he stopped me. He said, ""That's all right. You can speak about fishermen. But,"" he said, ""the prime exponent of Christianity was Paul. And Paul was previously Saul. He was not a fisherman. And he was traveling to a town on a particular... Damascus. And there he received direct revelation from God."" And he said, ""Then this one man, single-handedly, he converted most of the known world to Christianity.""",Prabhupāda, That means he got direct revelation from God.
Pañcadraviḍa,Yes.,Prabhupāda, That is wanted.
Pañcadraviḍa,"So he said just to talk about theBibleas evidence is not enough. He said, ""You're overlooking direct revelation,"" which is what we are also dealing with, that the man who lives according to the word of God, he receives the word of God directly.",Prabhupāda, It is said there?
Pañcadraviḍa,Hm?,Prabhupāda, It is said there?
