Question Speaker,Question Text,Answer Speaker,Answer Text
Ravīndra-svarūpa,Knowledge,Prabhupāda, Hmmm? Find out this dictionary meaning.
Prajāpati; Pañcadraviḍa; Acyutānanda; Trivikrama; Ravīndra-svarūpa; Acyutānanda; Ravīndra-svarūpa,"Logic is the rational ordering of thoughts in words.; When I was inSanFrancisco six or seven years ago, some new school of theology, theologians, they were having things, like they were opening up churches to the hippies to have parties for LSD and things like that. I remember a couple at the Glide Memorial Church. They had that. And a number of the other new theologians, they were starting to talk about ""free sex,"" and drugs, and...; They put on stunts to attract people to accept Christianity.; Like Bingo.; Yes.; Bingo.; And they have opened special churches for homosexuals in Australia.",Prabhupāda, Eh?
Ravīndra-svarūpa; Devotee; TamālaKṛṣṇa; Pañcadraviḍa; Acyutānanda; Trivikrama; Śrutakīrti,"Special churches for homosexuals in Australia.; Oh, all over.; All over.; So see: Churches for illicit sex, churches for intoxication, churches for gambling, and churches for meat-eating.; Every (?) Sunday they all have.; Once I was driving a taxi, and a woman got in the cab, and she said, ""I hope my goddamn luck is better tonight."" She was going to a church. (laughter) She was going to a church to play bingo, and she was speaking like that.; There's the word ""logos,"" ""logo."" ""Logos"" is here. It means ""word, or second person of a trinity.""",Prabhupāda," No, no. ""Logy."""
Śrutakīrti; Pañcadraviḍa,"""Logy"" is not here.; Logic.",Prabhupāda, Logic.
Śrutakīrti,"Logic is here. ""Scheme of or trustees (?) on, science of reasoning...""",Prabhupāda, That... That...
Śrutakīrti,"""...chain of reasoning, arguments, logical...""",Prabhupāda, Yes.
Śrutakīrti; TamālaKṛṣṇa; Prajāpati,"""...of logic, in conformity with principles of logic.""; Science of reasoning.; In words.",Prabhupāda," So ""logy"" means logic."
Acyutānanda,"If you say what you are..., your own theory, cannot be done, that's illogical.",Prabhupāda, Yes.
Acyutānanda; Prajāpati; Acyutānanda; Pañcadraviḍa; Prajāpati; Pañcadraviḍa; Prajāpati; Pañcadraviḍa; Prajāpati; Acyutānanda; Prajāpati; Acyutānanda,"If you propose a theory and say, ""It can exist,"" then that's an illogical presentation. A rabbit's horn. [break] It can't exist. Sky-flower. Doesn't...; Each of these big theologians has a specific area of specialization. For example, I took a course, when I was a student in the School of Theology, in theNew Testament,hoping to learn scriptures, but instead, the entire semester was spent trying to decide which of the books of theBiblecame first—theBook of Matthewor theBook of Mark?And they had very detailed ways of what they called ""form criticism,"" taking a particular passage and checking it, seeing...; Right. What is their method?; Why did you say you joined? What was it? I mean what was it you were trying to study? You said...; I went three years to a school of theology.; But that particular course?; This was a course in theNew Testament.; So why, why did you say you took it?; To study theśāstra,to study the scriptures. What was being said. Instead...; No, what was their method for examining their material, research?; The material research is taking, finding certain forms, certain sentence construction, grammar, and comparing it with other passages in the scriptures as opposed to that grammar, to see if the form is the same, to see, to determine by different criteria which came first, which is earlier.; So after...",Prabhupāda," No, their..."
Acyutānanda,Since St. Paul did they find out...,Prabhupāda, That is academic. That is not theology.
Acyutānanda; Prajāpati; Acyutānanda; Prajāpati; Acyutānanda; Prajāpati; Pañcadraviḍa; Prajāpati; Acyutānanda; Ravīndra-svarūpa; Pañcadraviḍa; Acyutānanda; Pañcadraviḍa; Acyutānanda; Pañcadraviḍa; Ravīndra-svarūpa; Acyutānanda,"I think that, Prabhupāda, the theologians invented these questions like ""Can God make a yardstick with no end on it? How many angels can fit on the head of a pin? Can God make a mountain that He can't pick up? Can God commit suicide?"" All these questions, they...; Not so much...; ...talk about.; This is what's called philosophy of religion. This is different than theology. Philosophy of religion, they're all atheists, all taking pokes at the other people's idea of God.; People like (indistinct); A great, a conference of philosophers of religion met in London about ten years ago on the topic ""Talk of God."" Each man presented a paper, his idea of talk of God. No one had any inkling of God. Simply they were speculating on why people talk of God.; Then what is the use of all this? I'd rather just sit home and readCaitanya-caritāmṛta(laughter) than get into this.; The use, the reason for it, is because these people, though they are great rascals, are influencing millions of other people. They're influencing them to hell rather than those same people hearing from Śrīla Prabhupāda or hearing from you gentlemen can be elevated to the point ofKṛṣṇaconsciousness.; There's a single serious way. You can say, ""Look, you've been sitting here since St. Paul, and you haven't arrived at anything except discussion, and you're bluffing the whole public that you're doing some advanced research and taking salaries and...""; But, but we have to convince them.; But how can you convince them...?; We'll convince them that they haven't come to any conclusion.; Yeah, how can you convince them if they can't even, they cannot define who is God, they cannot define what is the soul, they cannot define what is the principles of religion?; And their leader is breaking all of them.; They cannot... They can't... They don't even have any disciplic succession. Theirśāstrais... They can't agree among them what is the conciseśāstra,nor can they agree on what is the importance of acceptingśāstrain the first place. They're doing all sinful activities. So then... Then what is there to convince?; So why not start an authoritative group of Christians who chantHareKṛṣṇa, who study theBibleand read theBhagavad-gītā?; We are.",Prabhupāda, We are all Christians.
Acyutānanda; Pañcadraviḍa; Ravīndra-svarūpa,"Here we are.; We already are Christians.; But they are seeing us... They don't accept that, though. If somebody was calling themselves Christians...",Prabhupāda, That... It is not possible that everyone will accept you. That is not possible.
Pañcadraviḍa; Ravīndra-svarūpa; Prajāpati; Acyutānanda; Pañcadraviḍa; Acyutānanda; Prajāpati; Ravīndra-svarūpa; Prajāpati; Acyutānanda; Ravīndra-svarūpa; Acyutānanda; Ravīndra-svarūpa; Pañcadraviḍa; Ravīndra-svarūpa; Trivikrama; Prajāpati; Acyutānanda; Pañcadraviḍa; Prajāpati; Pañcadraviḍa; Acyutānanda; Pañcadraviḍa; Trivikrama; Acyutānanda; Prajāpati; Acyutānanda; Pañcadraviḍa; Acyutānanda; Pañcadraviḍa; Acyutānanda; Pañcadraviḍa; Acyutānanda; Prajāpati; Acyutānanda; Pañcadraviḍa; Ravīndra-svarūpa; Prajāpati; Acyutānanda; Prajāpati; Pañcadraviḍa; Acyutānanda; Prajāpati; Pañcadraviḍa; Prajāpati; Acyutānanda; Pañcadraviḍa; Trivikrama; Prajāpati; Acyutānanda; Pañcadraviḍa; Acyutānanda; Prajāpati; Acyutānanda; Paramahaṁsa; Acyutānanda,"They... The Christians on the street, they don't accept because they say, ""You have not accepted Christ."" I say, ""I am following all Christ's teachings."" They say, ""Well, you haven't been baptized. If you're following all the principles, why not be baptized?""; I was baptized.; But this is a... This group of Christians you meet on the street that are fundamentalists following theBibleare very different group from the big Harvard scholars. The theologians that we're concerned with are those that are actually influencing millions of people by their rascaldom.; Do they come up with any big decisions every year and change people's...?; I never met anyone who was influenced by any of these theologians. I never even heard of 'em. I never even heard of them till you just started discussing today. (laughter) I don't know anybody in the Western world who's influenced by any theologians.; No, maybe they set the policies for churches. Maybe they influence them.; Yes, right.; They do.; The main people who listen to the theologians are the pulpit preachers, the shepherds of individual flocks of Christians around the world. They are the ones who are most influenced by the theologians.; They stay in...; Government leaders all over the world are influenced by these... And they run their... They base their policies on the ethics of the Christian Church.; What I say is that...; And if you try to present something different, then they're opposed to that based on their conditioning, based on the influence...; But is the Christian Church, is that being determined by the theologians at Harvard? They, they have some say in this?; Yes. They set the... They write the books, though. They interpret theBible.They are the so-called gurus because they interpret the scripture whatever way they want to.; So you know some of these people?; Yes, we've had some contact. We arranged a very nice meeting with KīrtanānandaMahārājawith one of the foremost theologians at Harvard. His name is Harvey Cox. Perhaps you're familiar with his bookThe Secular City.And we came and brought devotees into the class and chanted. The people thought it was...; So what was his suggestions?; Now, what was his reaction, first of all? What was his reaction toKṛṣṇaconsciousness? What did he say?; They don't take us seriously. They still look upon us as just singing and dancing in the street, and that's it.; Well, that's...; They have to realize that...; That's also there in theHinducommunity. Most of the Hindus they don't take us seriously either.; Even when they see all these books?; No, when they see that we've given up our drugs and our everything, we've taken a religious life, they invited us. I think they just see that we have something to beat them, and they usher us out, knowing that their position is in jeopardy.; The reason we're here right this afternoon is the fact that though these men are preaching this rascaldom, our preaching can undermine it, at least to the point where they can be influenced and that the people that they are, are being influenced by them will take some notice, ""Yes, this is a viable alternative"" to the rascaldom that they're being presented, this...; Good.; I had the feeling that it is just like when I was approaching people in Calcutta. They said, ""We'll help you, but we cannot help you in a big way because we're already giving so much help to the Ramakrishna Society."" So then after hearing this a few times, I concluded that people respected the Ramakrishna Society because they have a lot of money and a lot of popular support and everybody was giving to them, so they just, just like everybody else, they wanted to be part of the whole show. So the International Society for Krishna Consciousness, we have books, we have teaching, and we can present the principles very purely. But in terms of a world movement, we don't have a lot of money or a lot of power or a lot of tanks or a lot of guns or a lot of churches or a lot of popular support.; What is the idea...?; So maybe the theologians won't accept us on that basis, that we're not powerful.; Who is the ideal Christian according to the theologists? What do they say is the best, let's say, flock of Christians? What do they do?; Who's the biggest?; Bishop Sheen?; There is no, I would say, among theologians, no consensus.; So when are they satisfied that you are a real Christian or not?; When do you become a theologian? Who is the biggest theologians? How are they accepted? On the basis of degree?; Scholarship.; Yes, scholarship, books published.; Well, then it could probably be possible to be a theologian without even really believing in Christianity.; Oh, definitely. Most of them don't.; Then Prabhupāda's the biggest theologian because we have twenty-two books right here on the shelf. And we have the credentials. And they cannot dismiss the books either because we have the credentials that they are being used in major universities in, all over the world. So if universities are accepting, and they get their power from the degrees obtained from the universities, they cannot dismiss any longer. Isn't it?; We have broken the disciplic succession now. We become by degree, by qualification.; In all their scholarly journals—and they publish quite a few—very few, little is written about God. The subject matter of God is...; They talk of man's relation, the benefit of man...; The Church, different aspect of scholarship, different aspects in biblical research.; No, say some things specific.; Yeah, I can't understand all that.; I know what you mean. I read some of their...; I have tried to attack them by just taking a specific article, and I am lost immediately myself. It's all mish-mosh. There's nothing there to fight. It's like a... But the use is that we must...; There must be something to attract them. So they're giving arguments for Christians who are, you know... intellectual.; The thing is... The thing that makes it hard to understand what the use is—because we say, then, in all these... We try to define and they can't be defined. And then you say that they don't take us seriously. They don't accept what we're saying. They don't accept these teachings. They would dismiss us in a minute. What is the use?; They must say something concrete.; Well, the most concrete they get is their dissatisfaction with the present status quo. So in that we're in agreement with them. ""Yes, we're dissatisfied with the status quo also, but we are offering alternatives that are...""; They're dissatisfied with the people who are sinful.; Where is their method for changing the status quo?; They're not dissatisfied...",Prabhupāda," Method is there, the Ten Commandments, but they won't follow."
Prajāpati,"Well, instead of being dissatisfied with the fact that people are sinful...",Prabhupāda, Method is already there in theBible.
Prajāpati,They're dissatisfied with the fact that the...,Prabhupāda, But they don't follow it.
Prajāpati; Pañcadraviḍa; Pañcadraviḍa; Prajāpati; Ravīndra-svarūpa; Acyutānanda; Ravīndra-svarūpa; Acyutānanda; Ravīndra-svarūpa; Pañcadraviḍa; Ravīndra-svarūpa; Acyutānanda; Ravīndra-svarūpa; Acyutānanda; Prajāpati; Ravīndra-svarūpa; Prajāpati; Acyutānanda; Prajāpati; Pañcadraviḍa,"...that the air is polluted, that people are...; So the hippies are dissatisfied that the air is polluted also. So what?; Yes, who cares for the hippies?; That, exactly, is the point. They're looking to Freud, they're looking to Marx, they're looking to everyone as an authority.; I'll give you an example, In Zambia, the president, his name is Dr. Kenneth Kaunda. [break] He's exactly one of these persons. I met with him a couple weeks ago. He's John, John... What's his name? John Patrick? Śrīla Prabhupāda, you met him in London. And he's one of these philosophers. And his argument against our work and our preaching was that we shouldn't fly on jet planes because it pollutes the air. That was his argument; How did he get to Africa from London?; He said he walked. (Laughter); And you killed so many insects under your feet.; No, he goes on jets. But that's his argument to defeat our philosophy. This is how they argue. What he's saying is true. They actually argue like this, that we are, we are, our philosophy is not correct because we fly on jet planes. They have a completely materialistic... Yes.; Well, then how's he travel?; Well, for him, it's all right. He doesn't care. But for someone who's preaching a nonmaterialistic philosophy. So this is... These are the kind of people that are influencing people like Dr. Kenneth Kaunda, who's the president of a country, of Zambia, that has something like twelve million people.; Well, we say, ""What is the difference between matter and spirit?""; Yes, we argued all these points with him, but still, his ultimate...; So actually all these people are just word-jugglers who want to keep their position with the government.; They have government.; Yes, and that's what they do.; They have grants. They write books.; Just to keep their, their...; But the books are being read.; There's a saying that.",Prabhupāda, Eh?
Acyutānanda; Ravīndra-svarūpa; Pañcadraviḍa; Ravīndra-svarūpa; Acyutānanda; Devotee (2); TamālaKṛṣṇa,"Cinmayananda Swami. He's a professional swami, and he confuses all the people very talentedly so that they all clap. If you ask them after... Prabhupāda has asked them, ""What did he say?"" ""He said very nicely."" But they can't say anything.; So... These men are influencing. One of the things we did. We invited him to the temple, and we gave him a big plate of niceprasādam,and he liked it very much. He said, ""If my wife could learn to cook like this, I'd give up meat."" So we thought that was very significant.; Send his wife over to the temple. We'll train her up.; So why don't you write a book? Why don't you become a theologian from their point of view and write a book about Christianity? If they, if they can do it, if they can do it, write books and get people to read them, then why can't you do the same thing, write books on Christianity?; Did you pass the course in...?; If you want to get into their world.; Rūpānuga... Rūpānuga is already getting one book together, so you can write a chapter in it. There's a book, and he's going to comment... It's a scientific book on different aspects and he's commenting on, I think, social, various social applications. So you can comment on the theosophical points. I mean it can be included in this book. Actually if you have the qualifications, I'm sure he would want a chapter from you. Prabhupāda, you know that book Rūpānuga's putting together?",Prabhupāda, Yes.
TamālaKṛṣṇa; Acyutānanda; Prajāpati; Acyutānanda; Prajāpati; Acyutānanda; Śrutakīrti,"That'd be appreciated cause it's going to reach many intelligent people.; More than the theologians people listen to psychiatrists.; Yes, the theologians listen to the psychiatrists.; They have another mish-mosh to delude the people into paying the money. They're simply tricksters. Tricksters.; Many of the theologians today are influenced by a book calledI'm OK, You're OK,which...; We're O.K.; (To Prabhupāda) You want to keep this here?",Prabhupāda, Hm.
Prajāpati; Acyutānanda; Trivikrama; Pañcadraviḍa; Acyutānanda,"...Dr. Harris. And this book's central tenet is that we can be happy in life simply by patting each other on the back and approving of what each other does.; No one's saying stabbing... (?); Actually material nature's kicking them on the head and shoulders every minute. And they're thinking everything is OK. That ismāyā.; One of the principles, I'm told, of psychology's is whether a person can pass semmina or not. If he can pass semina, then he's considered normal, and if he can't, he's subnormal. This is the standard.; So he has said to...",Prabhupāda," Now our next point is that we say that God, the person, is identical with His name. Now, if, by meeting God, by seeing God, you become purified, then by chanting His name also, you'll become purified, because we say God and His name, identical. But if, by meeting God, you become immediately purified of material contamination, similarly, by chanting God's name you immediately become purified. So what is that name of God that acts immediately, exactly like God? So farKṛṣṇaname is concerned, it is practically that so many thousands of men, they are chanting ""Kṛṣṇa,"" and they are becoming purified. So find out any other name which can act equally. Then that is accepted as God's name, not by imagination."
Pañcadraviḍa,"How do you find out, Prabhupāda?",Prabhupāda, Eh?
Pañcadraviḍa,"How...? If a person says, ""How do you find out? How we can find out other names?""",Prabhupāda, Here we are chantingHareKṛṣṇaand we are becoming purified. That is the name.
Pañcadraviḍa,DhruvachantedOṁ...,Prabhupāda," Kṛṣṇetina...,varṇa-dvayam. Kṛṣṇeti. Kṛṣ-ṇa,varṇa,alphabets two.JīvaGosvāmī said,kṛṣṇetivarṇa-dvayam.This is the name.Rāma.Rāmetivarṇa-dvayam.You chantRāma,Rāma, you chantKṛṣṇa, and it is... It will act. And there is proof. So find out any other name. If he acts... If it acts like that, then it is God's name.Phalenaparicīyate:""By the action, we have to understand the substance."" Just like quinine is understood to subsidize, subside fever. Then if you take something as quinine and if your fever is gone, then it is quinine. Similarly, God-name, it acting as God, purifying... SoKṛṣṇais purifying. Therefore it's God's name. Yes?"
Devotee (3),"It's almost time for lunch, Prabhupāda.",Prabhupāda, Eh.
Devotee (3),Shall we go?,Prabhupāda," Oh, yes.HareKṛṣṇa. [break] It will take some time. But our line of action..."
Devotee (2),Generally these type of people are... They're so mentally puffed-up that a process like chanting doesn't appeal to them. They want something for their minds to speculate on.,Prabhupāda, Why not process? Eh? Eh?
Devotee (2),The books are what actually attracts them. It attracts their minds.,Prabhupāda, Yes. We have got two process. One process is chanting. Another process: read books. That is also chanting.
Ravīndra-svarūpa,"One argument that the Christians have... When we tell them that we accept Lord Jesus, so they say that ""You haven't accepted Jesus into your heart."" We say, ""We're following the teachings of Jesus."" And they say, ""But you haven't accepted Jesus into your heart,"" that ""You're not a follower of Jesus. And that's the lacking qualification.""",Prabhupāda," It is very difficult to convince them. [break] We may not keep the Christ in heart, but even you do not keep Christ by your dealings. You are simply disobeying the orders. Then how you can be a Christian?"
Ravīndra-svarūpa,"Jesus says that inMatthew.He says that ""Many will come to me and say, 'Lord, Lord,' that 'We cured the sick in your name, and we cast out demons in your name,' "" and Jesus said that ""When they come I will say, 'Get away from me. I know you not, for you failed to do the will of my Father.' "" Even though they're claiming to be Christians.",Prabhupāda, Yes.
Prajāpati,"Many times, Śrīla Prabhupāda, I've heard you say, when speaking to people, that ""You don't have to give up your faith. You can remain a Christian or you can remain a Mohammedan. Simply chant theHareKṛṣṇamantra,and you'll become purified."" So the main point...",Prabhupāda," No, we say not onlyHareKṛṣṇa. ""You chant the name of God. But if you have no name of God, then here is the name of God."""
Ravīndra-svarūpa,"Yeah. So that if we can get Christians to chantHareKṛṣṇa, then...",Prabhupāda," That is all right. Anyone who chantsHareKṛṣṇa, he becomes purified. It doesn't matter what he is."
Ravīndra-svarūpa; Prajāpati; Ravīndra-svarūpa; Prajāpati; Pañcadraviḍa,"Many of them are afraid to accept our movement or our philosophy because they feel that their personal religion is threatened, that they'll have to stop being a Christian. So when I earlier mentioned that to start some Christian group, the idea was to have some people who are professing to be Christians, but they are taking the word of Jesus to the deepest point where he says that ""There are many things I have not revealed to you, and you will understand them by the grace of the Holy Spirit."" So they could have a Christian group where people worshiped Lord Jesus as their spiritual master and simultaneously worshipedKṛṣṇa. And they could introduce that to develop more knowledge of God one can read theBhagavad-gītā,one can follow the instruction in theBibleby chanting the names of God, and they would have better access to Christians than those of us who are wearing robes or shaving our heads.; Better the same people to understand that Śrīla Prabhupāda meets all the qualifications that Jesus Christ met, plus more in he is here, and he is the Christ. Christ is the anointed one of God.; Yes. So we have to bring them to that understanding, but we have to understand also that they're afraid, that their own faith will be shaken. So if you can give them more knowledge, then they can come to understand that. So if they... You have said that we accept Jesus as ourguru. So if someone was practically worshiping, so then they could see. They could not deny. When a devotee says to them, ""Yes, I'm accepting Jesus in my heart,"" They could not deny. If they are, for instance in a person, householder's home-he's worshipingKṛṣṇa, and he's having a picture of you and a picture of Jesus—then there's no way they can deny that they are not Christians. And they could have access to a lot of the young Christian groups. [break]; This life... [break] (end); ...take the chemicals and combine them together in a test tube so that a soul can enter into that and...",Prabhupāda," God is not your father's servant, that He will arrange to bring the soul. You are God's servant."
Pañcadraviḍa,"So you're... Cannot be done, then?",Prabhupāda," No. If you bring, you can bring soul by some arrangement, then we shall think that you are better than God. But you are rascal. You are thinking like that. You cannot do that. God will not agree to send a soul to your arrangement. You should always remember that you are servant of God. God is not your servant. That is knowledge. [Break]"
Gurudāsa,Jaya.,Prabhupāda, Eh?
