Question Speaker,Question Text,Answer Speaker,Answer Text
Devotee,Law and order.,Prabhupāda," Yes. Wherefrom the idea came to the human society unless it is there in the Absolute? How the idea comes? Therefore that law and order isViṣṇu.Janmādyasyayataḥ[SB1.1.1].The idea of law and order came fromViṣṇu. How nicely explained.Janmādyasya.In two words,janmādyasyayataḥ[SB1.1.1].Janmameans creation, andādi,ādimeans firstjanma,thensthiti.Sthitimeans staying, maintenance. And then dissolution. So three things.Yataḥ,from where these three things are happening. That means this world is being created from that source, it is being maintained by that source, and when it is annihilated it rests in that energy, the whole energy.Pralayaṁyāntimāmikam, Bhagavad-gītā.When everything is dissolved, the energy is absorbed by the energetic. So that is Absolute Truth. SoŚrīmad-Bhāgavatamexplains that Absolute Truth.Janmādyasyayataanvayād itarataścaartheṣuabhijñaḥsvarāṭ[SB1.1.1].In theVedānta-sūtrait is simply said that ""The Absolute Truth is that which is the fountainhead of everything."" Now if fountainhead of everything, then what the Absolute Truth's nature shall be like? That is explained in theŚrīmad-Bhāgavatam.The first thing is thatjanmādyasyayataḥ[SB1.1.1].The factor, the Absolute Truth from which everything is emanating, so that emanation includes indirect and direct manifestation. What is that indirect and direct manifestation? The direct manifestation is the spiritual world and the indirect manifestation is this material world. Indirect manifestation means it is simply a shadow of the spiritual world. Just like in the Bible also it is said the man is made after God. So you have got two hands, one head, two leg. So the mental speculation is said that these devotees, they create God according to their own feature. Because I am two-handed, and therefore I create God with two hands,Kṛṣṇa. But actually, the fact is not that. Actually, becauseKṛṣṇahas got two hands and we have got an imitation body ofKṛṣṇa, therefore we have got two hands. Because this is imitation. That we know everything, everyone. This body will not stay. Therefore it has gotjanma.Janmameans birth or creation at a certain period, and it stays, say, for fifty years or hundred years. Then dissolved, dissolution. Therefore it is imitation. Just like if you create a doll, clay doll, very nice beautiful girl. But it will... It is imitation. It is shadow of the real beautiful girl. It is created at some time and... So reality is there in the spiritual world. Therefore it is calledjanmādyasyayataḥ[SB1.1.1].The idea comes from there, but the impersonalists, due to their intelligence being very meager, they think that the Absolute Truth is without any variety, impersonal or void. They think that varieties are only in the material world, but actually, real varieties are there in the spiritual world. It is only reflection, as it is described in theBhagavad-gītā,ūrdhvamūlamadhah-śākha.Adhah-śākham.Aśvatthaṁprāhuravyayam.Aśvattha...This material creation, material manifestation is compared with a banyan tree whose root is upward. And that I have explained several times how the tree can be upwards root. That means it is reflection. Just like you stand on the riverside, the tree will be reflected on the river, on the water, as obverted. That means that is reflection. As soon as we say that this is a tree, the root of which is up, that means it is reflection. TheMāyāvādīphilosopher, they do not take account of the mathematical calculation, 380 degree. They are taking account of... 360 degree, the whole circle. They are taking account only 180 degree. And other 180 degree they're making void. But actually, the whole point is 360 degree. That is geomatrical calculation. If you simply know 180 degree, then the other 180 degree is unknown to you. So real life, real variety, real beauty, real knowledge, everything in reality is there in the spiritual world. It is only reflection. ThereforeBhāgavataexplains thatjanmādyasyayataḥanvayād itarataścaartheṣuabhijñaḥ[SB1.1.1].The Supreme Absolute Truth is cognizant,abhijñaḥ.Cognizant andsvarāṭ.Svarāṭmeans independent. In this way, the explanation ofBrahma-sūtrais given in theŚrīmad-Bhāgavatam.ThereforeŚrīmad-Bhāgavatamisvaiṣṇavānāṁpriyam.Yadvaiṣṇavānāṁpriyam.Yasminparamahaṁsamekaṁparaṁjñānamjñeyate.The knowledge ofŚrīmad-Bhāgavatamis to be understood by theparamahaṁsa,the highest perfected man,paramahaṁsa.It is not ordinary thing."
Devotee,"Swamiji, if all things here are a reflection of what is perfect in the spiritual world, then shouldn'thateand frustration and despair and prejudice also appear in the spiritual world?",Prabhupāda, Yes.
Devotee,Does it?,Prabhupāda, Yes.
Devotee,Then isn't that... Aren't they bad?,Prabhupāda," But that frustration has no disappointment. (laughter) That is the beauty. Just like LordCaitanyais manifesting that spiritual frustration. ""OhKṛṣṇa, I could not see You."" He's jumping on the sea in frustration. But that frustration is the highest perfection of love. Yes. Everything is there. But without inebriety. You are very intelligent boy. I thank you. Yes. Yes. There is frustration, but not this frustration. Yes. That frustration, I mean to say, enriches one's eagerness of love forKṛṣṇa. Everything is there, but without inebriety. Everything is there. Yes. Now see,Viṣṇu? Of course, inVaikuṇṭha-jagatthere is no violence. ButViṣṇuis taking the symbol of violence. Otherwise what is the meaning of this disc and club? So when He wants to be violent, He comes here asNṛsiṁha-mūrti.(laughter) And He sends some of His devotees to play violence. That is Hiraṇyakaśipu. Because there the devotees are so much in accord withKṛṣṇaandViṣṇuthat there is no question of disagreement. But violence is when this disagree-ment, atheist. Therefore sometimes a devotee is deputed in this world to play as atheist, andKṛṣṇacomes to kill him. To teach these people that ""If you become atheist, then here is disc and club for you."" But it is not possible to be displayed in theVaikuṇṭha. Otherwise, if there is no the propensity of violence... Just like there is sometimes mock fight. A father is fighting in mock with a small child, and he has become defeated. But there is pleasure. Soānandamayo 'bhyāsāt(Vedānta-sūtra1.1.12).The Lord is joyful. So there is joy in fighting also sometimes. So your question that everything is there, that is a fact. Everything is there. Otherwise if everything is not there, they cannot be manifested here because it is reflection. Just like in... Of course, this discovery is by theVaiṣṇava,GauḍīyaVaiṣṇava. Just like the love betweenRādhāandKṛṣṇa, it is calledparakiya.They are not married husband and wife. But Rādhārāṇī appears to be wife of some other gentleman. ButKṛṣṇa, from childhood, They were friends. So Radhārāṇī could not forgetKṛṣṇa. She used to come toKṛṣṇaand stand like that. That's all. And He was playing.Kiśora-Kiśorī, They were boy and girl. But there is no inebriety. Just like here the boy and girls mix and there are so many abominable things. Distressful, which is binding their material bondage. So that friendship between boy and girl is there, but without inebriety.Kṛṣṇahad so manygopīs,girlfriend, but there was no contraceptive pills. (laughter) That is the beauty. Here, the so-called love is lust. And there, that is the highest. The same thing, obverted, perverted reflection. Just like in the original tree the topmost part has come down to the down. Similarly, in the spiritual world the highest, topmost level of love,parakiya...Parakiyameans love not by marriage life, by friendship. That is there. But there is no such inebriety. It is pure. So perverted means the topmost thing has come down to the lowest. Here, thisparakiya,loving other's wife or other's husband, is most abominable, adultery. Not allowed by society, not allowed by the state. But tendency is there. Even one is married, he wants to love another's wife. Or if the girl married (s)he wants to love another husband. Why? That is there. But without inebriety. That is the beauty. So everything is there, but here, that thing is reflected, pervertedly. Therefore misunderstood. There is so many other corollaries. You see? But you must know everything, that without being in the Absolute Truth there cannot be relative manifestation. This world is relative manifestation. So these things are not to be understood in the beginning, but as the questions came we discussed something. But you must know, as theVedānta-sūtrasays,janmādyasyayataḥ[SB1.1.1].Everything is emanated from that Absolute Truth. That is the fountainhead of everything. We cannot manufacture anything. It is not possible. But this is shadow and that is reality. And in the shadow... Just like photograph. You find that everything in detail of your beautiful face in the photograph, but that is not reality. That's all. So you'll find everything in details, all... Or you can understand actual photograph, actual idea, actual notion of the spiritual world by scrutinizingly studying this material world. The impersonalists, they think that in the material varieties there are so many abominable inebrieties, therefore in the spiritual world all these things should be minus, void. That is their material calculation. They cannot think that in the spiritual world also there is love. Because here, in this world, the so-called love or lust is frustrated and followed by so many calamities that therefore they cannot conceive that in the spiritual world also there is love. Their idea, in one sense, is right, that how these nonsensical things can exist in the spiritual world? Therefore they make it altogether minus. No variety. Impersonal. That is less intelligence. They cannot understand that photograph is the reflection of the actual person. There is everything in detail. A movie. Actually, the same man is laughing, walking, dress, everything, but it is all false. That they cannot understand. Therefore the Vaiṣṇavas say they are less intelligent. The real understanding should be that if in the real person all these features are not present, how they can be reflected in the photograph? TheMāyāvādīsays,brahmasatyaṁjaganmithyā.Brahman, the Absolute Truth, is real truth, and this world ismithyā.Thenmithyāmeans it is a reflection or shadow.Mithyādoes not mean that it has no existence. The shadow is also existence. ThereforeVaiṣṇavaphilosophers say thatmithyāmeans temporary. Now you have got this body. This is temporary. That's the real understanding. And if I say it ismithyā,then if I kill you, then why I am punished? I can say, ""Oh, it ismithyā,it is false. So what is their fault?"" No. It is notmithyā.It is temporary. Notmithyā.Mithyāhow can it be? Because it is reflection of the reality, therefore it cannot bemithyā.Then the reality becomesmithyā.Mithyāmeans not fact. The real explanation is that this is shadow. Shadow, but the reality is in the spiritual world, and that is indicated in theVedānta-sūtra, janmādyasyayataḥ[SB1.1.1].The fountainhead of all emanation. That is Absolute Truth."
Advaita,"Swamiji, last night our window was broken. Was thatmāyāstriking at us?",Prabhupāda, Hm?
Advaita,Last night my window was broken. Was thatmāyāstriking?,Prabhupāda, Yes.
Advaita,Kids broke the window?,Prabhupāda," Yes.Māyāis always striking. Why do you take only a window? Why do you compactmāyāin the window? He is without window, within the window.Māyāis not only, I mean to say, limited to a certain extent. The whole world ismāyā. Jaganmithyā.The whole universe ismāyā.Only that part is notmāyāwhere the chantingHareKṛṣṇais there."
Devotees,Haribol.HareKṛṣṇa.,Prabhupāda, As soon as there was some slacking inHareKṛṣṇathemāyāstruck. (laughs) Yes. Yes.
Govindadāsī,Swamiji?,Prabhupāda, Yes. You are asking at the last moment. You are very much careful about time.
Govindadāsī,Oh. I didn't know.,Prabhupāda," No, you ask me."
Govindadāsī,"No, I won't ask.",Prabhupāda," No, no, no, you ask. Yes. Yes."
Govindadāsī,Could you describe Kṛṣṇa's pastimes as cowboy whenever He goes out in the morning with the cowherds boys?,Prabhupāda," Yes, you can... Because... Have you seen how the... You have no experience here in your country. Have you got any experience? But in India we have got experience how in the morning the cowboy takes some food from the mother and with the cows he goes to the field. The cows are let loose on the grazing ground. They are enjoying, and this cowboy is sometimes singing. The flute, Kṛṣṇa's flute is because He is cowboy. The cowboys still play in that flute. In India you'll find. Because the cows are let... They are doing their own work, and what this boy will do? They are playing. There are many cowherds boys, they are playing. Sometimes playing on flutes, sometimes sporting, sometimes eating. SoKṛṣṇawas exactly doing like that. All the cowboy friend went with Him.Kṛṣṇawas, of course, a very rich man's son. His father was very rich. So He used to take with Him very nice foodstuff,lugdoo, kacaurī.And other, His poor friends, they were takingcapātīs,drycapātīs.(laughs) So they were enjoying, dividing, ""Your food, my food, his food."" And sometimes there was some trouble in the forest becauseKamsawas afterKṛṣṇato kill Him. He was sending his assistants. So someasurawould come, Bakāsura,Aghāsura, andKṛṣṇawould kill. And the boys would return and narrate the story to their mother. ""Oh, my dear mother! Such and such thing happened andKṛṣṇakilled it! Very..."" (laughter) The mother will, ""Oh, yes, ourKṛṣṇais very wonderful!"" (laughter) SoKṛṣṇawas their enjoyment. That's all. The mother is speaking ofKṛṣṇa, the boy is speaking ofKṛṣṇa. So therefore they did not know anything butKṛṣṇa.Kṛṣṇa. Whenever there is some trouble, ""OhKṛṣṇa."" When there is fire, ""Oh,Kṛṣṇa."" That is the beauty ofVṛndāvana. Their mind is absorbed inKṛṣṇa. Not through philosophy. Not through understanding, but natural love. ""Kṛṣṇa is our village boy, our relative, our friend, our lover, our master."" Some way or other,Kṛṣṇa. That is the beauty. Therefore Śukadeva Gosvāmī is describing the playing of the boys."
Devotees,HareKṛṣṇa.,Prabhupāda, You can take this.HareKṛṣṇa.
Devotees; Brahmānanda; Gargamuni,HareKṛṣṇa. (offer obeisances) (end); It's the capital.; Tallahassee.,Prabhupāda, Miami is the capital.
Brahmānanda,No. Miami is a big tourist city.,Prabhupāda, Oh.
Janārdana; Gargamuni,"It's all tourist, the whole place.; There's an Indian fellow in theSanFrancisco temple. He comes very often. He's a student, and his name is Vinode.",Prabhupāda, Vinode.
Gargamuni,"Yes. And he helps us cookprasādam.And he cooks in the kitchen and oh, he says, ""Kṛṣṇa is my only life."" He says he was so happy to find a temple here.",Prabhupāda, Very good.
Gargamuni,"He mentioned to me that he's married and that he has a child in India. And he asked, ""Oh, were you married?"" And I said, ""No. My wife was taken away."" And he came over and he hugged me. ""Oh,"" he said, ""you are so lucky."" (laughter) He hugged me. He said, ""Oh, you are so lucky.""",Prabhupāda," (chuckling) There is aTulasīdas poetry,dinkaḍākinīratkabhāginīgargarabhāginīcuṣe.Bhāginī.Tulasīdas had very good, beautiful wife, and he was very much attached to her. So the system is that after the girl is staying with her husband... Because young girls, very minor age, they were married, say, ten years, nine years, twelve years. But they're allowed to live with husband, say, after thirteen years or fourteen years, when she has attained puberty. So the system is six months father house and six months husband. In this way, going and coming. But when she is elderly she can remain continually with her ...but in the beginning... Because after all, she is girl, so she cannot tolerate the separation from father and mother. So six months here, six months... SoTulasīdas, as soon as the, his father-in-law will come to take his daughter, he won't allow. He won't allow."
Brahmānanda,"Oh, he's so attached.",Prabhupāda," Yes. ""She'll go later on. She'll go."" So he went back. The father used to..., went back. In this way, several times. Then it was agreed that the girl would go there, father's house, and the father took the girl in the morning, and in the eveningTulasīdāsawent there. (laughs) His wife chastised, ""You are so rascal fool that I have come this morning and you have, evening you are here? You have so much attachment for the skin?"" Just like husband and wife talking. That struck him very badly, and he immediately left that place and went to... Left home for good. Yes. And that was the initiation that he took up writing aboutRāma. That isTulasīdāsa's life. Just being, I mean to say, hurt by the words of wife, that ""I love her,""... Later on he understood, ""Yes, she is right. So why should I be so much attached?"" She uttered this (indistinct), ""If you have got so much attachment for this skin and bone; if you had so much attachment forRāmathen your life would have been different."" So he took it seriously. ""Why not attachment forRāma?"" So he became a great devotee ofRāma,Tulasīdas. His book,Rāma-carita-mānasa.""Thinking always ofRāma,"" that is his book. It is very famous book, and that is the only important literature in the Hindi language,Rāma-carita-mānasa.It is very popular in India. Village to village. PracticallyGītāPress has flourished simply by selling theRāma-carita-mānasaandGītā.GītāandRāma-carita-mānasa.Two books. Millions of books they print and sell, thisRāma-carita-mānasaandBhagavad-gītā.So he has written thatdinkadakini.In the daytime she is just like what is called, witches. Witch? Witch?"
Brahmānanda,"Witch, yes.",Prabhupāda, Ḍākinī.Andratkabhāginī.At night she is tigress.
Devotee; Brahmānanda,She's what?; Tigress.,Prabhupāda, Tigress. At daytime she is witches. Witch or witches?
Brahmānanda,Witch.,Prabhupāda," Witch. And at night she is tigress. So that is the nature of woman. But the world is so made that everyone is keeping such tigress. (laughs heartily)Dinkaḍākinīratkabhāginī.(Hindi) Every moment she is sucking blood. She is such a dangerous tigress. Every moment sucking blood. But (Hindi) the people, the world, people of the world has gone so crazy that each one is keeping one tigress. (laughs)"
Brahmānanda,Right in the home.,Prabhupāda," Yes. That isTulasīdāsa's remark. So in many passages of his poetry he has not done very justice to woman. And another poetry, he writes,dhol guṇārśūdranarī. Dhol guṇārśūdranarīihe sabśaśankeadhikārī.(?)Dhol guṇārpaśuśūdranarī, ihe sabśaśankeadhikārī. Dhol, dholmeans drum,mṛdaṅga. Gunar, guṇārmeans... What is called English? A fool, fool. Illiterate fool, what is one word?"
Brahmānanda,Buffoon?,Prabhupāda, Maybe buffoon. Buffoon is sometimes troublesome. Butguṇārmeans he doesn't understand very nicely.
Brahmānanda,Dullard.,Prabhupāda," Dull, dull.Dhol guṇār, dholmeans drum andguṇārmeans dull.Śūdra,and the laborer class. Three.Dhol, guṇār,śūdra,andpaśu,household animals, just like cows, dogs."
Brahmānanda,Pet.,Prabhupāda," Pet, like that.Dhol guṇārśūdrapaśuandnarī.Narimeans woman. (laughs) Just see. He has classified thenarīamongst these class,dhol, guṇār,śūdra,paśu,narī. Ihe sabśaśankeadhikārī.Sasankeadhikārīmeans all these are subjected for punishment. And what about the guest?"
Govindadāsī,"Oh, the guest? It's coming.",Prabhupāda," Sośaśankeadhikārīmeans they should be punished. (laughs) Punished means, just likedhol,when the, I mean to say, sound is not very hard, dag-dag, if you beat it on the border, then it comes to be nice tune. Similarly,paśu,animals, if you request, ""My dear dog, please do not go there."" Hut! (laughter) ""No, my dear dog."" Hut! This is the way.(?) Similarly, woman. If you become lenient, then she will be troublesome. So in India still, in villages, whenever there is some quarrel between husband wife, the husband beats and she is tamed. (laughs) In civilized society, ""Oh, you have done this?"" Immediately some criminal case. But in uncivilized society they don't care for court or civilized way of...Kicharī.(prasādambeing served)"
Rayarama,"Swamiji,Janārdanatold me that from Vedic sources, you drew some conclusion that there are different universes visible? The stars are different universes? What is that?",Prabhupāda, Yes.
Rayarama,So each star is a different universe.,Prabhupāda," Begin, begin. (eating) Yes. Gargamuni, you distribute thispurī."
Gargamuni,Made some curry. (everyone eating for a long time),Prabhupāda, Everything hot.
Brahmānanda,Yes.,Prabhupāda," BeforeKṛṣṇaconsciousness, was there anypurīmanufactured here? No. (laughs)"
Gargamuni; Brahmānanda; Rāyarāma; Devotee; Gargamuni,"No. None of this.; When I first came toKṛṣṇaconsciousness, I'd only been coming I think maybe two days toKṛṣṇaconsciousness, and thenMukundahad his wedding. Oh, that hooked me. Nice wedding and nice feasting. I was hooked.; That was the day after our initiations. They initiated the night before. We had two days feasting.; I came intoSanFrancisco looking for a spiritual teacher and I came toprasādamand I never left.; I think that's what hooked all of us. (laughter)",Prabhupāda," Prasādesarva-duhkhānāṁhanir asyopajāyate.(pause) Thank you.Govindadāsīhas become very good housewife. Yes. (pause) Rāyarāma, come.Kṛṣṇabaṛo doyāmoy koribārejihvājaysva-prasād-annadilobhāi.No more. (end)"
Student (1),"My question, that one child (inaudible)...Kṛṣṇaconscious... [Break] ...I don't know...",Prabhupāda," I told you that I do not expect that everyone will beKṛṣṇaconscious. That is not possible. But if there is one moon in the sky, that is sufficient to eradicate the darkness. You don't require many stars.Ekaś candras tamohantinacatārāsahasraśaḥ.If one man understands perfectly what is thisKṛṣṇaconsciousness movement is, he can do tremendous benefit to the other people. So you are all intelligent boys and girls. You try to understand thisKṛṣṇaconsciousness philosophy with all your reason or argument. But try to understand it seriously. Don't make it a farce. That is the object of life."
Student (2),"When you've got that... (inaudible) ...Kṛṣṇaconsciousness, and then you become unconscious, and then you become conscious, and then you become unconscious. And it extended like that, backwards and forwards, for five minutes. Is that Vedic?",Prabhupāda, What is that? Unconscious? You are unconscious or you answer?
Student (2),I have read and thought that...,Prabhupāda, To become unconscious.
Student (2),"...that God, the force who made everything and more in this (inaudible)..., in making this, (inaudible)...playing agame. And you play agameby playing hide and seek. The whole point of thegameis that someone is hidden from you.",Prabhupāda, There is nothing hide and seek here. It is all open. Yes?
Student (2),"Years ago, everyone wasKṛṣṇaconscious.",Prabhupāda, Everyone was...? When?
Student (3); Student (2),"When? In the beginning.; If you sit down and you look very closely into his eyes, and you get closer and closer and closer and closer. (laughter)",Prabhupāda, What is their doubt?
Student (2),"You can go all the way, all the way, all the way, and what do you find? (laughter)",Prabhupāda, You can find. I cannot find.
Student (3),"I wanted material world, being in spiritual consciousness is to get...",Prabhupāda," Yes. We are trying that. Calling everyone, ""Come and push your conscious."" We are inviting everyone. There is no restriction. And it is very easy. Just try to dance and chant. That's all. In the treatment they are taking part. That child is taught something ofKṛṣṇaconsciousness. He'll be a very good child. So it is open to everyone. There is no restriction."
Student (4),(inaudible),Prabhupāda," That I have explained, that changing our body, there are 8,400,000's of bodies. So after death, you enter in one of the bodies."
Student (4),And what happens?,Prabhupāda," As happens... As you enter the body, the happening is according to the body."
Student (4),But does this go on and on indefinitely or does it stop? Do you just keep changing bodies indefinitely or does it end?,Prabhupāda," Not indefinitely. If you becomeKṛṣṇaconscious, then you haven't got to change this material body. You are transferred to the spiritual world. There is eternal body."
Student (4),Oh. Does everyone go there or only some?,Prabhupāda," It is accepted that everyone goes. But if somehow you are stubborn to remain here, how one can help? (laughter) Just like the university is open for everyone. But somebody is stubborn to go to the prison department. So how the government can help? Government does not say that ""Some selected people come to the university, and others go to the prison department."" It is open for everyone, but it is the particular mentality—one is going to the university; one is going to the prison house. That is your individual independence. That is your choice. Just like so many students, they have come here. Others have not come here. So everyone has got little independence. So everyone can go to the spiritual world if he likes. But if he does not like, he will remain here. That is his choice."
