Question Speaker,Question Text,Answer Speaker,Answer Text
MissRose,"Swamiji, but that has to advertised in papers...",Prabhupāda, So why don't you do it? This is a service. You can do it.
MissRose,"Yes, right.",Prabhupāda, You are acquainted with so many people. You are experienced.
MissRose,But I mean so that people can read it. So they'll understand it's not hippies.,Prabhupāda," Yes. You go to responsible men and see, that ""This is a nice movement. Why don't you patronize it to save your country's from the hippies' falling down, confusion?"" We are saving. Practically this society is giving the best service to your country. They should appreciate, but they should not misunderstand us. How we can be hippies? We completely... That is also said. How foolish man he is, that, er... In that article, Satsvarūpa, in that article, it is clearly stated that we are refusing all these things. How they conclude that we are hippies?"
Satsvarūpa,It wasn't a bad article.,Prabhupāda, Oh! What a nonsense he is!
Candanācārya,He is worried that hippies come to the ceremonies to see us.,Prabhupāda, Oh.
Candanācārya,I think that's why he's worried about hippies.,Prabhupāda, Oh.
Candanācārya,Because he saw photographs that audience was hippies.,Prabhupāda," Oh. So that we cannot cancel: ""These hippies are not admitted."" No. We admit everyone. We cannot say that ""Such and such person cannot enter into our temple."" We cannot say. Everyone is welcome. Everyone is welcome. And, if they do not come, how they'll converted?"
MissRose,I think that the confusion is...,Prabhupāda," We cannot say, just like, in some hotels, that ""Such and such persons are not admitted."" No. We cannot. We admit everyone. Our mission is to elevate persons from down state of life to the highest state of life. So everyone is in down state. Lord Jesus Christ also said that ""You do nothatethe sinners, buthatesin."" Is not that, Lord Jesus Christ said? So hippies may be sinners. We raise them to the pious life. But we say, ""Don't do this. Don't do this sinful act. Don't take intoxication. Don't do this. Don't do this."" Wehatesin, not the sinners. Actually. If wehatesinners, then where is the possibility of preaching?"
MissRose,"If the hippies would come, come, come...",Prabhupāda, Yes.
MissRose,Then you can get them out of this hippie into Christian conscience. See.,Prabhupāda, Yes. That is our mission.
MissRose,Yes. I can understand that.,Prabhupāda," HareKṛṣṇa. All right.Kṛṣṇawill see. So you just give service toKṛṣṇa, impressing people that theseKṛṣṇaconscious people are not hippies."
MissRose,"Oh, yes! I told a lot of people. You know, Swamiji, the first time when I heard about 95 Glenville Avenue, the first time, a woman told me that, she says, ""You know,"" she says, ""gypsies, we have neighbors, gypsies on the street."" ""Gypsies! I haven't seen any gypsies."" Well, I put my shoes. I went downstairs. I went to the door and I start reading. I says, ""This is spiritual. This is beautiful. This is spiritual."" I forgot right away. So she came to the door, Jadurani. She came to the door and she said, ""HareKṛṣṇa,"" and she said, ""Come in."" I came in and she started talking to me and that's... I got started. So when I seen her, I said, ""That's not gypsies. That's not gypsies."" And I explained it to her. ""Oh,"" she said, ""I seen the curtains in the window,"" she said, ""and I thought they were gypsies."" ""Oh, well,"" I explained it to her. ""Oh,"" I says. I let her have it, there was no gypsies there. So she used to see me coming down to got to the temple. So nice, yeah? Do you like that place, Swamiji?",Prabhupāda, Which place?
MissRose,"Where the disciples are now, on Glenville Avenue? Or do you think that you need another place?",Prabhupāda," No, sometimes the, some children disturb. They broke..."
MissRose,"No. Oh, I know they broke the windows. I know that. You know, Swamiji, it's very hard to find apartments, and, Swamiji, they're very expensive. $125, $135, $145 dollars a month, the apartments are. See. Yeah. And they're very, very hard to find. And sometimes I want to get out of there myself. Because, I mean, there is so many... It's really turning out to be kind of a bad, a lot of children there.",Prabhupāda, Let us see. AsKṛṣṇadesires. Beginkīrtana.Chant. (end)
Pradyumna,"Swamiji, I read in theŚrīmad-Bhāgavatamin the purport to the (inaudible)...ślokas...And I saw in another book aboutsambandha,abhidheya,(inaudible) ... Could you explain that?",Prabhupāda," That is calledprayojana.Everyone enters into contact or agreement with another. What is the idea? To achieve some profit. To get some profit. Similarly, we have got... (break—kīrtana) (end)"
