Question Speaker,Question Text,Answer Speaker,Answer Text
Student (5),"(inaudible)... Why do you butter, ...cheese ...?",Prabhupāda, I do not know. No. We avoid.
Student (5),(inaudible)...Is that part of the whole...?,Prabhupāda," No. There is not part only, but we discourage killing. That is in the Bible also, ""Thou shall not kill,"" but they are killing. What can be done? In the Bible, Ten Commandments, there is, ""Thou shall not kill."" But they are killing. What shall be done?"
Student (6),"Have you ever found what you believe to be your self? Have you ever found your inside, I mean, not physically or mental...",Prabhupāda, Yes. Yes.
Student (6),What...?,Prabhupāda, Yes!(laughter)
Student (6),Could you tell us what you found.,Prabhupāda," Yes. I am prepared to tell you, and this center is open for telling you. Our books are there. It is not a paltry subject that you can understand immediately, but I can give you one instance. That is stated in theBhagavad-gītā."
Student (7),Do you use your body when you speak?,Prabhupāda, Yes. Why not?
Student (7),Tell me. You said (inaudible)... that I am the soul that enters the body... (inaudible),Prabhupāda," Yes. I change my body. Just like if I change this apartment, does it mean I shall stop speaking? Similarly, if I change this apartment of body, does it mean that I shall stop speaking? That's right. (laughter) All right. Let us now chantHareKṛṣṇa. (The recording of the recording ends here-tape is turned off)"
Devotee,No.,Prabhupāda, Just see. (end)
Devotee (1) (woman),Yes.,Prabhupāda, You are feeling all right? Satsvarūpa?
Satsvarūpa,Yes.,Prabhupāda, Yes. You did not go to the airport?
Satsvarūpa,No. I gave the lecture that was cancelled at...,Prabhupāda, Oh. Lecture?
Satsvarūpa,"You were supposed to give a lecture today, but because you gave a lecture last night in Buffalo, we cancelled it and I went instead.",Prabhupāda," So you lectured there? That's nice. Now you have to lecture. I will have to retire. (chuckles) I want that all my students now should be prepared.Puruṣottama, you sit down. You are standing. You come here. Sit down. When, at present, when we speak of past, present, future, we refer to this particular creation of my body. Is it not? Similarly, ""never return back."" ""Never return back"" means... What is your question? I... missing point. Whose question it...? Yes."
Devotee (1),"What is the question? That if we've never been withKṛṣṇa, if we've never been in Kṛṣṇaloka, then how is it that we start remembering His pastimes and His form?",Prabhupāda, You remember Kṛṣṇa's pastimes by hearingŚrīmad-Bhāgavatam.You can hear Kṛṣṇa's pastimes. That you can remember.
Devotee (1),But how can we remember if we've never known them before?,Prabhupāda, How you can remember?
Devotee (1),If we haven't known it.,Prabhupāda," You can know it by hearing fromŚrīmad-Bhāgavatam.Why we are citing so many scriptures,Śrīmad-Bhāgavatam, Bhagavad-gītā?Just to remember."
Devotee (1),Just to remember?,Prabhupāda," Something you forget, but I tell you repeatedly, you hear; you remember. Is it not? Here something you have forgotten completely, and I remind you constantly. Then don't you remember?"
Devotee (1),Yes. But I don't understand how is it that we forgot it... How can we remember...,Prabhupāda," Forgot, you forgot. That is your nature. You forget so many things. You cannot remember what you were doing exactly at this time yesterday. Can you remember immediately? Forgetfulness is our nature. We are very minute; therefore our..., we are subjected to the quality of forgetfulness. Just likeArjuna.Arjunawas askingKṛṣṇathat ""How I can believe that you told this philosophy ofBhagavad-gītātoVivasvān?"" He said that ""In... I, first of all, I told toVivasvān."" So in reply to that question,Kṛṣṇasaid that ""Both you and I had many, many births before, but you have forgotten; I remember."" That is the difference between the Supreme Lord and ourself. He does not forget. He remembers everything, past, present, future, all, but we forget. That is the difference between God and living entity. We are subjected to forgetfulness. So we forget; again, if it is reminded, we remind. That is our nature. So at the present moment we are forgetful of our eternal relationship withKṛṣṇa. And then, by good association, by constant chanting, hearing, remembering, we again revoke our old consciousness. That is calledKṛṣṇaconsciousness. So forgetfulness is not wonderful. It is natural. We forget. But if we keep constant touch, we may not forget. Therefore this association ofKṛṣṇaconsciousness, devotees, and constant repetition of the chanting, scripture, that will keep us intact without forgetting.Satataṁkirtayantomāṁyatantaścadṛḍha-vratāḥ[Bg.9.14].We have to continue this service constantly. Then we shall not forget. Forgetfulness is not wonderful. That is our nature. That is our nature. And that is the difference between ourself and God. God does not forget. We forget. We are claiming, some of us, foolishly claiming, that ""I am God, but I forget."" God does not forget. Therefore I am not God. Is that clear? That is the difference between livingjīvaand Śiva, God. He does not forget. In theBhagavad-gītāHe says,vedāhaṁ samatītāni:[Bg.7.26] ""I know everything of this present, past, future, everything."" But we do not know. We have forgotten. In our daily life, in our childhood, so many things we did. We don't remember. But our parents may remember that as a child, that we did this. So forgetfulness is our nature. But if we keep constant touch withKṛṣṇa, then He will give us remembrance. Sosarvasyacāhaṁhṛdisanniviṣṭo[Bg.15.15].Kṛṣṇasays in the Fifteenth Chapter. Now you readBhagavad-gītāvery carefully. In our examination next January... Yes. FromBhagavad-gītāfor title ofbhakti-śāstrī.Now we have to make our organization regularly a spiritual institution so that we may be recognized, and our students may be freed from this draft board requisition. That I am... Next step is going on. [Break]Natasyakāryaṁkaraṇaṁcavidyate.Puruṣottama? Why don't you get that tape? Yes."
Puruṣottama,Oh.,Prabhupāda," Natasyakāryaṁkaraṇaṁcavidyatenatasyasamādhikaścadṛśyate.This is fromUpaniṣad.Parasyasaktir vividhaivasruyatesvabhaviki-jnana-bala-kriyaca[Cc.Madhya13.65, purport].It is said that nobody is seeing... This is called research. You are accepting any nonsense as God, and they do not have any information from the..., that God meansnatasyakāryaṁkaraṇaṁcavidyatenatasyasamādhikaścadṛśyate:""God has nothing to do, no responsibility. Nobody is found greater than Him."" So if this Vedic injunction is followed, if somebody is claiming, ""I am God,"" we have to see whether he has nothing to do and whether nobody is greater than him. And these two tests will make him false immediately. He has to prove that nobody is greater than... Even contemporary... Suppose I am claiming I am God. So I have to show that at the present moment, throughout the whole world, apart from universe, nobody is greater than me. Then I am... Will these pretenders be able to show that nobody is greater than him? This is a simple test. Andnatasyakāryaṁkaraṇaṁcavidyate:""And he has nothing to do."" There are so many things to test who is God.Ṣaḍ-aiśvarya-pūrṇaḥ.Nobody shall be richer than him; nobody shall be stronger than him; nobody shall be wiser than him; nobody shall be beautiful than him. So these things have to be tested, whether he is God. And simply if I claim, ""Oh, I am God,"" there will... No testament? If I say, ""I am President Nixon,"" will you accept it? If you don't accept it, even an ordinary President Nixon, without testing his credentials, how you will accept a false man as God without testing? You must know what is that test. Credential. He must present credential. Just like when some ambassador comes to a foreign country, there is a ceremony that that ambassador must be recognized by the governor or the governor-general in that state, and he has to place his credentials, similarly, anybody is claiming as God, he has to place his credentials. And what is that credential? The test is there in theUpaniṣad,in theBhagavad-gītāand so many, all literatures,Brahma-saṁhitā,Vedānta-sūtra, inŚrīmad-Bhāgavatam.InŚrīmad-Bhāgavatamfirst it is said,janmādyasyayataḥ, anvayād itarataś cārtheṣvabhijñaḥsvarāṭ[SB1.1.1].Svarāṭ,svarāṭmeans fully independent.Satyaṁparaṁdhīmahi.The Supreme Truth, fully independent. We are not fully independent. And just now, if I feel a little toothache, I will have to go to a doctor. So how can I claim that I am God? God's first qualification is fully independent,svarāṭ.Abhijñaḥ.Abhijñaḥmeans fully cognizant of everything. What is that?"
Puruṣottama,Lugdoos.,Prabhupāda," Oh, yes. All right. Take. Distribute little.Natasyakāryaṁkaraṇaṁcavidyate.Just likeKṛṣṇa. He is the Lord, but He has nothing to do. He is simply enjoying with His friends, with Radharani, with cowherds boy, withgopīs.That is greatness. He has nothing to think, ""How to provide?"" (chuckles) That is greatness. He is taking the cows as a sporting. You see? And when He was called for killingKaṁsa, He left everything, renounced everything.Aiśvaryasamagrasyayaśasaḥ...Everything in full, so much love, so much everything, but at once, in a moment, He renounced everything, went to..., leftVṛndāvana, and all these devotees, they began to cry forKṛṣṇafor the rest of life. And wheneverKṛṣṇawas reminded, oh, He will say, ""I am very soon coming. Don't worry. I am very soon coming."" (chuckles) You see?"
Girl,"Have took, Your Grace?",Prabhupāda, Yes. I have taken. You take. You know how to make lugdoo? Himavatī is good. (chuckles) She learned many things about... We have got another nice girl in Buffalo. I have given her name... What is?Sadā?
Pradyumna,Sadānandinī.,Prabhupāda," A very nice girl. Yes. Always chanting and dancing and always jolly. (chuckling) Very nice girl. You know her? No. She has recently joined. She is good devotee, good worker, very nice. SoKṛṣṇaconsciousness is so nice. Anyone who comes toKṛṣṇaconsciousness immediately becomes beautiful in every respect. [Break]"
Haṁsadūta,Puruṣottama.,Prabhupāda, How manyrosetrees Jayānanda has...
Puruṣottama,108.,Prabhupāda," 108. So at least 108 flowers we'll have daily. Yes. So it is very nice. Our Hawaii,tulasigrows very nice."
Haṁsadūta,Hawaii. They have a new place?,Prabhupāda," Yes, the place where nowGovindadāsīis staying, a very nice place, just on the seaside. And the house is two stories, entire house among the fig trees. There is nice arrangement. So you have any correspondence with her?"
Jadurāṇī,A little.,Prabhupāda, So what does she say?
Jadurāṇī,"She said the flowers weren't out yet, but that was months ago. We have some mail for you. One letter is from her with up-to-date news.",Prabhupāda," Oh. Some devotees are coming. And in Honolulu, two boys, they are also doing. In Hawaii there are two branches now. Yes. One at Honolulu, one at Kauai. Kauai. That island's name is Oahu. Hawaii has five islands' stretch, and this is called Oahu. Oahu island, one side, Honolulu, and one side... This island means hill. And the valley of the hills are utilized for residential purposes. So all sides, Pacific Ocean. And there is ample production of sugar cane and pineapple. I was chewing sugar cane as it is. Yes. And there is so many coconut trees, palm trees, and mango. In mango season they throw away mangos. So I have askedGovindadāsīthat ""You make mango pulp and dry it and send it."" So they are doing nice, husband and wife, Gaurasundara, yes, trying their best. I do not know whether they are working now."
Himāvatī,Govindadāsīis working.,Prabhupāda, Working. She can work. She can earn $400 at least.
Haṁsadūta,Typing?,Prabhupāda, Yes. She is good typist.
Haṁsadūta,"We have one boy in Montreal. He says that he wants to go to Florida the first of May. His father is a real estate man. So he wants to get a job and then get a temple, and he wants someone to come there. He said me preferably.",Prabhupāda," All right. This South, North Carolina, they are also doing... (laughs)"
Haṁsadūta,He wants to go to Palm Beach. Palm Beach is the richest place in the country.,Prabhupāda," That's all right. That's all right. So chantHareKṛṣṇaand everything will be all right. And Buffalo is also doing nice. Oh, yes. The students are educated circle. They are taking interest, both the boys and girls. And three meetings I attended. Every meeting was full, two hundred boys and girls. They were dancing, chanting, asking very intelligent questions. And Rūpānuga is holding class. There will be some examination of the students. They accept papers. Yes. Some Indians are coming from long distance. One Indian gentleman, he came to see me from, what is that place? Ninety-two miles away from Buffalo."
Himāvatī,Did you see Nauvanī?,Prabhupāda, Nauvanī is there. Yes. He is there still. He is also very good. He works very nice in the temple.
Haṁsadūta,Every day.,Prabhupāda," He's a very good man. Everyone who will come to thisKṛṣṇaconsciousness will become good man, even he's a bad man. That is the influence ofKṛṣṇaconsciousness.Sarvairgunaiḥtatrasamāsatesuraḥ.All godly qualities will develop inKṛṣṇaconsciousness. That is the test. Now, our students, nobody can compare with their behavior, with their character, with their innocence. Everything nicer. So don't worry. Simply go on chanting. Everything will be all right. Don't worry."
Jadurāṇī,Doesn't sound like you're concerned about temple affairs.,Prabhupāda," No. It... That's all right. For the time being you don't touch. You chant and everything will be... Soon you will be in good health. Then you will again work. Yes. Śāradīyā, you are painting? No. All right, you finish your school. You are going to school?"
Śāradīyā,Yes.,Prabhupāda," That's nice. You are painting? That's nice. You? That's nice. Practice painting nicely. We'll require so many pictures. We shall publish so many pictures, book. You are not painting. You have no time to paint. You have got enough engagement. So you can... So long you are here, you just show how to Deity worship, how you are doing that, and they will learn. Yes. She is doing that very nice. So you can, all of you, all girls, you take, her. See doing, how she is doing. Who is doing your temple worship?"
Haṁsadūta,Are you going to give some more instruction?,Prabhupāda, No. This is... In this age temple worship is not recommended.
Haṁsadūta,It's not recommended. But Deity worship is temple worship?,Prabhupāda," It is Deity worship. Because nobody can actually, very nicely perform, this age is not suitable. You see? Temple worship, the regulation, the engagement—at least four, five men must always be engaged, always, twenty-four hours."
Haṁsadūta,In the temple worship. In the temple.,Prabhupāda," Yes. We haven't got sufficient men, neither we can arrange such a way. Besides that, your previous culture, everything is completely different. So in this ageCaitanyaMahāprabhuhas..., thissaṅkīrtana,HareKṛṣṇa,harernāmaharernāmaharernāma[Cc. Ādi17.21].This is all round. But at the same time, if you can perform as far as possible, that's nice, Deity worship. In this age Deity worship is secondary.Saṅkīrtanais primary."
Haṁsadūta,Does it matter who performs the Deity worship? Does it matter? I mean is it some particular person?,Prabhupāda," Oh, yes. That is calledarcana-siddhi."
Haṁsadūta,"Who should do it? I mean, in the temple who should do it?",Prabhupāda," No, everyone should do it. Yes, everyone should learn. Everyone should learn. Sometimes somebody is doing something, somebody is doing something. Yes, like that. Everyone should be expert in every respect, twenty-six qualifications. (car noise outside) You have got car here? No. Nobody has got car amongst our disciples?"
Jadurāṇī; Himavatī,"No.; Do you need a car, Swamiji?",Prabhupāda," No, because the temple is here, just in front. So what is the use of car?"
Satsvarūpa,"Prabhupāda, I found a place very likely for a new temple. And I've gone so far as... The lawyer even drew up a lease. So maybe tomorrow you could look at it.",Prabhupāda," Oh, yes. What is the description?"
Satsvarūpa,"Very excellent location, right downtown. The things wrong with it is that the temple area is no bigger than the temple area we have now, but the location is just the greatest. Second floor. Still, right downtown.",Prabhupāda, Second floor. So what is the rent?
Satsvarūpa,"Three hundred a month. But we can do it as long as... Presently,Patita-pāvanais working and so am I, and sometimes thegopīsget some money. So we wouldn't have any problem as long asPatita-pāvanawould continue to work.",Prabhupāda," All right,Kṛṣṇawill solve the problems. But the space is not lesser than this temple?"
Satsvarūpa,"Well, the temple room is maybe even smaller than the present temple room, but then there's another large, very large room for a kitchen and then another space where bunks could be for sleeping. So there's actually three different spaces. The thing is that the main temple hall is not too large.",Prabhupāda," That's all right. That doesn't matter. You have to takesaṅkīrtanaparty. That should be the main business. And the..., at least sixteen men, fourmṛdaṅgas.Practicemṛdaṅgalike that. And twelve cymbals, and one chanting and all others responding. Oh, it will be tremendous. Take some flags, ""ISKCON,HareKṛṣṇa"" flag, red flag. You see? And conchshell,mṛdaṅga.In New York they are doing now, and they also one day collected 240 dollars or something like that. What is that?"
Puruṣottama,247.,Prabhupāda, 247. You see? (chuckles)
Haṁsadūta,"I'll try in Montreal. We have new devotees now, lot of new boys.",Prabhupāda," Yes. Oh, you will get devotees. You just beginsaṅkīrtanaparty. You will get many devotees. You see? In Los Angeles, daily the devotees, new devotees, are coming, and very nice boys. We are now searching after a bigger place. Yes. That temple is not sufficient, although that is the biggest center of all our centers. It has got compound. It has got parking place. It has got two big halls, one big room, one big kitchen, and three, four, five small rooms. It is a nice situation, you see, just suitable for our purpose. And they decorateJagannāthavery nicely. Yes. So increase centers. And what is the name of the boy who went to...Nanda-rūpa(?). He wants to open Toronto?"
Haṁsadūta,In Toronto. Toronto is a very good place to go.,Prabhupāda, So let him open.
Haṁsadūta,Let him go?,Prabhupāda, Yes.
Haṁsadūta,"Okay. But not alone. He needs someone else, I think. He needs one more boy. I don't think by himself he can do it.",Prabhupāda," That we shall arrange, somebody to go. Yes."
Haṁsadūta,Maybe you remember Mr. Sini(?) in Montreal?,Prabhupāda," Yes, yes."
Haṁsadūta,"Well, he approached me just recently. He wants to open a store, Indian store and goods, and he wants the boys in the temple to work there. He wants to make some arrangement so the temple will get some money.",Prabhupāda, He is very cunning man.
Haṁsadūta,"Yes, I know. I don't trust him at all.",Prabhupāda, He wants to utilize our men.
Haṁsadūta,"Yes. Don't deal with him, right? That's what I thought.",Prabhupāda," He wants a cheap, cheap price. [Break] I don't believe all these things they have... They have come here to beg, to make money. You see? Their mentality cannot be good."
Haṁsadūta,I have a letter for you fromGopālaKṛṣṇa.,Prabhupāda, Oh.GopālaKṛṣṇais a good boy.
Haṁsadūta,"Oh, he's very nice. Oh, he's getting so nice. He wants to come.",Prabhupāda, Yes. Yes. Because he is serving.
Himavatī; Haṁsadūta,"He lives in our house now.; He lives with us now. You know we have another house, the whole house, and almost everyone now is a devotee there. And they're eatingprasādam.",Prabhupāda," GopālaKṛṣṇais very nice boy. You give him good protection, and he will turn very good help.Sevonmukhe...ThisKṛṣṇaconsciousness can be, I mean to say, appreciated only by service. There is no other, no other way.Sevonmukhehijihvādau[Brs. 1.2.234].You cannot catchKṛṣṇaby any way, by your riches, by your beauty, by your..., because He excels everything. How you can make Him under your control? You can simply make Him under your control by service, like thegopīsdid. Yes. What is this?Prasāda?Oh, I think I cannot take any. All right, I shall take some."
Satsvarūpa,The devotees haveprasādamover at the temple that's ready.,Prabhupāda," Oh, they can take. They can go. [Break]... initiated, they are chantingmantrasthree times,oṁbhūrbhuvaḥsaviturvareṇyam?Yes. (devotees chantingjapa)"
Haṁsadūta,What are they called?,Prabhupāda," It costs not much with single... (Someone turns on tape of chanting) Oh, the... Middle. Middle. What is this? Tune? Tune? No, what is called?"
Satsvarūpa,Speed.,Prabhupāda," Speed. Yes. That's all right. Oh, so many things. This is the rest of..."
Haṁsadūta,Conchshell.,Prabhupāda, Is it broken?
Haṁsadūta,"A little bit. What is this for, Swamiji?",Prabhupāda, Thispancapātra.
Haṁsadūta,What do you put in there? Ghee?,Prabhupāda, No. Water.Ācamana.And what is this?
Himāvatī,Look inside.,Prabhupāda, Jagannātha?
Himāvatī; MissRose,Yes. (end); It's not in good order Swamiji.,Prabhupāda, Eh?
MissRose,It's not in good order.,Prabhupāda, Which order?
MissRose,"Well, my house where I live.",Prabhupāda," No, no. I say that you purchase one house."
MissRose,Participate in one house?,Prabhupāda, Purchase.
Devotee; MissRose,Purchase. Buy.; Oh. Am I gonnadiggold?,Prabhupāda," Oh, you have no money?"
MissRose,To buy a house? I wish I did. I'd take all of the disciples and put 'em all in one house.,Prabhupāda," Yes. You just make one down payment, and they will pay monthly."
MissRose,Kṛṣṇa!,Prabhupāda, Yes.Kṛṣṇawill help you.
MissRose; Candanācārya; MissRose; Candanācārya,Kṛṣṇa!; Sell your car!; I've got a bad back. I can't walk.; Your car helps your back?,Prabhupāda," Oh, your car is so nice. If I would have remained here, I would ask you to donate this car to the society."
MissRose,Can never tell what I do for (Prabhupāda chuckling) all my sisters and my brothers.,Prabhupāda, Yes.
MissRose,"These are all my sisters and brothers, Swamiji. Right?",Prabhupāda, Yes. certainly. So don't worry.Kṛṣṇawill give you better place.
Satsvarūpa,"That was a disappointment because we almost, almost had it.",Prabhupāda," Yes. No question of disappointment. In Los Angeles, we had so many disappointments. At last, we got very nice place. Now we are after bigger place."
Candanācārya; MissRose,Tell Swamiji about the church we want to get.; The church...?,Prabhupāda, Then that article has worked adversely?
Satsvarūpa,"Yeah. The real estate man said if it had only come out a week later, he said, ""You'd be in.""",Prabhupāda," So publicity like this is not good for us, that people are thinking we are hippies."
MissRose,"Yes. That's true, Swamiji. Yeah.",Prabhupāda," So then you should not give publicity. You must even in the beginning verify that we are not hippies.HareKṛṣṇamovement is not for hippies. In many places this is a notion, that we are hippies."
Devotee,Montreal.,Prabhupāda, Eh?
Devotee; MissRose,"Montreal too, the same thing.; Yes, but a lot of hippies have gone back to... They've went to Florida, Swamiji. Thousands of hippies went back to Florida. They left Boston.",Prabhupāda," They are, most of them, in Hawaii also."
MissRose,"Oh, there's some in Hawaii too?",Prabhupāda, Yes.
MissRose; Candanācārya,"Oh.; Prabhupāda, I think he was worried because... [Break]",Prabhupāda, ...all right. We don'thatehippies. We have nothing... But these people misunderstand. That is... That is another thing. We welcome everyone. We have no such distinction.
MissRose,"Oh, yes, yes. Everyone can come.",Prabhupāda, Never mind.
MissRose,Kṛṣṇa's good.,Prabhupāda, Yes.
Devotee; MissRose,Kṛṣṇawants a better place for us.; Kṛṣṇawants a better place.,Prabhupāda, (laughing) And also it is a fact that many of our students have come from the hippies.
Haṁsadūta,Almost all of them. (laughter),Prabhupāda," So they are our best candidates. So you can advertise that ""We are not hippies, but we are converting many hippies to the sane condition of life."" That's a fact. They are searching after something better, but they have no leader."
MissRose,"Yes, that's true. That's it.",Prabhupāda," They have no leader. Now, if they come to us seriously, they get the right thing. But that is also their defect. When we propose, ""Come and take thisKṛṣṇa,"" they don't want. They want that marijuana."
Candanācārya,"Prabhupāda, my mother had the idea of going to rich parents who are very anxious about their children who've become hippies and saying that this movement...",Prabhupāda," So you should write article that ""We are not hippies, but we are converting hippies to the sane condition. So father, mothers, who are anxious for their children, let them send their children to us. We take care."" In this way you make impression in the public mind."
Candanācārya,And also they make donations.,Prabhupāda, Yes. So our New Vrindaban scheme is there. Let them help and send their children. We make just opposite number of hippies. Yes.
