Question Speaker,Question Text,Answer Speaker,Answer Text
Gargamuni,Swamiji? Didn'tKarṇarequestArjunanot to fight when he was lifting the chariot? Didn'tKarṇarequestArjunanot to kill him?,Prabhupāda," Yes. Request. ButKṛṣṇasaid, ""No. You kill him. I say.""Arjunasaid, ""That's all right. (laughter) When You order me, 'Fight,' I don't care for any morality or discipline. Your order is 'Fight.' """
Devotee,Can you chant for us loudly? Can you chant from theBhāgavata?,Prabhupāda," Yes, I'll chant.HareKṛṣṇa. Oh, thank you very much. All should be offered there,Jagannātha. The etiquette is nice. Everything should be offered to the, through the spiritual master. That is the etiquette. No direct. (Prabhupāda chants the second chapter of First Canto.) One chapter. Just play it. [break] ...have the sound only. (Laughs) The explanation... I shall give you little explanation."
Gargamuni,"Isn't the sound, though, as good as the explanation?",Prabhupāda, Yes. Hearing is always good.
Gargamuni,"Although we don't know what it means, but just the sound.",Prabhupāda," Yes. Yes. Sound will act. Just like ""Kṛṣṇa,HareKṛṣṇa,"" is acting, similarly."
Gargamuni,"What chapter is this, Swamiji?",Prabhupāda," This is second chapter, First Canto.SūtaGosvāmī, before speaking to the audience, he is offering his respect to the spiritual master. To offer respect to anyone means to remember his qualification. Just like we sing... Just like you offer respect to your spiritual master. What is the meaning?"
Gargamuni,Yes.,Prabhupāda, Through.Nārāyaṇaṁnamaskṛtyanaraṁcaiva narottamam[SB1.2.4].Yes.
Gargamuni,"Oh, that's his master.",Prabhupāda," Thank you very much.Naraṁcaiva narottamamdevīṁsarasvatīṁ.Sarasvatī, the goddess of learning. AndVyāsam,and then Vyāsadeva, who is the master of Vedic literature. One after another. This is...Vyāsaṁtatojayaṁudīrayet.Then he is... He was questioned by the audience that what is the most important religion in this age? That was their question. There are many types of religious principles. So what is the best one for this age? So he is replying that question.Munayaḥsādhupṛṣṭo 'haṁ bhavadbhirloka-maṇgalam[SB1.2.5].""You have put very nice question, because you have put the question that 'What is the best religion for the people of this age?' ""Yat-kṛtaḥkṛṣṇa-sampraśno yenātmāsuprasīdati.""And you have, you are very much anxious to understand the activities of LordKṛṣṇa. It is very nice. By this discussion everyone will become actually peaceful and satisfied."" So the answer, ""What is the best religious principle?"" He is answering.Savaipuṁsāṁparo dharmo yato bhaktiradhokṣaje[SB1.2.6].""My dearbrāhmaṇas...""in that meeting all the audience were great learned sages andbrāhmaṇas.So he is addressing them. That is the best form of religion which performing one becomes elevated to devotional service of the Lord. Not religious formalities. One has to test by the result.Phalenaparicīyate.You are Christian, I amHindu, or he is Mohammedan. That's all right. You are very good, I am very good, he is very good. But what is the result of your following religion? Have you attained love of God? Simply I go the church, I go to temple, and I do all kinds of nonsense, I have no love for God, I have love for mymāyāand I go simply..., that is useless. Religious principle means... It doesn't matter whether you areHinduor Christian or Muslim or anything. It doesn't matter. Just seeBhāgavata.Savaipuṁsāṁparo dharmo [SB1.2.6].That sort of religion is nice, best, by which you can develop love of Godhead. It doesn't mention that ""This religion is best, that religion is best."" That religion is best which helps someone, the religionist, to develop love of God, Godhead. If you put to test all kinds of religion in this formula ofŚrīmad-Bhāgavatam,you'll understand which religion is best. You haven't got to ask anybody. Simply by testing how much one has developed love of Godhead. How much one has learned to loveKṛṣṇaor God. If, following any type of religion, if you get this result, then you have performed your religious principle very nicely. This is the answer. And what kind of love?Ahaitukī,without any cause. ""Oh, I love God because I want something from Him."" Generally, as they love God, distress, they want something. ""My dear Lord, I am very unhappy. Please help me."" That is also good. That is not bad. That is accepted inBhagavad-gītā.But that is not pure love. Pure love means there is no reason. ""Why I am lovingKṛṣṇa? Oh, there is no reason. I loveKṛṣṇa. I wantKṛṣṇa."" This is love. Just likeCaitanyaMahāprabhusays... You have got this translation in my first book, that, thatAdvaitahas quoted thatślokain his sermon.(?) ""Whatever you do, You are my Lord. I don't mind whether You put me into distress or You put me into happiness. Or if You don't help me in realizing You. It doesn't matter. Still, I love You. Whether I am going to hell or heaven, it doesn't matter. But I love You."" Just like Cowper said, ""England, with all thy fault, I love you."" This is love. This is material, crude.Ahaitukīapratihatā.Apratihatāmeans that business, ""I loveKṛṣṇa,"" cannot be stopped. ""I could not loveKṛṣṇabecause I was busy in doing this thing or that thing, or because..."" So many reason we can put forward. No. Love ofKṛṣṇacannot be stopped by any material reason. That is love. Nobody can say that ""For this reason I could not loveKṛṣṇa."" There is no reason. There is no impediment for anyone. Any circumstances. So any religious principle which helps a person to loveKṛṣṇaand God, in that way, without any reason, without any impediment... Just like flow of the river. There is no impediment in this world which can stop the flow of the river. Or the waves of the Pacific Ocean. There is no power in the material world which can stop the waves going on, going on, going on. You see? Similarly, that is the best type of religion. Now just see howBhāgavatais liberal in the description of religion. Religion... You are religious, you are very pious man—how it will be tested? How much you have developed love of God. That's all. Without any reason, without any impediment. This is test of best religion.Vāsudeve...(aside:)Gurudāsa, you can hear? Yes."
Gargamuni,Thank you for chantingŚrīmad-Bhāgavatam.,Prabhupāda, Śrīmad-bhāgavatamamalaṁpurāṇam.You have gotŚrīmad-Bhāgavatam.Read very carefully. All these things are already explained there. Cut it into pieces and distribute.
Devotee,Swamiji? Should we read just one chapter a day or...,Prabhupāda, It is very nice if you read one chapterBhāgavatamdaily. It is very nice. You make it a point to read one chapter daily. That is very nice.
Devotee,No more?,Prabhupāda," No, if you can do more, that's all right. Just like I ask everybody to chant 16 rounds. But if you can chant 1600 rounds, then who prohibits you? You can do that. But we should make a regulation of our life, that ""So many times I chant. One chapter I shall read. I shall go to the temple at this time."" In this way we must have routine work. Then we'll get practiced automatically. Yes. And Gosvāmīs, the Six Gosvāmīs, they were following routine work. Even they...Sāṅkhyā-pūrvaka-nāma-gāna-natibhiḥ.They were doing regularly counting. Just like you are counting sixteen rounds. Not only chanting in that counting, but they were offering obeisances also by counting, that ""Hundred times I shall offer my obeisances."" You see? This is regular routine. Yes."
TamālaKṛṣṇa,"Swamiji, can you tell me about what you said, going through the spiritual master, not directly toKṛṣṇa, through the spiritual master.",Prabhupāda, Yes.
TamālaKṛṣṇa,Can you just tell me something about it?,Prabhupāda," Spiritual master is the representative of God, orKṛṣṇa. Just like if you work in some office, so there is one head man, representative of the proprietor of the company. You have to work under him. If you satisfy that person who is in charge of that department, that means you are satisfying the proprietor of the company. Is it clear? And he can give you direction how to work nicely because he's experienced. The boss. So spiritual master is external manifestation of God. God is within and without. Within, He is Supersoul. He will give you... If you are sincere, He will give you good counsel, ""You do like this."" You'll get dictation from within. That requires advancement of spiritual life. Then you get from within dictation. So God is helping from within and without. Within, asParamātmā, and without as spiritual master. Both ways. As soon as you are sincere, then God will send you to somebody who is Hisbona fidespiritual representative. And if you take help from him, and help within and without... Just like a person going, or a boy going to a school, he's getting training in the school as well as home, both sides. Then his chance is very good. So we have to take both wise: from inside, from outside. You are doing some things in the service of the Lord. How you'll know that you are doing it properly or improperly? This you will know from the spiritual master. If he says, ""It is all right,"" then it is all right. If he says, ""It is not good,"" then it is not good. Just like the same way. The officer in charge, if he is satisfied (with) your work, that means you have satisfied the government or the supreme company, arranger, with whom you have no direct connection.Yasyaprasādādbhagavat-prasādo **.Therefore it is said that if you satisfy your spiritual master, that means you have satisfiedKṛṣṇa. Andyasyaprasādādnagatiḥkuto 'pi.And if you have not satisfied your spiritual master, then you must know that you are, what is called, there is no certainty about your whereabouts, what you are doing.Nagatiḥkuto 'pi.Therefore,dhyāyanstuvaṁstasyayaśastri-sandhyaṁvandeguroḥśrī-caraṇāravindam.So spiritual master is necessary and his direction is necessary. That is the system of disciple succession. In theBhagavad-gītāalso,Arjunais surrendering. He was Kṛṣṇa's friend. Why he surrendered himself, ""I am your disciple."" You see in theBhagavad-gītā.He had no necessity. He was personal friend, talking, sitting, eating together. Still, he acceptedKṛṣṇaas spiritual master. So that is the way. There is a system to understand. It is specifically mentioned,śiṣyaste'ham.""I am your disciple now.""Śiṣyaste'haṁśādhimāṁprapannam[Bg.2.7].""You kindly instruct me."" And then He began teachingBhagavad-gītā.Unless one becomes aśiṣya,or disciple, it is prohibited, not to instruct. Not to inst... That instruction is useless. That is the system. We are instructing in the class because there are few disciples who have taken vow to learn from me. Otherwise, I have no business to teach the public. The public may come. But actual interest is to teach my disciples. But that is secondary. For the public, secondary. But real business is to teach the disciples. Just likeŚrīmad-Bhāgavatamwas meant forParīkṣitMahārāja, Śukadeva Gosvāmī's disciple. But there were many others present. They also heard. Yes?"
Gargamuni,"Well, how can we begin to serve you so that you'll be pleased?",Prabhupāda, (laughs) That I shall tell you later on. (laughter) Do you think I am not pleased?
Gargamuni,I don't know.,Prabhupāda," Oh, you must know it. How can you say that I am not pleased? How you know it that I am not pleased?"
Gargamuni,"Well, we cause you so much anxiety and everything.",Prabhupāda, Huh?
Gargamuni,We cause you so much anxiety due to our faults.,Prabhupāda," Therefore I am pleased with you. Why I have given up all my anxieties of the sons and daughters who is born from my body, and why I am taking and transferring... (end)"
Girl,I didn't check. I just poured it in.,Prabhupāda, You check after giving it? This is not...
Girl,How can I distin...?,Prabhupāda, How is that? Eh?
Girl,I didn't know.,Prabhupāda, Yes?
Girl,It's my fault because I wasn't conscious of what I was doing.,Prabhupāda, It is your fault but is it grievous fault that you put something instead of something?
Girl,What can I do?,Prabhupāda, Eh?
Girl,What can I do now?,Prabhupāda, How it was done? What is that thing you put?
Girl,Salt.,Prabhupāda, Salt?
Girl,Yes. It tastes like it.,Prabhupāda," Tastes like. You know that it is..., that was salt?"
Girl,"Well, I didn't know.",Prabhupāda, So somebody responsible should be in charge. That way instead of salt something may be put. So many people cooking is going on. All right.HareKṛṣṇa. (end)
Mr.Murti,(inaudible),Prabhupāda, Thank you. (chuckling) So any particular question?
Rukmiṇī,On the picture today that you gave Jadurani a picture of ŚrīViṣṇu. There is a foot on His chest. We didn't know what that was... there was a little footprint.,Prabhupāda," There are some special marks on the chest ofViṣṇuby which inVaikuṇṭhaHe is known that He is the Supreme Personality of Godhead. Otherwise, inVaikuṇṭha, everyone has got the same feature likeViṣṇu. Just like if President Johnson comes here as a gentleman, you'll not, nobody will recognize him whether he's president or not unless he shows his special mark. Is it not? All government officers, big officers, they have got within the coat one, some mark. So far I know. So similarly, inVaikuṇṭhathe inhabitants, they gotsvarūpa.Their form is exactly likeViṣṇu. There is no difference. When the Viṣṇudūta came to takeAjamilafrom the hands ofYamadūta. They were four-handed withśankha-cakra-gadā-padmaasViṣṇu, the lotus flower, this disc, and the club, and the conchshell. There is no difference in the body. Simply by that special mark, some special hair on the chest and there isBhṛgu, I mean to say, sole, sole, a mark of the feet ofBhṛguMuni. So by some special marks one can recognize He isViṣṇu. Otherwise, from bodily features and from dress and from ornaments, there is no distinction betweenViṣṇuand His devotees inVaikuṇṭha. They're all four-handed.Svarūpasāyujyasālokyasārṣṭi.They have got equal, I mean to say, situation of prosperity, wealthy, equally, almost equally powerful. So practically there is no difference betweenViṣṇuandViṣṇu-bhakta. In Kṛṣṇaloka also. OnlyKṛṣṇais little blackish. Otherwise there is no... In the Kṛṣṇaloka they are two-handed, and Viṣṇuloka they are four-handed. All the Vaikuṇṭhas, the residents, they are four-handed. You want four-hand or two-hand? (laughter) Mr.Murti? What do you want? Four hands?"
Mr.Murti,Two hands more thanKṛṣṇa.,Prabhupāda," Yes. In this universe onlyBrahmāhas got four hands. Nobody within this universe. AndViṣṇualso. In thisbrahmāṇḍa,in this universe, there is a planet where the ocean is of milk. Here, just like salted water. There are many oceans. Ocean of oil, ocean of ghee, ocean of milk. The ocean of oil, you have got experience in this planet. Within the earth you are getting some... Your civilization depending, your motor car civilization is depending on that ocean of oil. You are getting oil and lavishly spending it. Stock is supplied by God. Your material advancement will be finished if the stock is not supplied by the Lord. So these foolish men, they do not know. They think that ""Without God we can live."" Who has created the ocean of petroleum within the earth? Is it possible for human being? (laughter)"
Haṁsadūta,"Someone has said that thedhotī,thedhotīthat thebrahmacārīswear, is the dress that's worn inVaikuṇṭha. Is that correct?",Prabhupāda," Just seeViṣṇu. He has no coat-pant. Here isViṣṇu. OrKṛṣṇa, He has no dress. He is alsobarebody. Only Rādhārāṇī is covered. In India also, still, the covering of the body is only for woman, but men, this, practically onedhotīis sufficient. Sometimeslaṅgota,the underwear.Laṅgota,underwear. What is that?"
Nanda-kiśora,Swami? What doesNanda-kiśoramean?,Prabhupāda," Nanda-kiśora,kiśorameans a boy."
Nanda-kiśora,Boy?,Prabhupāda, The transcendental boy ofNandaMahārāja.
Devotees,Oh!,Prabhupāda, Yes.
Madhusudana,"How is the lotus a weapon? They're all weapons. All the symbols in Viṣṇu's hand, are, all the symbols in Viṣṇu's hand are weapons. How is the lotus a weapon?",Prabhupāda," Lotus is blessing. And that disc and club is for punishing.Viṣṇuhas to see two ways because He's the Lord. So, as it is said in theBhagavad-gītā,paritrāṇāyasādhūnāṁvināśāyacaduṣkṛtām[Bg.4.8].Just like the state. State is meant for punishing the criminals and giving protection to the law-abiding citizen. Wherefrom this idea is taken? It is taken fromViṣṇu. Everything. Because He is the supreme maintainer. So everything is required for maintaining. So thisgada,the club, and the disc is for punishing the disobedient, the demons, or those who are harassing devotees. To punish them theViṣṇu-cakrais there. Just likeMahārājaAmbarīṣa, he was harassed by DurvāsāMuni, andViṣṇu-cakrapunished him sufficiently.MahārājaDurvāsā...MahārājaAmbarīṣawas a great king, but a great devotee at the same time. Because he waskṣatriyaand householder, DurvāsāMuni, he was envious. DurvāsāMuniwasbrāhmaṇaand a greatyogi. So he could not tolerate that a householder king... King is supposed to be dealing in politics, economics. Therefore, according to social position, he is lesser than thebrāhmaṇabecause they are simply engaged in the matter of transcendental advancement of life. But a devotee is above thebrāhmaṇas.That is the position of devotee. Here, the highest qualitative position is to be situated in the modes of goodness or to acquire the qualities ofbrāhmaṇa,in this material world. Truthfulness, controlling the senses, controlling the mind, simplicity and knowledge, faith in God, there are so many qualifications which makes a person as recognizedbrāhmaṇa.But a devotee, never mind whether he'sbrāhmaṇaor acaṇḍāla,he automatically develop all these qualities.Yasyāsti bhaktir bhagavatyakiñcanā[SB5.18.12].Anyone who has unflinching devotional faith in God, he has all the good qualities. I've several times narrated the story of that hunter. He was animal killer and he used to enjoy by killing the animal half. But when he became a devotee, he was not prepared to kill even an ant. Who taught him? Nobody taught him but he was simply chantingHareKṛṣṇa. That's all. So if you actually making progress in devotional service, you are constantly in touch with the purest.Kṛṣṇais the purest.Bhagavad-gītā,it is said,paraṁbrahmaparaṁdhamapavitraṁparamaṁbhavān[Bg.10.12].""You are theparaṁbrahma,SupremeBrahman.""Brahman, every living entity isBrahmanbut He isparaṁbrahma,the leader of theBrahman. Just like the president is the first citizen of the state. Similarly,Kṛṣṇais also a living entity, but supreme living entity. Just like the first citizen. So similarly, every living entity isBrahman, butparaṁbrahmais one. That isKṛṣṇa. And therefore in theBrahma-saṁhitāit is confirmed,īśvaraḥparamaḥkrsnaḥ[Bs. 5.1].Kṛṣṇais... Everyoneīśvara,more or less controller. Lord Śiva, LordBrahmā,Indra,Varuṇa,Vāyu,Candra,Sūrya. There are so many. They're all demigods. Say, almost God. But they are not Supreme God. Supreme God is one. Sometimes people who do not know the purpose ofVedas,they say, ""The Hindus are worshiper of many gods."" That is nonsense. Actually those who are followers ofVedas,they worshipKṛṣṇa, onlyKṛṣṇaorViṣṇu.Tadviṣṇoḥparamaṁpadaṁ. Ṛgmantra.Tadviṣṇoḥparamaṁpadaṁsadāpaśyantisūrayaḥ.And in theBhagavad-gītāit is said,vedaiścasarvairahamevavedyam[Bg.15.15].What is the purpose ofVedas?To understandKṛṣṇa. One who does not understandKṛṣṇa, hisVedāntaphilosophy is nonsense. However you may advertise that ""I am Vedāntist,"" is apakkanonsense. Because he has not attained the perfection of Vedic knowledge. The perfection of Vedic knowledge is to knowKṛṣṇa, and that is also confirmed in theBhagavad-gītā:Bahūnāṁjanmanāmante[Bg.7.19].After many, many births.Jñānavān.Jñānavānmeans Vedāntist. Not... They have made it, that Vedāntist... Vedāntist, Vaiṣṇavas, they are also Vedāntist, but it has become a common sense, a common affair that the impersonalists, they are called Vedāntists. Because, due to Śaṅkarācārya's propaganda, they have made their position as Vedāntists. But common men, they do not know that the Vaiṣṇavas are the best Vedāntists. We shall discussVedāntahere also.Vedānta... InRāmānuja-bhāṣyathere is... Perhaps you know, in your country. There isRāmānuja-bhāṣyaVedānta. Madhvācārya, he has also writtenVedānta-bhāṣya.Not only Śaṅkarācārya. But because the Vaiṣṇavas, they knowbhāṣyambrahma-sūtrāṇām**. TheŚrīmad-Bhāgavatamis the actual explanation ofVedānta. So therefore they take more interest inŚrīmad-Bhāgavatambecause that is the actual explanation ofVedānta. Just like in theVedānta-sūtra,the, what isBrahman, Absolute Truth.Athātobrahmajijñāsā.The inquiry is, ""What isBrahman, Absolute Truth?"" TheVedānta-sūtraanswers... TheVedānta-sūtrais made like that, questions and answers like that. So answer isjanmādyasyayataḥ[SB1.1.1].""The Absolute Truth is that from whom everything is emanating."" He is the ultimate fountainhead of everything. Just now we tried to explain that the state functions protecting the good citizens and punishing the criminals. That should be the state business. Wherefrom this idea came? The law and... What is called? The law and order department or what is that?"
