Question Speaker,Question Text,Answer Speaker,Answer Text
Allen Ginsberg,"Actually, what I got into, you were saying so everything stands on ""My,"" Kṛṣṇa's personality. And then there was a twist there: ""But I am empty."" Is that what you said before? Do you remember? Just about eight minutes ago you concluded the description of the sun and the...",Prabhupāda," Sun globe, sun, and the sunshine."
Kīrtanānanda; Allen Ginsberg,"Kṛṣṇasays that ""Everything is depending on Me and still I am not in them.""; Oh, oh. I guess that's where I... ""Everything is depending on Me, yet I am not in them.""",Prabhupāda," ""Everything is resting on Me. But I am not there."" Just like this isKṛṣṇa. WithoutKṛṣṇait has no existence. But it is notKṛṣṇa. The pantheist will say ""I... Everything isKṛṣṇa, then I worship this."""
Allen Ginsberg,So who isKṛṣṇa?,Prabhupāda, KṛṣṇaisKṛṣṇa.
Allen Ginsberg,If He's not apprehensible by senses...,Prabhupāda," No. Why not senses? This isKṛṣṇa. This isKṛṣṇa. But at the same time... This is the philosophy of LordCaitanya.Acintya-bhedābheda,simultaneously one and different. That is very easy... Suppose this is gold. But this gold is not the gold mine. There is a difference. It is gold. Similarly, everything isKṛṣṇa, but still is different fromKṛṣṇa. That is explained inViṣṇuPurāṇa.Parasyabrahmaṇaḥśaktiḥsarvedamakhilaṁjagat.Eka-sthānīsthitasyajñerjyotsnāvistāriṇīyathā,parasyabrahmaṇaḥśaktiḥsarvedamakhilaṁjagat.The same example, that the sun. The sun is, sun-god is situated one place, but it is fiery. Blazing fire. Its heat and light is expanded. You see practically, the heat and light. So whatever this material existence is the sunlight, sunshine. Everything existing on sunshine. It is scientific. Your electricity, your this, that, whatever you take it is all sunshine. All these planets are moving, rotating on the sunshine. Heat. If heat is taken away immediately whole thing spoiled. Therefore everything is resting on the energy of the sunshine, but if you say that ""Then let me find out the sun-god in the sunshine,"" that you will have to go there."
Hayagrīva,"The Christians, I think they say, God is more than His creation.",Prabhupāda, Yes. Certainly. This creation is only a part of manifestation of His energy. Insignificant. That is explained inBhagavad-gītā.
Allen Ginsberg,"Well, the chanting is easy. The chanting is easy. That's true.",Prabhupāda," Yes. Let them do that. Don't come to the ritualistic performances. Let them chant as far as possible and see the result. This is the easiest method of transcendental realization. But if you recommend, oh, that will be accepted by many. And if we..."
Allen Ginsberg,"No. You see, I recommend it quite a bit but it isn't accepted by very many.",Prabhupāda," (laughs) No, no. Then I say, you are American. You are popular leader. You have got some voice. I am a foreigner. I have come new, and who cares for me? That is a different thing."
Allen Ginsberg,"Well, that's why I'm asking you very specifically cause I've been chanting for five years, six years. Since 1963, '64. Since the fall of 1963, I've been chantingHareKṛṣṇaon this continent, beginning in Vancouver in July, 1963. And I am finding there is a limitation to how many people will join that chant. Or I have found a limitation. Part of the limitation is the fact that it is strange and new to people here.",Prabhupāda, But there is no loss.
Allen Ginsberg,"As it becomes familiar, it might spread a little. Part of the limitation is just a natural resentment or resistance, people wanting a prayer in their own tongue, in their own language. I don't know... So that is, for the same reason an American Indian chant would not take hold or even a Latin chant would not take universal hold.",Prabhupāda," Mantra,mantrameans..."
Allen Ginsberg,"So that many of us will say, ""Is it possible to find an Americanmantra?""",Prabhupāda, Mantrameans the transcendental sound. You see. Just likeoṁkāra.
Allen Ginsberg,"So you think the very nature of the sound... Okay, but now,oṁis an absolutely natural sound from the throat to the mouth. And yet evenoṁ,natural as it is, sounds foreign.",Prabhupāda, Yes. Therefore it is apraṇāma.It is accepted.
Allen Ginsberg,That also sounds foreign here. It's hard to get people to sayauṁeven. 'Cause I tried in Chicago withauṁand withHareKṛṣṇa.,Prabhupāda, But there is no other alternative.
Allen Ginsberg,"Well, we haven't been able to think of one yet, I'll tell you that.",Prabhupāda, That is his misfortune if they...
Lady; Allen Ginsberg; Hayagrīva; Kīrtanānanda; Allen Ginsberg; Hayagrīva; Allen Ginsberg,"(Bengali); Many people here have said, ""What about 'God, God, God, God, God.' "" But that doesn't have the right...; No, that doesn't make it.; You couldn't do it(?) that for five minutes.; Well, you could almost do, ""Amen, Amen.""; That's not English.; Yes, that's not English. (laughter) But it's known in English. And maybeKṛṣṇacould become as well known as God and Amen, or something like that.",Prabhupāda," No,Kṛṣṇais in English dictionary."
Allen Ginsberg,Yes. Now in the dictionary?,Prabhupāda, Yes.
Allen Ginsberg; Hayagrīva,He infiltrated the dictionary.; Although as an incarnation ofViṣṇu.,Prabhupāda, English dictionary.
Allen Ginsberg; Hayagrīva; Lady,"Let's see what it says in the English dictionary.; ""Eighth incarnation ofViṣṇu.""; (Bengali)",Prabhupāda, Just see. Here is an intelligent statement. Yes. You can explain in English.
Lady; Allen Ginsberg; Lady,"I was saying that when the question of knowledge came and Western education was high tops, still it is, thousands of people from other countries like Africa, and India, and all the people, they deliberately learned from the beginning, from childhood, to speak. They started sayingMamaandPapaand they're still coming to the higher education in these universities. And when the question comes of ultimate knowledge and the Western civilization doesn't want to take, only the word, just the word, so that is their limitation. They don't want to know.; Okay. Partly the fear of that, is that the study ofKṛṣṇaconsciousness will become as bureaucratized in America as the examination system has made the study of higher Western knowledge in India.; Yes. But the only difference is that thatKṛṣṇaconsciousness is unlimited. It glorifies the Lord and it makes unlimited. But this education is just limited. See? Limited education other people can come and learn and take their language of their own mother tongue.",Prabhupāda, Takes so much trouble. Simply for uttering oneKṛṣṇathey are not prepared to take little trouble?
Lady,"Liberation. The whole life, whole human life liberation. They don't take, they don't like to take because it is started in Indian language. Or it is not Indian language.Kṛṣṇais not Indian language.Oṁisn't Indian language. It's the ultimate God's name.",Prabhupāda, NeitherKṛṣṇasays that He is Indian.
Lady,"He didn't say, ""I am Indian."" It's universal. It's not Indian.Oṁis not Indian. Anybody who wants to knowoṁ,how to sayoṁ.See?",Prabhupāda, So you have to accept little trouble to utterKṛṣṇa. That's all.
Allen Ginsberg,I'm willing.,Prabhupāda, We have taken so much trouble for understanding English language. And simply for our transcendental understanding...
Allen Ginsberg; Lady,"It's next toSantaClaus in the dictionary.; Yes,KṛṣṇaisSantaClaus. He is everything. He gives everything.",Prabhupāda, Very good.
Allen Ginsberg,Have you seen that? Kṛṣṇa's next to Kris Kringle.,Prabhupāda," What is the, what is theKṛṣṇa? What does he say?"
Kīrtanānanda; Hayagrīva; Lady,"""Eighth avatar ofViṣṇu. From SanskritKṛṣṇa. The widespread form ofHinduworship.""; That's the usual. That's in all the dictionaries.; Only the Indian people are lucky that still they are holding it tight. That's all. Now other people have forgotten. But it's all universal.",Prabhupāda," Kṛṣṇasaid in theBhagavad-gītāthat ""I am the father of everyone.""Sarva-yoniṣukaunteya[Bg.14.4].Not only human being. All animals, trees, plants. SoKṛṣṇais universal."
Allen Ginsberg,"Now, for instance, in America many of the black people are tending toward Allah and toward Muhammadanism.",Prabhupāda," That is another thing. Somebody is inclined to some thing, somebody is inclined to some thing. That is going on, and it will go on till the end of the creation. (laughing)"
Allen Ginsberg,Yuga.,Prabhupāda," But our process is that, you are searching after the center, here is the center. That is our proposal."
Allen Ginsberg,But what do you do when different religious groups claim to be the center? What do you do when different religious groups...,Prabhupāda," No, we welcome every religion. We don't decry any religion. Our point is the love of Godhead. OrKṛṣṇais love, all-attractive. So we want to be attracted byKṛṣṇa. Just like a magnetic force and iron. Unless iron is rusty, it is automatically attracted by the magnetic force. Similarly, we are contaminated by material coverings. So we are trying to make it rustless so that immediately we shall be attracted. This is the program.Kṛṣṇais all-attractive. That is a fact. And we are attracted. But being covered with this rust, we are, instead of being attracted byKṛṣṇa, we are being attracted bymāyā.This is our whole program. So our central program is how to loveKṛṣṇa, or how to love God. So we want to see... That is theBhāgavatadefinition, that how much you have enhanced your love of God. You callKṛṣṇaor something else, that doesn't matter.Phalenaparicīyate.The result. Your religious principle, what is the result? Are you enhancing your love for God or dog? That we want to see. If you are enhancing your love for God, it is all right. We don't say anything. But if... People should learn how to love. That is the perfection of life. That we are teaching."
Allen Ginsberg,"If you're identifying love, however, with thesabdaKṛṣṇa, what of those people who identify love with thesabdaAllah?",Prabhupāda," If thatśabda,of course, identifies with God, we have no objection. ThatCaitanyaMahāprabhusaid thatnāmnāmakāribahudhānija-sarva-śaktis.God has many names. God is attractive, His name is also attractive, because He's not different from His name. If you have got exactly the same attractive name, we have no objection. We simply say, ""You chant God's name, holy name."" Then you become purified. That is our program. We don't say that you change your Christianity. No. We don't say. If you have got a nice name, all-attractive name, in your scripture-don't manufacture but authorized—then you chant that. We simply request, ""You chant."""
Allen Ginsberg,"Well, then how would you adapt theKṛṣṇachanting to Christianity? By seeingKṛṣṇaas Christ or Christ asKṛṣṇaand sounding Christ's image in Kṛṣṇa's name?",Prabhupāda," Kṛṣṇa, Christ... Of course, this question was several times put to me. Christ says that ""I am son of God."" AndKṛṣṇasays ""I am God."" So there is no difference. Son of God and God, we respect everyone. If I respect your father, I respect you also. Do you mean to say if I disrespect your father, you'll be pleased upon me? No. That is our philosophy. SoCaitanyaMahāprabhusays that I am servant of the servant of the servant of the servant of the servant ofKṛṣṇa[Cc.Madhya13.80]. So if anyone lovesKṛṣṇa, he must love Lord Jesus Christ also. And if one perfectly loves Jesus Christ he must loveKṛṣṇa. If he says, ""Why shall I loveKṛṣṇa? I shall love Jesus Christ,"" then he has no knowledge. And if one says, ""Why shall I love Jesus Christ? I shall love..."", then he has also no knowledge. If one understandsKṛṣṇa, then he will understand Jesus Christ. If one understands Jesus Christ, you'll understandKṛṣṇa."
Allen Ginsberg,"Well, then do you think that theHareKṛṣṇachant could serve as an intermediary to link the religious tendencies of, both of Christianity and Muslim religions?",Prabhupāda," Yes. Yes. Any religion. Any religion. If he's serious about religion. If he takes the religion as a scapegoat, that is different thing. If he wants to understand religion and if he takes seriously to religion, then he will understand. We want serious persons. Now, according toŚrīmad-Bhāgavatam,religion means creation of the laws of God.Dharmaṁtusakṣādbhagavat-praṇītam[SB6.3.19].Laws of God. Who will deny it? Who will deny it? Any religion, Christian, Muhammadan or any. Who can deny that religion is the laws of God? Simple explanation. If you ask what is meant by religion, religion is laws of God. That's all. And if you want to know what is God, that is also replied. ""The original source of everything."" So one should try to understand in this way. But if one wants to remain in his compact ideas and does not want to go further, then it is very difficult. He should be open-minded and appreciating. Then everything is all right. We say,CaitanyaMahāprabhusays, it is not that you are necessarily to chantKṛṣṇa, but if you have no suitable name, then chantKṛṣṇa. Why do you make differentiate. Every name is the same."
Allen Ginsberg,"So if you have no other suitable name, chantKṛṣṇa.",Prabhupāda, Yes. ChantKṛṣṇa.
Allen Ginsberg,That's Caitanya's...?,Prabhupāda," Yes, yes."
Allen Ginsberg,Did He feel there were other suitable names? Did He feel or did He think that...,Prabhupāda," Yes. He said many thousand millions names there are. But if you are serious about God, then... You may have many names by your friends, but any name will do."
Allen Ginsberg,"Okay. So the problem I was posing before is, which I leave open, I don't know. What is the most attractive and suitable name here in this material country?",Prabhupāda," Now, take for example the Muhammadan name Allah. Allah means the greatest. So God is greatest. So that greatest conception is thisBrahmanconception. And so far Christian, I don't think they have got any particular name. They say God."
Allen Ginsberg,"Yes. Lord, God. That is the basic one.",Prabhupāda, Controller. God means controller. Is it not?
Allen Ginsberg; Hayagrīva,What is the etymology of God? Do you know?; I don't know.,Prabhupāda, God is the equivalent ofīśvara. Īśvarameans controller.
Allen Ginsberg,"Then the Jews, which were my background, had a prohibition...",Prabhupāda, Jehovah.
Allen Ginsberg; Hayagrīva; Allen Ginsberg; Lady,"They had Jehovah, but they had a prohibition of pronouncing the highest names. 'Cause they felt that God was imageless, and therefore should not be pronounced or painted. My background is I guess what would be impersonalist.; The Jews are personalist.; Well, what are they? Impersonalists or personalists?; Impersonalists. They believe in just the Absolute. That's all.",Prabhupāda, That was the difference in Jesus Christ. He was a personalist.
Devotee; Allen Ginsberg,Hasidics are personal.; Yes. They put their devotion into the rabbi or theguru. The ancient Hebrew... I guess you must know about that. The ancient Hebrew teaching was that the name of God should never be pronounced.,Prabhupāda, Now we come to know...
Allen Ginsberg,J-H-V-H.,Prabhupāda, Anyway why God's name...
Allen Ginsberg,Pictures should not be made. Pictures should not be made. Because it would limit God to human conception.,Prabhupāda," That is another thing. That is in Muhammadan. That means God is not material. That is the idea. Because here the idea is when I make something image or picture, that is material. So there is a prohibition of accepting God as material. But if you go to a higher stage, then you'll understand that if God is everything then there is no material. That isVaiṣṇavaphilosophy. If God is everything, then where is material? He is spiritual. Material means when you cannot understand God. That is material. Everything is sky. When it is covered by cloud we call it is cloudy. Similarly, cloud has no existence. It comes only to cover sometimes, but the sky is eternal. Similarly, God is eternal. When you are covered by somemāyā,you cannot see, you cannot understand God, that is material. So any philosophy which does not help understanding God, that is material. That is material. Otherwise, there is no material. Where is material if God is everything?Sarvamkhalvidambrahma.You see?"
Hayagrīva,All spirits.,Prabhupāda," All spirit. All the sky. Everywhere is sky, but when it's covered it is called cloud. Similarly when God is covered by some nonsense ideas, then it is material. Otherwise, there is no material. Therefore those who are too much absorbed in materialistic way, there is a restriction but don't attempt. Because he will be to think that God's name is just like my son's name my daughter's name. Therefore that restriction."
Ranadhir; Hayagrīva; Allen Ginsberg,"I think when they worship, they're allowed to say God's name, it's just when they're not, when they're talking about Him outside the temple that they have to use different name.; We've got to tune some harmoniums.; Yes, we have to work on the music boxes. We have to start material preparations for the evening.",Prabhupāda," That is not material. (laughter) We have no,..."
Allen Ginsberg,Aśabdapreparation.,Prabhupāda," Yes,śabdais originally spi...,śabda-brahman."
Allen Ginsberg,We have to find out if all the...,Prabhupāda," Simply you have to understand that there is nothing material, everything is spiritual. That is required. So long you do not understand that everything is spiritual only, that is our defect."
Allen Ginsberg,"Well, then even sexuality is spiritual?",Prabhupāda," Yes, that is said in theBhagavad-gītā:if you use sexuality for giving birth to nice child, not cats and dogs, that is spiritual. But people are using sexuality for other purposes. That is stated in theBhagavad-gītā,śāstra-viruddho(?), according to religious ritualistic way, if one, when one uses sex life that is (indistinct). That is, therefore in the, according to Vedic system, therefore, having sex life with wife, there is a great ceremony which is calledgarbhādhānaceremony, and all the highercaste,brāhmaṇa, kṣatriyas,śūdra,ervaiśyasespecially, they are to observe ten kinds of reformative process. The first process is while giving birth to a child there is a great ceremony,garbhādhāna.So it is not a secret. To beget nice child, then there will be nice population, then there will be peace and prosperity. If you beget cats and dogs, how can you expect peace and prosperity? Living in the same dog society, cat society then there will be peace? No."
Allen Ginsberg,I would rather dogs and cats being Kṛṣṇa's though.,Prabhupāda, Hum?
Allen Ginsberg,But if all matter isKṛṣṇa?,Prabhupāda," That's all right, but whenKṛṣṇais covered, whenKṛṣṇais covered,nāhaṁprakāśaḥsarvasyayoga-māyā-samāvṛtaḥ[Bg.7.25].The same example: cloud is sunshine, but it covers. What is the cloud? This is creation of the sunshine as these trees and everything is creation of sunshine. Cloud is also. Mind is also Kṛṣṇa's. In that sense Mind is alsoKṛṣṇa, but it has a covering spirit."
Lady; Hayagrīva,"The element, its quality.; It's a whole spirit but in certain circumstances we tend to forget this...",Prabhupāda," Material energy that's said byKṛṣṇaaparā,inferior energy.Bhūmir āpo, bhūmir āpo analo, prakṛtir mebhinnāaṣṭadhā. Apareyam itastuviddhimeprakṛtiṁparā[Bg.7.5].So material energy is the covering energy, is alsoKṛṣṇa. Just like police department is also government, but it is not very convenient because putting under police department. (laughter) That is also government department. For government the university department and the police are equally important. They are spending equally, are taking care of both the, but for us, ""Oh, police department horrible."" This man is under police department, police custody, and that man is in education."
Lady,That's much better.,Prabhupāda," But when you go to the government state, they are equally important. They are distributing the finance everywhere. So similarly either you take material energy or spiritual energy or marginal energy, all energy of God's, Kṛṣṇa's, but they are acting differently. So, so far I am marginal energy, if I am under the control of the material energy, that is my misfortune. But if I am controlled by the spiritual energy, that is my fortune. Therefore in theBhagavad-gītāit is said,mahātmānastumāṁpārthadaivīṁprakṛtimāśritāḥ[Bg.9.13].They take shelter of the spiritual energy. They aremahātmā,and what is their symptom:bhajantyananyamanaso,simply engaged in devotional service. That, that is required."
Devotees,Haribol!,Prabhupāda, HareKṛṣṇa. (end)
Allen Ginsberg,Except that it would mean concentrating all my consciousness on the one single image ofKṛṣṇa.,Prabhupāda, Not image.
Allen Ginsberg,Or the one single thought or name or feeling or awareness.,Prabhupāda," That we have got varieties of duties. Just like we are. You have seen all these boys. They are always engaged. Always engaged. Similarly, everywhere they are always engaged inKṛṣṇa. We want extra time to work forKṛṣṇa. The twenty-four hours is not sufficient for us. Yes. Then we shall see that we are sleeping, wasting time. Gosvāmīs, they used to sleep for one half-hour only. That also sometimes forgot."
Allen Ginsberg,To dream?,Prabhupāda," No. They were always engaged. Volumes of books they have written. When there is no writing, chanting, dancing, talking, and like that—engaged inKṛṣṇaalways. That we have been taught by ourGuruMahārāja, twenty-four hours engagement withKṛṣṇa. Somāyāhas no scope to enter in our mind. She always remains aloof: ""Oh, here is fire. I cannot touch.""Bhaktimukulitāñ... Bhaktistvayisthiratarāyadibhagavansyāddaivenaphalatidivya-kiśora-mūrtiḥ, muktir mukulitāñjaliḥsevate'smān.BilvamaṅgalaṬhākura, a great devotee, he executed devotional service for seven hundred years. He lived for seven hundred years inVṛndāvana. That picture you have seen, Sūradāsa? Yes."
Allen Ginsberg,"Sūradāsa, the poet.",Prabhupāda, Yes. He is known as Sūradāsa.
Allen Ginsberg,"Teacher ofTulasīDāsa, or student ofTulasīDāsa.",Prabhupāda," He may be different, butBilvamaṅgalaṬhākura, he was also blind. He made himself blind. You know the story ofBilvamaṅgala?"
