Question Speaker,Question Text,Answer Speaker,Answer Text
Yogeśvara,"Yogeśvara : He says it's a moral question. He already has his guru , and his guru has died. He's gone over to the other side, and he can't change gurus.",Prabhupāda," But there is no question of changing guru . If he is actually searching after the truth, then why he is denying the truth when it is delivered? (French)"
Yogeśvara; Dr. Sallaz,"Yogeśvara : He would have to be sure that it was the actual highest truth.; The real truth, eternal truth. Because you see...",Prabhupāda, That is... That we are... (French)
Yogeśvara,"Yogeśvara : This is what the conclusion we came to yesterday with that other guest, that he says they have also find truths in China, they have also found truths in other scriptures.",Prabhupāda, So what is that truth? (French) [break] ...is that reality?
Yogeśvara,"Yogeśvara : He says he himself, he doesn't have the words to describe it.",Prabhupāda," If you cannot describe the reality, then you have not received the reality. (French) [break] That means, as soon as you say you cannot describe, then you have no idea what is the reality."
Yogeśvara,Yogeśvara : He's willing to admit that.,Prabhupāda," So if you are actually searching after reality, why not, if reality is available from other source, why don't you take it? [break]"
Yogeśvara,"Yogeśvara : Because certainly his members would have some questions they would want to ask you, and perhaps even you might have some questions that you would want to ask his members.",Prabhupāda, Very good. We are prepared. (French)
Yogeśvara,Yogeśvara : I think the thing is to make arrangement for such a meeting. Otherwise...,Prabhupāda, Then make arrangement. But our pro... (end)
Prof. Regamay,"Yes. Yes, I have seen. I have read them, but the Bhagavad- gītā I have not yet received.",Prabhupāda, Not yet seen Bhagavad- gītā ?
Guru-gaurāṅga; Prof. Regamay,"Guru - gaurāṅga : He has seen, but he will get today.; And perhaps, some questions I could put to you?",Prabhupāda, Yes.
Prof. Regamay,"But first I would like to express my thanks that you gave me this honor to receive me. So I have different questions because I'm in such a difficult situation that I have many Indian doctrines, and there was some difficulty because I know them only through the books, without (indistinct). And, for instance, one of the first questions I want to put: Viṣṇu Purāṇa , it's very similar and very coincidental to the Śrīmad- Bhāgavatam .",Prabhupāda," Yes. Yes, Viṣṇu Purāṇa ."
Prof. Regamay,"Is that... Practically, can it be considered that it's the same kind of...",Prabhupāda," Yes, Viṣṇu Purāṇa is Vaiṣṇava literature. There are eighteen Purāṇas. Out of eighteen, six are sāttvika , and six are rājasika, and six are tāmasika. The sāttvika Purāṇas, they are Vaiṣṇava literature. Viṣṇu Purāṇa , Brahmāṇḍa Purāṇa , Bhāgavata Purāṇa , Padma Purāṇa ."
Prof. Regamay,"The same... Because I understood through... It is that the problem, that Kṛṣṇa is the original person of divine, but in, by Rāmānuja or Viṣṇu Purāṇa it reverse Viṣṇu is the highest.",Prabhupāda, Kṛṣṇa is Viṣṇu .
Prof. Regamay,And Kṛṣṇa is the avatāra of Viṣṇu .,Prabhupāda, No. Kṛṣṇa is avatārī . You have read Bhagavad- gītā ?
Prof. Regamay,"Yes, of course.",Prabhupāda," Kṛṣṇa says, ahaṁ sarvasya prabhavaḥ . Find out this verse."
Guru-gaurāṅga; Prof. Regamay,"Guru - gaurāṅga :; Yes, I know what it is in the Bhagavad- gītā but, for instance, in the words of Rāmānuja, it is not Kṛṣṇa , but it is Viṣṇu which is the highest form. So this one question, what I had to put that... And also... May I sit down on...? I would be much more...",Prabhupāda," Oh, yes. Give him another pad ."
Prof. Regamay,"Among the avatāras which are described in the second and third book of Śrīmad- Bhāgavatam , there are two questions I have to put. There is Kṛṣṇa Himself, who appears as His own avatāra , and the Kṛṣṇa , the yādava Kṛṣṇa .",Prabhupāda," Kṛṣṇa , when He appears within this material world... That is also in the Bhāgavatam , that He appears as Viṣṇu incarnation. But actually, Kṛṣṇa is the... In the Brahma - saṁhitā it is stated, yasyaika- niśvasita - kālam athāvalambya jīvanti loma -vilajā jagad- aṇḍa - nāthāḥ , viṣṇur mahān sa iha yasya kalā - viśeṣaḥ [Bs. 5.48] . You understand?"
Prof. Regamay,"Yes, I understand.",Prabhupāda," Viṣṇur mahān , Mahā - Viṣṇu , yasya iha kalā -viśeṣo govindam ādi - puruṣaṁ tam ahaṁ bhajāmi . So the Mahā - Viṣṇu , the origin of the material creation... There is Mahā - Viṣṇu in the Causal Ocean. From Him the Garbhodakaśāyī- Viṣṇu enters into each and every universe. Yasyaika- niśvasita - kālam athāvalambya jīvanti loma -vilajā jagad- aṇḍa - nāthāḥ [Bs. 5.48] . So jagad- aṇḍa - nātha is Brahmā . So he is produced on the Garbhodakaśāyī Viṣṇu . And this Garbhodakaśāyī- Viṣṇu is expansion of Mahā - Viṣṇu . And Mahā - Viṣṇu is kalā viśeṣaḥ , partial expansion of Kṛṣṇa . Yasya hi , yasya hi . What is that? You have Brahma - saṁhitā ?"
Devotee; Yogeśvara,You have a copy downstairs.; Yogeśvara : Yasya prabhā prabhavataḥ [Bs. 5.40] .,Prabhupāda," No, that is another. Yasya niśvasita - kālam avalambya . Mahā - Viṣṇu is breathing. So taking advantage of that breathing, innumerable universes are generating. And each universe, there is a superintending deity who is called Brahmā . Yasya hi niśvasita - kālam . Kālam atha avalambya jīvanti loma -vilajā jagad- aṇḍa - nāthāḥ . Many hundreds and millions of Brahmās there are. They live, only taking advantage of the breathing period of Mahā - Viṣṇu . [break] Mahā - Viṣṇu is sub-plenary portion. First Kṛṣṇa , then Balarāma , then Saṅkarṣaṇa , Pradyumna , Aniruddha , Vāsudeva . Vāsudeva , Saṅkarṣaṇa . Then, from Saṅkarṣaṇa , Nārāyaṇa . Then, from Nārāyaṇa , again catur - vyūha , second Saṅkarṣaṇa , Vāsudeva , Aniruddha . And from the second Saṅkarṣaṇa is Mahā - Viṣṇu . And from Mahā - Viṣṇu , Kāraṇodakaśāyī- Viṣṇu . And from Kāraṇodakaśāyī- Viṣṇu , Kṣīrodakaśāyī- Viṣṇu . The Kṣīrodakaśāyī- Viṣṇu is in each universe. He is the Supersoul. And when any incarnation comes within this world, He comes through Kṣīrodakaśāyī- Viṣṇu . In that way, Kṛṣṇa comes through Kṣīrodakaśāyī- Viṣṇu . But this Kṣīrodakaśāyī- Viṣṇu is the expansion of the expansion of Kṛṣṇa ."
Prof. Regamay,"Yes, I see, but...",Prabhupāda, It is like that.
Prof. Regamay,Yādava Kṛṣṇa spoke with Arjuna ...,Prabhupāda, Huh ?
Prof. Regamay,"It was the personal God Himself or it was an incarnation, this Kṛṣṇa which is in Bhagavad- gītā ?",Prabhupāda," Advaitam acyutam anādim ananta - rūpam [Bs. 5.33] . Kṛṣṇa is one. Advaitam acyutam . Infallible. Anādi , He has no cause. Ananta - rūpam . Ananta - rūpam . Advaitam acyutam anādim ananta - rūpam ādyaṁ purāṇa - puruṣam [Bs. 5.33] . He is the origin. Advaitam - acyutam anādim ananta - rūpam ādyaṁ purāṇa - puruṣaṁ nava - yauvanaṁ ca [Bs. 5.33] . Still, He's just a fresh young boy. Govindam ādi - puruṣaṁ tam ahaṁ bhajāmi . So Govinda is the ādi - puruṣam . Aham ādir hi devānām . Find out this verse, aham ādir hi devānām . Rāmānujācārya has also admitted Kṛṣṇa the Supreme. Śaṅkarācārya has admitted in his notes on Bhagavad- gītā , sa bhagavān svayaṁ kṛṣṇaḥ . What is that?"
Prof. Regamay,"Yes. Thank you. Now, I'm still concerned with two of the incarnation which have... Because for me this is the doctrine of personalism and personal highest form of God. Now, among two of the incarnations, there is Kapila and Buddha . And Kapila is practically, finally, the classical Sāṅkhya -ist atheist. How could it be?",Prabhupāda," Yes. This is imitation Kapila , and there is... Original Kapila is Devahūti , son of Devahūti , Kapila ."
Prof. Regamay,It's what we can't find in Bhagavad- gītā with...,Prabhupāda," Śrīmad- Bhāgavatam . So Kapila , this Kapila is atheist Kapila . He's a different Kapila . Original Kapila is the son of Devahūti , son of Kardama Muni and Devahūti . That is described in the Third Canto of Śrīmad- Bhāgavatam . He is incarnation of Kṛṣṇa , God. Kapila . And actually, he enunciated sāṅkhya philosophy. And this sāṅkhya philosophy which is known in Europe amongst the European scholars, that is the atheist Kapila . It is not the original Kapila ."
Prof. Regamay,So that's not a true Kapila .,Prabhupāda, No.
Prof. Regamay,And Buddha ?,Prabhupāda," Buddha is śaktyāveśa- avatāra . We accept Lord Jesus Christ also, śaktyāveśa- avatāra ; Mohammed, śaktyāveśa- avatāra . Śaktyāveśa- avatāra means a living entity especially empowered and he preaches the philosophy on behalf... That is called śaktyāveśa- avatāra . There are different types of avatāras. Guṇāvatāra, manvantarāvatāra, yugāvatāra, līlāvatāra, śaktyāveśāvatāra, like that. They are described in the Caitanya - caritāmṛta . About avatāras. You find out Teachings of Lord Caitanya , avatāras. Innumerable avatāras. Come here. Find out this chapter. Avatāra saṅkhyeyaḥ. It is compared, just like in the river, the waves are flowing. You cannot count, or in the... What is that? Avatāra . Read, read that chapter."
Prof. Regamay,"Yes, I understand.",Prabhupāda," Dīpārcir eva hi daśāntaram abhyupetya dīpāyate vivṛta - hetuḥ [Bs. 5.46] . They are not derived from any other power. They are all Viṣṇu - tattva . Dīpārcir eva hi daśāntaram abhyupetya dīpāyate , yas tādṛg eva ca viṣṇu - tayā vibhāti [Bs. 5.46] . This is the expansion of Viṣṇu , Viṣṇu - tayā . Govindam ādi - puruṣam . He is always referring, Govinda , Kṛṣṇa . Govindam ādi - puruṣaṁ tam ahaṁ bhajāmi **."
Prof. Regamay,Yet I still think of this problem why Lord Kṛṣṇa had to have an incarnation like Buddha who was teaching atheist doctrine and no...,Prabhupāda," That is described. I have described in the Śrīmad- Bhāgavatam . Find out, Śrīmad- Bhāgavatam , First Canto, first part."
Prof. Regamay,"I read it in your commentary to Śrīmad- Bhāgavatam that he was, he didn't need to preach the worship of God because He was Himself God.",Prabhupāda, Yes.
Prof. Regamay,But He doesn't say it in the text.,Prabhupāda," That is described in the SB.., sammohāya sura - dviṣām [SB 1.3.24 ]. Sammohāya , just to bewilder the atheist class of men. The atheist class of men, we're advocating ""There is no God."" So He appeared before them... And they were killing animals like anything. So Buddhadeva inaugurated the non-violence. So therefore He is God Himself, and He is teaching, ""There is no God."" This is rather cheating."
Prof. Regamay,"Yes. Not teaching, but cheating.",Prabhupāda," Yes. (laughing) So sometimes... Just like a child does not want to go to school. So the teacher says, ""No, no, you don't require to go to... There is no need. But what do you see in your front?"" ""That's a cow."" ""Now, what is this?"" ""A leg."" ""Then what is next?"" ""Second leg."" ""What is this?"" ""Third leg."" So he is teaching mathematics, but practically, he says, ""You don't require go to school. You just count the legs of the cow, that's all."" It is like that."
Prof. Regamay,Now there are some schools of Buddhists who are worshiping Buddha like a God.,Prabhupāda," Yes, He is God. He is God. They don't accept Buddha as incarnation of God. But from Vedas we understand that He is incarnation of God."
Prof. Regamay,"But he brought to the world the ahiṁsā , but I think ahiṁsā appears already in the Bhagavad- gītā . But there was ahiṁsā also by the Jains.",Prabhupāda," Ahiṁsā , because at that time people were killing animals in the name of yajña . Just like in the Christian world the order is not to kill, but still, they are killing. So this misuse of scriptural injunction is always going on. A class of men there are who abuse the scriptural injunctions and go on with their own motive. So there was a period when people, under the protection of Vedas... Because Vedas, animal sacrifice is recommended for certain purpose, to test the proper chanting of Vedic mantras. The animal was not killed. The animal was put into the fire. Then again it would come out with new life. That is the proper chanting of the Vedic mantras. So for that purpose, animal sacrifice... Just like in biological laboratories, they experiment on the body of animals, frogs, guinea pigs. Similarly, a similar experiment was made, how the Vedic mantra is being properly chanted. The test was that animal should be put into the fire, and if the Vedic mantras were properly being chanted, then that animal would come with a new body. So an old cow or bull was put and he would come with fresh body. That was the purpose. Now later on, they began to eat meat by so-called animal sacrifice. In that period Lord Buddha appeared. About him it is, description is there, sadaya - hṛdaya darśita - paśu -ghātam. The Lord became compassionate on the animals, as they were being killed unnecessarily. So Buddha , Lord Buddha , his only mission was to stop the sinful activities of animal... Ahiṁsā paramo dharmaḥ . He was teaching that. But these rascals, they would show the evidence... Just like Christians says that ""Lord Jesus Christ ate fish"" or something like that. Because Lord Jesus Christ ate fish, therefore they should maintain slaughterhouse. This is their reasoning. The other day somebody questioned me that... I said that killing of animals is sinful activity. So somebody questioned that ""Lord Jesus Christ ate fish,"" somewhere. So I said that He is powerful. He can eat the whole world. But you cannot imitate. You have to follow his instructions, what he says. He said, 'Thou shall not kill.' So you should follow his instruction, not the action."" He is powerful. He can act some way or other, according to circumstances. That is his business. Actually, that is the Vedic statement, that just like the sun, the sun can absorb the urine. People pass urine on the street, and the sunshine absorbs the urine, evaporates, but sun is still pure. Rather, the place where the urine was passed, it becomes disinfected. Similarly, those who are powerful, īśvara , godly, you cannot imitate their actions. They are apparently doing something wrong; still, they are pure. The same example. The sun is absorbing or evaporating the urine, but sun is still pure. But if I imitate and lick up the urine, that is not very good business. Similarly, we cannot imitate the powerful, we have to simply follow the instruction of the powerful. That is... But people, on slight imitation... Is that very good reason? Suppose Christ sometimes ate fish, but that is sufficient reason to maintain big, big slaughterhouse? Because Christ said... And he teached in the desert. Suppose there was no food and he had to eat some fish. So that is his business. He could do it. He is powerful. But does it mean on that strength throughout the whole world the Christians will maintain big, big, up-to-date machinery for slaughterhouse? So it is sinful. So Buddha wanted to stop this nonsense, who were eating and killing animals on the strength of Vedas. They did not know what is the meaning, but they would say in the Vedas it is stated, paśavo vadhyaḥ sṛṣṭaḥ : ""The animals are created for being killed."" And what purpose it is killed? They, without knowing... Actually, they wanted to satisfy their tongue by eating the flesh, but they would give Vedic evidences. So to stop this nonsense business Buddha said that ""I don't care for your Vedas."" Nindasi yajña -vidher ahaha śruti - jātam . Śruti- jātam means Vedic injunction."
Prof. Regamay,Yes.,Prabhupāda," So he condemned, ""No, no. I don't care for your Vedas. "" So he defied Vedic injunction. Because otherwise, he could not establish his theory of nonviolence. The violence, in a certain way, is recommended in the Vedas. So if he says, ""No violence,"" then it is against Vedas. Therefore he had to declare, ""No, no, I don't follow the Vedic injunction."" And because he did not, he publicly declared that ""I don't follow Vedic injunction,"" therefore he is taken as atheist. Atheist means who does not take the authority of the Vedas. Nindasi yajña -vidher ahaha śruti - jātam . But he did it. He is all-powerful. He can do it. Why? Sadaya - hṛdaya darśita - paśu -ghātam keśava dhṛta - buddha - śarīra jaya jagadīśa hare . We worship him like that. Keśava dhṛta - buddha - śarīra jaya jagadīśa . From philosophical point of view, he is taken as atheist. But we Vaiṣṇava we know that He is God. He is God, incarnation of God."
Prof. Regamay,"I have been struck in Ceylon on seeing in Buddhist temples, Viṣṇu .",Prabhupāda," Viṣṇu , yes. There are in Penang. Penang also I have seen. They admit that Buddha is the incarnation of Viṣṇu . That is admitted in the śāstra . That means these Ceylonese or Penangese, originally they knew that Buddha is incarnation of Viṣṇu . In Ceylon you have seen?"
Prof. Regamay,I have seen.,Prabhupāda," Similarly, I have seen in Penang also, Viṣṇu , Viṣṇu - mūrti ."
Prof. Regamay,"And but he said also, the doctrine of Buddha , that man has not person, doesn't exist as person. He's only some moving elements, physical and psychical and nothing else.",Prabhupāda, Person. He is person. He is person. Lord Buddha is person.
Prof. Regamay,"Yes, but Brahman is not person. Brahman .",Prabhupāda, Huh ?
Yogeśvara,"Yogeśvara : He says that Buddha's philosophy did not admit a spiritual personal identity to the living being, that Buddhist philosophy was that we are simply this combination of chemicals.",Prabhupāda, Yes. That is all right.
Prof. Regamay,"Chemical, psychical, but no continuous, no ātman .",Prabhupāda, That is śūnyavādī. We say also.
Prof. Regamay,"So they are... I think it's... I must say that when comparing different religions, I see that for instance, what I find here...",Prabhupāda," There is no different religion. As soon as one tries to understand different religion, it is to be concluded that he does not know what is religion. That religion cannot be different. Religion is one. God is one. And the order given by God, that is religion. But ""different"" means according to time and circumstances... Just like Lord Buddha , he is giving the same religion. He is God, incarnation of God. He is asking, ""Just obey Me."" The same philosophy is being taught by Kṛṣṇa , ""Surrender unto Me."" That is religion. Buddha also says ""Surrender unto Me. Obey Me."" So that is religion. Yes. So the religion is... One who knows God and surrenders to Him, that is religion, and anything, that is all cheating. Anything else, that is all cheating. That is not religion. This is religion. God is one, and surrender to God, that is religion. That's all. You take any religion, it doesn't matter. If one has learned what is God and how to surrender to Him, that is religion."
Prof. Regamay,But I noted that for instance our Christian approach to God...,Prabhupāda, In Christianity they also recommend surrender to God.
Prof. Regamay,"It's nearer to your approach than, for instance, I don't know, as the kevalādvaita I mean, where nirguṇa - brahman is the higher form of, than...",Prabhupāda," Nirguṇa - brahman ... Just like... Here we have got this example. This is, what is called, New Zealand lake, and a few step after...,"
Guru-gaurāṅga,Guru - gaurāṅga : Geneva Lake.,Prabhupāda, Geneva Lake. And few step after French lake.
Yogeśvara,Yogeśvara : Because French is a border of Geneva lake also. Therefore sometimes it's considered French.,Prabhupāda," So the sky is one. Sky is one. So in the sky, in the atmosphere, where God is forgotten, that is called material sky. And the sky where God is not forgotten, that is spiritual sky. Just like the sky is one, and the sun is one. But when your eyes are covered by cloud, you say the cloudy sky. The sky is not cloudy. The sky is one, it is always clear. But some portion of the sky there is cloud, and you say, ""This is cloudy."" [break] Similarly, materialism means when you forget Kṛṣṇa , that is material. And when you know Kṛṣṇa and act for Kṛṣṇa , that is spiritual."
Prof. Regamay,"Now, one question still. Why in the Ṛg Veda there is not even the name of Kṛṣṇa ?",Prabhupāda," Oh yes, Viṣṇu , there is. Viṣṇu and Kṛṣṇa , I have already. There is no difference."
Prof. Regamay,"Viṣṇu , yes, but not the name of Kṛṣṇa .",Prabhupāda," No, in Atharva Veda there is name of Kṛṣṇa ."
Prof. Regamay,"Viṣṇu , yes, I know that the...",Prabhupāda," So it doesn't require that in every Veda there should be, because the Upaniṣads, they are impersonal study, negation of the material existence. That is negation. There is no positivity. So when you come to the positivity, then you can understand Kṛṣṇa ."
Prof. Regamay,"But I am struck that, for instance, for us in the West the idea of personal God is strongly rooted in our consciousness.",Prabhupāda," Yes. Lord Jesus Christ, he was Vaiṣṇava . He directly gave you the idea of personal God. The personal God is the origin. Brahmeti paramātmeti bhagavān iti śabdyate [SB 1.2.11 ]. The... Just like, the same example: the sun god, the sun planet and sunshine, they are one. They are not different. But still, this is impersonal, that is localized, and within the sun globe, there is the sun god. So sun god is the origin of this light. Similarly, Kṛṣṇa , the Supreme Personality of Godhead, He is the origin of everything. Ahaṁ sarvasya prabhavo mattaḥ sarvam [Bg. 10.8 ] . That's the fact. But people with poor fund of knowledge they cannot understand it. Therefore stop... [break] ...light, that's all. So much. Just like Lord Buddha . He did not explain anything about God. He said, ""Just obey me and stop this animal killing."" Therefore this much sufficient for him, that's all. The lower class students, one plus two equal to three, two plus two..., that much mathematics, not higher mathematics. Higher mathematics is not possible to understand."
Prof. Regamay,"Yes, of course.",Prabhupāda," That's it. But there is higher mathematics. Not one plus two or two plus three, no. There is still higher mathematics. So that is not meant for them. That will be explained, explained in the Bhagavad..., ye yathā māṁ prapadyante tāṁs tathaiva bhajāmy aham [Bg. 4.11 ] . Those who are expert, or sufficient, insufficient knowledge, they cannot understand the Supreme Absolute. That is also confirmed, bahūnāṁ janmanām ante jñānavān māṁ prapadyate : [Bg. 7.19 ] ""After many, many births, when one is actually in full knowledge, he can understand Kṛṣṇa and surrenders unto Him."" Vāsudevaḥ sarvam iti sa mahātmā sudurlabhaḥ [Bg. 7.19 ] . So Vedas and scriptures are there, differently, according to different conditions. Now, what Jesus Christ was teaching the people? You can understand. The first injunction is ""Thou shalt not kill."" So what class of men they were, just you can understand. Otherwise, why he is first of all telling ""Thou shalt not kill""? The Mohammed also said, ""From this day, there is no sex with your mother."" So just see what class of men. So according to class of men, there should be teaching. Similarly, Buddha also, Lord Buddha said, ""No, no, there is no God. Just try to understand me. You obey Me."" ""Yes, sir."" It has to be done like that."
Prof. Regamay,"Still, there are two questions I have which remain. One is quite a small question. I have read in your commentary to the chastisement of Droṇa , killing of Droṇa , and where it was that violence for a right cause is better than the so-called nonviolence. Now I wanted to ask, for instance, to find that nonviolence or like Gandhi , it was wrong...",Prabhupāda," Gandhi was not a man of spiritual under... He was a politician, that's all."
Prof. Regamay,"Yes, but in his personal...",Prabhupāda," Gandhi , actually he did not know anything."
Prof. Regamay,"Yes, he read Bhagavad- gītā in English.",Prabhupāda, That is also nonsense. There was no Kṛṣṇa . There was no Mahābhārata or Kurukṣetra . He has written like that.
Prof. Regamay,"But he was dead with the words Rāma , pronouncing, ""Rāma Rāma .""",Prabhupāda," Well, I... That is the process of India to chant the name of Kṛṣṇa . Every Indian has got initial propensity, but actually Gandhi did not know anything about spiritual science. He was politician, that's all. That one Bengal governor, he was from Australia, Mr. Keziar (?). So he, I remember. ""Gandhi is a politician amongst the saintly person or a saintly person amongst the politicians."" This study was made. His moral principle, character, is very good. That is to be taken by the politicians. But so far his spiritual knowledge is concerned, that is nil."
