Question Speaker,Question Text,Answer Speaker,Answer Text
Satsvarūpa; Yogeśvara; M. Roche-dieu; Yogeśvara; M. Roche-dieu; Yogeśvara; M. Roche-dieu; Yogeśvara; M. Roche-dieu; Yogeśvara,"The letter, in English.; Yogeśvara : (French); Are you in touch with Professor M. Eliade who is in Chicago, department, religious department?; Yogeśvara : What is his name?; Mssr. Eliade, Eliade.; Yogeśvara : Professor Eliage?; E-l-i-a-d-e. He's a woman.; Yogeśvara : Eliage, Professor Eliage...; Eliade. Eliade.; Yogeśvara : Eliade. Chicago University?",Prabhupāda," No, I have never gone to Chicago."
Yogeśvara,Yogeśvara : Is not Professor Dimmock from Chicago?,Prabhupāda, Yes.
Yogeśvara; Satsvarūpa; Yogeśvara; M. Roche-dieu; Swiss Man (1); Swiss Man (2); Yogeśvara,"Yogeśvara : Professor Dimmock, perhaps you are familiar with Professor Dimmock. He's head of which department?; East Asian.; Yogeśvara : The East Asian Studies Department of Chicago University has written the preface to this Bhagavad- gītā .; I have seen it, yes. Chicago University Department; (French); (French); Yogeśvara : He says he hopes we excuse if he has some basic questions that he wanted to ask. And his first question was regarding tilaka . What is the symbolism, significance?",Prabhupāda," It is just like your cross, amongst Christian. It is temple of Viṣṇu . Not only here, we have got twelve place: here, here, here, here, here. Twelve place. The idea is being protected by Viṣṇu from all sides."
Swiss Man (2); Yogeśvara,"(French); Yogeśvara : The shaved head, he's asking.",Prabhupāda," This is cleanliness. Instead of keeping unnecessary hair, we keep very clean."
Swiss Man (2); Yogeśvara,"(French); Yogeśvara : These traditions have existed for a long time, he's asking.",Prabhupāda," Yes. Especially the brāhmaṇas, they keep the shaven head. Brāhmaṇas are the topmost class. What is the symptoms of brāhmaṇa , find out."
Yogeśvara; Nitāi,Yogeśvara : (French); Nitāi :,Prabhupāda," So the Vedic conception is that the human society should be divided into four divisions, namely the brāhmaṇa , kṣatriya , vaiśya , and śūdra , natural division. One section of the human society should work as the brain. Another section should work just like the arms, another section, like the belly, another section, like the leg. These four divisions are essential. That is also mentioned, cātur - varṇyaṁ mayā sṛṣṭaṁ guṇa - karma - vibhāgaśaḥ [Bg. 4.13 ] . Find out this verse."
Yogeśvara,Yogeśvara : (French),Prabhupāda, Page?
Nitāi; Yogeśvara; Nitāi; Yogeśvara,Nitāi : 235.; Yogeśvara : You have it?; Nitāi : You want to read it?; Yogeśvara :,Prabhupāda," Just like by nature there are four division in the body—the brain, the arm, the belly, and..., all of them required... You cannot reject any one of them. Then it is not fullness. But the brain should be the, I mean to say, prime director, managing director. So the qualification of brāhmaṇas are stated. Śamo damas titikṣā ? Eh? So at the present moment the society has no brain because there is no person, no person who is qualified like that, samo damas titikṣā ."
Yogeśvara,Yogeśvara : (translates),Prabhupāda," So their qualification, brāhmaṇa qualification, find out. Page?"
Nitāi; Yogeśvara,Nitāi : It's eight twelve.; Yogeśvara : Eight twelve?,Prabhupāda, 812.
Yogeśvara; Swiss Man (2); Yogeśvara,"Yogeśvara : (reads verse 18.42 in French); (French); Yogeśvara : He says, ""Does this Kṛṣṇa consciousness message apply as well to the outcastes?""",Prabhupāda, Outcaste? There are four castes only.
Swiss Man (1); Yogeśvara,But there are the outcastes...; Yogeśvara : Do you mean the untouchables?,Prabhupāda," Outcaste means those who are less than the śūdras. They are called pañcamas. These are four divisions: brāhmaṇa , kṣatriya , vaiśya , śūdra . Śūdra means laborer class but they are also obedient to the other three classes. And less than that, they have been described as caṇḍālas, pañcamas, or untouchable as you say. But for us, Kṛṣṇa consciousness movement, there is no such distinction. Anyone can become Kṛṣṇa conscious. The pañcamas, the fifth class men are called caṇḍālas. Caṇḍāla means untouchable. So they are also many: kirāta -hūṇāndhra- pulinda -pulkaśā ābhīra -śumbhā yavanāḥ khasādayaḥ [ SB 2.4.18 ] . So Kṛṣṇa says, māṁ hi pārtha vyapāśritya ye 'pi syuḥ pāpa - yonayaḥ [Bg. 9.32 ] . There is... Māṁ hi pārtha vyapāśritya ."
Yogeśvara,Yogeśvara : (translates),Prabhupāda, Read it.
Nitāi,Nitāi :,Prabhupāda," So in Kṛṣṇa consciousness movement there is no such distinction because we are interested with the soul. The soul is the same everywhere and these designations are different. So Kṛṣṇa consciousness movement is above designation. Sarvopādhi- vinirmuktam [Cc. Madhya 19.170 ] . One is freed from all designation. Actually, on the spiritual level, the Kṛṣṇa consciousness movement, anyone who is in Kṛṣṇa consciousness is above all these divisions. Sa guṇān samatītya . Find out. Māṁ ca avyabhicāreṇa bhakti - yogena yaḥ sevate , sa guṇān ..."
Yogeśvara,Yogeśvara : (translates),Prabhupāda, The designations are on the material platform according to the quality. But in the spiritual platform it is transcendental to material qualities. So when one becomes Kṛṣṇa conscious there is no more distinction.
Yogeśvara; Swiss Man (2); Yogeśvara,"Yogeśvara : (translates); (French); Yogeśvara : He says this seems to be somewhat different from the traditional Hindu practice, since in the Manu - saṁhitā , for example, śūdras are not to be instructed.",Prabhupāda," Yes, but we do not keep him śūdra . A devotee is no longer śūdra . We are creating brāhmaṇas. Just like these Europeans and Americans. They, according to Manu - saṁhitā , they are mlecchas, yavanas. But we are not keeping them mlecchas and yavanas. Just like these European and American boys. They are accepting the Vedic regulatives principles: no illicit sex, no meat-eating, no intoxication, no gambling. So they are no more śūdras or caṇḍālas. They are brāhmaṇas."
Yogeśvara,Yogeśvara : (translates),Prabhupāda," So it is said, guṇa - karma - vibhāgaśaḥ [Bg. 4.13 ] , according to quality and work. When one is educated in the quality of brāhmaṇa , Vaiṣṇava , and he works like a brāhmaṇa , he is no longer śūdra or caṇḍāla or yavana . He is brāhmaṇa or Vaiṣṇava ."
Swiss Man (2); Yogeśvara,"(French); Yogeśvara : He says, in a sense we're something like the Buddhists because the Buddhists also don't take account of this, of the caste system.",Prabhupāda," No, no. Buddhist or anyone. Just like a person, when he is not educated in medical science he is not a medical man, but when he is properly educated in the medical science and he practices as a medical man, then he is a medical man. So you take it from Buddhism, or Hinduism; it doesn't matter. The thing is, consideration is, guṇa - karma . One must be qualified and he must work. Then he is elevated."
Yogeśvara; Swiss Man (2); Yogeśvara,"Yogeśvara : (translates); (French); Yogeśvara : In other words, he's saying, what we're saying is that spiritually, everyone is equal, which is actually the same as the Christian idea.",Prabhupāda," Yes. Spiritually, not materially. Materially there must be distinction. Materially there must be distinction. But spiritually there is no distinction."
Swiss Man (2); Yogeśvara; Guru-gaurāṅga,(French); Yogeśvara : What was his first point?; Guru - gaurāṅga : The point was that in Christianity everyone can become Christian whereas it seems in this only some can become brāhmaṇa . So he is interested what is the path to becoming brāhmaṇa . How does one become brāhmaṇa ?,Prabhupāda," Brāhmaṇa means purified. Just like in Christianity also there are ten commandments. If you do not obey the ten commandments, how you can become Christian?"
Yogeśvara,Yogeśvara : (French),Prabhupāda," First of all, the quality. The quality of Christian is that he must obey the ten commandments. If he does not obey, then where is his Christianity? That is stated, guṇa - karma : by quality and work one becomes Christian or Hindu or Muslim. There must be the quality. But when the spirituality develops either from Christianity or Hindu or Muslim—it doesn't matter—then there is. Find out that verse, sa vai puṁsāṁ paro dharmo yato bhaktir adhokṣaje [SB 1.2.6 ] . Read it. This is the ideal of equality. Find out."
Puṣṭa-kṛṣṇa,Puṣṭa - kṛṣṇa :,Prabhupāda," So our, this movement is to create lover of God. It does not matter whether he follows Christianity or Hinduism or Buddhism or this ism or that ism. One must be lover of God, and that is stated in the Bhāgavata . That is first-class religion which turns the followers to become lover of God, that's all."
M. Roche-dieu,"In Christianity, mystics would emphasize the same thing.",Prabhupāda," That is the essence of religion, to know God and to love Him. That's all."
M. Roche-dieu,Yes. Love God and love the man too.,Prabhupāda," Why man? Simply love God; then you will love everyone. Because God is the center, God is the father of everyone, so if you love the father, automatically you love the sons. It is not required that you simply love this son and not that son. That is not love of Godhead. ""I love human being but I do not love the poor animals. Send them to the slaughterhouse."" This is not love of God. So in the Bhagavad- gītā , you will find, God says,"
M. Roche-dieu,Living being.,Prabhupāda," Living, any living. We are all living beings. We are in different dresses. Just like you are European; you have got a different dress. I am an Indian; I have got a different dress. But dress is not consideration. You are a human being; I am a human being. Similarly, all the living entities, they are dressed in 8,400,000's of dresses. But they are living being. And all the living beings are part and parcel of God."
M. Roche-dieu,"(French) Life is a whole view, and there is no division between animals and man.",Prabhupāda," Spiritually advanced man, God conscious, there is no such distinction that ""Here is an animal; here is a man."" He sees that spirit soul is there in the animal and in the man, in the tree, in the plant, in the aquatics, the same spirit soul. Read that."
Nitāi,Nitāi :,Prabhupāda," Yes. The father is God, and they are all sons. But they have, they have been given different types of dress according to karma . So when actually one loves God, he loves all of them as brothers, not that only human being. That is not love of God. Then he does not know what is God. In the Bhagavad- gītā you'll not find a single sentence where it is recommended that ""Only love the human being."" There is no such thing."
Yogeśvara; Frenchman; Yogeśvara,"Yogeśvara : (translates); (French); Yogeśvara : He's asking, ""Well, that's all right. But this love that we have for God, only man can give it. An animal can't love God. A tree can't love God.""",Prabhupāda," But you can love animal. You are not animal. Animal... Just like we are discussing about theosophy because we are grown up, and the child, he cannot understand. That does not mean we shall be unkind to the children. He may be ignorant, the animal may be ignorant, but I am not ignorant. How can I kill the animal?"
Swiss Man (1); Yogeśvara; Guru-gaurāṅga,"(French); Yogeśvara : He's asking, ""How do we see ourselves and how is it that we intentionally distinguish ourselves by dressing differently, by having a different presentation than the rest of society.""; Guru - gaurāṅga : Given the fact that all others, they are loving God too, the same principle, Christianity...",Prabhupāda," No, symptoms must be there. If you love God, then you should love everything of God. You cannot distinguish that ""These are human beings. They should be given service, and the animals should be sent to the slaughterhouse."" That is not love of God. That means he does not know what is God. He is still unaware of God. Just like father. Father has got ten sons. Out of them, one is very intelligent or two are very intelligent; others are fools. And if the intelligent sons propose to the father, ""Father, these are useless sons. Let me kill,"" will the father agree? So God is father of all living entities. He is providing food for the animal, for the man, because He is father. There is, in the jungle of Africa elephants. They are eating at a time hundred kilos. The father is providing. And the ant, a small ant, is eating one grain of sugar. He is providing. Within the hole of your room there are millions of ants. The father is providing food for them. That is God. Eko yo bahūnāṁ vidadhāti kāmān . That one is providing all necessities of life to everyone, all living entities. That is God. So if I know God, then I can know also that all of them are sons of God and God is providing all their necessities of life. What right I have got to kill them?"
Swiss Man (1); Yogeśvara,"(French); Yogeśvara : (translates) He says, ""Yes, but we see that among the animals there are certain, many species that do eat meat.""",Prabhupāda, Among the animals. But you are not animal.
M. Roche-dieu,They do not eat anything else.,Prabhupāda," But you are not animal. Animals among... The tiger, he is destined to eat meat. But you are not animal. You are human being. Why should you eat? Why you should imitate an animal? Then why there is religion?"
Frenchman; Yogeśvara,"(French); Yogeśvara : (translates) There's a story. Someone asked Lord Jesus to describe how we should love all people. Describe... Just like a man who has one hundred sheep and there is one of them who has gone astray, he is lost, so the man leaves aside all of his other hundred sheep to go looking for that one sheep. So in the same way, he says, we must take care of the people who are suffering. The minority, those who are suffering, they must receive food, they must be given help and fed.",Prabhupāda, That's all right. But why you should kill animal?
Young Swiss Man (3),At the beginning of Bhagavad- gītā ...,Prabhupāda," And Christ says, ""Thou shall not kill."" Why you are killing? From the very beginning disobedience. How you can become Christian?"
Young Swiss Man (3),"Isn't it at the beginning Arjuna hesitates to kill his family and doesn't want to go to fight, and what he is taught, through Bhagavad- gītā in some way is that he should not restrain and that...",Prabhupāda, But first of all you take your Bible. You are ordered not to kill. Why you are killing? Then go to Bhagavad- gītā . When there is aggression you have the right to kill but not unnecessarily you can kill. Suppose a tiger attacks you; you can kill. But you cannot go in the forest and kill the tiger. That is sinful.
Young Swiss Man (3); Yogeśvara,Why does the distinction stop with animals and not with plants?; Yogeśvara : Why do we make the distinction between not killing animals and plants? Why do we kill plants?,Prabhupāda," We do not kill plants also. We take... Of course, by nature's way some living entity is the food for another living entity. Jīvo jīvasya jīvanam . That is the nature's way. But if you give that argument, then I can say, ""Why you are killing cows? Why don't you kill your own children?"" If that is the way, that ""Because I have to eat some animal,"" so why go outside? Just inside the family there are so many animals. You can kill them and eat. there must be discretion. Apart from this point of view, we Kṛṣṇa conscious people, we do not kill even a plant because, Kṛṣṇa says-find out this - patraṁ puṣpaṁ phalaṁ toyaṁ yo me bhaktyā prayacchati [ Bg. 9.26 ] ."
Yogeśvara,Yogeśvara : (translating) ...jīvo jīvasya jīvanam (French)...,Prabhupāda," There is no jīvo jīvasya jīvanam . Here Kṛṣṇa says, ""Give Me these things, patraṁ puṣpaṁ phalaṁ toyam . "" There is no question of jīvasya jīvanam ."
Yogeśvara,Yogeśvara : (translates),Prabhupāda," Just hear. Kṛṣṇa is ordering, ""Give Me this food."""
Yogeśvara,Yogeśvara : (translates) Patraṁ puṣpaṁ phalaṁ toyaṁ yo me bhaktyā prayacchati . (translates),Prabhupāda," So we take Kṛṣṇa prasādam . We don't directly do anything. Kṛṣṇa says, ""Give Me this foodstuff containing of vegetables, fruits, flowers, grains."" So we offer them and then you take. If there is any sinful activity there, it is Kṛṣṇa's, not mine."
Yogeśvara; Frenchman,Yogeśvara : (translates); (French),Prabhupāda, (aside) Why don't you open this?
Yogeśvara,"Yogeśvara : He says, ""That may be so, but in the Bhagavad- gītā Kṛṣṇa orders Arjuna that 'You must kill.' """,Prabhupāda, You must kill always. Where is that...? Where is that quotation?
Yogeśvara,Yogeśvara : (French),Prabhupāda, Are... You know... Where is the quotation in the Bhagavad- gītā ?
Swiss Man (1); Yogeśvara,"(French); Yogeśvara : He says in the beginning of the Gītā , Kṛṣṇa tells Arjuna to fight.",Prabhupāda," Why? ""Because you are kṣatriya . There is fight, war, you must fight. You are meant for..."" Just like my hands, kṣatriya . If there is attack it is hand's duty to protect me. The hand is being asked to give protection. That is natural. If I go to attack you, immediately you spread your hand. This is the duty of the hand. So when there is attack, the other's party, they have come to fight. You must fight because you are hand."
Yogeśvara; Swiss Man (1); Yogeśvara,"Yogeśvara : (translates); (French); Yogeśvara : He says, ""But then Kṛṣṇa says, 'Why are you afraid to fight? After all, the soul is eternal, but the body is only temporary.' So isn't that a justification...""",Prabhupāda," But Kṛṣṇa does not say, ""Therefore you open slaughterhouse and go on killing animals."""
Yogeśvara; Swiss Man (1),Yogeśvara : (translates); (French),Prabhupāda," Well, if you have killed some man and you go to the court and if you say that ""He is not killed,"" will you be saved?"
Yogeśvara; Swiss Man (1); Yogeśvara,"Yogeśvara : (translates); (French); Yogeśvara : He says, ""How is this, that the only thing we've talked about since we've gotten here has been eating of meat? Is that the only...?""",Prabhupāda, Huh ?
Yogeśvara,"Yogeśvara : He says, ""How is that that the only thing we've talked about since we came today has been eating meat? Is that the only thing that the Bhagavad- gītā teaches?""",Prabhupāda," Yes, because our proposal is that unless you become... Find out that verse, yeṣām anta - gataṁ pāpaṁ janānāṁ puṇya - karmaṇām , te dvandva - moha - nirmuktāḥ . This is the beginning of theism. Theism means you must be free from all sinful activities. That is theism. If you remain sinful you cannot make any progress in theism. That is the point. [break]"
Yogeśvara,"Yogeśvara : Doesn't that make us rather exclusive, that we have some facility for spending all of our time meditating and purifying our lives? Doesn't that make us a rather exclusive group of people? If only those who are completely pure can engage in service, that means only people like us who have time to sit and meditate...",Prabhupāda," What meditation? The thing is that here it is stated, ""Unless one is free from all sinful activities, he cannot be engaged in My service."" And the pillars, according to Vedic, pillars of sinful activities... Just like four pillars. One is this meat-eating, the other is illicit sex, the other is gambling, and the other is intoxication. So unless we break these four pillars of sinful life there is no meaning of meditation or worshiping God. You cannot ignite fire, at the same time pour water on it. So sinful life means destruction of spiritual life. So once you begin spiritual life, and other way you begin sinful life, then how it will be? It is counteracted. There is no progress."
Yogeśvara; Swiss Man (1); Yogeśvara,"Yogeśvara : (translates); (French); Yogeśvara : He says there are other sinful activities as well. For example, egoism and jealously.",Prabhupāda," But first of all begin these primary principles, and then others will be automatically stopped."
Yogeśvara; Swiss Man (1); Yogeśvara,Yogeśvara : (translates); (French); Yogeśvara : He does not think that they will follow naturally just by stopping these four things.,Prabhupāda," Naturally it follows, but if somebody wants to cheat, that is another thing. Naturally it follows."
Yogeśvara; Swiss Man (1); Yogeśvara,Yogeśvara : (translates); (French); Yogeśvara : This gentleman suggests that he prefers someone who may be committing all four of these sinful activities but who helps his fellow man.,Prabhupāda," The fellow man helping, what does he gain?"
Yogeśvara,"Yogeśvara : (translates) He says, ""Even if someone is committing all kinds of sinful activities...""",Prabhupāda," No, no. What you gain by helping your fellow man? First of all that is the question."
Yogeśvara,"Yogeśvara : He says, ""The purpose of helping other people is not to gain something for yourself.""",Prabhupāda, But I say that you help your fellow man. So do you know how to help him?
Swiss Man (1); Yogeśvara,"Certain circumstances.; Yogeśvara : He says, ""In certain circumstances.""",Prabhupāda," In certain circumstances, but if you do not know how to... Suppose a man is diseased and you think... The doctor says that he should not eat anything. But if you think that ""Let me give  some food. The doctor is very cruel. He is not giving food,"" is it, that, helping or fully pushing him towards death? First of all you must know how to help. If I do not know—I help in the opposite way—that is not helping. That is degrading. These are all manufactured things. They are not... Helping means, real helping is, that a man or anyone... Everyone is suffering for want of knowledge. So if you can give knowledge, that is real help."
Swiss Man (1); Yogeśvara,"(French); Yogeśvara : The first thing is that this gentleman doesn't agree. He doesn't think that the major problem is ignorance. But this gentleman suggests that there is a danger, there's a danger in what he calls ""spiritual pride,"" ""spiritual egoism,"" that is to say, thinking that we have helped someone and actually...",Prabhupāda," But that pride is there. That gentleman is proud that he's helping someone. That prideness is there. But out of these two kinds of prideness, one prideness which is real, that is welcome. If one is falsely proud, that is useless. But if one is actually proud of doing something, then he... That is good. Just like in the Vedic literature it is recommended that you should feel ahaṁ brahmāsmi: ""I am Brahman ."" This is also ego. This is real ego, that ""I am spirit soul."" This is not bad. But when one thinks, ""I am this body,"" he's a rascal. If one thinks that ""I am servant of God,"" that is real ego. And if one thinks, ""I am servant of Satan,"" that is not very good."
Yogeśvara,Yogeśvara : I think this gentleman still isn't feeling satisfied about his question.,Prabhupāda, What is that?
Yogeśvara,"Yogeśvara : That how can we say that to give people..., that the only real problem is to give knowledge. There are people who are starving; there are people who are sick; there are people who are in so much distress.",Prabhupāda, But you cannot do. You cannot do. There are so many people starving in the hospital. What can you do?
Yogeśvara; Swiss Man (1); Yogeśvara,"Yogeśvara : (translates); (French); Yogeśvara : He says, ""Probably not very much."" He said, ""But maybe we can do something.""",Prabhupāda," Then this is simply a false pride, that ""I can do something."" You cannot do anything. Rather, you can do this service, that ""There is God. You are servant of God. Please become servant of God."" And if you make this program, ""I can give food to so many,"" what you can do? There are millions and millions. People are starving all over the world. What can you do? It is simply false pride. You cannot do anything. Now, just like I have heard that in your country, because they have got excess milk supply there was recommendation to kill twenty thousand cows. Is it a fact?"
Guru-gaurāṅga,Guru - gaurāṅga : Yes.,Prabhupāda," So is it very good intelligence? Because there is excess of milk supply, why not supply it to others who are starving for milk?"
Swiss Man (1); Yogeśvara; Guru-gaurāṅga,"(French); Yogeśvara : You want to translate that?; Guru - gaurāṅga : ""But when we go to India, on the other hand, you may see cows dying of hunger, just bare skeletons.""",Prabhupāda," But there are so many human beings also dying out of hunger. Is it to be recommended that they should be killed? There are many human being also; they are also skeletons. They have no sufficient food. So if you think that the cows are skeletons for want of food, you supply them food. Why you are restricting? If... The Americans, they are throwing tons of food in the water. Why they do not send to India for feeding the skeleton cows? What the cows have done? They are also living entity. Why you are thinking of human beings, not of the cows?"
