Question Speaker,Question Text,Answer Speaker,Answer Text
Guest (1),Walk.,Prabhupāda," No, not walk. Giving massage. So He was sleeping. So at two or three o'clock when Caitanya , Śrī Caitanya Mahāprabhu became awake: ""Govinda, you are sitting here. You have not taken your dinner?"" ""No, sir."" ""Why?"" ""Now, how could I cross you and take my dinner?"" ""Then how you came?"" ""No, that is for Your massaging. (laughter) But I cannot cross You for my dinner."""
Guest (1),"Yes. ""For You I can cross.""",Prabhupāda," For You, I can do anything."
Guest (1),For You...,Prabhupāda, For Your service.
Guest (1),For your service.,Prabhupāda," But for my sense gratification, I cannot do that."
Guest (1),Very good answer.,Prabhupāda," In a, in the Western countries, I had to sometimes do something which I should not have done. But I've done it to bring so many souls to Kṛṣṇa ."
Brahmānanda,Brahmānanda : The preaching necessitates that.,Prabhupāda," Yes. Because if there is no other alternative, what can I do? In the beginning I had no disciples. So I was cooking myself. So one gentleman, he... Later on, he became my disciple. He gave me some place. I was cooking. And in the refrigerator, I saw there was meat. (laughs) So I asked: ""What is this?"" He said, ""It is for cats. I don't take meat."" ""All right. (laughter) I'll do (?)."" So of course, I stayed there for three, four days. And if I cry, ""Oh, I have violated my rules and regulations..."" Rules and regulations can be violated when there is urgent necessity of service, not whimsically or for one's sense gratification. And that is, of course, in our present..., with the permission of the spiritual master, not one should think, ""Oh, I have become so much great devotee, I can violate all the rules and regulations."" No, you cannot. If there is need of violating rules and regulations, you must take permission. Now we have no temple. Under the circumstances, we are doing that. So you construct the temple as soon as possible so that people may not criticize you. [break] ...for all gṛhastha devotees, you should begin preaching amongst the gṛhasthas. It is not forbidden for the gṛhasthas to preach. Because preaching is required everywhere. Arjuna was gṛhastha . So yei kṛṣṇa - tattva - vettā sei guru haya [Cc. Madhya 8.128 ] . One must know the science of Kṛṣṇa . Then you can become preacher."
Guest (1),It is temporary...,Prabhupāda," You have yet to see what is temple. ""Temple will be constructed. This is not temple."" I wanted to stay in the dharmaśālā of Tīrtha Mahārāja , to construct the temple. I requested him that ""Some of my men will stay in the dharmaśālā. "" He refused. Then how can I construct temple? Therefore I have first constructed residential quarters. And unless my men live here, how can I construct temple? So this is residential quarter. This is not the temple. The temple has yet to be done. So suppose we have no regularly constructed temple, do you think we shall give up worship of the Lord?"
Guest (1),No.,Prabhupāda, Then?
Guest (1),We must continue it.,Prabhupāda," That's it. Because there is no temple... Bhavānanda , you are understanding?"
Bhavānanda,Bhavānanda : Oh yes.,Prabhupāda, Yes.
Guest (1),We can do our worship anywhere else.,Prabhupāda, Yes. And it is said...
Guest (1),"Anywhere, in the jungle, anywhere else.",Prabhupāda," ... bhakti . Bhakti , the definition of bhakti is given in the Bhāgavata , apratihatā . Pratihata means impediment. I have seen amongst the Mohammedans. It is very good. As soon as their namaz time is there, anywhere they will..."
Guest (1),"Anywhere, anywhere, they will.",Prabhupāda, It is very good.
Guest (1),"Even on road, they will...",Prabhupāda, Yes.
Guest (1),"On the boat, on everywhere.",Prabhupāda, Everywhere.
Guest (1),"The four times, three times, namaz.",Prabhupāda," They're so regulated, as soon as the time is there, anywhere, they'll worship."
Guest (1),There was big trouble about them...,Prabhupāda, Eh?
Guest (1),There was big trouble about them in London for some time.,Prabhupāda, What is that?
Guest (1),Because they would leave their work and start praying.,Prabhupāda, Oh.
Guest (1); Guest (2),"Then the work was stopped, and later on, it was sorted out. They were allowed to do their worship.; [break] ...cultured under, say, very comfortable circumstances. This has a relation to constant inquiries from public, specially young men, at the entrance of our mandira , our, this building, these days. I was sort of doing, helping them for entrance and exit. In that course, many young people specially they asked, ""How could people living in so much comfortable circumstances could hear and ask for bhakti .""",Prabhupāda, Then does it mean that those who are...?
Guest (2),"I, knew... Yes... Yes...?",Prabhupāda," Those who are in uncomfortable situation, they are big bhaktas? (laughter) Can you show me that because they're in uncomfortable situation, they have become big bhakta ? Is that the proof? What is this land?"
Bhavānanda,Bhavānanda : This land we were looking at a few days ago? You suggested purchasing it for grazing.,Prabhupāda, Yes. It is very nice. So it is possible?
Bhavānanda,Bhavānanda : Yes.,Prabhupāda," Oh, so do it. [break] ...bhakti's, as I explained, apratihatā . Any condition, bhakti can be executed. The example is given: Just like Rūpa Gosvāmī and Rāmānanda Rāya . Rāmānanda Rāya was gṛhastha and governor, and he was very comfortably situated. And Rūpa Gosvāmī was living underneath a tree every night. And both of them were equally... Rather, Rāmānanda Rāya was accepted in greater position than Rūpa Gosvāmī. Caitanya Mahāprabhu was in renounced order of life, but He gave even better position to Rāmānanda Rāya than Rūpa Gosvāmī. And Rāmānanda Rāya was a gṛhastha . He was not even a brāhmaṇa . And governor, very opulent. Very comfortable situation. You know this?"
Guest (2),Yes.,Prabhupāda," So how Caitanya Mahāprabhu treated them equally or gave better position to Rāmānanda Rāya than Rūpa Gosvāmī? This question was raised—not only now—when our Guru Mahārāja started Gauḍīya Maṭha . So he was allowing the sannyāsīs to live in palatial building and go in car for preaching work. So many such persons questioned, ""How is that, sannyāsīs are going in car, living in palatial building?"" So our Guru Mahārāja replied that ""A devotee should be offered the best comfort of life. And if he would not have introduced this comfortable life, at the same time, to become pure devotee, then these devotees from Western countries will, would never come. They would never agree to sit down under the tree and, imitating Rūpa Gosvāmī... That is not possible."" Do you understand or not?"
Guest (2),Yes.,Prabhupāda, What is your answer?
Guest (2),I answered that...,Prabhupāda," No, no. You answer me. I am talking with you."
Guest (2),"Actually, I didn't know...",Prabhupāda," Now, in our building we have got the most comfortable situation. There is no such sanitary arrangement in any of the temples. But we are trying to give them. Because we deal, dealing in a different atmosphere."
Guest (1),People of the different countries can...,Prabhupāda, Yes. And they are...
Guest (1),They are not habituated...,Prabhupāda, They are not habituated...
Guest (1),...with this...,Prabhupāda," ...to go on the field and pass, evacuate."
Guest (1),...to pass their obnoxious and,Prabhupāda, Then it will be a great difficulty for them.
Guest (1),...great difficulties for them. And to...,Prabhupāda," They must be given, as far as possible, their western type of comforts and chant Hare Kṛṣṇa ."
Guest (1),And they're born and brought up in this...,Prabhupāda," They have sacrificed so much for me. They are ready to lie down under the tree. But it is my duty to see they are, as far as possible, they're comfortably situated. That is my duty. They can agree to live in any condition."
Guest (2),"Gargamuni said me like this one day, and myself and one of the devotees went to draw the ration from the river in the distance, two miles off. And the devotee's saying, ""We'll go by the car."" And ""Let us go by the rickshaw.""",Prabhupāda," Yes, they do like that."
Guest (2),"I like to save the paths(?) of the temple. And that devotee's not... Up till devotee, but he was a worker, his whole time living in the temple. And I asked Gargamuni, ""Your devotee is saying, 'We'll go by car. It is expensive. Because we are collecting money from the different peoples and from the public. And we must not use our money in this way.' """,Prabhupāda," Jaya . For Kṛṣṇa bhakti , yes."
Guest (2),Hare Kṛṣṇa .,Prabhupāda, (Bengali)
Guest (2); Dhanañjaya,"(Bengali) [break]; Dhanañjaya : ...who are very much attracted to living in Māyāpura, residing in Māyāpura, after perfecting their lives, do they sometimes join Lord Caitanya Mahāprabhu's saṅkīrtana movement in Goloka Vṛndāvana ?",Prabhupāda," Let me... [break] Those who are living in Māyāpura, they have already joined."
Dhanañjaya,Dhanañjaya : Haribol.,Prabhupāda, 
Guest (3),(Hindi),Prabhupāda," It is just to give His personal example that a sannyāsī should not be very much intimately mixing with rich men. That is by His personal example. He was a sannyāsī . He refused to see a king because a king is supposed to be always busy in material affairs. So if... For the general people aspiring to go back to home, back to Godhead, for them, to mix with the materialistic persons is forbidden. Viṣayiṇāṁ sandarśanam atha yoṣitāṁ ca [Cc. Madhya 11.8 ] . Those who are viṣayī , simply engaged in sense gratification, and yoṣitām ... Yoṣitām means women or enjoyable things."
Guest (1),Prabhupāda?,Prabhupāda, Hmmm.
Guest (1),"Many religious institutions, they welcome the rich peoples. Those who are coming by cars, and those who are coming gorgeously, and they are donating much to the institutions, they are welcomed by the people, management of these institutions. And this is your version. It is just contradictory. I accept your version. It is quite, quite right. And I hope our institution must do not like that. This ISKCON must not do like that. The well-to-do peoples who come, they'll get more... [break] ...more receptions, more congratulations. I request it must be your direction that our institution ISKCON must not do like this. And it is your... (laughter)",Prabhupāda," But one, one thing is that we are not living like Caitanya Mahāprabhu . (laughter)"
Guest (1),Yes.,Prabhupāda," Caitanya Mahāprabhu , He was ideal sannyāsī , and He was living apart from any material attachment. But we have to do preaching work. We have to construct temple, comfortable temple. So who will pay for that?"
Guest (1),Then your version...,Prabhupāda," Therefore we have to sometimes do that. Just like that woman, that chaste woman. She served a prostitute..."
Guest (1),To make them correct.,Prabhupāda, No. Serve prostitute for serving her husband. That is a big story.
Guest (2),"Big story, yes.",Prabhupāda, Lakṣa - hīra .
Guest (1),Lakṣa - hīra . Yes.,Prabhupāda," You know that, Lakṣa - hīra ."
Guest (1),And husband was a...,Prabhupāda, Yes.
Guest (1),"And he requested his Lakṣa - hīra that ""I want to go one night to the...""",Prabhupāda," Yes, to the prostitute and her pay, her fee, was lakṣa - hīra , one hundred thousand pieces of diamond. You see."
Guest (1),"Yes. I know that, that story.",Prabhupāda," So for the satisfaction of Śrī Caitanya Mahāprabhu , we sometimes do that. But we collect money from them not for our sense gratification, but constructing this temple."
Guest (1),For the general public and...,Prabhupāda, Yes.
Guest (1),...country and...,Prabhupāda," And unless we have got temple like this, nobody would come. If I sit down here, ""Bhaktivedanta Swami is sitting here,"" nobody will come. (laughter)"
Guest (1),"But people, like poor people, like come to the...",Prabhupāda," But Caitanya Mahāprabhu , He is God. He can attract any man. But I am not God. I have to attract people by some opulence."
Guest (2),"But Prabhupāda, in the beginning, you attracted in the park everyone. When you went to America, you were chanting and attracting people just in the park. Same place. (laughter)",Prabhupāda," Now, at that time, only Brahmānanda was attracted. (laughter) Not you. Not you."
Guest (2),Only because he was sincere soul.,Prabhupāda," This Brahmānanda and Acyutānanda , they first danced in my chanting in the park. The photograph was published in the Times of New York."
Guest (1),"And I heard that your first devotee in America, Kīrtaniyā .",Prabhupāda, Eh?
Guest (1),Kīrtaniyā Swami.,Prabhupāda, Kīrtanānanda Swami.
Guest (1),Kīrtanānanda Swami.,Prabhupāda," Yes, he is next. He is next."
Guest (1),"Oh yes, I met him.",Prabhupāda, He came next. Brahmānanda came first.
Kīrtanānanda,"No, I came first. (laughter)",Prabhupāda, No. You were present in that Thompkinson Square?
Kīrtanānanda,Before that.,Prabhupāda, Eh?
Kīrtanānanda,Before that.,Prabhupāda," Oh before that. Yes, yes. Yes, I..."
Guest (1),"I asked him. And somebody, some devotee...",Prabhupāda, Brahmānanda you are defeated. (laughter) So kīrtana is glorious than brahma - jñāna . (laughter)
Guest (1),"And some devotee introduced me with him, that ""He is the first devotee of Prabhupāda in America, in foreign.""",Prabhupāda," Yes. He's also a priest's son, coming from very respectable, priestly order family."
Guest (1); Guest (2),"Last few days, we were enjoying a good day.; But there are so many disciples of one guru . Are they come all in bona fide disciplic succession?",Prabhupāda," Hmmm? Well, everyone is in a bona fide disciplic succession provided he keeps that tradition, keeps that tradition. Āpani ācari prabhu jīve śikhāilā . One must behave that ""I belong to this disciplic succession. I must keep myself fit for the post."" Then it is all right. If he deviates, then he deviates the disciplic succession. Hare Kṛṣṇa . Caitanya Mahāprabhu says frankly that... This is disciplic succession. Āmāra ājñāya : ""Just carry out My order."" Then you are in disciplic succession. If you do not keep yourself in the order of Caitanya Mahāprabhu , then simply by becoming disciple, you are not in the disciplic succession. This is disciplic succession. Caitanya Mahāprabhu said this clearly, āmāra ājñāya guru haña tāra ei : ""Wherever you live, you become a spiritual master."" How? Yāre dekha tāre kaha kṛṣṇa - upadeśa : [ Cc. Madhya 7.128 ] ""Whomever you meet, you only speak what Kṛṣṇa has instructed."" Then you are disciplic succession. It doesn't matter what you are and where you are. It doesn't matter. This is disciplic succession. And if you think, ""Now I am initiated. I am now liberated. I have no other business,"" then you are not in the disciplic succession. You must preach. That is disciplic succession."
Guest (1),This is the definition of a disciple.,Prabhupāda," Yes. Āmāra ājñāya guru haña tāra ei deśa [Cc. Madhya 7.128 ] , yāre dekha ... You have to... Anywhere, any friend, any businessman, ""Are you Kṛṣṇa conscious? Chant Hare Kṛṣṇa ."" That's all. What is the loss in that? ""My dear friend, I request you to chant Hare Kṛṣṇa mantra . "" Where is the difficulty?"
Brahmānanda,"Brahmānanda : Even a child like Sarasvatī , she does.",Prabhupāda," Yes? Ah, yes."
Guest (1),"She asks everybody. Every child, she will say: ""Jump!"" ""Jump, Jump, Jump!"" And she will...",Prabhupāda," And if he does not, she'll say: ""Śyāmasundara, here is a karmī . "" (laughter) So they're... Our Gosāin in Rādhā - Dāmodara temple, he was smoking. ""Mālatī, Mālatī see this old man is smoking."""
Guest (2),Take this beedie out. Chant Hare Kṛṣṇa . She was telling.,Prabhupāda," Just see. ""He's smoking beedie."" This man became little ashamed. ""Yes, my girl, I'll give it up by and by."" She was surprised that a man is smoking. Hare Kṛṣṇa Hare Kṛṣṇa ... [break] ... dṛḍha - vrata , vows, very rigidly. Bhajante māṁ dṛḍha - vratāḥ . So if I'm unable, there is no need of starving. No. Because if you become diseased, then your bhajana will be hampered. So you can do it."
Guest (1),(Bengali),Prabhupāda," (Bengali) Or ability, inability, that depends on the person."
Guest (3),(Bengali),Prabhupāda, (Bengali) [break] Adjust their cash.
Guest (2),Cash is different...,Prabhupāda," No, no. I mean to say, account computer. But they must tally with their daily balance."
Guest (2); Guest (1); Guest (2); Guest (2); Guest (2),"Well, they put in the suspense. When they find out this mistake, that somebody pointed out, then they adjust it. So many times it has happened. But this computer system is not hundred per cent efficient.; One Indian girl, Śakuntalā, went to London and America and stay on (?) these computers. She was able to work out computer, one...; She challenged. She challenged.; Śakuntalā?; Śakuntalā, yes.",Prabhupāda," Some girl came to see me. She's little fatty, that girl?"
Guest (2),Yes.,Prabhupāda," Oh, I think..."
Guest (2); Guest (1),"She printed a photo in the London papers also and challenged that ""I can beat any computers in the western world."" [break]; Under one high-court?",Prabhupāda," Under one high-court, yes."
Guest (2); Guest (1),Āśrama (?) also.; Asambala. (?),Prabhupāda, Hmmm? Yes.
Guest (3); Guest (2),"(Bengali) [break]; During the festival days...,",Prabhupāda, Yes.
Guest (4),"...for the last three or four days, many people, specially young men, were asking for different sort of informatory books or leaflets in their own language. And also asking for how they can became members or more closely associated.",Prabhupāda, This is very important.
Guest (4),With more translational or a type of...,Prabhupāda," So unfortunately, we haven't got any expert Bengali to do these things."
Guest (4),"In my own way, I am ready to prepare a sample of the English translation of the books.",Prabhupāda, Welcome. It is a great service.
Guest (4),But that must be very cheap.,Prabhupāda," Oh, cheap. We can distribute without price. That is not the question."
Guest (4),And also they were asking to be associated more in the facilities for life membership like that with... They feel it's within their reach.,Prabhupāda," No life membership, life membership they're... Just like if somebody joins, he's more than life member. But if he does not join, then he becomes life member by paying the fees."
Guest (4); Guest (5),"I also...; I want to be a member, and I wish to resign from my present service. And I wish to dedicate my whole life to...",Prabhupāda, What is your present service?
Guest (5),"At present, I am serving in the steel plant, Hindustan Steel Industry.",Prabhupāda," Oh, steel plant."
Guest (5),"And I want to, wish to dedicate my whole life to the lotus feet of Lord Kṛṣṇa .",Prabhupāda, That is very good proposal.
Guest (5),And I am a...,Prabhupāda, How far you are educated?
Guest (5),". As long as I will live, I will broom and clean the temple.",Prabhupāda, Very good. That's all right. You go on doing that.
Guest (5),OK. And then I will submit my resignation.,Prabhupāda, That is up to you. I cannot say.
Guest (5),Yes. And my parents are sufficient enough. They have enough land...,Prabhupāda," Śrī-vigrahārādhana- nitya - nānā - śṛṅgāra - tan - mandira -mārjanādau **. Tan - mandira -mārjanādau. That is also great service. If you guide other people, and you do yourself, just to keep the temple very neat and clean, it will be a very, very, great service."
Guest (5),"Yes, yes, yes. I am ready to do that.",Prabhupāda," Well, then you are welcome immediately."
Guest (5),"And that is my desire, all, inner desire.",Prabhupāda," Āpani ācari prabhu jīve śikhāilā . If you show example how to keep the temple neat and clean, then these foreigners also will learn from you. [break] ...those who are earning money, they should... But we are giving them books. So our books are worth about three thousand rupees. But we are simply collecting eleven hundred."
Guest (4),"All that they wanted, I understood from the talk, informatory, informations I mean, in their own dialect.",Prabhupāda," Well, one thing is that at least in Bengal they do not require much information because this Caitanya Movement is their movement. It is simply a plea. Everyone know that Caitanya Mahāprabhu came to distribute the Hari - nāma - saṅkīrtana . This is the essence, and let them help, prāṇair arthair dhiyā vācā , by life, by money, by words. This is the movement. Why they are anxious to get information more? That is a plea. Everyone knows what is Caitanya Mahāprabhu , at least in Bengal."
Bhavānanda,Bhavānanda : I tell them that when they ask.,Prabhupāda, Yes.
Bhavānanda,"Bhavānanda : I say, ""Why you are asking me that? You already know.""",Prabhupāda," Rather, they are to give information. But this is a plea. Bhagavad- gītā is, was not made in London. (laughter) It was spoken in India. Why they are asking? That means they have become so rascal and fool they do not know what is Bhagavad- gītā , what is Caitanya Mahāprabhu ? Their position is so low-graded now?"
Guest (1),They do not like to learn it. They do not like to know it.,Prabhupāda, That's it. Is Bhagavad- gītā imported from London? Why do they ask like this? How much degraded they have become.
Guest (1),And our answers must be like this.,Prabhupāda," Yes. As if you are... They are importing knowledge from Lenin, these rascals, and they do not know what is Bhagavad- gītā . How much degraded they have become. Just see."
Guest (2); Guest (4),"They even go as far as to say that this Bhagavad- gītā is adulterated now, and...; Maybe also they...",Prabhupāda, Adulterated?
Guest (2),"Yeah, they say so many things have been added to it. Sometimes some rascals come to criticize to that extent.",Prabhupāda, What is that addition?
Guest (2),"Well, when you come to, when you come to ask a specific answer, they say, ""If you bring Bhagavad- gītā , we'll show it to you.""",Prabhupāda, So bring Bhagavad- gītā . What is the addition?
Guest (2); Guest (4); Guest (2); Guest (4); Guest (2); Guest (4),"This was, this was pointed out by quite a few in the train.; No, you can ask them at that time, ""Please place one book like that which is adulterated, and it is somehow or another added in it.""; But what is their source of knowledge?; They have no, no source of... They like to; Speculate...; They like to convey...",Prabhupāda," They do not know what is Bhagavad- gītā , but they can say it is added and subtracted. They're... But they do not know what is Bhagavad- gītā . Yes."
Brahmānanda,Brahmānanda : Sarva - dharmān parityajya [Bg. 18.66 ] . There is no adulteration there. Very simple.,Prabhupāda," So you, all Indians, you have to do this. This is simply a plea to avoid. In Bengal, everyone knows Caitanya Mahāprabhu was for chanting Hare Kṛṣṇa ."
Guest (4),"But so far, most of them, perhaps, also wanted informations regarding, full informations regarding ISKCON.",Prabhupāda," ISKCON. That is a short-cut of ""International Society for Krishna Consciousness."""
Guest (4),"No, that I know, myself. They wanted to know, in their own language, etc... And for that I meant...",Prabhupāda," No, it is, it is..."
Guest (4),"...a sort of booklet in local dialect, in the Bengali. To be more propagated.",Prabhupāda," So I can give you the hints. You prepare a leaflet immediately, and we publish."
Guest (4),"Yes, yes. I, we have already prepared. Already...",Prabhupāda," Come. I shall give you more hints. Immediately come. I shall give you. Only need... [break] They should come forward. That is needed. Otherwise, everything is there."
Guest (4); Bhavānanda,"I was having discussions with Pāñcajanya Prabhu regarding these things. Even to have them locally printed.; Bhavānanda : Anyway, we can work that out.",Prabhupāda, Yes.
Bhavānanda,"Bhavānanda : Yes, it's all taken care of. [break]",Prabhupāda," ""Waves in the ocean. Let it, let it be stopped. Then I shall start my boat."" It will never come."
Guest (4),Then this is not my intention.,Prabhupāda, It will never come.
Guest (4),It is not my intention.,Prabhupāda," Start boat immediately, in whatever condition."
Guest (4),Any circumstance.,Prabhupāda, Any circumstance. That is required.
Guest (2),We should take it very seriously.,Prabhupāda," Yes. [break] ""First of all let us become economically fit. Then we shall consider our spiritual."" This is nonsense."
Guest (1),That will never come.,Prabhupāda," All the big, big leaders, they wanted to keep themselves economically fit, but when death came, they had to surrender. ""Yes sir, (Bengali)"""
Guest (4),Many leaders are economically...,Prabhupāda, They do not... They're not leaders. I say they're rascals.
Guest (4),"They do not live here, and they must...",Prabhupāda," All these leaders, I must say clearly, they're all rascals, misleaders. Not only in our country, all over the world. Therefore we have started this movement, who is real leader? (end)"
Passerby,Jayo!,Prabhupāda, Hare Kṛṣṇa .
Bhagavān,Bhagavān : Are śūdras supposed to take sannyāsa also?,Prabhupāda," No, why?"
Bhagavān,Bhagavān : Śūdras...,Prabhupāda," Those who are śūdras, they should not be allowed to take sannyāsa . Only those who are qualified brāhmaṇas, they'll be allowed to take sannyāsa ."
