Question Speaker,Question Text,Answer Speaker,Answer Text
Jayapatākā,They would put this bitter sauce on it. Then only they would take.,Prabhupāda," And in Burma, my Guru Mahārāja opened a branch. So when they were frying puri , the, nice ghee, all the tenants, ""Oh! What you are...!?"" (laughter) They cannot tolerate. But in Burma, there is a preparation which is called nafi. The nafi means that a, a big jar will be kept on the door, and whatever animals, insect, cockroaches will die, they'll put in that. And during rainy season, it will be filled with water. And it will be kept for years. Then... And the bad smell was so terrible that if somebody would open the lid, it will immediately create very bad smell. So after some years, they will strain the water and keep in bottle. And when there is festival, they'll supply it in small... That is called nafi. And they'll take it very pleasantly. And when they were frying ghee, ""Oh! What you are doing, this?!"" Therefore Narottama dāsa Ṭhākura says that"
Devotee,No. Nobody would.,Prabhupāda," So the Brahman realization is like that. Every living entity, he wants ānanda . Ānanda means just like we are walking together, talking together. This is ānanda . If I would have walked alone, it would have been no ānanda . I do not like. Nobody likes. So ānanda means there must be entourage. Therefore ānanda is with Kṛṣṇa . When we play with Kṛṣṇa , we dance with Kṛṣṇa , talk with Kṛṣṇa , serve Kṛṣṇa , take care of Kṛṣṇa , then there is ānanda . And simply to become one with the Brahman , then you will have to fall down again. Therefore jñāna - kāṇḍa is not perfect. And karma - kāṇḍa is, you can migrate from one body to another or one planet to another. You'll be brahmāṇḍa bhramite . You have to wander. And jñāna - kāṇḍa means you merge. That is also intolerable. Therefore unless you come to bhakti - kāṇḍa , there is no question of real life and bliss. That is the conclusion."
Siddha-svarūpānanda,Siddha -svarūpānanda: Yes.,Prabhupāda," And after eating meat, then seven hundred years old loaf. Cut it and add with little butter. That's all. And then take wine. Bās. Kadarya bhakṣaṇa kare . Now they're eating rasagullā. Am I right or wrong?"
Devotees; Siddha-svarūpānanda,Right.; Siddha -svarūpānanda: I didn't hear what you said. Now they're eating...,Prabhupāda, Explain.
Jayapatākā; Siddha-svarūpānanda; Jayapatākā; Devotee; Viṣṇujana; Jayapatākā,"Previously they were only eating meat. Now they're taking rasagullā.; Siddha -svarūpānanda: Oh yes.; So their taste has improved.; That is our kīrtana party.; Yes.; Ācchā, the way back we passed. Do you want to go back yet or around to the end?",Prabhupāda," Eh? [break] ...In every life, there is āvaraṇātmikā- śakti . He'll think that ""I am very well situated."" Even in the hog's life. That is māyā . Similarly, even if you are thinking, ""Now we have got human body. We are well situated than the hog,"" that is also mistake. That is also mistake. ""I am European, American, I have got so comfortable."" Everything is wrong. Because you have to transmigrate. You do not know what is the next life. So what is the meaning of this well-situated. That is the mistake. That is māyā . You are not sure that you'll continue this life. You'll have to die. You have to accept. So this is māyā . Somebody well-situated, he's thinking, ""Oh, I haven't got to do anything with Kṛṣṇa consciousness. I am well situated. I am European and American."""
Jayapatākā,Watch out here.,Prabhupāda," Where is our... [break] ( kīrtana - party in background) ...that ""Europeans and Americans will come, and they will dance here with the chanting, ""Jaya Śacīnandana, Jaya Śacīnandana!"" So that is being done."
Devotee,"That is being done. By the mercy of Prabhupāda Mahārāja , everything has become possible.",Prabhupāda," Oh... So when they chant and dance, I simply remember Bhaktivinoda Ṭhākura. That's all. I pray to Bhaktivinoda Ṭhākura, ""Now they have come to your shelter. Give them protection."" That's all. What can I do more? I cannot do anything more. [break]"
Devotee,... bhakti - mārga . And ours is also bhakti - mārga .,Prabhupāda, Yes. They are Vaiṣṇava .
Devotee,Then what is the difference in our philosophy and...,Prabhupāda," No, that is not different. That is variety, that they worship Bāla - Kṛṣṇa , and we worship Kiśora - Kṛṣṇa . We worship Bāla - Kṛṣṇa also. Gauḍīya Vaiṣṇava , they worship all kinds of pastimes of Kṛṣṇa . But they specially stress on Bāla - Kṛṣṇa , child Kṛṣṇa . That is spiritual variety. There is no difference. That is not difference. Cid-vaicitra. The exact name is cid-vaicitra. Cit means spiritual. Vaicitra means varieties. Where this road goes?"
Jayapatākā,This one goes down on the river side. (?),Prabhupāda, Hmm. So... [break]
Devotee,"... Rādhā and Kṛṣṇa , very prominent. When Lord Caitanya came, He made the worship of...",Prabhupāda," Yes, yes."
Devotee,... Rādhā and Kṛṣṇa very prominent.,Prabhupāda," Yes, yes."
Devotee,The Vaiṣṇavas before...,Prabhupāda," No, other Vaiṣṇavas. But... The on... This Vaiṣṇava party, they stress on Bāla - Kṛṣṇa , Gopāla . We also, we have got our Gopāla , as Mādhavendra Purī installed a Gopāla . That Gopāla is now worshiped, Nāthavara (?), by the Vallabha - sampradāya . That is Gauḍīya Vaiṣṇava Deity. It is admitted in the court. [break] ...the modern civilization is that they do not know that this, there is transmigration of the soul, and this constant change of body is not very good. They do not know anything. Neither they do know that there is change of body. Neither they feel that ""The constant change of body is not very good. If there is any remedy?"" These rascals, they do not find the final remedy. They are busy with the temporary problems. Real problem they set aside. [break] ...simply being bewildered by the three guṇas, sattva - rajo -tamo- guṇa , they do not know the ultimate goal is Kṛṣṇa . They do not know it. That is stated in Bhagavad- gītā ."
Siddha-svarūpānanda; Jayapatākā; Siddha-svarūpānanda,"Siddha -svarūpānanda: It's better this way.; Let's go down this side, this way.; Siddha -svarūpānanda: [break] ...body when it's old and wears out, and yet they're spending all their energy...",Prabhupāda," No, he desires. He creates his body. Just like the, sometimes the Mohammedans, they think that tiger is the best life. Sera . Sera . Wa (?) sera haya . Means to become a tiger is the perfection of..."" You become sera . That's all. Kṛṣṇa gives... He is within the heart. ""All right, I'll give you chance. Become a sera . "" But when he becomes sera , he does not eat for months. You'll never find a sera very fatty. Because he cannot eat. Every animal knows, ""There is a tiger."" They avoid. By chance, he can hunt out."
Viṣṇujana,Farrow.,Prabhupāda, Eh?
Viṣṇujana,The farrow bird.,Prabhupāda, Yes.
Viṣṇujana,He'll call.,Prabhupāda," This is the position. ""You wanted to become a sera . All right, you become a sera . Jump over some animal and immediately suck his blood."" All facility is—the nails, the teeth-given. But is he happy? But everyone thinking that ""If I could become like this, I would have been happy."" So Kṛṣṇa gives all chance. ""All right, you become this."" This is transmigration. This is transmigration. [break] ...yathāndhair upa ... We are thinking something like that, and Kṛṣṇa is giving us chance, ""All right, you take this chance; you become like this."" Ye yathā māṁ prapadyante [Bg. 4.11 ] . But it will not make you happy. Therefore ultimately says, sarva - dharmān . ""You give up all this rascaldom. What I speak, you can accept. That is your dharma ."" Sarva - dharmān parityajya mām ekaṁ śaraṇam ... [Bg. 18.66 ]. That will be beneficial for you, the most confidential instruction. There is that story that one old woman, she was suffering. And she had to collect woods from the forest and sell in the market. So one day, how do you say, she was praying to Kṛṣṇa , or God, that ""Kindly help me. I am in very poverty-stricken."" So one day, she was carrying that load of fuel. It fell down. So nobody was there to help him. So she began to cry, ""Who will help me?"" So she began to pray to God ""Kindly help me."" And God came: ""What do you want?"" ""Who are you, Sir?"" ""I am God."" ""Kindly help me to take this burden on my head."" Yes. ""All right."" From God, she's asking, ""Please help me to get this burden on my head."" That's all. So everyone is going on, ""Let family be very happy, my son be married. He may... Let him pass MA examination."" But it is the same thing, ""Give me the burden on my head."" This is the prayer. Mūḍhāḥ . Na māṁ prapadyante mūḍhāḥ [Bg. 7.15 ] . The life was meant for understanding Kṛṣṇa and worship Him, and he's asking, ""Give me the burden on my head."" Therefore mūḍha , rascal, fool. He's asking something which will never make him happy, even by merging into the effulgence, Brahman effulgence. It will never make him happy. But he does not know. Therefore he's mūḍha , rascal."
Siddha-svarūpānanda,Siddha -svarūpānanda: That's a very clear example.,Prabhupāda, Yes.
Siddha-svarūpānanda,Siddha -svarūpānanda: Very clear.,Prabhupāda," Yes. Everyone is asking, ""Please help me to get this burden on my head."" Everyone is asking. [break] Kṛṣṇa mantra means asking nothing from Kṛṣṇa , but only praying, ""Please engage me in Your service."" This is Hare Kṛṣṇa . Now let him engage, whatever service He likes. I don't dictate that ""Give me this service."" That is also sense gratification. As soon as I'll say that ""Engage me in this type of service,"" that is also sense gratification. When one surrenders fully that ""Engage me in Your service in whatever way You like,"" that is pure devotion. You cannot dictate Kṛṣṇa . Because He wants, sarva - dharmān ... ""First of all surrender, then I will give you. I will allot what kind of service you can do."" Sarva - dharmān parityajya mām ekaṁ śaraṇam , ahaṁ tvāṁ sarva ... [Bg. 18.66 ]. But if I dictate, then Kṛṣṇa will be..., ""All right, you take this."" Then you again become unhappy. Don't dictate Kṛṣṇa . Be dictated. That is happiness. But everyone is dictating, ""Please give me this. Give me this. Give me that. Give me that. Give me this."" Why should you dictate Kṛṣṇa ? As soon as I dictate, that is my sense gratification. That is not pure devotion. Anyābhilāṣitā- śūnyam . Anyābhilāṣitā- śūnyam [ Brs. 1.1.11] . Make zero all your desires. It doesn't matter, this desire or that desire. Any kind of desire. Whatever you desire, that is material. Anyābhilāṣitā- śūnyam [Cc. Madhya 19.167 ] . That is pure devotee."
Devotee,That takes practice.,Prabhupāda, Eh?
Devotee,"That takes practice, to stop desiring for oneself.",Prabhupāda, Yes. And therefore...
Devotee,You have to practice...,Prabhupāda," ...the practice is that you should simply desire what your spiritual master says. Don't desire yourself. Yasya prasādād bhagavat - prasādaḥ **. If you fulfill the desires of your spiritual master, then Kṛṣṇa will be pleased."" Because he's the representative, the immediate representative, boss, if you satisfy him, the master, supreme master, is also satisfied. If he gives report, ""This clerk is doing nice,"" that is sufficient. Yasya prasādād bhagavat - prasādaḥ **. This is the injunction."
Jayapatākā,"So human life was no advantage. Only because you have come, now it can be advantage.",Prabhupāda, Eh?
Jayapatākā,"Human life is no special advantage. Only if you come, the spiritual master comes, then it can be some advantage.",Prabhupāda," Yes. Therefore Vedic injunction is gurum eva abhigacchet: ""You must go to a bona fide spiritual master if you want to make your life perfect."" There is no question whether I shall go or not. ""You must!"" That is the beginning of human life. Otherwise animal life. He has no spiritual master. He's not going to obey anyone. He's working in his own whims. That is animal life. Real life here begins."
Devotee,(Bengali),Prabhupāda, (Bengali)
Devotee,They're self-interested. They're making money and forgetting the public.,Prabhupāda," That's all. Godless. They must be like that. Gandhi was a student of Bhagavad- gītā — never taught about Kṛṣṇa . This is his knowledge of Bhagavad- gītā , Bhagavad- gītā without Kṛṣṇa ."
Devotee,"They want the material after killing the source. After killing the cows, they want milk. After...",Prabhupāda," Gandhi was approached by the Hindus that ""You are doing so much for the Mohammedans. The Mohammedans are obedient. So why don't you stop this cow killing?"" ""How can I interfere with their religious?"" Just see."
Devotee,This is...,Prabhupāda," ""Cow killing is religion."" And he was such a fool that if somebody said that ""Cutting the throat of others is my religion,"" he would allow, ""Yes, you can do that."""
Jayapatākā; Devotee,"Go this way, Śrīla Prabhupāda? [break]; ...proof that the cause of cancer is beef-eating.",Prabhupāda, Yes.
Devotee,I have...,Prabhupāda, Leprosy. Leprosy is also due to beef-eating. Get it folded.
Siddha-svarūpānanda,"Siddha -svarūpānanda: The third greatest cause of accidental death in, in the world...",Prabhupāda, Is intoxication.
Siddha-svarūpānanda,Siddha -svarūpānanda: It is...,Prabhupāda," Yes, this drunkard. Especially the drunkard, they collide."
Siddha-svarūpānanda,Siddha -svarūpānanda: I think that's the second.,Prabhupāda, Oh.
Siddha-svarūpānanda,"Siddha -svarūpānanda: But the, this one is the choking on meat at dinner table and dying, suffocating. It's very wide-spread. And in restaurants, while they're eating meat, they get so into eating, they want to swallow to eat the next piece. So they, before chewing enough, they have a big lump of meat in the mouth, and they swallow and they choke. They get caught. So in many big restaurants, they have these fancy forks like this that if somebody's choking, they go to the table, a very nice waiter, and he sticks the thing down the throat and pulls out the meat. Then the person can continue eating. But it is a very high cause of death in the world. They choke on meat.",Prabhupāda," Just like dog. Dog, if you give..."
Siddha-svarūpānanda,Siddha -svarūpānanda: Because the teeth are not made...,Prabhupāda, ...meat. (makes sound) Like dog. Yes.
Siddha-svarūpānanda,"Siddha -svarūpānanda: But the dog doesn't choke so much. Well, sometimes they choke, though.",Prabhupāda, Dog is a natural animal.
Siddha-svarūpānanda,Siddha -svarūpānanda: He has teeth for meat.,Prabhupāda, Yes.
Siddha-svarūpānanda,"Siddha -svarūpānanda: The human beings, they don't have so much teeth for meat. So they're trying to eat, and then they choke.",Prabhupāda," [break] ...sness movement is all-embracing, all problems. People should carefully study and take it. Then they will be happy. Otherwise all plans are nonsense, the scientists, the philosophers, the... All rascals. Māyayā apahṛta - jñānāḥ . They appear to be very learned, but māyā has killed them already. They have no knowledge. Māyayā apahṛta - jñānāḥ . Just see. Why? Āsuraṁ bhāvam āśritāḥ [Bg. 7.15 ] . Life is created by God. They'll not accept. ""Life is created from dirt."" That's all. Māyayā apahṛta - jñānāḥ . Where is the instance that you create life by chemicals? ""That we shall see in the future."" Kick him immediately on his face with boot. Rascal. Will you accept any check, ""It will be paid in future?"" Will you accept? So why shall I accept this rascal's theory? If somebody gives me check, one million dollar, payable three hundred years after, shall I be inclined to accept such check? So why these fools accepting this post-dated check?"
Viṣṇujana,"Prabhupāda, they say they've already done so much. The scientists will say...",Prabhupāda, What they have done? What they have done? Why people are starving? What you have done?
Viṣṇujana,But they'll say we have created so much machineries and gone to the moon.,Prabhupāda," You cannot eat machine. You produce. You produce rice, wheat in the machine. What you have done? You have simply misled the people that instead of tilling the ground, they have come to machine, and there is no food."
Siddha-svarūpānanda,"Siddha -svarūpānanda: Yes, yes.",Prabhupāda," You have done this. You have, on the false plea that ""We'll give you five hundred rupees salary. You come in the city and be engaged."" Oh, he saw, ""Oh, I am simply producing my food. If I get five hundred rupees, then I'll go to cinema, I'll have a good dress."" Now there is no food even. You have done this. That's all. What is the benefit of this machine. Machine benefit is that we were purchasing, when there was no so much machine, in our childhood, three rupees, four annas per mound, first-class rice. Now we are purchasing one Kg."
Devotee,Ten rupees Kg. For one rupee (indistinct) first-class wheat.,Prabhupāda," Just see. So if one is rascal, they will be misled by this. Otherwise, any sane man will not accept. They say that, ""We have done so much."" What you have done? You have done this. At least in India, the effect of machine and factories: that there is no rice, no food."
Devotee,With the machines they're mixing stones in the rice.,Prabhupāda, Eh?
Devotee,"With machine help, they're mixing stone in the rice.",Prabhupāda," That's it. That's it, that you cannot get. Oh, you have done so much. But India is not meant for machine. These rascals, they do not know. India is, India's culture is plain living, high thinking. You require some food. Produce food, and take it, and chant Hare Kṛṣṇa . But they'll not accept, ""Oh, this is primitive. Nowadays we have got... We must have the motor car, motor tire ."""
Devotee,Farmer sees that a job of three hundred rupees and runs away to city. He will not work in the field. Then there will be no food.,Prabhupāda," Yes. Because they require. They require. The cow is being killed, and that's all. That is sufficient food for them."" And let the farmers work for me, for bolts and nuts and motor tire . We make huge profit."" You see. You are making profit, but other..."
Devotee,"What is the use of that profit, Prabhupāda Mahārāja , when don't get even for eating, no clothing, no eating? Only profit... What profit will be beneficial?",Prabhupāda," No, but they don't care for others. But they're having wine and women with their black market money. That's all. They're satisfied. They do not know... (end)"
Guest,(Bengali),Prabhupāda, [break] (Bengali) Hare Kṛṣṇa and dance. Do this. [break] ...and for constructing four buildings like that. [break] Kṛṣṇa took part in politics. So what is His politics? What is His sociology? What is His culture?
Guest,Support the right minority?,Prabhupāda, Eh?
Guest,Support the right minority?,Prabhupāda," There is no question of minority. Support the right person. Kṛṣṇa supported Mahārāja Yudhiṣṭhira in place of Duryodhana. So formerly it was monarchy. That is perfect politics. This democracy is useless. It has proved. One man, the king, he should be properly educated how to rule, what is the aim of ruling, how the people will be, I mean to say, culturally elevated, what is that culture. [break] There was a consulting board of learned brāhmaṇas and saintly persons. They would advise the monarch how to rule."
Jayapatākā,This is... This is the land here.,Prabhupāda, This is the land?
Jayapatākā; Śyāmasundara,"Yeah, we're walking over it. We're going through... [break]; Elizabeth, in England, she's got a..., what she calls a ""think-tank"" or a board of advisors who meet and advise her on different policies.",Prabhupāda, Privy council.
Śyāmasundara,"Something like that. It's called a ""think-tank"". She's named it. It's presided over by Lord, Lord Goodman.",Prabhupāda," No, no. The thing is, unless the people are Kṛṣṇa conscious, either this board or that board, that will not help. First of all, people should know what is the aim of life, what is culture, how the human activity should be directed. The people should know first of all this. Otherwise, changing from frying pan to the fire, it is useless. That is going on. That change, revolution, is going on. Just like the Russian people, they changed the Czarist government into communist government, revolution, but still, they're unhappy. They're trying to change by another revolution. This is going on. Punaḥ punaś carvita - carvaṇānām [SB 7.5.30 ] . This is described in the śāstra as ""chewing the chewed."" Or the same simple philosophy: ""This side of stool is better than that side."" So he keeps the whole thing, stool. ""This side, the dry side, is better and the moist side, wet side, is bad."" This is no philosophy. It, it must not be stool. It must be gold. Then it is all right, this side or that side. That philosophy, that the dry side of stool is better than the wet side, this will not help. So first, first of all, human society must know what is the aim of life. Na te viduḥ svārtha- gatiṁ hi viṣṇum [SB 7.5.31 ] . We are part and parcel of God, Kṛṣṇa , Viṣṇu . We are suffering on account of our relationship with God. This is the cause of our suffering. Then we have to make plan how to revive our lost relationship with God. Then the... Everything is there in the Vedic literature. All directions are there. So we have to... Just like when we are in danger, we consult some learned man or physician or a lawyer, similarly we have to consult the Vedic culture, how perfect it is. This way?"
Jayapatākā,Yes.,Prabhupāda," Then everything is there. You haven't got to manufacture anything. And the Bhagavad- gītā is the gist idea of all Vedic culture. And our propaganda is to establish that gist idea of Bhagavad- gītā . That is Kṛṣṇa consciousness movement. So therefore I am asking. ""What is the politics of Kṛṣṇa ?"" Kṛṣṇa's politics was to have a king of the world which..., Kṛṣṇa conscious, a devotee of Kṛṣṇa . That is the Kṛṣṇa's politics. He wanted to replace. So the first politic is to replace these so-called leaders, demons. Hare Kṛṣṇa . Where is that land? This land?"
Jayapatākā,We already walked over it.,Prabhupāda, Oh.
Jayapatākā,You're talking. So I don't want to interrupt.,Prabhupāda, Oh.
Jayapatākā,But on the way ba ... It's that land over there.,Prabhupāda, So where are... Where are those boys? That Svarūpānanda?
Jayapatākā,"They may have gone back to the temple now. This land... I'm sending... Because land, different land takes different time, so I'm sending both information out for this land here-It goes from this path, this, over to the other side of the barley, right to the river edge, twenty bighās— or this one, ten bighās, whichever is first. This is more fertile. For agriculture, this one...",Prabhupāda," So which one, like you like?"
Guest,"Whichever one is possible. As he says, ""First come, first served.""",Prabhupāda," All right. So you arrange. During stay, arrange something."
Guest; Śyāmasundara,"Something available here also?; This is the old river bed, isn't it?",Prabhupāda, Hmm?
Jayapatākā,Yes. [break],Prabhupāda, ...will help us. (Bengali) So you purchase on this side land.
Jayapatākā,This land is for sale with this dhow (?) here. (end),Prabhupāda," He's situated as Paramātmā , antaryāmī , everywhere, aṇḍāntara- stham , within the universe as Garbhodakaśāyī Viṣṇu , within the heart of everyone, and even within the atom. Then how we can walk? Kṛṣṇa is within the atom. How we can walk? If somebody says, ""How we are walking on the road?"" Because in the atom there is God. Within... Aṇḍāntara- stha - paramāṇu -cayāntara- stham [Bs. 5.35] ."
Guest (1),In everywhere...,Prabhupāda," So this, this is combination of paramāṇu , atom. So how we can walk? People may question like that, that ""In, within the paramāṇu , there is Kṛṣṇa . How we are walking on this road?"" So this question you should all understand very... You know that upon the mandira , we do not stay. Just like our Vṛndāvana mandira is being constructed. There is no residential quarter upon the mandira . Similarly, when the mandira will be constructed, we are not so fool that we'll show, we'll go and stay upon the mandira . But mandira is not constructed yet. So what shall we do?"
Guest (1),Worship should go on.,Prabhupāda," Yes. Therefore we have temporary situated mandira in the same building. We cannot stop our worship. That is not possible. Because one cannot go upon the mandira , because the Lord is now being worshiped within the residence, it does not mean we can stop His worship. Worship must continue in any condition, apratihatā , without being impeded by any rules and regulations. This is called rāga - mārga . Vidhi - mārga , and there is rāga - mārga . Vidhi - mārga means under rules and regulations, and rāga - mārga means out of love. That is another thing. There is another instance. Govinda was personal servant of Caitanya Mahāprabhu . So after His dinner, Govinda used to give Him massage on the leg. So one day Caitanya Mahāprabhu fell down on the ground and began to sleep on the door. So Govinda was to give massage to His leg. So he crossed Caitanya Mahāprabhu , and began to..."
