Question Speaker,Question Text,Answer Speaker,Answer Text
Girirāja,"""They then returned to Lord Kṛṣṇa and Balarāma and explained everything that had happened. After hearing their statements, the Supreme Personality began to smile. He told them that they should not be sorry for being refused by the brāhmaṇas.""",Prabhupāda," And this is the position of the preacher. Even if you are disappointed, you should not stop your preaching. You should go on with your business."
Girirāja,"""He told them that they should not be sorry for being refused by the brāhmaṇas. Because that is the way of begging. He convinced them that while one is engaged in collecting or begging, one should not think that he will be successful everywhere. He may be unsuccessful in some places but that should not be cause for disappointment.""",Prabhupāda," [break] ... tama dāsa Ṭhākura has said, karma - kāṇḍa jñāna - kāṇḍa , kevala viṣera bhāṇḍa . Bhāṇḍa . It is a pot of poison. Karma - kāṇḍa , karma - kāṇḍa process and the jñāna - kāṇḍa process, karmīs and the jñānīs... Karma - kāṇḍa jñāna - kāṇḍa , kevala viṣera bhāṇḍa : ""Both of them are poison pots."" Jñāna - kāṇḍa also."
Dr. Patel,"But jñāna , you say, bhakti or jñāna automatically comes up.",Prabhupāda," No, bhakti does not depend on jñāna , but jñāna depends on bhakti . Without bhakti , one cannot get liberation simply by jñāna . But if one develops bhakti , automatically he gets jñāna . Karma - kāṇḍa jñāna - kāṇḍa , kevala viṣera bhāṇḍa . Viṣera bhāṇḍa , amṛta baliyā yebā khāya . If one mistakes that this is the pot of nectarean, ambrosia, then what is the result? Nānā yoni sadā phire : ""He remains within the cycle of birth and death."" Nānā yoni sadā phire , kadarya bhakṣaṇa kare . And if he gets the body of a hog and dog, then he eats all the abominable things. Nānā yoni , tāra janma adhah - pāte yāya . So he condemns his human form of body in this way, spoils. So one should not be attached to karma - kāṇḍa , jñāna - kāṇḍa . Anyābhilāṣitā- śūnyam [ Brs. 1.1.11] . [break] The inhabitants there, they can go from one planet to another without any aeroplane. That is Siddhaloka. Hm. Go on."
Dr. Patel,"The highest is Satyaloka, no?",Prabhupāda," Brahmaloka. No highest Brahmaloka, where Lord Brahmā lives."
Yaduvara,"""There was beating of drums, and being inspired by godly feelings, the residents of Gandharvaloka began to play on their tamburās to please the Lord. Once when he was..."" [break]",Prabhupāda," ...what is God. Such innocent. You see? They thought, ""Might be some demigod."" That's all."
Yaduvara;,"""O Nanda Mahārāja , we are now in great doubt. Your son Kṛṣṇa must be one of the demigods."" [break]",Prabhupāda, ...the Supreme Personality of Godhead.
Yaduvara,"""And he saved all honest men from the hands of the dishonest."" [break]",Prabhupāda," ... Vṛndāvana inhabitants, they are always anxious how to save the cows, always. They are connected with cows."
Yaduvara,"""Thus ends the Bhaktivedanta purport of the Twenty-sixth chapter of Kṛṣṇa , Wonderful Kṛṣṇa ."" [break]",Prabhupāda," ...only Indra , even an ordinary person, he thinks he is all in all."
Dr. Patel,"When he does work, he says, ahaṁ kartā , ahaṁ kartā .",Prabhupāda," Ahaṅkāra -vimūḍhātmā kartāham iti manyate [Bg. 3.27 ] . They think like that, the mūḍhas. Ahaṅkāra -vimūḍhātmā. Vimūḍha . Not only mūḍha , vimūḍha ."
Dr. Patel,Viśeṣa - mūḍha .,Prabhupāda," Viśeṣa . But... you are right. ""Specifically mūḍha . "" [break]"
Dr. Patel,Janma karma me divyam [Bg. 4.9 ] .,Prabhupāda, No. Yaṁ brahmā varuṇendra- rudra - marutaḥ stunvanti divyaiḥ stavair vedaiḥ sāṅga - pada - krama ...
Dr. Patel,Dhyānāvasthita- tad - gatena manasā ... [break],Prabhupāda," ... asura also, they cannot understand, and these so-called scholars, they are interpreting Kṛṣṇa . Go on. Vimūḍha . Māyayāpahṛta- jñānāḥ [Bg. 7.15 ] ."
Dr. Patel,"All the Vaiṣṇava books, all... [break]",Prabhupāda, Vaiṣṇava ācārya ...
Dr. Patel,"No, Vaiṣṇavas, all quotes come from Vaiṣṇavas. They all believe in the form.",Prabhupāda, Yes.
Dr. Patel; Yaduvara,"Then I was not able to grasp it, though I am born Vaiṣṇava from my right birth. [break]; Lord Indra is saying that Kṛṣṇa is so merciful that without punishing the offenses of the demons, that He devises means so that their false prestige is subdued. How is that? How does he devise means without punishment.",Prabhupāda," This is the device, that he agitated Indra , and he came down and surrendered unto Him. This is the device. Not directly punishing. That he came to understand what is the value of Kṛṣṇa ."
Yaduvara,"""My dear Lord, You are the supreme father, supreme spiritual master and supreme king."" [break]",Prabhupāda, ...accepted by Indra is all described in the Bhagavad- gītā . [break] ...composed after Mahābhārata.
Yaduvara,"""Due to my gross ignorance, I created great disturbance in Vṛndāvana by sending torrents of rain and heavy hailstorms."" [break]",Prabhupāda," ...first of all, being observed by father of Kṛṣṇa . It is very important. [break] ...necessity of tapasya , if one worships Kṛṣṇa ? Nārādhito yadi haris tapasā tataḥ kim . And after austerities, if he does not know Kṛṣṇa , then what is the value of his tapasya ? [break] ...imitating here, that is lust."
Dr. Patel,Anything with a view on the sex is lust.,Prabhupāda, Yes. That is lust. Here everything is lust. Center is lust. Yan maithunādi- gṛhamedhi - sukhaṁ hi tuccham [SB 7.9.45 ] . The central point is sex.
Dr. Patel; Dr. Patel,"What this...? (end); No, no, but even for Vaiṣṇavas, sāṅkhya ...",Prabhupāda," Sāṅkhya is required, but the cause of sāṅkhya must be understood, cause of all causes. Sāṅkhya philosophy is our philosophy, Vaiṣṇava , because it was enunciated by Kapiladeva. Later on, the atheist sāṅkhya , they wiped out God. [break] Na brahmā na rudra ca . These are the Vedic mantras. [break] Koṭi - brahmāṇḍa - vigraha . Koṭi - brahmāṇḍa - vigraha . Innumerable universes are there in the body of Kṛṣṇa . [break]"
Dr. Patel,"Now they are not... The government is telling lies, that some people have come to work, and they have... [break]",Prabhupāda," ... bindu sama , suta mitā ramaṇī samāje , sohe viṣere mana , tahe samarpala, ābrahma yuga hobo kono kāj. (?) This is Vidyāpati's song, that ""We are seeking water in the desert."" Taṭala saikata. Saikata, means the sandy beach and very hot. So then water is required. But we get little water. What is that? Suta mitā ramaṇī samāje . In the society, friendship and love, we are seeking that happiness, and it is exactly like seeking water in the desert. Although there is little happiness, but what is the comparison? Vāri bindu sama . I want water, but it is a drop of water. Vāri bindu . Hare Kṛṣṇa . So when there is requisition of water like seas and ocean, what this one drop will do? He admits there is little happiness, but this happiness is nothing that we want in comparison. Hare Kṛṣṇa . Taṭala saikata, vāri bindu sama , suta mitā ramaṇī samāje , tahe viṣere mana , tahe samarpala, havana yughamala na kāj. Mādhava āmāra pari nama nirasa (?): ""Therefore, my Lord Kṛṣṇa , I see my future is hopeless, and therefore I surrender unto You. There is no other way."" Mādhava āmāra pari nama nirasa , tuhu jagad taraṇa , dīna dayāla, ataeva tohari varosa (?), that ""I have no other hope. Simply hope you are."" Hare Kṛṣṇa . [break] ...is better, the breathing air. That side is..."
Indian Man (1),"Now the wind is changing, this side.",Prabhupāda, This side is pūrva .
Indian Man (1),"No, this is east. This is north.",Prabhupāda," Oh, north. So here, this is pūrva ..."
Indian Man (1),The rains will come from southwest.,Prabhupāda," Southwest, oh, yes."
Dr. Patel,It has not changed as yet. Still... [break],Prabhupāda," ...even the sun, what to speak of other things, even the sun, the central point of this universe. Yasyājñayā bhramati saṁbhṛta - kāla - cakraḥ . It is also rotating in the orbit by order of Govinda . Govindam ādi - puruṣaṁ tam ahaṁ bhajāmi **. Hare Kṛṣṇa . [break] ... nama utila pi- asa nīre (?). Now, if you live on the ocean and if you are thirsty, you cannot drink a drop. You will have to die. Nīra kari vasa (?). Although the same water we are drinking. Is it not, Dr.?"
Dr. Patel,"Yes. Water, water everywhere, not a drop to drink.",Prabhupāda," Yes. The same water drinking, but when it is purified by the arrangement of Kṛṣṇa ... You cannot drink. And still, you are scientist. (Hindi)"
Dr. Patel,One boy from engineers' school of technology here in Bombay has found out a method of...,Prabhupāda, That is another nonsense. He will turn one cup of seawater into sweet water and it will cost some hundreds of rupees.
Dr. Patel,"That is right, but these fellows, they have found some natural way.",Prabhupāda, Well.
Dr. Patel,"He is passing it through this banana leaf, some very rational method.",Prabhupāda, Banana leaf. So that also required by God's mercy.
Dr. Patel,"Nobody says that he does himself. If he says, he's a fool. But what I mean to say is from that way... And the government of Ceylon has (indistinct) the world over, this method. There was a big row about it. This boy approached the Bombay Municipal Corporation (indistinct) they say... [break]",Prabhupāda, ...scientist.
Dr. Patel,"Scientist, that you say. Einstein never claimed that he is... Einstein was a great bhakta . Einstein is the grandfather...",Prabhupāda, Yes.
Dr. Patel,"...of the modern science. He never claimed that anything can be done by man. Einstein has always said it is God who does it. Still you say that ""Scientists are atheists. Fight them""?",Prabhupāda," No, no."
Dr. Patel,I don't think that is right statement.,Prabhupāda," No, no, there are many scientists like..., but generally they think in their way. Just like modern scientists, they are trying to prove: from chemicals, life."
Indian Man (2); Dr. Patel,"Jagadish Candra Bose, he was a great scientist. (Hindi) He can answer how many wise (?) He can answer.; There is no question of... He cannot make even a grain of sand. Scientists, if they say that they are making, that is wrong. They are finding out what is already admitted.",Prabhupāda," No. Some of them say, ""Now there is no need of God. Science is everything."" Even Dr. Radhakrishnan was saying in a meeting."
Dr. Patel,"No, what is science?",Prabhupāda, Science means...
Dr. Patel,Science means knowledge. And knowledge is there. Knowledge means God.,Prabhupāda, Practical...
Dr. Patel,But we are trying to honor the knowledge which we have not now known...,Prabhupāda," That knowledge is described in the Bhagavad- gītā . Vāsudevaḥ sarvam iti sa mahātmā sudurlabhaḥ [Bg. 7.19 ] . When one understands, ""Oh, here is the original source of everything,"" vāsudevaḥ sarvam iti sa mahātmā sudurlabhaḥ [Bg. 7.19 ] , that is greatest scientist. And how this knowledge comes? Bahūnāṁ janmanām ante [Bg. 7.19 ] . They are struggling for the ultimate knowledge. So struggling many, many births after births, when, by the grace of Kṛṣṇa , he comes to the real knowledge, then he admits, vāsudevaḥ sarvam iti sa mahātmā sudurlabhaḥ [Bg. 7.19 ] ."
Indian Man (3),(Hindi conversation) [break],Prabhupāda," ...and police is controlling by beating them. Now they will go to the office, and again they will come in that way. And coming home for two cāpāṭis. You see? That's all."
Dr. Patel,They reach their office at two o'clock.,Prabhupāda, Just see. And again... (Hindi)
Dr. Patel,Modern civilization is the civilization of the indriyas. We want a civilization...,Prabhupāda," No, no, indriyas... Material civilization means indriyas, but it should be so organized. That is the Vedic principles, that you enjoy your indriyas in a systematic way so that you may not fall again, another difficulty. That is the Vedic way."
Dr. Patel,The whole background of that modern civilization is indriyas.,Prabhupāda," Yajñārthe karmaṇo 'nyatra loko 'yaṁ karma - bandhanaḥ [Bg. 3.9 ]. That civilization is yajñārthe karma . You work, but for yajña . Yajña -śiṣṭāśinaḥ santo mucyante sarva - kilbiṣaiḥ . (Hindi) ...modern science... (Hindi) ...This is mistake."
Indian Man (4),This is not the ultimate solution.,Prabhupāda," No, that is not."
Dr. Patel,"Ultimate solution, nobody knows.",Prabhupāda, 
Dr. Patel,"Bombay also is hell. Bombay, nobody inhabited this island till the Britishers came, and they created this spot. The importance of Bombay backward... Otherwise so far hell is concerned they are both place. Best is Bangalore in India. Best.",Prabhupāda," [break] Doctor can manage securing medicine, distributing. That is another thing."
Indian Devotee (5),"Actually, from his talk I could understand that he actually doesn't want to do much. He said he will not be able to come and examine the patients even.",Prabhupāda, Then?
Indian Devotee (5),"He says, ""You try to find some other doctor."" He told me, ""You find out names and addresses of the local doctors, and we'll pick one of them.""",Prabhupāda," No, no, we cannot divert our attention. It is not possible. Say, ""No."" You can say that ""We consulted Prabhupāda. He said, 'At the present moment, unless our building is there, we cannot accept any other extra business.' "" Tell him like that. [break]"
Yaśomatīnandana,I suggested. [break],Prabhupāda," For nothing. No, no, that is not possible. These are for the karmīs, bodily concept of life. If government has got so many hospitals, what is the use of opening a teeny hospital by us? Vivekananda policy—to collect money by school and hospital. So you can tell him that ""At the present moment, we are concerned about the sanction of the building and temple. So when the building is there, then we can consider, not at the present moment. We require money. We collect for this purpose. We cannot divert attention for medicine and other things."""
Indian Devotee (5),Actually I could gather that he just talked because he also said that we should train up some devotees to do bandage and other things like that.,Prabhupāda," (laughs) No, no, this is not."
Bhāgavata,"Bhāgavata : We do all the work, and he gets advertised as a great charitable doctor.",Prabhupāda, That's it.
Bhāgavata,Bhāgavata : That he has opened the clinic.,Prabhupāda, Daridra - nārāyaṇa - sevā . We are not all these false things. Doctor Ghosh is also after daridra - nārāyaṇa - sevā . [break] We will collect medicine. Our... We shall pay for the expenditure. Our men will be engaged for bandaging. (laughs) Nonsense.
Bhāgavata,Bhāgavata : And the preaching stops.,Prabhupāda," Ah. They cannot understand what is the meaning of this Kṛṣṇa consciousness. They are such dull headed men. They have no brain to understand. They are coming down again. Just like the dog's tail. Know, dog's tail. You may, however grease it... (laughs) They are hearing about this Kṛṣṇa consciousness. The aim is the body, the dog's tail. They are hearing daily about Kṛṣṇa na ..., but they cannot understand. It is very difficult. These karmīs... Now they say... Because we are reading this Bhāgavatam , now gradually they dispersed. Gradually they dispersed. They are not interested. Hare Kṛṣṇa . And if you talk politics and all nonsense, oh, they will gather."
Bhāgavata,"Bhāgavata : [break] ...take Caraṇāravindam from the hospital. So before we left, we had kīrtana . And immediately all the patients became happier.",Prabhupāda, Just see.
Bhāgavata,"Bhāgavata : The whole attitude was very dull and unhappy and morose, that ""Oh, we are in the hospital. My body, my body..."" As soon as we had the kīrtana , they all got out of the bed and they came and stood around and they watched and some were clapping and chanting.",Prabhupāda," Just see. Immediately life. Oh, just try to understand how much great responsibility you have got."
Bhāgavata,Bhāgavata : They all appreciated that we made this kīrtana .,Prabhupāda, Even the Russians appreciated. (aside:) Don't push it in my mouth.
Satsvarūpa (?),"Oh, I'm sorry.",Prabhupāda," That's all right. [break] ""...bright-faced."" [break] They are surprised to see the American boys. ""Are you Americans?"" Do they not question? Yes. Completely changed. They cannot recognize. Is it not?"
Devotee; Bhāgavata,Yes. (Śrīla Prabhupāda laughs); Bhāgavata : They are only used to seeing the hippies.,Prabhupāda, Yes.
Bhāgavata; Girirāja,"Bhāgavata : With beard and the hair, dirty.; My parents telephoned last week, and at first they couldn't recognize my voice. They couldn't believe that it was me.",Prabhupāda, Then?
Girirāja,Kṛṣṇa consciousness has changed the...,Prabhupāda," So your father said that ""I could not..."""
Girirāja,"Yes. He said, ""Are you sure it's you?""",Prabhupāda," (laughs) Just like a lawyer. (laughter) Hare Kṛṣṇa . [break] Mother is also very nice. Unless father and mother is nice... I told your mother also. Hare Kṛṣṇa . [break] ...she become beautiful, now there is lusty desire."
Girirāja,"(reading) ""She frankly proposed to Kṛṣṇa , 'My dear hero, I cannot leave you...' """,Prabhupāda," She was a prostitute. She was a prostitute but engaged in Kaṁsa's service. In India the prostitutes are engaged as maidservants in respectable houses still. During daytime they serve in some house, and at night they become prostitute. There are many prostitutes. One prostitute, when we were boys, she was coming to serve my mother as a lady barber. There is lady barber, for serving the ladies. And at night she was standing as prostitute. [break] ...a good relation with the neighborhood. There was no enviousness. ""She is doing her own business. That's all."""
Bhāgavata,Bhāgavata : So then it is looked on as a necessity in the society.,Prabhupāda," Yes. Prostitute is necessity. Otherwise these rascals, they will pollute all the woman. Therefore, for the rascals there must be some provision. Just like opening wine shop. It is not meant for everyone. But there are drunkards. Unless they get drinking, they will create some disturbance."
Bhāgavata,"Bhāgavata : So just like in Dvārakā there was prostitutes, and they were all devotees of Kṛṣṇa .",Prabhupāda," Yes. There are many devotees, prostitutes."
Bhāgavata,"Bhāgavata : So that was their service, not their service, but that was their work.",Prabhupāda, Yes.
Bhāgavata,"Bhāgavata : But, still they were devotees of Kṛṣṇa .",Prabhupāda," Yes, that is their profession, livelihood, but they are devotees. In Calcutta, there is a big temple. It is called Kāca -Kāminī's temple. Kāca -Kāminī means she was a prostitute, but she was kept by a very big businessman who was dealing in glass, mirrors and all... So he has made a temple for her with glass and mirrors. Therefore it is called kāca . Kāca means glass. Kāca -Kāminī. [break] ...have a dispensary. Dr. Ojha . He thinks in this way people can be saved. That is also necessary, but not as necessary as this Kṛṣṇa consciousness movement. Hare Kṛṣṇa ."
Girirāja,Chapter Forty-two. The Killing of the Elephant Kuvala... [break],Prabhupāda, We are speaking of Kṛṣṇa . No Indians are interested. Just see. (Hindi) Dr. Patel and his company. (Hindi) [break] Hear about the expedition to moon but not about Kṛṣṇa . What is that?
Devotee,It came off.,Prabhupāda," No, it is all right."
Devotee; Yogeśvara,"There's another one underneath. (end); Yogeśvara : ""It is explained in the Second Chapter that the living entity is transmigrating from one body to another just as one changes dress. This change of dress is due to his attachment to material existence. As long as he is captivated by this false manifestation, he has to continue transmigrating from one body to another. Due to his desire to lord over the material nature, he is put into such undesirable circumstances. Under the influence of material desire, the entity is born sometimes as a demigod, sometimes as a man, sometimes as a beast, as a bird, as a worm, as an aquatic, as a saintly man, as a bug. This is going on. And in all cases the living entity thinks himself to be the master of his circumstances, yet he is under the influence of material nature.""",Prabhupāda," So this is our... because we are developing a different consciousness... Different... Consciousness is one, but it is being colored under different circumstances. And therefore we have to accept a similar type of body. So if our consciousness is cleansed, then we do not undergo the circumstantial changes by different species of life. That is required. In the human form of life we can do that, not to associate with the modes of material nature, but associate with God. That we can do. And if we associate with God, then we become liberated from the clutches of māyā . Mām eva ye prapadyante māyām etāṁ taranti te . And our real business is how to get out of the clutches of māyā ."
Guest,Give up this staying here?,Prabhupāda, Yes.
Guest,How?,Prabhupāda, We have to take to Kṛṣṇa consciousness because such consciousness will help us to be free from the contamination of these different types of material consciousness and save us from transmigrating from one body to another. So we accept this different association on account of our strong propensity for sense gratification. Therefore we have to purify the senses so that the senses may be engaged in the service of the master of the senses. Hṛṣīkena hṛṣīkeśa - sevanaṁ bhaktir ucyate .
Devotee; Guest,"Your master, does he study Bhagavad- gītā ?; My master is a teacher of the science of the soul.",Prabhupāda, What is that science of the soul?
Guest,"Well, just like what you have been saying, purifying the senses and becoming in consciousness through a master, to know a way of purification by not..., living(?) properly and thinking properly.",Prabhupāda, The idea is purify the senses.
Guest,"And meditation, meditation. Being devoted, your life will be changed. The master teaches these things, purification. He has written also some books. When he came to America in 1967, I met him personally. And he initiated a group of people. And I was also aiming at that, being a vegetarian a few years prior to that. He accepted me and gave me initiation with the group. And, of course, he went back in about... He stayed in the States about twelve days then he came in Europe. Then he went back. I haven't seen him ever since. I have a picture of him. I carry a picture of him, the leader of, in our movement. (indistinct) meditating on the master. And I try to live up to it, to the teachings. Would you like to see that picture?",Prabhupāda," Yes. Yes, I have seen this gentleman. In Delhi I have seen him."
Guest,In New Delhi. And there are the five names of meditation on the back.,Prabhupāda, What is that?
Yogeśvara; Atreya Ṛṣi; Guest; Dhanañjaya,"Yogeśvara : I can't read it.; Niran, san , oṁkara , dvāroṁkāra, so 'ham, sat -nām.; Sat -nām. Those five names, according to your ways, position, you will be attracted to one of the names. Everyone has a center of power, energy, the way he taught us. Whatever you fear(indistinct), what particular name one(indistinct), some one that you're attracted to meditating on. (indistinct) dvāroṁkāra, so 'ham and sat -nām. I thought that I met a good master.; Dhanañjaya : Mr. O'Grady. Desmond O'Grady and some of his friends have just arrived. They'd like to come and see you and speak with you.",Prabhupāda, Yes.
Atreya Ṛṣi; Satsvarūpa,This is the Irish poet. (guests enter); Please sit down.,Prabhupāda, Hare Kṛṣṇa . Jaya . How are you?
Woman; O'Grady; Dhanañjaya; O'Grady,"Very well, thank you.; We are very well and very tired. We've been traveling a long, long way, a long road from Delhi.; Dhanañjaya : Desmond is a poet. He's written books also, published in London. And tomorrow he goes to Sicily to a convention of poets and writers, international conference for writers and poets. He's representing Ireland, he's coming from Limerick in Southern Ireland.; This is my friend, Michael Robert (indistinct) We are colleagues together since we teach literature, English literature. And this is another friend of ours who has just come from Greece. Everybody seems to be traveling within the last twenty-four hours. This is a young painter friend of mine, Bob Jackson, also from Ireland, whose first time in Italy, out of Ireland, and he's staying with me at the moment. He came back with me from Ireland just a few weeks ago.",Prabhupāda," We are also writing books, so many. You have seen our books?"
O'Grady,"I have seen some, yes, because some of the friends have come up and...",Prabhupāda," Some of the books, you can show him. Here is one book, Bhagavad- gītā ."
