Question Speaker,Question Text,Answer Speaker,Answer Text
SvarūpaDāmodara,"When I drove, so the stars were very shining in the sky very clear. [break]",Prabhupāda, Man-made rubbish. Although they have got machine. [break] What other things they can produce there?
SvarūpaDāmodara,From sand?,Prabhupāda, Yes.
SvarūpaDāmodara,"There is a compound that is called silicon carbide. That is, I think, it is very hard, as hard as diamond They make silicon carbide. I'm not sure but silicon carbide or tungsten carbide. They are used for cutting diamond. They are harder than diamond. Very strong, very hard. They combine this with carbon. It requires tremendous amounts of force to do this, high temperature, high pressure. (pause)",Prabhupāda, Anything eatables?
SvarūpaDāmodara; Brahmānanda,"(Laughs) No, not so far.; Future.",Prabhupāda," ""In future."" But God creates so many eatables from sand. Do you know?"
SvarūpaDāmodara,"The smaller birds, they are eating something from sand?",Prabhupāda," No, even for man. The cantaloupe, watermelon, they are produced in sand in large quantity.Kharmuja.(Bengali)"
SvarūpaDāmodara,Lemons also.,Prabhupāda," Not lemon. Watermelon. These are the products of the desert, as well as dates. Just like these date trees can grow in sand. (pause)"
SvarūpaDāmodara,"Śrīla Prabhupāda, yesterday'sBhāgavatalecture, the example that the hundred dollar bill, one hundred dollar bill. So if somebody picks up and takes it, he's a thief, and if somebody who just does not care...",Prabhupāda, Does not take it.
SvarūpaDāmodara,"Yes, he's also not good. And the one who takes up and says, ""Whose coin is this?"" Then he's good.",Prabhupāda," Yes, his service is better."
SvarūpaDāmodara,"Yes, but how about the one who picks up and he doesn't find the owner of the coins but he offers toKṛṣṇa.",Prabhupāda," No, he must find out. Because there are so many men, some of them must have lost that. So so far Kṛṣṇa's property is concerned, everyone knows, ""This is Kṛṣṇa's property."" There is no need of finding out.Īśāvāsyamidaṁsarvam[Īśomantra1].Just like everyone knows, ""This is American state."" Where is the difficulty to find out? That was an example, but so far things are concerned, we know that, as we know that this land belongs to the American state, similarly this is false. Actually, everything belongs to God. There is no difficulty to understand. You have not created this ocean. You have not created this land. You have created nothing. You are simply stealing. That is your business. So how you do not know that it belongs to God? Everyone should know. This is knowledge. If I create something, I must enjoy it. Rather, the Vedic injunction is that you do not enjoy anything which you cannot create. You do not enjoy anything which you cannot create."
SvarūpaDāmodara,So we cannot create anything so...,Prabhupāda," Therefore you cannot enjoy anything. You have to accept everything asprasādam.First of all you take sanction from the proprietor. Then you he will give... That is your business. Just like if I want to use this land, I have to take permission from the government, that ""I want this land. Give me permission."" So when government gives you permission you can use. Otherwise you will be criminal. You cannot say, ""Oh, there are so much land, let me encircle it with my fence and I live there."" No. Immediately criminal. You cannot do anything as you like with this ocean. Can you do? No you have to take permission from the government. Just like the fishing boats, they have got government permission. Otherwise they cannot. Therefore in theĪśopaniṣadit is said,tenatyaktenabhuñjīthāḥ[Īśomantra1].Tenatyaktena.""When it is sanctioned, when it is given to you, then you enjoy.""Māgṛdhaḥkasyasviddhanam.""Do not touch anyone's property."" This is Vedic injunction. So if everything belongs to God, how you can touch it without His permission? But they are rascals. They do not know who is God, where is God, how to take permission. They do not know. Therefore they become criminals. They are suffering. Encroaching upon God's property and therefore they are suffering. All these things are stated in theŚrīmad-Bhāgavatam.Everything belongs to God, and because we are sons of God, we can use the father's property. But not more than what I require. Just like in a family everything is father's property, and if you eat more, all the good things in the family, that is not allowed. You must take what the mother or the father gives you. That is your business. Similarly everything is God's property. Everyone, even the birds, beasts, everyone has right to use the father's property. Just like the birds. They will use. Just like they are picking up the small fishes. So as much they require, they are allowed, ""Take it."" But they are not making any stock for speculation. Man does that. As soon as there is some good harvest, ah, immediately they... [break]... problem. If everyone only takes as much he requires, there is no problem in the world. But he wants to take more. Just like you Americans, you have covered so many thousands of miles. And you don't allow anyone. ""No, you cannot enter. Here is gun."" What is this nonsense? It is God's property. Why do you disallow others. Let them come. So there is no question of over-population. There are so much land in Australia, in Africa, here in America, that ten times of the present population can be provided. God has provided. But these rascals will not allow. So there is overpopulation in India, in China and other places, and there is problem. They are trying to occupy more land but you will not allow. Therefore war, there is war. So we create problems. Otherwise God has supplied us enough. You can use it; as much as you like you can use what you have... They are creating trouble and the scientists giving them, ""Yes, I am giving you this chemical composition. You drop on the enemies' camp."" This is scientific research, to impel the rascals. (laughter) The rascals, rogues, they are trying to usurp other's property, and the scientists helping them. That's all. If you help one murderer, if you help one thief, then you also become criminal. Is it not? So they are helping one another, all these thieves and rogues. Therefore there is so much trouble in the world. They are all criminals.Stenaevasaucyate[Bg.3.12].One who does not recognize the proprietorship of the Lord, he is a thief. Find out, take statistics how many people recognizes God. Take statistic. Everyone will say, ""Eh! What is God, nonsense."" Everyone will say. Therefore they are in trouble. Bhaktivinoda Ṭhākura summarizes this fact:māyār bośe, jāccho bhese, Khāccho hābuḍububhāi, jīvkṛṣṇa-dās, e biśwās, korle to ār duḥkhonāi.As soon as you believe in God and accept yourself as eternal servant, there is no more problem. Everything is there. But they are being carried away by the illusory energy. Therefore they are under the control of time and nature.māyār bośe, jāccho...Just like these seaweeds are carried by the waves, ""Get out,"" similarly, one who is not accepted... There are other seaweeds, they are not thrown away, but these sea weeds, because little outside—thrown away. There are millions and millions of fishes, they are not thrown away, because they have surrendered to the sea, under the protection of the sea. The sea is protecting them. Just see. Similarly you surrender, you will be protected.Kṛṣṇasays that.Ahaṁtvāṁsarva-pāpebhyomokṣayiṣyāmimāśucaḥ:[Bg.18.66] Don't be worried. I will give you protection. You surrender unto Me."" And the scientists say, ""Oh, what is God. These are all nonsense, primitive ideas. Primitive."" They have become advanced. Therefore they should give up the idea of God. Now India is declared famine. What these leaders will do?"
SvarūpaDāmodara,They are fighting each other.,Prabhupāda," Kṛṣṇais asking you that ""You realize Me."" ""No, I cannot see You."" ""No, why cannot see you? Here is water. You are drinking water."" ""Yes."" ""I am water, I am the taste of the water. Why don't you see Me?""Prabhāsmiśaśi-sūryayoḥ:""I am the sunshine."" So who is not seeing the sunshine? Why the rascals says, ""I do not see God""? God says, ""I am here."" But he says, ""I do not see."" Liar. If you are in my front, if I say, ""Here I am,"" if you say, ""No, sir, I don't see you,"" what is this? Similarly, God is before you in the form of sunshine. Don't you see the sunshine? Why do you say that I do not see God? Who has not seen the sunshine? In the morning, very early in the morning, you see God. That isGāyatrīmantra.Oṁbhūrbhuvaḥsvaḥtatsaviturvareṇyaṁbhargodevasya.That is the obeisances to the sun.Savitṛ. Savitṛmeans,savitāmeans sun. In the very beginning we see God by the sunshine, and then think of the sunshine, how much potential it is, how everything is being produced by the sunshine. As soon as there is no sunshine, we become disturbed, so many business become disturbed. So why don't you understand that without God's presence, we cannot do anything. Where is the difficulty? Does it require any very big philosophical speculation? The rascal will not admit as directed in the Vedic literature. That is their fault. Otherwise where is the difficulty? No difficulty. What is the explanation of these scientists of the sunshine?"
SvarūpaDāmodara,"They say the sunshine is just some... Sun is a... There is a gaseous material, very hot temperature. So the rays are coming from the sun...",Prabhupāda," That's all right, but it can kill you. Is it not? So when did you accept with God? Sunshine, if it increases a little temperature, millions of you will be killed immediately. So why don't you accept sun as God? Therefore, according to Vedic principles, sun in the beginning is accepted as God."
SvarūpaDāmodara,They take it as a material object.,Prabhupāda," Then accept you are under its control. God means controller.Īśvara. Īśvarameans controller. God means controller. So He is controlling you. It is material but it is not under your control. You are under its control. So if anything is controlling you, that is God. God means controller. If you cannot seeKṛṣṇa, you can see the sun."
SvarūpaDāmodara,The sun is a product ofKṛṣṇa.,Prabhupāda," Yes, energy.Yac cakṣureṣasavitāsakalagrahāṇām.Sun is working under the order of... Just like if you don't see the managing director or the proprietor of a firm, the immediate boss who is controlling you, you have to obey. In the office or in the factory. Similarly, you cannot see directly God, but God's agent is working. Why don't you obey? God's agent is working? How it is working?Yasyājñayābhramatisaṁbhṛta-kāla-cakraḥ,exactly in time by the order ofKṛṣṇa, rising exactly in the time, without any deviation even by 1/10,000th part of a second, astrological calculation. Is it not? So how it is working? Under whose order it is working?Śāstrasays, ""By the order ofKṛṣṇa.""Yasyaājñayā.""Under whose order he is working,""govindamādi-puruṣam,""I worship thatGovinda."" Theśāstrais giving you information, that he is working under, he must be working under... Otherwise why it is so accurate, so punctual, unless there is some direction? Unless there is order of God, why this big ocean is so obedient, it is not coming here? Why don't you study like this? Where is the difficulty? There must be some direction that ""You Pacific Ocean, you are so big, that's all right, but you cannot come here. Remain up to this."" Otherwise why you are feeling so safety although in the front of a big ocean. If the ocean likes, within a second, he can finish us immediately. But she will not do, because there is order. Similarly sun. Sun is also moving under the order. You have to study like that. If you do not see God, see how God's order is being carried out. Then you will understand. Just like we do not see President Nixon. But you know there is direction, and the government is going is going on under his direction. That we can know. This is seeing of God to see how things are going on under His order. That is seeing of God. Just like from long distant place like this hills, we are seeing, but at the same time not seeing distinctly. You are seeing those, but you do not see the detail. Similarly you are seeing God by these things, but because you are not so powerful, you are not seeing Him in detail. But you are seeing God. You cannot say that ""I don't see God."" How can you say? These are the directions. You are seeing that things are going on under direction.Yasyājñayā.Therefore you have to...śāstrayonitvāt.TheVedāntasays, ""You have to understand God throughśāstra;""by the scriptures you have to understand.śāstrayonitvāt.Everything is there. Theśāstragives you direction. Therefore human being is meant to study theśāstras.Theśāstras,Vedic literature, is meant for the human being, not for the cats and dogs. If you don't consult theśāstras,then you remain a cats and dogs. That's all. Why you are taking so much trouble, writingśāstra,explaining to you? So that you may come to the real platform from the platform of cats and dogs. That is our mission. That is the duty of the spiritual master.Nānā-śāstra-vicāraṇaika-nipuṇausad-dharma-saṁsthāpakaulokānāṁhita-kāriṇau.The spiritual master is the most beneficent friend, he is giving you direction from theśāstra.Lokānāṁhita-kāriṇau:""He is the real welfare worker for the human society.""Lokānāṁhita-kāriṇautri-bhuvanemānyau śaraṇyākarau,rādhā-kṛṣṇa-padāravinda-bhajanānandena mattālikauvanderūpa-sanātanauraghu-yugauśrī-jīva-gopālakau.You seeśāstrais giving direction. So many lawyers are going to the school colleges to learn the government laws. Why they are taking so much trouble? Just to give people the direction that ""You work under this direction, you will not be in difficulty."" Similarly the spiritual master is the lawyer. He knows things as they are. He gives direction to the disciple so that he'll be happy. He will not be in trouble. This isguru-śiṣya-sampatti.Yasyaprasādādbhagavat-prasādaḥ**.By the mercy ofgurueverything is...Bhagavat-prasādaḥ,immediately, mercy of God. Oh, it is coming. No. Now, one should study the sprinkler. We'll give credit, ""Oh, who has manufactured this sprinkler?"" But there is no glorification for the original sprinkler, who takes all the water in the sky and sprinkles all over. There is no appreciation, rascal. You appreciate this thing."
SvarūpaDāmodara,"The engineers, they'll say, ""Oh, we have made this.""",Prabhupāda," Yes, but another engineer, such a big engineer, he has no appreciation. Just see."
Devotees,All glories to Śrīla Prabhupāda. (Prabhupāda gets in car),Prabhupāda, We simply ask that you appreciate the original engineer. That is our... (end)
SvarūpaDāmodara,"Recently I went to a lecture called ""The origin of life."" It was given by a well-known biochemist whose name is Professor Stanley Miller. He was talking about the origin of life.",Prabhupāda, Yes. So what is origin of life?
SvarūpaDāmodara,"He said that there are twenty amino acids, twenty of them which are necessary for the maintenance of life, the living entities. So he was discussing how these amino acids are formed before the dawn of creation, and he had so many theories, all nonsense.",Prabhupāda, So did you not protest?
SvarūpaDāmodara,"Yes. Then there was... After his lecture... It was a one hour long seminar, and there was question and answer. So they invited questions. Nobody asked.",Prabhupāda, So you did not ask?
SvarūpaDāmodara,"No, I asked later on. I asked, that ""Your topic is about origin of life, but you are not talking about the origin of life. So there is no basis of your argument.""",Prabhupāda, Very good.
SvarūpaDāmodara,"Then I asked, ""Supposing I give you the chemical materials, say, the molecules likes amino acids and the big molecules like DNA andRNA..."" These are the molecules, which they think necessary for the maintenance of life. ""Supposing I give you all these chemical compounds, then do you think that you will be able to put life into it. If you get all the chemical materials necessary, but will you be able to put life into it?"" Then he said, ""I do not know.""",Prabhupāda, Then why you are talking nonsense? (laughter) Then? People did not laugh?
SvarūpaDāmodara,"Yes. No, everybody was silent. Everybody was silent because everybody believes that life started from matter, all the, in the audience. So I said that ""Your basis means life started from matter. That means..."" He was saying that when the earth, before the life started, there was no living entities on earth. Then I said, ""How do you know there is no living entities on earth?"" Then he could not answer.",Prabhupāda," Just see. Very good. Yes. You have to go and lecture all the universities, calling these rascals fools. That will be our mission. They do not know anything and talking all nonsense. That's it. There was nobody to challenge till now. Now we are creating persons to challenge these rascals. That is our credit. Till now whatever nonsense they are talking, people thought, ""Oh he is a big scientist."" Now our scientist will protest against them, stop them talking all nonsense. That is what we want. If a lay man like me goes and protesting, he may say that ""First of all you come to my level, then I shall talk with you."" Now, he cannot talk with you like that. Because you are on the level. So challenge all this nonsense. Why they talk nonsense? So later on, other persons, they did not talk with you?"
SvarūpaDāmodara,"No, the chairman of the department, he was telling later on that ""About theology let us talk later on."" So he dispersed the meeting after that. Theology, they thought, that I was talking on theology.",Prabhupāda," It is not theology, it is science."
SvarūpaDāmodara,"Yes, it is science. But he was assuming like that because his business is to protect the... This is outside speaker, comes from outside the university.",Prabhupāda, So how do you say it is theology?
SvarūpaDāmodara,"He was just commenting like that, that...",Prabhupāda," So you should have presented, ""No, it is not theology. I am talking on the scientific basis."""
SvarūpaDāmodara,"I said, ""Why not think like life started from life? What is wrong in it?"" Because he was talking that life started from matter. So why not think like life started from life? What is wrong in it? That is why they thought I was talking about theology, when I asked them.",Prabhupāda," Yes, this protest must be now. If they accept life started from life, then they will have to accept God. That is their difficulty. That is their difficulty. And practically we have no experience... We can see life started from life, father begetting child. We can see father is a living man, and another child will be born. But where is life starting from matter? Where is that evidence? Life starting from life, we have got practical experience, but where is the evidence that life started from matter?"
SvarūpaDāmodara,"They are assuming. There is no proof. They just think, they just assume it.",Prabhupāda," Assuming, what is that? There is no proof?"
SvarūpaDāmodara,There is no proof.,Prabhupāda," What is their proof? What they go on, proof?"
SvarūpaDāmodara,"They are just speculating that life started spontaneously. There was a time, they said, it started all spontaneously, only once.",Prabhupāda," That's all right. But life, whether begins from life or matter? That is the question. You are saying that life started from matter. We are saying life started from life. How to make solution of this question? For life starting from life, we can see practically. Birds, beasts, human beings, they are begetting children, eggs. The life from life, he's a living entity. That we have got proof. But where is the proof that life started from the matter? Where is that proof? Just give one instance that ""Here is a life starting from matter."" Where is that instance? Anyway, at least one audience protested. It will be recorded. And he said, ""I do not know."""
SvarūpaDāmodara,Yes.,Prabhupāda," Oh, then what kind of scientist he is? So they know that you are theologist?"
SvarūpaDāmodara,"In the department everybody knows. (laughter) There is one theoretical chemist. His name is Max Muster (?). He is from Germany. He is a theoretical chemist. Once I invited him to come to Los Angeles to talk with Prabhupāda. He agreed, and but then he told me that he will think for one day whether he will come or not. Then next day he told me that he is afraid. ""I cannot come because I am afraid that I will be put on the walls."" (laughter) But he is very philosophical. He believes in God. He has some... That's why if you talk with him, very nice.",Prabhupāda," So that is also nice. We are not afraid of meeting any philosopher or scientist, but they are afraid. That is our credit. All scientists know that they are on the wrong basis, but because they are scientists, they say like that. That is their position. They do not believe in their own statement. Therefore he said, ""I do not know."""
SvarūpaDāmodara,Because there is no solid background.,Prabhupāda," No. (pause,japa)You and Dr. Rao just make a combination, world-touring. I shall give you all expenditure. And go to the universities, scientists, and talk with them. Ourkīrtanaparty also will go. We challenge all scientists, ""Come on."" We shall pay all expenditure. Ask Dr. Rao to come and join. Just like in Calcutta University, all the students... No, one leader student, he came. He talked about economic development, and he said that ""Our students did not derive any faith by your theological statement."" So I told them that ""Because you are all rascals, therefore you could not."" I told them freely. Because in theBhagavad-gītā...Because they are student of Sanskrit. And in theBhagavad-gītāit is said,namāṁduṣkṛtinomūḍhāḥprapadyantenarādhamāḥ[Bg.7.15].""So you are amongst these. You areduṣkṛtinas,sinful, lowest of the mankind, and the university is responsible for creating such rascals."" So professors clapped and later on they said, ""Swamiji, you have rightly said."" All the professors said. And so far economic question is concerned, the birds, beasts, animals, they have no economic concern. Why you have got? You are less than bird and beast, you have created this economic problem.Harernāmaharernāma[Cc. Ādi17.21].Where is the economic question? The small birds, tiny birds, they are solving their economic question, coming (makes sound:) ""bup, bup,"" finished. They are not stocking, they are not thinking of tomorrow, but are satisfied. They have got eating, sufficient eating, sufficient sex, sufficient intelligence to defend. As soon as we go, immediately they fly away. That is defense. They know how to defend them. They immediately understand, ""They are human beings, stronger. They may do some harm. Let us fly away."" So these things are everywhere, eating, sleeping, mating and defending. There is no scarcity. Only scarcity isKṛṣṇaconsciousness. That we have to preach. Theology... Logy means science, is it not?"
SvarūpaDāmodara,Yes.,Prabhupāda," Everything, logy means science. So theology is also science. Why they reject theology ""Yes, you are talking..."" What kind of scientist you are? It is a ""logy,"" it is a science. Why you are giving preference to one ""logy"" to another? What kind of scientist you are? Even though I am talking of theology, why should you reject it? In Vedic knowledge, ""logy"" is the basic...Nyāya-prasthāna,śruti-prasthāna,smṛti-prasthāna.These are the three ways of understanding the Absolute Truth."
SvarūpaDāmodara,Logic and argument?,Prabhupāda," Yes.Nyāya-pra...Just likeVedānta-sūtra,it is logic and argument to approach the Absolute Truth.Athātobrahmajijñāsā:""Now it is the time for inquiring aboutBrahman."" This is logic. Because other animals, they cannot inquire about the Absolute Truth, but human being can, therefore the first proposition is,athaataḥ,""Now because you have got human form of life, therefore you should now inquire about the Absolute Truth."" This is the beginning. It is logic. And actually we feel, ""Who has created the ocean? Who has created the stars? How it is floating? Whether there are human beings?"" So many questions. That should be solved now. And actually they are doing, the scientists. Scientists means they are also trying to solve so many problems. So that is, human being can be scientist. Not a dog can be scientist. So why not become the supreme scientist to know the Absolute Truth. That isVedānta-sūtra.Athātobrahmajijñāsā.Now you propose that ""Why don't you accept that life begins from life?"" What is their objection? This is also theory, and why not accept this theory? And now let us compare, which theory is feasible. Why you are afraid?"
SvarūpaDāmodara,They are silent.,Prabhupāda, Biased. Rascal bias.
Karandhara,They say life is also matter.,Prabhupāda," Life is matter, that's all right. But produce from matter life. That you cannot do. Life is also matter or we say, ""Matter is also life."" We say that.Sarvaṁkhalvidaṁbrahma.Brahmanmeans life. So everything is life. The basis of everything. Just like my body is depending on my life. Therefore the whole cosmic material manifestation is also depending on God. So matter is another energy of life. That we practically see. So in that sense we can say that matter is also life. That we can say. Or obversely, we can say, ""life is matter,"" that we can accept."
