Question Speaker,Question Text,Answer Speaker,Answer Text
Paramahaṁsa,"The Buddhists also say that the body is like a house. You put the house together, you put the body together with chemicals. And when the bodies die, just like you take the house apart, all the wood, and then there is no more house... no more soul, no more life.",Prabhupāda," Yes. That is callednirvāṇa.And with the chemicals you can build another house. Buddhists they do not give any information of the soul. That is Buddhism. What...? Oh, wet? (the ground?)"
SvarūpaDāmodara; Paramahaṁsa,"No, it's dry.; There's another very interesting factor that scientists, they state that matter is, or that there is, they dispute the fact that there's one soul within the body. There's a special kind of worm, it's an earthworm, that if you cut it in half, both parts will live.",Prabhupāda, Yes.
Paramahaṁsa,"So they wonder how is it possible that if there is soul, that there could be two souls within one body?",Prabhupāda," Yes, why not. Souls takes the opportunity."
Paramahaṁsa,"Oh, it takes the opportunity of the other body, the fertile...",Prabhupāda," Yes, yes."
SvarūpaDāmodara,"The spirit soul must necessarily have a body, either spiritual or material.",Prabhupāda," He has got already spiritual body. Material body is his covering. It is unnatural. Real body is spiritual. Just like your coat, this is unnatural. But your real body is natural. Otherwise how transmigration is possible? I am accepting different unnatural bodies. Unnatural means to my constitution. My real constitutional body is servant ofKṛṣṇa. So, so long I do not come to that position, I remain servant of nature and I get so many bodies. According to the nature's direction I am getting body, I am giving it up, again I am desiring something, I am getting another body. This is going on.Prakṛteḥkriyamāṇāniguṇaiḥkarmāṇisarvaśaḥ,ahaṅkāra-vimūḍhātmā [Bg.3.27].He is a rascal. He is thinking, ""I am this body.""Īśvaraḥsarva-bhūtānāṁhṛd-deśe'rjunatiṣṭhati,bhrāmayansarva-bhūtāniyantrārūḍhānimāyayā[Bg.18.61].This is ayantra, machine. And we are traveling many species of life, all riding on this car, given by nature.Yantrārūḍhānimāyayā.Māyāhas given this vehicle, anywhere wandering, up and down, sometimes demigod, sometimes dog. This is going on. And in this wandering process, if he gets in touch with a devotee, then his real spiritual life begins. Otherwise he has to go on, rotating."
SvarūpaDāmodara,Mahāprabhu?,Prabhupāda," Yes,CaitanyaMahāprabhu. By mercy of spiritual master, the mercy ofKṛṣṇa, he gets the seed of devotional service, and if he cultivates, then his life becomes successful. Otherwise he has to rotate, sometimes up, sometimes down. Sometimes this grass, sometimes lion."
Paramahaṁsa,"But ultimately if we come toKṛṣṇa, there's no return. But nevertheless,Jagāi, and..., the two gatekeepers, they returned?",Prabhupāda," There is return, that is voluntary. Return there is."
Paramahaṁsa,If we want.,Prabhupāda, Yes.
Paramahaṁsa,So we can come to the spiritual world and return?,Prabhupāda, Yes.
Paramahaṁsa,Fall down?,Prabhupāda," Yes. As soon as we try, ""Oh, this material world is very nice,"" ""Yes,""Kṛṣṇasays, ""yes, you go."" Just like nobody is interested inKṛṣṇaconsciousness. Do you think everyone is interested? So. They want to enjoy this material world. Otherwise what is the meaning of free will? Every living entity has got a little free will. AndKṛṣṇais so kind, He gives him opportunity, ""All right, you enjoy like this."" Just like some of our students,Kṛṣṇaconscious, sometimes go away, again come back. It is free will, not stereotyped. Just like one goes to the prisonhouse, not that government welcomes, ""Come on. We have got prisonhouse. Come here, come here."" He goes out of his free will; again comes out, again goes. Like that.Kṛṣṇa-bahirmukhahañābhogavāñchākare,nikaṭa-sthamāyātārejāpaṭiyādhare(Prema-vivarta).The police is there. Just like the police car was there. We have nothing to do with it. But if you do anything criminal, immediately you will be arrested, under police custody. Themāyāmay be there, butmāyācaptures him who is not a devotee ofKṛṣṇa. That's all. Therefore,māmevayeprapadyantemāyāmetāṁtarantite:""Anyone who surrenders unto Me,māyādoes not interfere anymore."""
Paramahaṁsa,"So our desire to enjoy, we achieve these bodies; and our desire to achieveKṛṣṇabrings us to our natural position.",Prabhupāda, Yes.
Paramahaṁsa,But then again there's this constant struggle with our lower nature? We are constantly fighting our desires even though we want to serveKṛṣṇa? This continues?,Prabhupāda, What is that? I do not follow.
Paramahaṁsa,"Well, like, many devotees, they experience the difficulty that although they sincerely want to love God and serve Him, yet their body is almost like another dictator within them.",Prabhupāda, Yes. That means he is strongly under the grip ofmāyā.
Paramahaṁsa,Even though the desire exists.,Prabhupāda," Yes. Just like a thief, he knows that ""If I steal, I will be arrested. I will be put into jail."" And he has seen that one thief, he has stolen, he is arrested. Still he commits theft. He knows everything. Why does he commit theft?"
Paramahaṁsa,Why?,Prabhupāda, Yes.
Paramahaṁsa,Ignorance?,Prabhupāda, Yes.
SvarūpaDāmodara,Śrīla Prabhupāda gives the example of the elephant.,Prabhupāda, Yes.
SvarūpaDāmodara,Takes shower again and...,Prabhupāda," Yes.Hasti-snāna.Therefore, knowledge giving, that is the beginning of spiritual life.KṛṣṇagivesArjuna, knowledge giving, that ""You are not this body."" This is the beginning of knowledge. What is that knowledge, all over the world? Where is that university? This preliminary knowledge whichKṛṣṇabegins,Bhagavad-gītā, where is that university?SvarūpaDāmodara, where is that chemical laboratory or university?"
SvarūpaDāmodara,There is none in the universities.,Prabhupāda," Yes. So this is the position of your education. There is no knowledge, and you are simply advertising, ""Advancement of knowledge, university, PhD's, Nobel Prize holder."" But they are all rascals. Fools' paradise. It is called, fools' paradise."
SvarūpaDāmodara,"If the scientists know that we are not this body, then definitely the whole outlook will be changed.",Prabhupāda, Yes. That we want to do.
Paramahaṁsa,They don't want to admit their failure.,Prabhupāda," That is another foolishness. If you are a fool and if you want toposeyourself as intelligent, that is another foolishness. You cannot make progress. Stubborn dogs. If you are seeking after knowledge, you must take the right knowledge. That is intelligence. And if you want to remain in ignorance and advertise yourself that ""I am man of knowledge,"" how much cheater you are! You are cheating yourself and cheating others. That is going on. We want to stop this."
Paramahaṁsa,"Just like many of our devotees, we experienced when we tried to preach to our parents, because they are much older, to admit thatKṛṣṇaconsciousness is the right path in life, means to also admit that they have wasted their entire life.",Prabhupāda," Real knowledge is to be given to the younger section. Older section, it is not possible. They will have to forget first of all, what they have learned. That they cannot. Therefore it is impossible. Therefore knowledge begins from the school children, not from the man who is going to die. (laughing) That is not... Impractical. ThereforePrahlādaMahārājasaidkaumāraācaretprājñodharmānbhāgavatān: [SB7.6.1] ""Kṛṣṇa consciousness should be taught from the very childhood."" Not that at the time of death. That is not possible. Therefore our students, they are all young generation, they capture. These rascals, they cannot. Old fools, they cannot. There was a practical examination. One father and one daughter, both appeared forBAexamination in India. The daughter passed and the father failed. It was in the newspaper. In old age they cannot take any lessons. They forget."
Kṛṣṇa-kāntī,Because of sense gratification or mind...,Prabhupāda," Anyway, they say all... Yes. The bodily functions, intelligence...,"
SvarūpaDāmodara,"Blunt, intelligence becomes blunt.",Prabhupāda," Yes, blunt. When the knife is sharp, it can cut, but if it is become blunt, then you cannot cut."
Paramahaṁsa,Or worn by age.,Prabhupāda," Yes. They have all been described asmāyayāpahṛta-jñānāḥ: [Bg.7.15] ""Their real knowledge is taken away bymāyā."" Therefore we don't give any credit to all these rascals. Although we are very small, but we don't give any credit. We frankly say, ""These are rascals, fools."""
Paramahaṁsa,After the 20th...During the Industrial Revolution in the western world....,Prabhupāda," The Industrial Revolution means revolution of theśūdras.That is Industrial Revolution. Increasing the number ofśūdras.These scientists, they are alsośūdras.Because they have no real knowledge.Brāhmaṇameans one who has got real knowledge.Brahma-jānātītibrāhmaṇaḥ.And this industrial development means technologists; they areśūdras."
Kṛṣṇa-kāntī,But they have taken the position ofbrāhmaṇasin the society.,Prabhupāda," No, no. They are never as... They are always working. How they can take the position of thebrāhmaṇa? Brāhmaṇa'sposition is to teachbrāhmaṇaknowledge,brahma-jñāna.That isbrāhmaṇa."
Paramahaṁsa,Prior to the growth of technology...,Prabhupāda," Yes. No, there was technology. But not in such large scale. Village technology. There was a blacksmith. You want a knife. You take one piece of steel, and he will do it,phutphutphutphut, and he'll put in the fire, and everything do. And now you are manufacturing these cutleries, cutleries, in larger scale. So they areśūdras.Similarly any factory, it is a combination ofśūdras.Kalauśūdra-sambhavaḥ:""In this age, all areśūdras."" Only we are trying to becomebrāhmaṇa.Otherwise allśūdras.So therefore there is no adjustment. Just like if you have got only legs, no arms, no mouth, so what is this body?"
Paramahaṁsa,Corpse.,Prabhupāda," Corpse, yes. You require everything, full body. You require head, you require arms, you require belly, you require legs. But if you have got simply the belly and legs, then it is a dead body. It cannot work properly. The brain is lost; therefore they aremadafter so much advancement of civilization. They are exactly like cats and dogs. As soon as you enter some country, dog, watchdog: ""Wowf! Wowf! Why you have come? What is your position?"" (""Where is yourvisa?""?) This is dog's business. This is dog's business. (laughter) And they have set up immigration department. But it is a dog's business, watchdog. I say it is watchdog's business. A first-class gentleman is being searched out pocket, whether you have got revolver. Cannot be trusted, all these educated rogues and thieves. So what is this advancement of civilization? It is civilization? No sober man, no intelligent man, all cats and dogs, thieves, rogues. Is that civilization? It is not civilization."
Paramahaṁsa,"The question I have, Prabhupāda is that before scientific advancement, many people would listen to, like, scriptural knowledge.",Prabhupāda, Yes. That meansśūdras.That I have already said.
Paramahaṁsa,But now they listen more to scientists.,Prabhupāda, That meansśūdra. Śūdrasare interested to hear fromśūdra.
Paramahaṁsa,"For example in the Bible they quote that the world is flat. So therefore when they found out the world is round, they say, ""Oh, scripture is false.""",Prabhupāda, Yes.
Paramahaṁsa,"Scientists, they have proven the truth that the world is round. Therefore scientists...",Prabhupāda," Yes. That must be, therefore the scriptures must be transcendental. Nonsense scripture, and people become nonsense. So except Vedic literature, all nonsense scripture. They are not scripture. Manufactured. This Bible was manufactured by the saint, this saint, that, according to their imagination. It was not spoken by Lord Jesus Christ. What was spoken by Jesus Christ, that they ignore: ""Thou shalt not kill."" They kill. Nobody is following Christian principle; neither Bible is perfect. But that, if we say, we will be shot. (laughter)"
Paramahaṁsa,That is what they do now in the Vietnam. For God they are killing.,Prabhupāda, Huh?
Paramahaṁsa,"One of the reasons that the Vietnamese war was beginning was because Communists, being atheists, it was a fight between the theists and the atheists. This was an excuse given.",Prabhupāda, Yes. But that is quite all right. We also prepare to kill atheists.
Paramahaṁsa,But preach first.,Prabhupāda, Yes.
Paramahaṁsa,They don't preach.,Prabhupāda," That is, killing is also preaching. If I kill your ignorance, that is also killing. That is also killing. Not... Killing does not mean that everyone has to take the sword."
Paramahaṁsa,A new method of warfare.,Prabhupāda," Yes, it is always there. By argument, by knowledge."
SvarūpaDāmodara; Paramahaṁsa,"It's a little wet.; Śrīla Prabhupāda, when you are not present with us, how is it possible to receive instructions, for example, on questions that may arise?",Prabhupāda," Well, the questions... Answers are there in my books."
Paramahaṁsa,"Other than that, for example, that we would ask you in...",Prabhupāda, Yes.
Paramahaṁsa,Do you direct us also through the heart? Besides theParamātmā?,Prabhupāda, If your heart is pure. Everything depends on purity. Whether there. What is this? Sacrificial arena? (laughter)
Paramahaṁsa,"For children, I think. No? For cooking, yeah. (pause)",Prabhupāda," (About tennis players) How people are kept into ignorance. Life is so valuable, and they are wasting time in that way. Life is valuable, how life should be utilized, what is the object of life—they do not know anything."
SvarūpaDāmodara,"Without knowing that the soul is eternal, everybody would be acting like this.",Prabhupāda," Yes. That is... Bodily concept of life means animal life. The animal does not know.Saevago-kharaḥ[SB10.84.13]. Go-kharaḥ. Gomeans cows, andkharaḥmeans ass. One who is in the, under bodily concept of life, he is no better than animals. So when the animal talks of knowledge, an intelligent man laughs. That is our position. The animals, they are talking of knowledge."
Paramahaṁsa,"At least, the animals live by certain codes. They do not kill unless necessary. They only eat when necessary, whereas man, he kills unnecessarily, eats unnecessarily. So forgetting God, we are even lower than animals.",Prabhupāda," Yes. Therefore we suffer also, more than the animals. (pause) SoKṛṣṇaconsciousness movement is not a bogus religious sentimental movement. It is a scientific movement. So now it is up to you to prove this. Then you will be actuallyKṛṣṇaconscious. (pause) [break]"
SvarūpaDāmodara,So they were saying that everything in the universe is just happening by chance.,Prabhupāda, So you are writing book by chance. Then what is the value of your book?
Karandhara,The book is also by chance.,Prabhupāda," Yes. Everyone can write chance, so what is your credit? Anything nonsense can be written."
SvarūpaDāmodara,"Monod is his name. He got Nobel Prize in 1965 from... He is Frenchman, physiologist. And his, chance and necessity about life, he said everything started by chance. So he is saying that by chance these chemicals combined together, forming these molecules, the basic molecules...",Prabhupāda, But wherefrom the molecules came?
SvarūpaDāmodara,According to him it is simply by chance.,Prabhupāda, Chance. So everything is chance. So what is the necessity of your writing book?
SvarūpaDāmodara,"Then necessity arises, so these moleculesre-orient, change as a fashion because of necessity.",Prabhupāda," Why? If everything is by chance, where is the necessity? What is the meaning? Let the chance take place. Why necessity?"
Paramahaṁsa,He is hoping for another Nobel Prize by his chance.,Prabhupāda," All fools' paradise. That's all. Why do they send their children to school? Why not let them grow by chance? Is there any excuse if I say, ""By chance I have violated this rule?"" Is that the cause of excuse?"
SvarūpaDāmodara,That's because of my ignorance.,Prabhupāda," That is chance. That is chance. Because I am ignorant, therefore there is chance."
Paramahaṁsa,It would be just as stupid as saying a beautiful instrument like a car was made by chance.,Prabhupāda," Yes. Yes. That is the most regrettable condition, that these rascals are getting recognition; talking all foolish, and they are getting recognition."
SvarūpaDāmodara,It's so strange. When I read that book. He defines the difference between the living and the non-living by a term called teleonomy. I tried to find out in the dictionary and I couldn't find any word like that. But I understood that what he meant was...,Prabhupāda, Hyerpolosvel. (Prabhupāda's mythical scientific word) (laughter)
Kṛṣṇa-kāntī; SvarūpaDāmodara,He invents his own word jugglery.; He was trying to present the difference between organic beings and the non-organic beings. So he goes in such a round about fashion just to differentiate.,Prabhupāda," Petitio principii. This logic is called petitio principii. He has to prove something, but he is taking his premises from that something. (end)"
SvarūpaDāmodara,No.,Prabhupāda," They accept one energy. We accept also that. But they, defect is they are beginning from the material. That is their method. Just like this weather is beginning from the light and gradually it is becoming dark. So darkest part or the dark part is called material. But the dark is beginning from light, not the light is beginning from dark. That is their method. They are thinking that from matter, consciousness is coming. Now consciousness is there. When it is covered, degraded, that is unconsciousness. So material means when the consciousness is forgetful ofKṛṣṇa. That is material. Material means gradual development of forgetfulness ofKṛṣṇa. That is material. And spiritual means full consciousness ofKṛṣṇa. Is it clear? Try to understand this. Darkness is coming from light. Where the light is not visible that is called darkness. This is not the nature of the sun, this covering, cloudy nature. That is not the... The nature of sun is light, but by the energy of the sun another thing is temporary created which is called mist or darkness. This is temporary. This is not permanent nature. Therefore material nature is temporary and spiritual nature is permanent. So ourKṛṣṇaconsciousness movement is to get out of this temporary nature and go to the spiritual nature, permanent nature. Nobody wants also this temporary nature. Nobody likes this cloudy atmosphere."
SvarūpaDāmodara,The cloudiness is created from the superior energy.,Prabhupāda, Yes.
SvarūpaDāmodara,So material is created from the superior.,Prabhupāda," Creator is one. It is always superior. Whatever is created, that is created by Him.Kṛṣṇasays,ahaṁsarvasyaprabhavaḥ[Bg.10.8].""I am the creator of everything."" So bad or good, everything. Bad and good, that is your creation. Kṛṣṇa's creation everything good. God is good. What you think bad, for God is good. Therefore we cannot understandKṛṣṇa. He's doing something. In our consciousness it is bad, but we do not know that for him there is no such thing as good and bad. That we do not know.Kṛṣṇais marrying 16,000 wives, somebody's criticizing, ""Oh, He's so much fond of women."" But we do not see the other side. He has got the power to expand Himself into 16,000 forms."
Paramahaṁsa,"If this mist of material nature is temporary, then why bother to disentangle oneself from something transitory?",Prabhupāda, Why do you take covering? Does man walk naked?
Paramahaṁsa,No.,Prabhupāda, Why do you take covering? You know everything will be cleared after few hours. Why do you cover?
Paramahaṁsa,It is dangerous now.,Prabhupāda," Whatever it may be, why do you take this step to avoid this?"
Kṛṣṇa-kāntī,It's uncomfortable. It's not natural.,Prabhupāda," Yes. That is theMāyāvādatheory; that everything will uncover automatically, why do you bother? That is nonsense."
Karandhara,They will not be able to be so philosophical in their next lives when they're a dog.,Prabhupāda, Eh? Eh?
Karandhara,The Māyāvādīs will not be able to be so philosophical in their next lives when they're dogs or cats.,Prabhupāda, Yes.
Karandhara,They have to have a human body in order to enjoy that philosophy.,Prabhupāda," Their philosophy is that there is only one-God. So cats and dogs, that is God'slīlā.That is their rascal philo... God is making pastimes,līlā,by becoming a dog. That is their rascal philosophy.Daridra-nārāyaṇa.Vivekananda's philosophy.Nārāyaṇahas becomedaridra,poor.HareKṛṣṇa. (pause) So with chemists we have no quarrel if they begin from light. They're beginning from darkness. That is our contention. We say, ""Begin from light."" And they say, ""No, begin from darkness."" Because they're in darkness. One who is in the darkness, from darkness, if he goes to light, he thinks that the darkness is the beginning."
Paramahaṁsa,"In comparison, they always compare.",Prabhupāda," No, no comparison. It is practical. Suppose you have been in the darkness for millions of years and when you come to the light you think that ""Oh, from darkness the light has come."" Light, when it becomes dimmed, that is darkness. Not that (from) darkness, light has come."
Kṛṣṇa-kāntī,Darkness cannot exist without light.,Prabhupāda," Yes. Or in the light there is no darkness. When the light is dimmed that is darkness. Similarly, whenKṛṣṇaconsciousness is dimmed, that is material."
Kṛṣṇa-kāntī,It's very wet. (referring to the ground),Prabhupāda," Yes. After awaken, when one becomes tired he comes to sleep. Or the life, when it is somehow or other disturbed, sleepless comes. When at night we sleep and get up in the morning, it is not that from sleeping condition this life condition has come. I slept some reason or I was in life condition, but I slept, again I am coming to life. That is their philosophy. Just like a child, baby comes from the womb of the mother. From the day he comes out of the womb, if he thinks, ""Now, from this day my life has begun."" That is not the fact. He's eternal, but he was constructing his body within the womb of the mother, therefore he was unconscious. Now, as soon as the body is finished, he comes out and again comes to consciousness."
Karandhara,And again falls asleep at death.,Prabhupāda," Yes. That is described in theBhagavad-gītā:bhūtvābhūtvāpralīyate[Bg.8.19].Once he comes to awareness and again he's unconscious. Just like this flower, it has come to now consciousness. Again it will dry and die but the seeds again will grow. Again it will dry. This is material life. And spiritual life means flower only. That's all. (pause) I have got some nice shirt buttons somebody has given me. I shall never put on shirt, neither our students. I think we shall sell it."
Devotee,Buttons?,Prabhupāda," What is called? Button, is it not button? Shirt-fixing? Collar-fixing?"
Devotee,Is it a pin or something like this?,Prabhupāda," Yes, like that...gold."
Devotee,Not cuff links. No those are...,Prabhupāda," Aha, cuffles."
Devotee,"Oh,jaya.Do you like I buy from you?",Prabhupāda, Yes.
Devotee,I give you my soul for the cuff links?,Prabhupāda," No, you take it and sell it. (pause) [break] The last four days this students are not clear."
Devotee,Man's best friend.,Prabhupāda," Hmm. Because he has no knowledge who is the best friend. According to the quality, friend is selected."
Karandhara,And one is known by the company he keeps.,Prabhupāda," Yes.Kāranaṁguṇa-saṅgo 'sya [Bg.13.22].The best friend will lead him to take birth in that family. He'll help him next birth because he'll always think of dog, so next birth, dog.Yaṁyaṁvāpismaranbhāvam[Bg.8.6].At the time of death, if you are attached to something then you'll think of it, and next birth is that."
Paramahaṁsa,"Śrīla Prabhupāda, if one's life is achieved by one's consciousness, how is it one cannot remember one's previous life?",Prabhupāda, Do you remember everything what you did last year or yesterday?
Paramahaṁsa,"No, I don't.",Prabhupāda, So that is your nature. You forget.
Paramahaṁsa,Something.,Prabhupāda," Something there is possibility of. Something..., somebody forgets more, somebody forgets little. But the forgetfulness is there."
SvarūpaDāmodara,That's the platform of material nature.,Prabhupāda, Just like stealing. Somebody's pick-pocket. Somebody's dacoit. The stealing is there.
SvarūpaDāmodara,"When we sleep, when we dream, are we carried away by the three subtle elements, mind, intelligence...",Prabhupāda, You are carried always by nature under different conditions. You're simply being carried by the nature.Prakṛteḥkriyamāṇāni[Bg.3.27].You are under the grip of material nature. Just like pulling the ear.
Kṛṣṇa-kāntī,By our desires we are pulled?,Prabhupāda," No. You desire. There it is. That's how. It is not willingly because you are willing desires againstKṛṣṇaconsciousness. Therefore she's giving chance, ""Come on here. Take stool. Become hog. You wanted to eat stool. Come on."" This is going on."
SvarūpaDāmodara,This also shows the eternal nature of the spirit soul?,Prabhupāda," No, no, no. That is not eternal."
