Question Speaker,Question Text,Answer Speaker,Answer Text
Śyāmasundara; Mr. Arnold; Śyāmasundara; Mr. Arnold; Śyāmasundara; Mr. Arnold; Devotee; Mr. Arnold; Śyāmasundara; Mr. Arnold; Devotee; Dhanañjaya; Śyāmasundara; Mr. Arnold; Śyāmasundara; Mr. Arnold; Śyāmasundara; Mr. Arnold,"Oh, I have one number in New York who would know where he is. Al Abramovitz(?).; I wonder whether this large records firm in New Oxford Street...; Warner Brothers?; No, no. Record. James something or other. James...; Oh, right over here.; Yes, in New Oxford Street.; Yeah.; They're agents for practically every...; Yeah, the, one of the, man who works there, big man, is also with George now. They might know where he is.; ...something to do with that particular firm.; Derrick Taylor.; Kenny Records.; Kenny, Kenny Records. Well, there are several record agents. They might know...; The whole building is taken up, and it all comes under the roof of James something or other, or agencies.; Yeah.; Now in New Oxford Street, you can see it very easily. There's a Midland Bank, takes up the ground floor.; It's right over here, isn't it?; Yeah.",Prabhupāda," So, so long I am here, let us try some tangible, not simply proposal."
Śyāmasundara; Mr. Arnold; Śyāmasundara; Dhanañjaya; Śyāmasundara; Dhanañjaya,"Yeah. Now we've seen how nice places we can get, so we have to work on these other angles: the Indian community and George.; The bank; And the bank. There's... What about Mr. Gopal? Did you see him? He's very wealthy.; Yes, but he helps by donating material things. Not material things, but he likes to give things rather than...; No, he's never been tactfully approached for anything else. He used to like us. He'd come around all the time. He lost his son, so he adopted us, like that. He used to give us presents, money.; The most he's given is carpets.",Prabhupāda, Huh?
Dhanañjaya; Śyāmasundara; Dhanañjaya,Carpets. He was giving carpets. The purple carpet in the temple.; The carpet in the temple cost how many hundreds of pounds?; Three hundred pounds. And the material for the Rathayātrā cart. All the material.,Prabhupāda, Where he is?
Dhanañjaya; Śyāmasundara; Dhanañjaya; Śyāmasundara,"He lives in Stretton.; Yeah.; Near Stretton.; Do you have his phone number? I'll call him, call him. He's, I'm sure he..., we could count on him to give something for...",Prabhupāda," So take their consult, what price they want."
Dhanañjaya; Śyāmasundara; Dhanañjaya,"There's also Nandalal Chabria, Mr. Chabria's son, he's here.; He's not very wealthy.; No, he's not wealthy.",Prabhupāda, This Chabria is here?
Śyāmasundara; Dhanañjaya; Śyāmasundara,Yes. His son.; Nandalal.; Yes.,Prabhupāda, Nandalal?
Śyāmasundara,Yeah.,Prabhupāda, What is his father's name?
Śyāmasundara,"Rāma, Ramachand.",Prabhupāda, Oh. Ramachand.
Dhanañjaya; Śyāmasundara,"There's Mr.Padma(?).; Yeah. Those men might help do legwork, but they're not wealthy in themselves.",Prabhupāda, So you raise one fourth million.
Śyāmasundara,Okay. (begins laughing),Prabhupāda, And Mr. Arnold will help for the bank one fourth.
Mr. Arnold,"I don't think I can get my bank to loan it, my lord, but certainly we'll go and see the bank... (laughter by devotees)",Prabhupāda, And we'll pay gradually to the bank. Then we can immediately...
Mr. Arnold; Śyāmasundara; Dhanañjaya,"You see, the tragedy is, my lord, they haven't got one account in this temple in my bank.; Then why don't we go and take an account in his bank?; Mr. Arnold's in the Midland Bank.",Prabhupāda," So why not open all the accounts there? Or ask the present bank that we are proposing this. Otherwise Midland Bank is a famous bank, it is nice bank."
Mr. Arnold,"Well I suggest that they, they should go to the National Westminster and tell them that you'll want this loan for...",Prabhupāda," But they agreed, National Westminster."
Śyāmasundara,Yeah.,Prabhupāda, To agree to pay on account of this Kingsway.
Mr. Arnold,"Oh, no. That was Lloyd's that agreed then, because they were trying to save their premises. They knew perfectly well that if it went to someone else then the whole premises, sooner or later, would be torn down.",Prabhupāda, That was it.
Mr. Arnold; Śyāmasundara,"Yeah.; So he's, he promised them perpetual lease.",Prabhupāda, At what price it was being sold?
Dhanañjaya; Mr. Arnold,"Two and a half million pounds.; Two and a half, which is exactly the price that I told them to put the bid in for. I went over...",Prabhupāda, Two and a half million.
Mr. Arnold; Śyāmasundara,Yes.; What Dāyananda didn't tell us is that the bank was prepared to finance the whole thing.,Prabhupāda, Huh!
Śyāmasundara; Mr. Arnold; Śyāmasundara,"The whole thing.; Well the bank and the building society.; One building society and one bank combinedly would have financed the whole thing, but he sent us a letter that said only two-thirds, they would finance two-thirds.",Prabhupāda, So he is not very intelligent. A missed opportunity.
Mr. Arnold,"See, I went to the Midland Bank, to various departments, and I found out almost to within a penny what exactly what it would raise. Of course, some of the people that put in the bids it happened were Midland Bank customers. I know I shouldn't have done it, but I did it, and I...",Prabhupāda," The bank was prepared to finance it, and he missed that opportunity?"
Śyāmasundara; Mr. Arnold,"Yeah, and he didn't even tell us.; The bank was only going to loan two-thirds. Then the building society next door was going to help, and also the National Westminster was prepared to help, I'm quite sure. But of course, I think...",Prabhupāda, It was not tactfully done.
Śyāmasundara,No.,Prabhupāda, Not intelligent.
Śyāmasundara,He didn't tell us.,Prabhupāda, He is not very intelligent.
Śyāmasundara,Had he told us a hundred percent financing...,Prabhupāda, Hm?
Mr. Arnold,"I pleaded with him to send you a letter. Of course you told him that to only put in a bid for a million and a half, and I pleaded with him to send you a letter that said no, step the bid up to two and a half million. Because quite honestly, I feel that the place was so vast, and most of it was let-places like Decca Recordings, Kodak, things like this—that most of the repayments to the banks would have been met quite easily.",Prabhupāda, I asked him also to consult some expert.
Śyāmasundara,"Well, somehow or other...",Prabhupāda," That was two and a half million, and it is half million."
Śyāmasundara,Yeah. Perhaps it's better if we go step by step.,Prabhupāda, Yes.
Śyāmasundara; Dhanañjaya,Someday we'll go up into the big place. There will always be a big place.; But there was not even a thousand pounds here.,Prabhupāda, Huh?
Dhanañjaya,"There wasn't even a thousand... At the time, there was not one, even one thousand pounds in the temple fund, and they were going for a two and a half, one and a half million deal.",Prabhupāda, No. The bank was prepared to finance. That is the point.
Mr. Arnold,"You see, I sort of schooled Dāyananda and told him to go over and have words with the bank manager, promising that, you know, if they helped us to fund this building, then we would guarantee them tenure, and instead of paying interest back on the, on the loan, we, for bids, we would give them a guaranteed tenure, or peppercorn rent, but we would pay the original loan back, so that there was no charge at all, it was just...",Prabhupāda," Anyway,natasyaśocananarthi.Don't lament which is gone. (laughter)"
Mr. Arnold; Dhanañjaya,"Yes, thank you, thank you.; Don't cry over spilt milk.",Prabhupāda," That is Sanskrit,natasyaśocananarthi."
Śyāmasundara,"Actually, for a place in the center of London like this, it's nice to have offices and a small chapel and maybe a bookstore, but we would not be able to recruit many people to come on a residential basis, being in the center of the city. But in a place a little bit further out, like in a student neighborhood, everybody comes.",Prabhupāda, What? Student neighborhood?
Śyāmasundara,"Yes, they'll come.",Prabhupāda," So, why not negotiate that?"
Śyāmasundara,Daily they'll come and then gradually become devotees.,Prabhupāda," No, among the young men there is hankering after this sort of an institution. Everyone asks me, ""Why the younger generation is attracted to this movement?'' so many reporters. So somehow or other, I reply, ""The young men, they're receptive, they can understand the value, whereas the old fools cannot.'' (laughing)"
Mr. Arnold,"Well, my wife and I, we can. We're old.",Prabhupāda, (laughing) You are excepted. You are excepted. Sometimes old men are called old fools. (laughing)
Mr. Arnold,"My wife is twice..., she's older that I am, and she's made me return because sometimes I've lost my temper with, over, you know, various things that happen...",Prabhupāda," The thing is that you are liberal to understand things as they are. But generally, old men, they are sophisticated. They do not like to accept anything new: ""Go away.'' Or they are not serious about religion. That is another thing. Actually..., as I see that old, older section, they have been habituated in a different way, so they do not want to change (indistinct). That is the difference. So ""Here is a nice thing; you should accept it.'' They are not inclined in that way. All stereotyped. Just like you have said last night, I told Lord Zet... (end)"
Revatīnandana; Guest (1) English lady,"So their residence place is not very far away, and she was curious. She came over a few days ago to find out more aboutKṛṣṇaconsciousness.; I've seen a few about the street.",Prabhupāda, Where?
Guest (1),"We live down there, you see, and we've seen them several times in the street singing, and asked them what you're doing, really.",Prabhupāda, You can keep it here. It may fall down. No. So do you know something about our movement?
Guest (1),"I've been told something about it, the other day.",Prabhupāda," We are preaching God consciousness. God is God. God is neither Christian, norHindu, nor Muslim. God is God. So everyone should be God conscious. That is our movement. We are preaching love of Godhead. So it doesn't matter what type of religion one is following. We simply want to see that he has love for God. Ourbhāgavata-dharmadefines: that is first-class religion following which one becomes a lover of God.Savaipuṁsāṁparo dharmo yato bhaktiradhokṣaje[SB1.2.6].That is first-class religion if by following that one becomes a lover of God. It doesn't matter what religion he is following, but the test will be whether he has become a lover of God. That is our..."
Guest (1),So you don't try to convert people from other religions.,Prabhupāda, No.
Guest (1),One can be Christian and...,Prabhupāda, Anyway. We are teaching how to love God. That's all.
Guest (1),Yes. So we're doing the same thing.,Prabhupāda," Yes. But the test is there, whether he has become a lover of God or lover of dog. That is the test. If you find that he has become a lover of dog, then his religion is useless."
Guest (1),How does he know?,Prabhupāda," You can see whether he's loving God or dog. That's all. That you can see. Everyone can see, whether he has got good love for dog or good love for God. That you can see. Anyone can see. The test is there. Crucial test is there."
Revatīnandana,Jesus used the expression loving God or loving mammon.,Prabhupāda," That says, or... Everyone says different way. Mammon or dog is expression in the faith. That is the test.CaitanyaMahāprabhusays:"
Guest (1),We say Jesus Christ.,Prabhupāda," But Jesus Christ never said that He is God. He said ""Son of God."" We have no objection to chant the name, holy name of Jesus Christ. We have no objection. But we are preaching that ""Chant the holy name of God."" If you haven't got any name of God, then you chant our conception of name of God,Kṛṣṇa. We don't sayKṛṣṇa."
Guest (1),We see that.,Prabhupāda," Yes. So what you want more? Therefore let us cooperate. Don't think that it is against Christianism or it is sectarian. Let us cooperate fully. Jointly, let us preach all over the world, ""Chant the holy name of God."" Let us join together. That should be the real purpose of devotees of God. Here is... They are preaching love of God. Why should we be envious about them? It doesn't matter. We don't say that you chantHareKṛṣṇa. If you have got name of God, you chant it. That's all. But we are preaching this cult, that chant the holy name of God. That's all. So what objection there may be from other sects? But they are envious. Because the younger generation are taking to it, so they are envious. Why they are envious? We wanted to purchase one church, and the priest in charge said that ""I shall better burn this church. I shall not give them."" Just see. Why? What we have done wrong? This is the very statement. ""Better I shall burn this church, but I won't give them."" Then? What we have done?"
Guest (1),Don't worry about that.,Prabhupāda," No, I don't worry. That is another thing. But there are so many vacant churches. They are forsale. But as soon as we go, they refuse. ""No."""
Guest (1),"When you chant, do you have to think what you're saying? How can you do other things?",Prabhupāda, Other things?
Guest (1),"Well, many things require your concentration.",Prabhupāda," Well, let us first of all chant the holy name. Then we shall think of concentration."
Guest (1),"You see, two, two things... You can't...",Prabhupāda," No. Concentrate, concentration automatically. If I chantHareKṛṣṇaand I hear, that is concentration. That is concentration. Immediately."
Guest (1),But you can't read or talk to someone.,Prabhupāda," There is no question of reading. We are simply asking to chant. Reading will come later on. Just like a small child, he's taught... In our educational system they chant... What is that? That...? (Hindi)Pahara pahara.(?)"
Indian man,Pahara.Alphabet. A.I.E.,Prabhupāda," They chant. By chanting, by hearing they learn. ""A,B,C,"" like that. ""2 plus 2 equal to 4."" We did it in our childhood. One boy will chant like that. ""2 plus 2 equal to 4."" And we shall repeat. ""2 plus 2 equal to 4."" So repeating three times, I understand 2 plus 2 equal to 4."
Guest (1),Do you find that the chant goes on in your heart?,Prabhupāda, Huh?
Revatīnandana,Do you find that the chant goes on in your heart?,Prabhupāda, Why not? Why not?
Guest (1),It goes deeper and deeper?,Prabhupāda," Yes. Everything we hear, it goes to the heart. If I call you by name, it does not go to my heart? ""You rascal. You stupid."" You hear. Does it not go to my heart? Why I become angry unless it goes to my heart. If ""rascal,"" ""stupid,"" and all these bad names go to my heart, why God's name will not go to my heart? If by calling you by ill names you become angry, that means it goes to your heart. Why not good name? It goes. It enters through the ear and goes to the heart."
Guest (1),"I'm doing that, saying sometimes a little prayer...",Prabhupāda," So if you repeatedly chant, it will remain. It will always remain in your heart."
Guest (1),Always going on.,Prabhupāda," Yes. There is no chance of escape. Chant constantly,HareKṛṣṇaHareKṛṣṇaKṛṣṇaKṛṣṇaHareHare,HareRāmaHareRāmaRāmaRāmaHareHare. It remains in the heart. Not only my heart. Others' heart, they also joke, ""HareKṛṣṇa!"" If it can remain in others' heart, why not my heart? Those who are joking me, imitating me. We... Last time, when I was going in Africa, I stopped for few minutes in Athens. Some of the younger residents chant, ""HareKṛṣṇa!"" You see? As soon as they saw us, they began to chantHareKṛṣṇa. They could understand, ""These areHareKṛṣṇapeople."" Yes. So by their dress, by theirtilaka,they oblige others to chantHareKṛṣṇa, either for imitating or for joking. So they gain. But ifHareKṛṣṇachanting has got any effect, even by joking like that, he'll get gain. If it is actually spiritual, by simply joking he will get gain."
Revatīnandana,"In Manchester across the street from the temple there's a big park. Sometimes I would go over there to walk and chant rounds, and there's many little children in the park. They'd follow me, ""HareKṛṣṇaHareKṛṣṇa!"" All day. Hundred times.",Prabhupāda," Everywhere. Everywhere. In Bombay, everywhere we go, ""HareKṛṣṇa."" In Montreal. They joke, they'll clap, but they'll chant. And that is wanted. I want to see that everyone is chanting. And if chanting has effect, then either he's chanting jokingly or seriously it will have the effect. Fire, if you touch either jokingly or seriously or cautiously, it will act. So our request is that you also preach this cult. Let us cooperate. The whole world is suffering for want of God consciousness. So it is the duty of all religious sects to teach this simple art of chantingHareKṛṣṇaor any other name which you have got. That's all."
Revatīnandana; Guest (1); Revatīnandana; Guest (1),"They have got this prayer, ""Lord Jesus have mercy on me, a miserable sinner."" And she was showing me they have a, almost likejapabeads. Show him.; You see, here.; They're almost likejapamālā.; We do it in some, together, in the orthodox church. And we take turns doing two hundred.",Prabhupāda, That's nice.
Guest (1),And... These are for counting.,Prabhupāda, That is nice. We also do the same thing. We chantHareKṛṣṇa.
Guest (1),"""Lord Jesus Christ, son of God, have mercy on us.""",Prabhupāda," Oh, what is the wording?"
Guest (1),"""Lord Jesus Christ, son of God, have mercy on us.""",Prabhupāda," ""Lord Jesus Christ, son of God..."""
Revatīnandana; Guest (1),"""Have mercy on us.""; It's a little prayer.",Prabhupāda, That's nice.
Guest (1),And they also pray to the mother of God.,Prabhupāda," Sinful? ""We are sinful?"" You say, ""sinful"" something? ""Forgive some sins"" or something like?"
Haṁsadūta; Guest (1),"""Lord Jesus Christ, son of God, have mercy on us."" That is the prayer.; And you say it in your own language.",Prabhupāda," That's all right. ""Lord Jesus Christ, the son of God, have mercy on us."" That's nice. Very good."
Guest (1),(indistinct),Prabhupāda," That is nice. Now, the, by praying, it is expected that one should have mercy of God. So what is the test that he has got the mercy of God?"
Guest (1),"The mercy of God is the love of God, isn't it?",Prabhupāda," That's it. Mercy of... So... That is the test, that he has learned how to love God.Kṛṣṇa-prema-pradāyate[Cc.Madhya19.53].CaitanyaMahāprabhuis also worshiped, that ""You can give love of God.""Kṛṣṇaprema-pradāyate.Namomahā-vadānyāya.""You are the most munificent of all incarnations because You are distributing love of God.""Kṛṣṇa-prema-pradāyate[Cc.Madhya19.53].Kṛṣṇāyakṛṣṇa-caitanya-nāmne.""You areKṛṣṇain the form of devotee ofKṛṣṇa. So I offer my respects."" This isRūpaGosvāmī's prayer."
Guest (1),"Do you find that you chant, it clarifies you?",Prabhupāda," Yes, certainly. God and God's name, and God or God's son, they are nondifferent. So either I be in touch with God's son or God's name, I am in touch with God. But they are nondifferent."
Guest (1),What happens to your mind? What do you do with your mind when you chant?,Prabhupāda," Whatever it may be in my mind, it doesn't matter. My mind may be different."
Guest (1); Revatīnandana; Haṁsadūta; Revatīnandana,Where does it have to be? It has to be fixed?; What will the mind be doing?; While chanting.; What should the mind be doing?,Prabhupāda," My mind should be absorbed in God consciousness. That is, that is the effect. He can think of God only, nothing else. That is the effect."
Guest (1),It's very difficult to think of God.,Prabhupāda," No. It is not difficult. It is difficult for the sinners. Those who are not sinners, it is not difficult. Because in theBhagavad-gītāit is said:"
Guest (1),There's a lot more ...sins than just those four things.,Prabhupāda, Yes. These are the four principles of sinful activities.
Guest (1),If you're irritated with somebody.,Prabhupāda, Hm?
Revatīnandana,"She says if you're irritated with somebody, this is also a sin.",Prabhupāda," No, that is..."
Guest (1),Your mind can be filled with this kind of sin.,Prabhupāda," Irritated... If your mind is in peace... If you are not indulging in intoxication, gambling, illicit sex, then your mind will not be irritated. How a gambler can be in peaceful mind? That is not possible. How a drunkard can be in peaceful mind? Agitation is for them who are simply engaged in sinful life. Those who are not engaged in sinful life, naturally they are peaceful. Their mind is not agitated. Vegetarians are naturally peaceful. Just see between a dog and a cow. (laughter). Dog unnecessarily will talk: ""Gow! Gow! Gow! Gow!"" (makes barking sound) without any fault. ""Why you are here? Why you are here? Why you are here?"" That is dog's qualification. A cow, so useful animal, it will never agitate. The dog has no use, but still he's the best friend. (laughter) And cow, actually giving us milk, sending to the slaughterhouse. Just see. This is human civilization. A dog is worshiped, and a cow is slaughtered. Do you think it is civilization? Do you think? Can you support this?"
Guest (1),"Well, I had a friend who was a vegetarian...",Prabhupāda," No, apart from this, these two animals. One is dog, and another is cow. So dog is worshiped and cow is sent to the slaughterhouse. What kind of civilization it is?Huh?"
Haṁsadūta,Animal.,Prabhupāda," Less than! Cow is supporting the whole society with milk. Every morning, without milk, we cannot live. The child, without milk, cannot live. She should be treated as mother. And they are being sent to the slaughterhouse. And still, they are thinking of becoming free from sinful life. Can anyone kill his own mother? ""Oh, mother is old and useless. Let her be killed. Burden."" Is that very gratitude for the mother by the son?"
Revatīnandana,"They do that. As soon as the cow is too old to give milk, immediately slaughterhouse. I was talking to one man, he was a cowherdsman here in England. He said he couldn't stand it. He said a nice cow, she would get old, she couldn't give milk anymore, immediately slaughterhouse. Just like that. The most disgusting thing.",Prabhupāda," (people coming in) Oh. You come forward. Give him seat. Śivānanda, you come... You can sit there. Yes. So the God consciousness can be awakened if you stop sinful activities. Otherwise, it is impossible. You go on preaching for millions of years; there will be no God consciousness. There will be no God consciousness. That is the... inBhagavad-gītā.(people sitting down) Why? You can come here, this side."
Haṁsadūta,You can sit here.,Prabhupāda," Yeṣāṁtvanta-gataṁpāpaṁ[Bg.7.28].One who has finished sinful activities, he can be engaged in God consciousness. One who is engaged in sinful activities, he cannot. Devil citing scripture. A devīl cannotcitescripture. Angel cancitescripture. And according to ourācāryas,SanātanaGosvāmī, he says that ""Don't hear scriptures from the devīl.""Avaiṣṇava-mukhodgīrṇaṁpūtaṁhari-kathāmṛtaṁśravaṇaṁnaivakartavyam."" If a devīl's preaching about God, don't hear."" If you say, ""God is pure, so let me hear about God. It doesn't matter whether he is devīl or angel. It doesn't matter."" No. The argument issarpocchiṣṭaṁ payoyathā.Just like milk is very nourishing food, but if it is touched by the lips, by the tongue of a serpent, it becomes poison.Sarpocchiṣṭaṁ payoyathā.You cannot bring the milk which is touched by the serpent's tongue. So we should receive knowledge of God, message of God, from a person who is not a devīl. Then it will be effective. Otherwise, it will act as poison.CaitanyaMahāprabhu's principle isāpaniācariprabhujīveriśikṣāya.He first of all behaves himself, and then he preaches. So if the preacher is sinful, how he can deliver other sinful men by his so-called preaching. That is not possible. He must be pure, he must be sinless. Then his preaching will be effective. But in all conditions, if we, with faith and love we chant the holy name of God, we shall become gradually purified. There is no, I mean to say, cause of anxiety. Anyone who will chant this holy name, he'll be purified."
Revatīnandana,"That line,jayasakal vipod bhaktivinod bolen jakhon o nām gāy.",Prabhupāda," O nām gāy,yes."
Revatīnandana,All obstacles will go away if you chant the holy name.,Prabhupāda," According toBhagavad-gītā,there are four classes of men who deride at God and four classes of men who approaches God."
Guest (1),People find it very difficult today...,Prabhupāda," It is not difficult. It is just like this, I gave you this example. Three years or two years before it was difficult. And it is not difficult. It has to be trained."
Guest (1); Revatīnandana,"For people outside.; People outside, she says, they find it difficult even to believe in God now.",Prabhupāda," No, therefore propaganda is required. They are rascal fools, but we are not rascal and fools. We must preach."
Guest (1),"Well, you can't preach until you are purified.",Prabhupāda," Eh? No, purification will go on. Suppose you are... Just like we are holding, what I... I began this propaganda in the Western countries. I was sitting in a park, Thompkinson's? What is that?"
