Question Speaker,Question Text,Answer Speaker,Answer Text
Woman Interviewer,"Yes, Your Grace, it seems to many people that there is probably more. There are probably more people in the world now who are seeking some kind of spiritual new light than probably ever before, or at least, there's more evidence of it. And I wonder if you agreed with that, and if so can you tell me why it is?",Prabhupāda," Yes, That should be the natural hankering with us. Because we are spirit soul we cannot be happy in material atmosphere. Just like you take out the fish from the water, it cannot be happy on the land, similarly, if we are without spiritual consciousness we can never be happy. So people after advancement of scientific knowledge and economic development, they are not happy. They are becoming hippies. So the cause is that they're in search of spiritual life and this is the proper delivery,Kṛṣṇaconsciousness, or God consciousness."
Woman Interviewer,Thank you. So presumably you would encourage this movement of more people to find a spiritual life. You...,Prabhupāda," Yes, unless you take to this movement, you cannot be happy. That's a fact. Therefore we invite everyone to study, to understand this great movement."
Woman Interviewer,"What worries me slightly is that since the arrival in Britain some while ago of the Maharishi MaheshYogi, a lot of... He was the firstguruthat most people ever heard of, and since then there have been a lot of people and a lot of gurus that have suddenly appeared out of nowhere. And one gets the feeling that sometimes they're not all as genuine as they ought to be, and I wondered whether you feel that it's right that you could perhaps issue a warning to people who are seeking some new spiritual life that they should take care to make sure they have a genuineguruto teach them.",Prabhupāda, Yes.
Woman Interviewer,Do you feel there's a danger?,Prabhupāda," Of course, to search outguruis very nice. But if you want a cheapguruor if you want to be cheated, then there will be many cheater gurus. But if you are sincere, then you'll have sincereguru. People want to be cheated because they want everything very cheap. But just like we are asking people no illicit sex, no meat-eating, no gambling, no intoxication. So people think it is very difficult, it is botheration. And if somebody says, ""No, you do. Whatever nonsense you like do. You simply take mymantra,"" they will like it. So the thing is that they want to be cheated; therefore cheaters come. They don't want to undergo some austerity. Human life is meant for austerity. But they are not prepared to undergo austerity. Suppose some cheaters come. They say, ""Oh, no austerity. Whatever you like you do. You simply pay me and I'll give you some particularmantra,and you become God within six months."" (Laughter) And that is going on. So you want to be, if people want to be cheated like that, the cheaters will come."
Woman Interviewer,So do you think people should beware?,Prabhupāda, They should be serious.
Woman Interviewer,"I mean if someone in all seriousness wishes to find the spiritual life and happens to finish up with the wrongguru, I mean should they beware?",Prabhupāda," Yes. But... When ordinary education, to take ordinary education one has to devote so much time, labor, and understand, and if one is going to take spiritual life they must be serious. And how is that, they think that simply by some wonderfulmantrawithin six months they become God? Why they want like that? That is... That means they want to be cheated."
Woman Interviewer,And how would one tell that one had a genuinegurubecause one would be told to give up certain parts of...?,Prabhupāda," That of course depends on the person who is really anxious forguru. Just like when you go to the market to purchase some thing, you test it whether it is genuine or not. Similarly, you have to test who is genuine."
Woman Interviewer,How can you tell if you don't...?,Prabhupāda," That requires little education, a little knowledge. Therefore we are opening so many centers, giving people opportunity to know what is genuine, what is not genuine."
Woman Interviewer,How many followers have you got now throughout the world or can you not count...?,Prabhupāda," Well, for any genuine thing the followers may be very little, and any rubbish thing, the followers may be many."
Woman Interviewer,"How many... I meant for the initiated followers, people who have...",Prabhupāda, About three thousand we have got.
Woman Interviewer,And is it growing all the time?,Prabhupāda," Yes, it is growing very slowly. Because we have got so many restrictions. People do not like any restriction."
Woman Interviewer,Yes. Where is the following the greatest? It is in America?,Prabhupāda," In America, in Europe, and Canada, inJapan, Australia. And India there is millions, there is millions of this cult. Apart from India, in other countries they are small quantity. But in India there are millions and millions."
Male Interviewer,Do you think your movement is the only way to come to know God?,Prabhupāda, What is that?
Devotee,Do you think this movement is the only way to know God?,Prabhupāda, Yes.
Male Interviewer,So how do you have that assurance?,Prabhupāda," From the authorities, from God,Kṛṣṇa.Kṛṣṇasays,sarva-dharmānparityajyamāmekaṁśaraṇaṁvraja[Bg.18.66]."
Male Interviewer; Śyāmasundara,"But if somebody else was to say that God had told him something else, would you equally believe him?; It's not that we don't accept other religious processes.",Prabhupāda," No, we believe other process. Just like there are steps. If you want to go to the topmost story, so you go by steps. So some of them have gone fifty steps, some of them have gone hundred steps, but to complete the required steps is 1,000 steps."
Male Interviewer,And you've gone up the thousand have you?,Prabhupāda, Yes.
Woman Interviewer,If any of us here this morning wish to become followers what would we have to give or give up?,Prabhupāda, First of all one has to give up illicit sex life.
Woman Interviewer,Does that include all sex life or...?,Prabhupāda, Huh?
Woman Interviewer,What is illicit?,Prabhupāda," Illicit sex (is) without marriage, without any relation, sex life, that is illicit sex life."
Woman Interviewer,"So sex is allowed in marriage, but not outside.",Prabhupāda," That is animal sex life. Just as animals, they have no relationship and have sex life. But human society there is restriction. In every country, in every religion there is a system of marriage. So without marriage, sex life is illicit sex life."
Woman Interviewer,But sex is allowed within marriage.,Prabhupāda," Yes, that is..."
Woman Interviewer,And what else would one have to give up for...,Prabhupāda, One has to give up all kinds of intoxicants.
Woman Interviewer,Is that drugs and spirits?,Prabhupāda, Any kind of drug that intoxicates.
Śyāmasundara,Even tea and...,Prabhupāda," Even tea, cigarette. They are also intoxicants."
Woman Interviewer,"So that includes alcohol, marijuana, tea. Anything else?",Prabhupāda," Yes. One has to give up animal food. All kinds of animal food. Meat, eggs, fish, like that. And one has to give up gambling."
Woman Interviewer,"Does one have to leave one's family? I think everybody lives in the temple, don't they?",Prabhupāda," Oh, yes. Unless one gives up all these sinful activities one cannot be initiated."
Woman Interviewer,So one should give up one's family as well?,Prabhupāda, Family?
Woman Interviewer,"To be a for..., yes.",Prabhupāda," Of course, family. We are not concerned with the family, we are concerned with the individual person. If one wants to be initiated in thisKṛṣṇaconsciousness movement he has to give up all these sinful activities."
Woman Interviewer; Śyāmasundara; Woman Interviewer; Śyāmasundara,"So you give up family as well. But what about...; No, no, you don't have to give up one's family.; But I mean supposing I wished to become an initiate. Wouldn't I have to come and live here?; No.",Prabhupāda, Not necessarily.
Woman Interviewer,"Oh, I could stay at home?",Prabhupāda," Oh, yes."
Woman Interviewer,"What about work, though? Does one have to give up one's job?",Prabhupāda," You have to give up these bad habits and chant these beads,HareKṛṣṇamantra.That's all."
Woman Interviewer,Would I have to give any financial support?,Prabhupāda," No, that's your voluntary wish. If you give us, that's all right. Otherwise, we don't mind."
Woman Interviewer,"Sorry, I didn't understand.",Prabhupāda," We do not want, depend on anyone's financial contributions. We depend on God, orKṛṣṇa."
Woman Interviewer,So I wouldn't have to give any money at all.,Prabhupāda, No.
Woman Interviewer,Is this one of the main things that distinguishes a genuinegurufrom a fakeguru?,Prabhupāda, Yes. A genuineguruis not a business man. Our... (end)
Guest,"There's one philosophical point I would like you to elucidate. I haven't been able to quite understand, certainly the dualistic, incomprehensible... the dualistic-nondualistic philosophy which sees at the same timeKṛṣṇa, as comprehending all of man, all of the world, everything, within the body, we might say, ofKṛṣṇa, And at the same time however, one sees the world as distinct fromKṛṣṇa, in other words, asmāyā,and as illusion. And it is this, the dualistic, I would like to... If you could just explain to me the difference between the... I mean, how this fits in, the monistic or the idea of the unitary view thatKṛṣṇais everything, all and in all. And then at the same time that the world, there is this world of illusion which is somehow distinct fromKṛṣṇa. Could you just explain this point to me?",Prabhupāda," This is very easy to understand. Just like you are recording my speeches in the tape recorder. When you play back it will speak just like I am speaking, but I am not there. Is it not fact?"
Guest,Yes.,Prabhupāda," It will appear now I am speaking from beyond this world. Somebody's hearing, here somebody's speaking. Again, when the record player will play... (end)"
Śyāmasundara; Dhanañjaya; Śyāmasundara; Mr. Arnold; Śyāmasundara; Mr. Arnold; Śyāmasundara; Mr. Arnold; Śyāmasundara; Dhanañjaya; Śyāmasundara,"There's already a big church on it.; That may be better, because there's more space there.; We haven't seen it yet. We haven't gone inside yet.; I'll try and make arrangements to go and have a look at that.; And also that other one around the corner.; The (indistinct) chapel? That's a very large building. But you can't go outwards(?). You can't go up. And there's no other facility.; (indistinct); Near Oxford. A very large building, but it's, it's in a bad state of repair.; We'll concentrate on the other ones.; (indistinct) best as far as the land's concerned. It's situated in the biggest area of space.; I have to try to find out when George is coming back.",Prabhupāda," George can give his..., what is called?"
Śyāmasundara,Endorsement.,Prabhupāda, Huh?
Śyāmasundara,Endorsement?,Prabhupāda," No. What is called? Reaction, or..."
Dhanañjaya,His qualities?,Prabhupāda," No. The show, what is called?"
Śyāmasundara,Concert.,Prabhupāda, Concert show.
Śyāmasundara,Yes.,Prabhupāda," Better he can raise funds from New York, but..."
Śyāmasundara; Dhanañjaya; Śyāmasundara,"Well, most of the money that they get from these concerts is not on the concert itself but on the record album and the movie that comes from it, the film.; And the royalties.; Royalties from making a record of music and the film of the show.",Prabhupāda, Uh-huh.
Śyāmasundara; Dhanañjaya; Śyāmasundara; Dhanañjaya; Śyāmasundara; Dhanañjaya; Śyāmasundara,"Just like Bangladesh. They raised about a million dollars from the concert and nineteen million from the record album and film. So those two don't require any special place. They could be anywhere.; Better here though, because George has never made any public appearances...; Actually I think it would be just as big here.; Yes. If the result, if people knew, if it was...; He's never made a public appearance. Only one in America.; Everyone from all over Europe will be coming to see him, without a doubt... In Europe there's about 350 million people, almost 400 million.; Actually he made two statements that, well, they practically promised to do this. He said in Los Angeles when he saw the Deities: ""Oh, we must have a place like this in London.'' And then in New York, because I said, ""Well, we don't want to be on your show here. We volunteer. You promised...,'' I said, ""You promised us to be on the show in New York, and he said, ""I know I promised, and I must fulfill my word, I gave you my word, but I'm just asking you if you will not be on this show, and later I'll have another special concert forHareKṛṣṇa.""",Prabhupāda, So remind him.
Śyāmasundara,Yeah.,Prabhupāda, What about theseHinducommunities?
Śyāmasundara,"Well, that we can do during this time you're here. We can organize it. We can at least inspire them to help us.",Prabhupāda, Are they willing to cooperate with us or not? Because they have already opened someHindutemple.
Śyāmasundara; Dhanañjaya,Yeah.; There's not so much cooperation from them.,Prabhupāda, Huh?
Śyāmasundara; Dhanañjaya; Śyāmasundara; Mr. Arnold,"They want their own local temple.; They come here and they stay forārotik, they take a littleprasāda, they give some money, then go.; They, the Indians know how to organize those things better that we do. They know how to collect money from individual Indians in their neighborhood, one, two pounds at a time. They can do that.; We went out to an Indian concert one night at Southall.",Prabhupāda, Huh?
Mr. Arnold; Śyāmasundara; Mr. Arnold; Śyāmasundara; Mr. Arnold; Śyāmasundara; Dhanañjaya,"This was..., we were very welcome, made very welcome indeed. And they had like a very small television, and they had pictures of the Deities there, andHareKṛṣṇa, (indistinct) about the chanting, and they loved it. I should mention there must have been about five hundred people in that hall.; There's noHindutemples on the West End, West End.; There's one in (indistinct).; Oh, there is?; Sikh.; Sikh, yeah. But I meanHindutemple.; I don't think the leaders, the leaders of these communities, they're not so willing to raise funds on our behalf.",Prabhupāda, Huh?
Dhanañjaya,"I don't think the leaders of theHinducommunities, they're not so willing to raise money on our behalf. They'll do it for their own functions, and their own temple requirements, but not on our behalf. And it's a weak...",Prabhupāda, Huh?
Śyāmasundara,"I'm thinking of the waySadhaJivatLal(?) raised so manylakhsof rupees, by selling, organizing, highly organized...",Prabhupāda," No, no. If they will, they can."
Śyāmasundara,Yeah.,Prabhupāda, But he says they're not willing. That is the difference.
Mr. Arnold; Śyāmasundara; Mr. Arnold,"I don't think they're willing at this stage, my lord, because there's been so little done for them, and I feel, and I...; Well, we're havingJagannāthaparade, Prabhupāda is speaking...; Yes, but in their own communities, we, I suggested a long time ago that in fact there should be an appeal, start off with an appeal in the local papers.",Prabhupāda," The priestly class, they will make propaganda against us: ""Oh, they aremlecchas, they are Europeans, they are Americans. What they can do? It is not good.'' Because India, thecastesystem is very strong. So I am giving the Europeans and Americans the opportunities to becomebrāhmaṇa, they are not satisfied."
Dhanañjaya; Śyāmasundara; :Prabhupāda; Śyāmasundara; :Prabhupāda; Śyāmasundara,"Also they say that here in our temple they don't let anyone else speak, so why should we..., they, why should we let them speak? This is what they say. Because we don't allow them to come, you know, and talk on Hinduism, so they say, ""Why should we ask, let them do it here, in our community?""; Still, they're asking us to supply thempūjārīs.; Huh?; They're asking us to supply thempūjārīs.Out of all their community, not one man will volunteer to be thepūjārī.; They're asking us forpūjārī?; Yeah.",Prabhupāda, So why not take charge?
Śyāmasundara,"At theHinducenter, didn't they ask, a couple, ""Come and live there, bepūjārī,'' and...? I was hearing that.",Prabhupāda, But we cannot becomepūjārī...
Śyāmasundara; Dhanañjaya,"Under their, under their direction. That's the trouble.; So they have, they have already installed a Deity. They have a Deity ofVasudevain theHinduCenter, but He's not dressed. He's standing withcakra, but He's not, He's not clothed very nicely, and the room is not decorated very nicely at all. He's just standing there. And they asked for apūjārīto come and look after. But they..., you see what they're thinking, they're thinking, ""Oh, we're pious. We're pious for acquiring Deity.'' You see? ""Deity is only for the lower class people, so they can see, or they will be reminded that God is here. But we already know that God is here.'' So they turn and sit with their back to the Deity and they talk like this, and the Deity is here.",Prabhupāda," No. They, asDhanañjayasaid, that are not willing to cooperate with us."
Śyāmasundara,"Well, I'm not so sure. They used to be when I was here, and I think if you have aBhāgavata-saptāha, if the weather stays, and the weather's any good... I don't know.",Prabhupāda," But theBhāgavata-saptāha, if they are willing to cooperate withourBhāgavata-saptāha."
Śyāmasundara,"Yeah, that's what I mean.",Prabhupāda," Some, some priest come from India, and they cooperate with me. But if they have a feeling of noncooperation with us, then what is the use ofpaṇḍitasandBhāgavata-saptāha?"
Śyāmasundara; Dhanañjaya; Śyāmasundara; Dhanañjaya,"Saturday night you'll be speaking in theHinduCenter?; On the fifteenth.; Saturday, next Saturday night. So that will be a good indication. We'll know after then, if they cooperated, if they'll come. I think there'll be a big crowd.; Actually, you see, it's the younger Indian families also. They're English. They're not Indian. They're more English than Indian. Their children, they don't speak Hindi, and they're playing just like Western children. So they're, when they see us, when we, when devotees go there, to the communities, they're so eager to take the books 'cause they can read them and they can relate with, withKṛṣṇaconsciousness somehow. Because they go every Sunday to their meetings there, and they hear the priest, and it's all boring. It's for the older, for the old. It's sentimental. That's all. So the older people, they're coming, and they're listening to the readings of theRāmāyaṇaand so many other things. And the young people, they know, ""Oh, these, these European people and American people, they must be doing something genuine. Otherwise why are they sacrificing so much?''",Prabhupāda, So how to attract the Indian younger people?
Dhanañjaya; Śyāmasundara,"But then again, they're influenced...; They've asked us in thatHinduCenter to teach classes.",Prabhupāda, Hm?
Śyāmasundara,They've asked us to teach classes also in that center.,Prabhupāda, So why don't you do that?
Śyāmasundara; Dhanañjaya,"Not many people come, though. But we could attract them to come. Advertise and attract.; See, that..., their main function is on a Sunday, and the last time Your Divine Grace came there, last year, that's where they hold their meetings, in that hall. But it's full of so much nonsense. They have pictures of Vivekananda...",Prabhupāda, Why don't you call that Dr. Shah?
Śyāmasundara,Dr. Shah.,Prabhupāda, He cannot help us?
Śyāmasundara,I don't know. We're still not sure about him.,Prabhupāda, And that one Mr. Ahujya came?
Śyāmasundara,"Uh-huh. There are many men here who respect us, who would help us...",Prabhupāda, He wanted me to go to his house.
Śyāmasundara,Ahh.,Prabhupāda, From that Auckland.
Śyāmasundara,"Oh, he's from Auckland.",Prabhupāda, So he visited there...
Śyāmasundara,"Oh, that's right, I know him. I have his card, yeah.",Prabhupāda, You have got his card?
Śyāmasundara,Yeah.,Prabhupāda, Why don't you call him just now?
Śyāmasundara,"Yeah, I have his... I think I have his phone number and everything too.",Prabhupāda," So call him so he can come here just now. He was talking seriously about ""You please come immediately."""
Śyāmasundara,I have his Delhi address too.,Prabhupāda," Now suppose the estimate is 250,000 pounds. So how much the bank may advance?"
Mr. Arnold,"I don't think the bank, in this state of, of, umm, the one at King Street, Hammersmith...",Prabhupāda, Huh?
Mr. Arnold,"The one at Kings Street, Hammersmith. I don't really think the bank will advance you anything. Umm, you see you've got nothing to mortgage.",Prabhupāda, Oh.
Mr. Arnold,"This is the first thing. You see, when we're talking of Kingsway Hall, you know, the big one, before, well here you had a bank on thesite, and they were rather anxious to keep their premises, and consequently they would have loaned us money to retain theirsite. Any of these four that we're dealing with at the moment, there are no other banks or building societies on thesite. This is what I think is, is absolutely imperative, that within the...",Prabhupāda, The bank will not be prepared to advance in such property?
Mr. Arnold,"Well, they may well do, but it would only be... One couldn't guarantee that they would be expected to. But the bank manager, where the account of this temple is kept, they may be tempted to loan a half or three quarters of it, if they think that the thing is a good... I mean, thissiteat Kings Street, Hammersmith, for instance, if we don't buy it, then the suggestion is that within the very foreseeable future the place will be pulled down to build a large hotel, which means to say that thesiteis very valuable. On this score, the bank may well be tempted to loan you some money, just on thesitealone, (indistinct) the premises. They would be interested.",Prabhupāda, Then means that a church turned out a new building. So that is a big stake.
Mr. Arnold; Śyāmasundara,"Mr. Dwyer was very anxious that the Dawson Place should have been purchased, or some house of a similar nature, because these can be used.; (re: Mr. Ahujya) He'll be calling up in a few minutes. He's just gone out. She said she would tell him. He has an Indian Handicrafts house.",Prabhupāda," Suppose we can arrange for the money, somehow or other, half. Half a million required?"
Mr. Arnold,"For, for the new premises.",Prabhupāda, One fourth million if we can arrange. So is it possible to arrange for the other one fourth million from the bank?
Mr. Arnold; Dhanañjaya,"I think that if you're putting up a quarter of it, a quarter of a million, then I think there's every certainty of the bank loaning you the other quarter. I think this is quite a definite circumstance.; See, because what they do is they loan the money on the strength of the value of the property. If the value of the property is 500,000 pounds, then they'll be quite...",Prabhupāda, So why don't you try for this property?
Śyāmasundara,"Oh, yes.",Prabhupāda," Then I will need the help of this Mr. (indistinct). I can try to raise that one fourth million, and one fourth million if the bank advances, then we can negotiate immediately."
Śyāmasundara,It would be nice if the Indians could help.,Prabhupāda, Do some practical proposal.
Śyāmasundara,Yeah.,Prabhupāda," So far George is concerned, now it is more or less Utopian."
Śyāmasundara,Yes.,Prabhupāda, Because...
Śyāmasundara,You can't count on him at all.,Prabhupāda," ...if he was willing, he would have done long ago, but he is not very serious."
Śyāmasundara,"Well, I've never asked him for it, to do that.",Prabhupāda," So what is this asking? When he visited our Los Angeles temple, he appreciated and he said, ""Why not a temple like this in London?"""
Śyāmasundara,"Well he's..., I..., He's been waiting for me to come here and talk to him here about it. I haven't...",Prabhupāda, But it is difficult to meet him.
Śyāmasundara,"Well, he's just out of station now. As soon as he's in station I'll get him, I'll meet him.",Prabhupāda, Why don't you call him in New York?
Śyāmasundara,I don't know where he is.,Prabhupāda, That you are getting.
Śyāmasundara,I don't know where he is.,Prabhupāda," But they can say, his men here."
Śyāmasundara,"His men here won't say. They don't know themselves usually. Only his wife or one other, two persons know.",Prabhupāda, So his wife is here?
Śyāmasundara; Dhanañjaya; Śyāmasundara,"They're all with him. His manager, Terry, is there.; Bob Dylan would know where he is.; Yeah, but Dylan changes his number about every two weeks. I have his old number from a year ago. I'm sure it's not the same.",Prabhupāda," If he agrees, he can in one night, he can."
